op-work/GPU_expr/Ansor_batch/COX2-origin/matmul_41_38_38_3.json
{"i": [["[\"matmul\", 41, 38, 38, 3, \"float32\"]", "cuda -keys=cuda,gpu -arch=sm_75 -max_num_threads=1024 -thread_warp_size=32", [-1, 16, 64, 49152, 2147483647, 1024, 8, 32], "", 0, []], [[], [["CHW", 2, "local"], ["SP", 2, 0, 41, [1, 1, 1, 41], 1], ["SP", 2, 5, 38, [2, 1, 1, 1], 1], ["SP", 2, 10, 3, [1, 1, 1, 3], 1], ["SP", 2, 15, 38, [2, 1], 1], ["RE", 2, [0, 5, 10, 1, 6, 11, 2, 7, 12, 15, 16, 3, 8, 13, 17, 4, 9, 14]], ["FSP", 3, 0, 1, 3], ["FSP", 3, 4, 2, 3], ["FSP", 3, 8, 3, 3], ["RE", 3, [0, 4, 8, 1, 5, 9, 2, 6, 10, 3, 7, 11]], ["CA", 2, 3, 8], ["CHR", 1, "shared", [2]], ["CA", 2, 3, 9], ["CHR", 0, "shared", [3]], ["CA", 1, 4, 9], ["FU", 5, [0, 1, 2]], ["AN", 5, 0, 5], ["FU", 5, [1, 2, 3]], ["AN", 5, 1, 4], ["FU", 5, [2, 3, 4]], ["AN", 5, 2, 6], ["FU", 3, [0, 1, 2]], ["SP", 3, 0, 6, [1], 1], ["AN", 3, 1, 2], ["FFSP", 3, 0, [3, 2, 1], 1, 1], ["AN", 3, 1, 6], ["FU", 1, [0, 1, 2]], ["SP", 1, 0, 2, [1], 1], ["AN", 1, 1, 2], ["FFSP", 1, 0, [3, 2, 1], 1, 1], ["AN", 1, 1, 6], ["PR", 4, 0, "auto_unroll_max_step$0"]]]], "r": [[0.000105471], 0, 1.12519, 1691318025], "v": "v0.6"}
{"i": [["[\"matmul\", 41, 38, 38, 3, \"float32\"]", "cuda -keys=cuda,gpu -arch=sm_75 -max_num_threads=1024 -thread_warp_size=32", [-1, 16, 64, 49152, 2147483647, 1024, 8, 32], "", 0, []], [[], [["CHW", 2, "local"], ["SP", 2, 0, 41, [1, 41, 1, 1], 1], ["SP", 2, 5, 38, [1, 1, 1, 1], 1], ["SP", 2, 10, 3, [1, 1, 3, 1], 1], ["SP", 2, 15, 38, [1, 2], 1], ["RE", 2, [0, 5, 10, 1, 6, 11, 2, 7, 12, 15, 16, 3, 8, 13, 17, 4, 9, 14]], ["FSP", 3, 0, 1, 3], ["FSP", 3, 4, 2, 3], ["FSP", 3, 8, 3, 3], ["RE", 3, [0, 4, 8, 1, 5, 9, 2, 6, 10, 3, 7, 11]], ["CA", 2, 3, 8], ["CHR", 1, "shared", [2]], ["CA", 2, 3, 9], ["CHR", 0, "shared", [3]], ["CA", 1, 4, 9], ["FU", 5, [0, 1, 2]], ["AN", 5, 0, 5], ["FU", 5, [1, 2, 3]], ["AN", 5, 1, 4], ["FU", 5, [2, 3, 4]], ["AN", 5, 2, 6], ["FU", 3, [0, 1, 2]], ["SP", 3, 0, 6, [1], 1], ["AN", 3, 1, 2], ["FFSP", 3, 0, [3, 2, 1], 1, 1], ["AN", 3, 1, 6], ["FU", 1, [0, 1, 2]], ["SP", 1, 0, 2, [2], 1], ["AN", 1, 1, 2], ["FFSP", 1, 0, [3, 2, 1], 1, 1], ["AN", 1, 1, 6], ["PR", 4, 0, "auto_unroll_max_step$0"]]]], "r": [[5.98962e-06], 0, 0.582286, 1691318025], "v": "v0.6"}
{"i": [["[\"matmul\", 41, 38, 38, 3, \"float32\"]", "cuda -keys=cuda,gpu -arch=sm_75 -max_num_threads=1024 -thread_warp_size=32", [-1, 16, 64, 49152, 2147483647, 1024, 8, 32], "", 0, []], [[], [["CHW", 2, "local"], ["SP", 2, 0, 41, [1, 41, 1, 1], 1], ["SP", 2, 5, 38, [1, 1, 2, 1], 1], ["SP", 2, 10, 3, [1, 3, 1, 1], 1], ["SP", 2, 15, 38, [19, 2], 1], ["RE", 2, [0, 5, 10, 1, 6, 11, 2, 7, 12, 15, 16, 3, 8, 13, 17, 4, 9, 14]], ["FSP", 3, 0, 1, 3], ["FSP", 3, 4, 2, 3], ["FSP", 3, 8, 3, 3], ["RE", 3, [0, 4, 8, 1, 5, 9, 2, 6, 10, 3, 7, 11]], ["CA", 2, 3, 8], ["CHR", 1, "shared", [2]], ["CA", 2, 3, 9], ["CHR", 0, "shared", [3]], ["CA", 1, 4, 9], ["FU", 5, [0, 1, 2]], ["AN", 5, 0, 5], ["FU", 5, [1, 2, 3]], ["AN", 5, 1, 4], ["FU", 5, [2, 3, 4]], ["AN", 5, 2, 6], ["FU", 3, [0, 1, 2]], ["SP", 3, 0, 114, [1], 1], ["AN", 3, 1, 2], ["FFSP", 3, 0, [3, 2, 1], 1, 1], ["AN", 3, 1, 6], ["FU", 1, [0, 1, 2]], ["SP", 1, 0, 76, [1], 1], ["AN", 1, 1, 2], ["FFSP", 1, 0, [3, 2, 1], 1, 1], ["AN", 1, 1, 6], ["PR", 4, 0, "auto_unroll_max_step$16"]]]], "r": [[7.29637e-06], 0, 0.629362, 1691318025], "v": "v0.6"}
{"i": [["[\"matmul\", 41, 38, 38, 3, \"float32\"]", "cuda -keys=cuda,gpu -arch=sm_75 -max_num_threads=1024 -thread_warp_size=32", [-1, 16, 64, 49152, 2147483647, 1024, 8, 32], "", 0, []], [[], [["CHW", 2, "local"], ["SP", 2, 0, 41, [1, 1, 1, 1], 1], ["SP", 2, 5, 38, [2, 1, 1, 1], 1], ["SP", 2, 10, 3, [1, 3, 1, 1], 1], ["SP", 2, 15, 38, [19, 1], 1], ["RE", 2, [0, 5, 10, 1, 6, 11, 2, 7, 12, 15, 16, 3, 8, 13, 17, 4, 9, 14]], ["FSP", 3, 0, 1, 3], ["FSP", 3, 4, 2, 3], ["FSP", 3, 8, 3, 3], ["RE", 3, [0, 4, 8, 1, 5, 9, 2, 6, 10, 3, 7, 11]], ["CA", 2, 3, 8], ["CHR", 1, "shared", [2]], ["CA", 2, 3, 9], ["CHR", 0, "shared", [3]], ["CA", 1, 4, 9], ["FU", 5, [0, 1, 2]], ["AN", 5, 0, 5], ["FU", 5, [1, 2, 3]], ["AN", 5, 1, 4], ["FU", 5, [2, 3, 4]], ["AN", 5, 2, 6], ["FU", 3, [0, 1, 2]], ["SP", 3, 0, 19, [1], 1], ["AN", 3, 1, 2], ["FFSP", 3, 0, [3, 2, 1], 1, 1], ["AN", 3, 1, 6], ["FU", 1, [0, 1, 2]], ["SP", 1, 0, 19, [1], 1], ["AN", 1, 1, 2], ["FFSP", 1, 0, [3, 2, 1], 1, 1], ["AN", 1, 1, 6], ["PR", 4, 0, "auto_unroll_max_step$16"]]]], "r": [[9.85107e-06], 0, 0.620996, 1691318026], "v": "v0.6"}
{"i": [["[\"matmul\", 41, 38, 38, 3, \"float32\"]", "cuda -keys=cuda,gpu -arch=sm_75 -max_num_threads=1024 -thread_warp_size=32", [-1, 16, 64, 49152, 2147483647, 1024, 8, 32], "", 0, []], [[], [["CHW", 2, "local"], ["SP", 2, 0, 41, [1, 41, 1, 1], 1], ["SP", 2, 5, 38, [2, 1, 1, 1], 1], ["SP", 2, 10, 3, [1, 1, 1, 3], 1], ["SP", 2, 15, 38, [19, 1], 1], ["RE", 2, [0, 5, 10, 1, 6, 11, 2, 7, 12, 15, 16, 3, 8, 13, 17, 4, 9, 14]], ["FSP", 3, 0, 1, 3], ["FSP", 3, 4, 2, 3], ["FSP", 3, 8, 3, 3], ["RE", 3, [0, 4, 8, 1, 5, 9, 2, 6, 10, 3, 7, 11]], ["CA", 2, 3, 8], ["CHR", 1, "shared", [2]], ["CA", 2, 3, 9], ["CHR", 0, "shared", [3]], ["CA", 1, 4, 9], ["FU", 5, [0, 1, 2]], ["AN", 5, 0, 5], ["FU", 5, [1, 2, 3]], ["AN", 5, 1, 4], ["FU", 5, [2, 3, 4]], ["AN", 5, 2, 6], ["FU", 3, [0, 1, 2]], ["SP", 3, 0, 19, [1], 1], ["AN", 3, 1, 2], ["FFSP", 3, 0, [3, 2, 1], 1, 1], ["AN", 3, 1, 6], ["FU", 1, [0, 1, 2]], ["SP", 1, 0, 19, [1], 1], ["AN", 1, 1, 2], ["FFSP", 1, 0, [3, 2, 1], 1, 1], ["AN", 1, 1, 6], ["PR", 4, 0, "auto_unroll_max_step$1024"]]]], "r": [[4.8939e-06], 0, 1.39589, 1691318026], "v": "v0.6"}
{"i": [["[\"matmul\", 41, 38, 38, 3, \"float32\"]", "cuda -keys=cuda,gpu -arch=sm_75 -max_num_threads=1024 -thread_warp_size=32", [-1, 16, 64, 49152, 2147483647, 1024, 8, 32], "", 0, []], [[], [["CHW", 2, "local"], ["SP", 2, 0, 41, [1, 41, 1, 1], 1], ["SP", 2, 5, 38, [1, 1, 1, 38], 1], ["SP", 2, 10, 3, [1, 1, 1, 3], 1], ["SP", 2, 15, 38, [1, 1], 1], ["RE", 2, [0, 5, 10, 1, 6, 11, 2, 7, 12, 15, 16, 3, 8, 13, 17, 4, 9, 14]], ["FSP", 3, 0, 1, 3], ["FSP", 3, 4, 2, 3], ["FSP", 3, 8, 3, 3], ["RE", 3, [0, 4, 8, 1, 5, 9, 2, 6, 10, 3, 7, 11]], ["CA", 2, 3, 8], ["CHR", 1, "shared", [2]], ["CA", 2, 3, 9], ["CHR", 0, "shared", [3]], ["CA", 1, 4, 9], ["FU", 5, [0, 1, 2]], ["AN", 5, 0, 5], ["FU", 5, [1, 2, 3]], ["AN", 5, 1, 4], ["FU", 5, [2, 3, 4]], ["AN", 5, 2, 6], ["FU", 3, [0, 1, 2]], ["SP", 3, 0, 3, [1], 1], ["AN", 3, 1, 2], ["FFSP", 3, 0, [3, 2, 1], 1, 1], ["AN", 3, 1, 6], ["FU", 1, [0, 1, 2]], ["SP", 1, 0, 1, [1], 1], ["AN", 1, 1, 2], ["FFSP", 1, 0, [3, 2, 1], 1, 1], ["AN", 1, 1, 6], ["PR", 4, 0, "auto_unroll_max_step$512"]]]], "r": [[5.62726e-05], 0, 0.749547, 1691318026], "v": "v0.6"}
{"i": [["[\"matmul\", 41, 38, 38, 3, \"float32\"]", "cuda -keys=cuda,gpu -arch=sm_75 -max_num_threads=1024 -thread_warp_size=32", [-1, 16, 64, 49152, 2147483647, 1024, 8, 32], "", 0, []], [[], [["CHW", 2, "local"], ["SP", 2, 0, 41, [1, 41, 1, 1], 1], ["SP", 2, 5, 38, [1, 2, 1, 19], 1], ["SP", 2, 10, 3, [1, 1, 1, 3], 1], ["SP", 2, 15, 38, [1, 1], 1], ["RE", 2, [0, 5, 10, 1, 6, 11, 2, 7, 12, 15, 16, 3, 8, 13, 17, 4, 9, 14]], ["FSP", 3, 0, 1, 3], ["FSP", 3, 4, 2, 3], ["FSP", 3, 8, 3, 3], ["RE", 3, [0, 4, 8, 1, 5, 9, 2, 6, 10, 3, 7, 11]], ["CA", 2, 3, 8], ["CHR", 1, "shared", [2]], ["CA", 2, 3, 9], ["CHR", 0, "shared", [3]], ["CA", 1, 4, 9], ["FU", 5, [0, 1, 2]], ["AN", 5, 0, 5], ["FU", 5, [1, 2, 3]], ["AN", 5, 1, 4], ["FU", 5, [2, 3, 4]], ["AN", 5, 2, 6], ["FU", 3, [0, 1, 2]], ["SP", 3, 0, 3, [3], 1], ["AN", 3, 1, 2], ["FFSP", 3, 0, [3, 2, 1], 1, 1], ["AN", 3, 1, 6], ["FU", 1, [0, 1, 2]], ["SP", 1, 0, 19, [1], 1], ["AN", 1, 1, 2], ["FFSP", 1, 0, [3, 2, 1], 1, 1], ["AN", 1, 1, 6], ["PR", 4, 0, "auto_unroll_max_step$64"]]]], "r": [[5.51174e-05], 0, 0.686891, 1691318026], "v": "v0.6"}
{"i": [["[\"matmul\", 41, 38, 38, 3, \"float32\"]", "cuda -keys=cuda,gpu -arch=sm_75 -max_num_threads=1024 -thread_warp_size=32", [-1, 16, 64, 49152, 2147483647, 1024, 8, 32], "", 0, []], [[], [["CHW", 2, "local"], ["SP", 2, 0, 41, [1, 1, 1, 1], 1], ["SP", 2, 5, 38, [1, 38, 1, 1], 1], ["SP", 2, 10, 3, [1, 1, 1, 3], 1], ["SP", 2, 15, 38, [2, 19], 1], ["RE", 2, [0, 5, 10, 1, 6, 11, 2, 7, 12, 15, 16, 3, 8, 13, 17, 4, 9, 14]], ["FSP", 3, 0, 1, 3], ["FSP", 3, 4, 2, 3], ["FSP", 3, 8, 3, 3], ["RE", 3, [0, 4, 8, 1, 5, 9, 2, 6, 10, 3, 7, 11]], ["CA", 2, 3, 8], ["CHR", 1, "shared", [2]], ["CA", 2, 3, 9], ["CHR", 0, "shared", [3]], ["CA", 1, 4, 9], ["FU", 5, [0, 1, 2]], ["AN", 5, 0, 5], ["FU", 5, [1, 2, 3]], ["AN", 5, 1, 4], ["FU", 5, [2, 3, 4]], ["AN", 5, 2, 6], ["FU", 3, [0, 1, 2]], ["SP", 3, 0, 114, [1], 1], ["AN", 3, 1, 2], ["FFSP", 3, 0, [3, 2, 1], 1, 1], ["AN", 3, 1, 6], ["FU", 1, [0, 1, 2]], ["SP", 1, 0, 38, [1], 1], ["AN", 1, 1, 2], ["FFSP", 1, 0, [3, 2, 1], 1, 1], ["AN", 1, 1, 6], ["PR", 4, 0, "auto_unroll_max_step$16"]]]], "r": [[2.63366e-06], 0, 0.620321, 1691318027], "v": "v0.6"}
{"i": [["[\"matmul\", 41, 38, 38, 3, \"float32\"]", "cuda -keys=cuda,gpu -arch=sm_75 -max_num_threads=1024 -thread_warp_size=32", [-1, 16, 64, 49152, 2147483647, 1024, 8, 32], "", 0, []], [[], [["CHW", 2, "local"], ["SP", 2, 0, 41, [1, 1, 1, 1], 1], ["SP", 2, 5, 38, [1, 19, 1, 2], 1], ["SP", 2, 10, 3, [1, 3, 1, 1], 1], ["SP", 2, 15, 38, [19, 1], 1], ["RE", 2, [0, 5, 10, 1, 6, 11, 2, 7, 12, 15, 16, 3, 8, 13, 17, 4, 9, 14]], ["FSP", 3, 0, 1, 3], ["FSP", 3, 4, 2, 3], ["FSP", 3, 8, 3, 3], ["RE", 3, [0, 4, 8, 1, 5, 9, 2, 6, 10, 3, 7, 11]], ["CA", 2, 3, 8], ["CHR", 1, "shared", [2]], ["CA", 2, 3, 9], ["CHR", 0, "shared", [3]], ["CA", 1, 4, 9], ["FU", 5, [0, 1, 2]], ["AN", 5, 0, 5], ["FU", 5, [1, 2, 3]], ["AN", 5, 1, 4], ["FU", 5, [2, 3, 4]], ["AN", 5, 2, 6], ["FU", 3, [0, 1, 2]], ["SP", 3, 0, 19, [1], 1], ["AN", 3, 1, 2], ["FFSP", 3, 0, [3, 2, 1], 1, 1], ["AN", 3, 1, 6], ["FU", 1, [0, 1, 2]], ["SP", 1, 0, 19, [1], 1], ["AN", 1, 1, 2], ["FFSP", 1, 0, [3, 2, 1], 1, 1], ["AN", 1, 1, 6], ["PR", 4, 0, "auto_unroll_max_step$1024"]]]], "r": [[2.47951e-06], 0, 0.619681, 1691318027], "v": "v0.6"}
{"i": [["[\"matmul\", 41, 38, 38, 3, \"float32\"]", "cuda -keys=cuda,gpu -arch=sm_75 -max_num_threads=1024 -thread_warp_size=32", [-1, 16, 64, 49152, 2147483647, 1024, 8, 32], "", 0, []], [[], [["CHW", 2, "local"], ["SP", 2, 0, 41, [1, 1, 1, 1], 1], ["SP", 2, 5, 38, [2, 19, 1, 1], 1], ["SP", 2, 10, 3, [1, 1, 3, 1], 1], ["SP", 2, 15, 38, [1, 1], 1], ["RE", 2, [0, 5, 10, 1, 6, 11, 2, 7, 12, 15, 16, 3, 8, 13, 17, 4, 9, 14]], ["FSP", 3, 0, 1, 3], ["FSP", 3, 4, 2, 3], ["FSP", 3, 8, 3, 3], ["RE", 3, [0, 4, 8, 1, 5, 9, 2, 6, 10, 3, 7, 11]], ["CA", 2, 3, 8], ["CHR", 1, "shared", [2]], ["CA", 2, 3, 9], ["CHR", 0, "shared", [3]], ["CA", 1, 4, 9], ["FU", 5, [0, 1, 2]], ["AN", 5, 0, 5], ["FU", 5, [1, 2, 3]], ["AN", 5, 1, 4], ["FU", 5, [2, 3, 4]], ["AN", 5, 2, 6], ["FU", 3, [0, 1, 2]], ["SP", 3, 0, 3, [1], 1], ["AN", 3, 1, 2], ["FFSP", 3, 0, [3, 2, 1], 1, 1], ["AN", 3, 1, 6], ["FU", 1, [0, 1, 2]], ["SP", 1, 0, 1, [1], 1], ["AN", 1, 1, 2], ["FFSP", 1, 0, [3, 2, 1], 1, 1], ["AN", 1, 1, 6], ["PR", 4, 0, "auto_unroll_max_step$64"]]]], "r": [[4.40085e-06], 0, 0.697482, 1691318027], "v": "v0.6"}
{"i": [["[\"matmul\", 41, 38, 38, 3, \"float32\"]", "cuda -keys=cuda,gpu -arch=sm_75 -max_num_threads=1024 -thread_warp_size=32", [-1, 16, 64, 49152, 2147483647, 1024, 8, 32], "", 0, []], [[], [["CHW", 2, "local"], ["SP", 2, 0, 41, [1, 1, 1, 1], 1], ["SP", 2, 5, 38, [1, 1, 38, 1], 1], ["SP", 2, 10, 3, [1, 3, 1, 1], 1], ["SP", 2, 15, 38, [1, 1], 1], ["RE", 2, [0, 5, 10, 1, 6, 11, 2, 7, 12, 15, 16, 3, 8, 13, 17, 4, 9, 14]], ["FSP", 3, 0, 1, 3], ["FSP", 3, 4, 2, 3], ["FSP", 3, 8, 3, 3], ["RE", 3, [0, 4, 8, 1, 5, 9, 2, 6, 10, 3, 7, 11]], ["CA", 2, 3, 8], ["CHR", 1, "shared", [2]], ["CA", 2, 3, 9], ["CHR", 0, "shared", [3]], ["CA", 1, 4, 9], ["FU", 5, [0, 1, 2]], ["AN", 5, 0, 5], ["FU", 5, [1, 2, 3]], ["AN", 5, 1, 4], ["FU", 5, [2, 3, 4]], ["AN", 5, 2, 6], ["FU", 3, [0, 1, 2]], ["SP", 3, 0, 1, [1], 1], ["AN", 3, 1, 2], ["FFSP", 3, 0, [3, 2, 1], 1, 1], ["AN", 3, 1, 6], ["FU", 1, [0, 1, 2]], ["SP", 1, 0, 19, [1], 1], ["AN", 1, 1, 2], ["FFSP", 1, 0, [3, 2, 1], 1, 1], ["AN", 1, 1, 6], ["PR", 4, 0, "auto_unroll_max_step$512"]]]], "r": [[1.06261e-05], 0, 0.658821, 1691318027], "v": "v0.6"}
{"i": [["[\"matmul\", 41, 38, 38, 3, \"float32\"]", "cuda -keys=cuda,gpu -arch=sm_75 -max_num_threads=1024 -thread_warp_size=32", [-1, 16, 64, 49152, 2147483647, 1024, 8, 32], "", 0, []], [[], [["CHW", 2, "local"], ["SP", 2, 0, 41, [1, 1, 1, 41], 1], ["SP", 2, 5, 38, [1, 1, 1, 2], 1], ["SP", 2, 10, 3, [1, 1, 1, 3], 1], ["SP", 2, 15, 38, [2, 1], 1], ["RE", 2, [0, 5, 10, 1, 6, 11, 2, 7, 12, 15, 16, 3, 8, 13, 17, 4, 9, 14]], ["FSP", 3, 0, 1, 3], ["FSP", 3, 4, 2, 3], ["FSP", 3, 8, 3, 3], ["RE", 3, [0, 4, 8, 1, 5, 9, 2, 6, 10, 3, 7, 11]], ["CA", 2, 3, 8], ["CHR", 1, "shared", [2]], ["CA", 2, 3, 9], ["CHR", 0, "shared", [3]], ["CA", 1, 4, 9], ["FU", 5, [0, 1, 2]], ["AN", 5, 0, 5], ["FU", 5, [1, 2, 3]], ["AN", 5, 1, 4], ["FU", 5, [2, 3, 4]], ["AN", 5, 2, 6], ["FU", 3, [0, 1, 2]], ["SP", 3, 0, 2, [1], 1], ["AN", 3, 1, 2], ["FFSP", 3, 0, [3, 2, 1], 1, 1], ["AN", 3, 1, 6], ["FU", 1, [0, 1, 2]], ["SP", 1, 0, 4, [1], 1], ["AN", 1, 1, 2], ["FFSP", 1, 0, [3, 2, 1], 1, 1], ["AN", 1, 1, 6], ["PR", 4, 0, "auto_unroll_max_step$1024"]]]], "r": [[6.8436e-05], 0, 1.60415, 1691318028], "v": "v0.6"}
{"i": [["[\"matmul\", 41, 38, 38, 3, \"float32\"]", "cuda -keys=cuda,gpu -arch=sm_75 -max_num_threads=1024 -thread_warp_size=32", [-1, 16, 64, 49152, 2147483647, 1024, 8, 32], "", 0, []], [[], [["CHW", 2, "local"], ["SP", 2, 0, 41, [1, 41, 1, 1], 1], ["SP", 2, 5, 38, [1, 1, 2, 1], 1], ["SP", 2, 10, 3, [1, 1, 1, 3], 1], ["SP", 2, 15, 38, [1, 2], 1], ["RE", 2, [0, 5, 10, 1, 6, 11, 2, 7, 12, 15, 16, 3, 8, 13, 17, 4, 9, 14]], ["FSP", 3, 0, 1, 3], ["FSP", 3, 4, 2, 3], ["FSP", 3, 8, 3, 3], ["RE", 3, [0, 4, 8, 1, 5, 9, 2, 6, 10, 3, 7, 11]], ["CA", 2, 3, 8], ["CHR", 1, "shared", [2]], ["CA", 2, 3, 9], ["CHR", 0, "shared", [3]], ["CA", 1, 4, 9], ["FU", 5, [0, 1, 2]], ["AN", 5, 0, 5], ["FU", 5, [1, 2, 3]], ["AN", 5, 1, 4], ["FU", 5, [2, 3, 4]], ["AN", 5, 2, 6], ["FU", 3, [0, 1, 2]], ["SP", 3, 0, 114, [19], 1], ["AN", 3, 1, 2], ["FFSP", 3, 0, [3, 2, 1], 1, 1], ["AN", 3, 1, 6], ["FU", 1, [0, 1, 2]], ["SP", 1, 0, 76, [1], 1], ["AN", 1, 1, 2], ["FFSP", 1, 0, [3, 2, 1], 1, 1], ["AN", 1, 1, 6], ["PR", 4, 0, "auto_unroll_max_step$16"]]]], "r": [[3.23407e-05], 0, 0.619663, 1691318028], "v": "v0.6"}
{"i": [["[\"matmul\", 41, 38, 38, 3, \"float32\"]", "cuda -keys=cuda,gpu -arch=sm_75 -max_num_threads=1024 -thread_warp_size=32", [-1, 16, 64, 49152, 2147483647, 1024, 8, 32], "", 0, []], [[], [["CHW", 2, "local"], ["SP", 2, 0, 41, [1, 1, 1, 1], 1], ["SP", 2, 5, 38, [2, 19, 1, 1], 1], ["SP", 2, 10, 3, [1, 1, 3, 1], 1], ["SP", 2, 15, 38, [2, 1], 1], ["RE", 2, [0, 5, 10, 1, 6, 11, 2, 7, 12, 15, 16, 3, 8, 13, 17, 4, 9, 14]], ["FSP", 3, 0, 1, 3], ["FSP", 3, 4, 2, 3], ["FSP", 3, 8, 3, 3], ["RE", 3, [0, 4, 8, 1, 5, 9, 2, 6, 10, 3, 7, 11]], ["CA", 2, 3, 8], ["CHR", 1, "shared", [2]], ["CA", 2, 3, 9], ["CHR", 0, "shared", [3]], ["CA", 1, 4, 9], ["FU", 5, [0, 1, 2]], ["AN", 5, 0, 5], ["FU", 5, [1, 2, 3]], ["AN", 5, 1, 4], ["FU", 5, [2, 3, 4]], ["AN", 5, 2, 6], ["FU", 3, [0, 1, 2]], ["SP", 3, 0, 2, [2], 1], ["AN", 3, 1, 2], ["FFSP", 3, 0, [3, 2, 1], 1, 1], ["AN", 3, 1, 6], ["FU", 1, [0, 1, 2]], ["SP", 1, 0, 4, [1], 1], ["AN", 1, 1, 2], ["FFSP", 1, 0, [3, 2, 1], 1, 1], ["AN", 1, 1, 6], ["PR", 4, 0, "auto_unroll_max_step$1024"]]]], "r": [[3.13158e-06], 0, 0.750612, 1691318028], "v": "v0.6"}
{"i": [["[\"matmul\", 41, 38, 38, 3, \"float32\"]", "cuda -keys=cuda,gpu -arch=sm_75 -max_num_threads=1024 -thread_warp_size=32", [-1, 16, 64, 49152, 2147483647, 1024, 8, 32], "", 0, []], [[], [["CHW", 2, "local"], ["SP", 2, 0, 41, [1, 41, 1, 1], 1], ["SP", 2, 5, 38, [1, 1, 2, 19], 1], ["SP", 2, 10, 3, [1, 3, 1, 1], 1], ["SP", 2, 15, 38, [1, 1], 1], ["RE", 2, [0, 5, 10, 1, 6, 11, 2, 7, 12, 15, 16, 3, 8, 13, 17, 4, 9, 14]], ["FSP", 3, 0, 1, 3], ["FSP", 3, 4, 2, 3], ["FSP", 3, 8, 3, 3], ["RE", 3, [0, 4, 8, 1, 5, 9, 2, 6, 10, 3, 7, 11]], ["CA", 2, 3, 8], ["CHR", 1, "shared", [2]], ["CA", 2, 3, 9], ["CHR", 0, "shared", [3]], ["CA", 1, 4, 9], ["FU", 5, [0, 1, 2]], ["AN", 5, 0, 5], ["FU", 5, [1, 2, 3]], ["AN", 5, 1, 4], ["FU", 5, [2, 3, 4]], ["AN", 5, 2, 6], ["FU", 3, [0, 1, 2]], ["SP", 3, 0, 1, [1], 1], ["AN", 3, 1, 2], ["FFSP", 3, 0, [3, 2, 1], 1, 1], ["AN", 3, 1, 6], ["FU", 1, [0, 1, 2]], ["SP", 1, 0, 38, [2], 1], ["AN", 1, 1, 2], ["FFSP", 1, 0, [3, 2, 1], 1, 1], ["AN", 1, 1, 6], ["PR", 4, 0, "auto_unroll_max_step$16"]]]], "r": [[4.78568e-05], 0, 0.584287, 1691318029], "v": "v0.6"}
{"i": [["[\"matmul\", 41, 38, 38, 3, \"float32\"]", "cuda -keys=cuda,gpu -arch=sm_75 -max_num_threads=1024 -thread_warp_size=32", [-1, 16, 64, 49152, 2147483647, 1024, 8, 32], "", 0, []], [[], [["CHW", 2, "local"], ["SP", 2, 0, 41, [1, 41, 1, 1], 1], ["SP", 2, 5, 38, [1, 2, 1, 1], 1], ["SP", 2, 10, 3, [1, 1, 3, 1], 1], ["SP", 2, 15, 38, [1, 1], 1], ["RE", 2, [0, 5, 10, 1, 6, 11, 2, 7, 12, 15, 16, 3, 8, 13, 17, 4, 9, 14]], ["FSP", 3, 0, 1, 3], ["FSP", 3, 4, 2, 3], ["FSP", 3, 8, 3, 3], ["RE", 3, [0, 4, 8, 1, 5, 9, 2, 6, 10, 3, 7, 11]], ["CA", 2, 3, 8], ["CHR", 1, "shared", [2]], ["CA", 2, 3, 9], ["CHR", 0, "shared", [3]], ["CA", 1, 4, 9], ["FU", 5, [0, 1, 2]], ["AN", 5, 0, 5], ["FU", 5, [1, 2, 3]], ["AN", 5, 1, 4], ["FU", 5, [2, 3, 4]], ["AN", 5, 2, 6], ["FU", 3, [0, 1, 2]], ["SP", 3, 0, 3, [1], 1], ["AN", 3, 1, 2], ["FFSP", 3, 0, [3, 2, 1], 1, 1], ["AN", 3, 1, 6], ["FU", 1, [0, 1, 2]], ["SP", 1, 0, 1, [1], 1], ["AN", 1, 1, 2], ["FFSP", 1, 0, [3, 2, 1], 1, 1], ["AN", 1, 1, 6], ["PR", 4, 0, "auto_unroll_max_step$0"]]]], "r": [[8.40246e-06], 0, 0.666071, 1691318032], "v": "v0.6"}
{"i": [["[\"matmul\", 41, 38, 38, 3, \"float32\"]", "cuda -keys=cuda,gpu -arch=sm_75 -max_num_threads=1024 -thread_warp_size=32", [-1, 16, 64, 49152, 2147483647, 1024, 8, 32], "", 0, []], [[], [["CHW", 2, "local"], ["SP", 2, 0, 41, [1, 1, 41, 1], 1], ["SP", 2, 5, 38, [1, 38, 1, 1], 1], ["SP", 2, 10, 3, [1, 1, 1, 1], 1], ["SP", 2, 15, 38, [1, 2], 1], ["RE", 2, [0, 5, 10, 1, 6, 11, 2, 7, 12, 15, 16, 3, 8, 13, 17, 4, 9, 14]], ["FSP", 3, 0, 1, 3], ["FSP", 3, 4, 2, 3], ["FSP", 3, 8, 3, 3], ["RE", 3, [0, 4, 8, 1, 5, 9, 2, 6, 10, 3, 7, 11]], ["CA", 2, 3, 8], ["CHR", 1, "shared", [2]], ["CA", 2, 3, 9], ["CHR", 0, "shared", [3]], ["CA", 1, 4, 9], ["FU", 5, [0, 1, 2]], ["AN", 5, 0, 5], ["FU", 5, [1, 2, 3]], ["AN", 5, 1, 4], ["FU", 5, [2, 3, 4]], ["AN", 5, 2, 6], ["FU", 3, [0, 1, 2]], ["SP", 3, 0, 246, [1], 1], ["AN", 3, 1, 2], ["FFSP", 3, 0, [3, 2, 1], 1, 1], ["AN", 3, 1, 6], ["FU", 1, [0, 1, 2]], ["SP", 1, 0, 82, [1], 1], ["AN", 1, 1, 2], ["FFSP", 1, 0, [3, 2, 1], 1, 1], ["AN", 1, 1, 6], ["PR", 4, 0, "auto_unroll_max_step$512"]]]], "r": [[2.81897e-05], 0, 0.87694, 1691318032], "v": "v0.6"}
{"i": [["[\"matmul\", 41, 38, 38, 3, \"float32\"]", "cuda -keys=cuda,gpu -arch=sm_75 -max_num_threads=1024 -thread_warp_size=32", [-1, 16, 64, 49152, 2147483647, 1024, 8, 32], "", 0, []], [[], [["CHW", 2, "local"], ["SP", 2, 0, 41, [1, 1, 41, 1], 1], ["SP", 2, 5, 38, [1, 2, 1, 1], 1], ["SP", 2, 10, 3, [1, 1, 1, 1], 1], ["SP", 2, 15, 38, [1, 38], 1], ["RE", 2, [0, 5, 10, 1, 6, 11, 2, 7, 12, 15, 16, 3, 8, 13, 17, 4, 9, 14]], ["FSP", 3, 0, 1, 3], ["FSP", 3, 4, 2, 3], ["FSP", 3, 8, 3, 3], ["RE", 3, [0, 4, 8, 1, 5, 9, 2, 6, 10, 3, 7, 11]], ["CA", 2, 3, 8], ["CHR", 1, "shared", [2]], ["CA", 2, 3, 9], ["CHR", 0, "shared", [3]], ["CA", 1, 4, 9], ["FU", 5, [0, 1, 2]], ["AN", 5, 0, 5], ["FU", 5, [1, 2, 3]], ["AN", 5, 1, 4], ["FU", 5, [2, 3, 4]], ["AN", 5, 2, 6], ["FU", 3, [0, 1, 2]], ["SP", 3, 0, 1, [1], 1], ["AN", 3, 1, 2], ["FFSP", 3, 0, [3, 2, 1], 1, 1], ["AN", 3, 1, 6], ["FU", 1, [0, 1, 2]], ["SP", 1, 0, 1, [1], 1], ["AN", 1, 1, 2], ["FFSP", 1, 0, [3, 2, 1], 1, 1], ["AN", 1, 1, 6], ["PR", 4, 0, "auto_unroll_max_step$64"]]]], "r": [[4.62321e-05], 0, 0.730036, 1691318032], "v": "v0.6"}
{"i": [["[\"matmul\", 41, 38, 38, 3, \"float32\"]", "cuda -keys=cuda,gpu -arch=sm_75 -max_num_threads=1024 -thread_warp_size=32", [-1, 16, 64, 49152, 2147483647, 1024, 8, 32], "", 0, []], [[], [["CHW", 2, "local"], ["SP", 2, 0, 41, [1, 41, 1, 1], 1], ["SP", 2, 5, 38, [1, 1, 1, 1], 1], ["SP", 2, 10, 3, [1, 3, 1, 1], 1], ["SP", 2, 15, 38, [19, 1], 1], ["RE", 2, [0, 5, 10, 1, 6, 11, 2, 7, 12, 15, 16, 3, 8, 13, 17, 4, 9, 14]], ["FSP", 3, 0, 1, 3], ["FSP", 3, 4, 2, 3], ["FSP", 3, 8, 3, 3], ["RE", 3, [0, 4, 8, 1, 5, 9, 2, 6, 10, 3, 7, 11]], ["CA", 2, 3, 8], ["CHR", 1, "shared", [2]], ["CA", 2, 3, 9], ["CHR", 0, "shared", [3]], ["CA", 1, 4, 9], ["FU", 5, [0, 1, 2]], ["AN", 5, 0, 5], ["FU", 5, [1, 2, 3]], ["AN", 5, 1, 4], ["FU", 5, [2, 3, 4]], ["AN", 5, 2, 6], ["FU", 3, [0, 1, 2]], ["SP", 3, 0, 57, [3], 1], ["AN", 3, 1, 2], ["FFSP", 3, 0, [3, 2, 1], 1, 1], ["AN", 3, 1, 6], ["FU", 1, [0, 1, 2]], ["SP", 1, 0, 38, [1], 1], ["AN", 1, 1, 2], ["FFSP", 1, 0, [3, 2, 1], 1, 1], ["AN", 1, 1, 6], ["PR", 4, 0, "auto_unroll_max_step$1024"]]]], "r": [[4.82014e-06], 0, 0.677742, 1691318033], "v": "v0.6"}
{"i": [["[\"matmul\", 41, 38, 38, 3, \"float32\"]", "cuda -keys=cuda,gpu -arch=sm_75 -max_num_threads=1024 -thread_warp_size=32", [-1, 16, 64, 49152, 2147483647, 1024, 8, 32], "", 0, []], [[], [["CHW", 2, "local"], ["SP", 2, 0, 41, [1, 41, 1, 1], 1], ["SP", 2, 5, 38, [1, 1, 1, 19], 1], ["SP", 2, 10, 3, [1, 1, 1, 3], 1], ["SP", 2, 15, 38, [1, 1], 1], ["RE", 2, [0, 5, 10, 1, 6, 11, 2, 7, 12, 15, 16, 3, 8, 13, 17, 4, 9, 14]], ["FSP", 3, 0, 1, 3], ["FSP", 3, 4, 2, 3], ["FSP", 3, 8, 3, 3], ["RE", 3, [0, 4, 8, 1, 5, 9, 2, 6, 10, 3, 7, 11]], ["CA", 2, 3, 8], ["CHR", 1, "shared", [2]], ["CA", 2, 3, 9], ["CHR", 0, "shared", [3]], ["CA", 1, 4, 9], ["FU", 5, [0, 1, 2]], ["AN", 5, 0, 5], ["FU", 5, [1, 2, 3]], ["AN", 5, 1, 4], ["FU", 5, [2, 3, 4]], ["AN", 5, 2, 6], ["FU", 3, [0, 1, 2]], ["SP", 3, 0, 3, [3], 1], ["AN", 3, 1, 2], ["FFSP", 3, 0, [3, 2, 1], 1, 1], ["AN", 3, 1, 6], ["FU", 1, [0, 1, 2]], ["SP", 1, 0, 19, [1], 1], ["AN", 1, 1, 2], ["FFSP", 1, 0, [3, 2, 1], 1, 1], ["AN", 1, 1, 6], ["PR", 4, 0, "auto_unroll_max_step$64"]]]], "r": [[5.21219e-05], 0, 0.724008, 1691318033], "v": "v0.6"}
{"i": [["[\"matmul\", 41, 38, 38, 3, \"float32\"]", "cuda -keys=cuda,gpu -arch=sm_75 -max_num_threads=1024 -thread_warp_size=32", [-1, 16, 64, 49152, 2147483647, 1024, 8, 32], "", 0, []], [[], [["CHW", 2, "local"], ["SP", 2, 0, 41, [1, 41, 1, 1], 1], ["SP", 2, 5, 38, [1, 1, 1, 1], 1], ["SP", 2, 10, 3, [1, 1, 3, 1], 1], ["SP", 2, 15, 38, [38, 1], 1], ["RE", 2, [0, 5, 10, 1, 6, 11, 2, 7, 12, 15, 16, 3, 8, 13, 17, 4, 9, 14]], ["FSP", 3, 0, 1, 3], ["FSP", 3, 4, 2, 3], ["FSP", 3, 8, 3, 3], ["RE", 3, [0, 4, 8, 1, 5, 9, 2, 6, 10, 3, 7, 11]], ["CA", 2, 3, 8], ["CHR", 1, "shared", [2]], ["CA", 2, 3, 9], ["CHR", 0, "shared", [3]], ["CA", 1, 4, 9], ["FU", 5, [0, 1, 2]], ["AN", 5, 0, 5], ["FU", 5, [1, 2, 3]], ["AN", 5, 1, 4], ["FU", 5, [2, 3, 4]], ["AN", 5, 2, 6], ["FU", 3, [0, 1, 2]], ["SP", 3, 0, 57, [1], 1], ["AN", 3, 1, 2], ["FFSP", 3, 0, [3, 2, 1], 1, 1], ["AN", 3, 1, 6], ["FU", 1, [0, 1, 2]], ["SP", 1, 0, 19, [1], 1], ["AN", 1, 1, 2], ["FFSP", 1, 0, [3, 2, 1], 1, 1], ["AN", 1, 1, 6], ["PR", 4, 0, "auto_unroll_max_step$0"]]]], "r": [[4.78339e-06], 0, 0.605778, 1691318033], "v": "v0.6"}
{"i": [["[\"matmul\", 41, 38, 38, 3, \"float32\"]", "cuda -keys=cuda,gpu -arch=sm_75 -max_num_threads=1024 -thread_warp_size=32", [-1, 16, 64, 49152, 2147483647, 1024, 8, 32], "", 0, []], [[], [["CHW", 2, "local"], ["SP", 2, 0, 41, [1, 1, 1, 1], 1], ["SP", 2, 5, 38, [1, 19, 2, 1], 1], ["SP", 2, 10, 3, [1, 3, 1, 1], 1], ["SP", 2, 15, 38, [1, 38], 1], ["RE", 2, [0, 5, 10, 1, 6, 11, 2, 7, 12, 15, 16, 3, 8, 13, 17, 4, 9, 14]], ["FSP", 3, 0, 1, 3], ["FSP", 3, 4, 2, 3], ["FSP", 3, 8, 3, 3], ["RE", 3, [0, 4, 8, 1, 5, 9, 2, 6, 10, 3, 7, 11]], ["CA", 2, 3, 8], ["CHR", 1, "shared", [2]], ["CA", 2, 3, 9], ["CHR", 0, "shared", [3]], ["CA", 1, 4, 9], ["FU", 5, [0, 1, 2]], ["AN", 5, 0, 5], ["FU", 5, [1, 2, 3]], ["AN", 5, 1, 4], ["FU", 5, [2, 3, 4]], ["AN", 5, 2, 6], ["FU", 3, [0, 1, 2]], ["SP", 3, 0, 38, [1], 1], ["AN", 3, 1, 2], ["FFSP", 3, 0, [3, 2, 1], 1, 1], ["AN", 3, 1, 6], ["FU", 1, [0, 1, 2]], ["SP", 1, 0, 76, [1], 1], ["AN", 1, 1, 2], ["FFSP", 1, 0, [3, 2, 1], 1, 1], ["AN", 1, 1, 6], ["PR", 4, 0, "auto_unroll_max_step$64"]]]], "r": [[2.4303e-06], 0, 0.677504, 1691318034], "v": "v0.6"}
{"i": [["[\"matmul\", 41, 38, 38, 3, \"float32\"]", "cuda -keys=cuda,gpu -arch=sm_75 -max_num_threads=1024 -thread_warp_size=32", [-1, 16, 64, 49152, 2147483647, 1024, 8, 32], "", 0, []], [[], [["CHW", 2, "local"], ["SP", 2, 0, 41, [1, 41, 1, 1], 1], ["SP", 2, 5, 38, [1, 1, 1, 1], 1], ["SP", 2, 10, 3, [1, 1, 1, 1], 1], ["SP", 2, 15, 38, [19, 1], 1], ["RE", 2, [0, 5, 10, 1, 6, 11, 2, 7, 12, 15, 16, 3, 8, 13, 17, 4, 9, 14]], ["FSP", 3, 0, 1, 3], ["FSP", 3, 4, 2, 3], ["FSP", 3, 8, 3, 3], ["RE", 3, [0, 4, 8, 1, 5, 9, 2, 6, 10, 3, 7, 11]], ["CA", 2, 3, 8], ["CHR", 1, "shared", [2]], ["CA", 2, 3, 9], ["CHR", 0, "shared", [3]], ["CA", 1, 4, 9], ["FU", 5, [0, 1, 2]], ["AN", 5, 0, 5], ["FU", 5, [1, 2, 3]], ["AN", 5, 1, 4], ["FU", 5, [2, 3, 4]], ["AN", 5, 2, 6], ["FU", 3, [0, 1, 2]], ["SP", 3, 0, 19, [1], 1], ["AN", 3, 1, 2], ["FFSP", 3, 0, [3, 2, 1], 1, 1], ["AN", 3, 1, 6], ["FU", 1, [0, 1, 2]], ["SP", 1, 0, 19, [1], 1], ["AN", 1, 1, 2], ["FFSP", 1, 0, [3, 2, 1], 1, 1], ["AN", 1, 1, 6], ["PR", 4, 0, "auto_unroll_max_step$16"]]]], "r": [[6.58062e-06], 0, 0.658391, 1691318034], "v": "v0.6"}
{"i": [["[\"matmul\", 41, 38, 38, 3, \"float32\"]", "cuda -keys=cuda,gpu -arch=sm_75 -max_num_threads=1024 -thread_warp_size=32", [-1, 16, 64, 49152, 2147483647, 1024, 8, 32], "", 0, []], [[], [["CHW", 2, "local"], ["SP", 2, 0, 41, [1, 41, 1, 1], 1], ["SP", 2, 5, 38, [1, 1, 1, 1], 1], ["SP", 2, 10, 3, [1, 1, 1, 1], 1], ["SP", 2, 15, 38, [19, 2], 1], ["RE", 2, [0, 5, 10, 1, 6, 11, 2, 7, 12, 15, 16, 3, 8, 13, 17, 4, 9, 14]], ["FSP", 3, 0, 1, 3], ["FSP", 3, 4, 2, 3], ["FSP", 3, 8, 3, 3], ["RE", 3, [0, 4, 8, 1, 5, 9, 2, 6, 10, 3, 7, 11]], ["CA", 2, 3, 8], ["CHR", 1, "shared", [2]], ["CA", 2, 3, 9], ["CHR", 0, "shared", [3]], ["CA", 1, 4, 9], ["FU", 5, [0, 1, 2]], ["AN", 5, 0, 5], ["FU", 5, [1, 2, 3]], ["AN", 5, 1, 4], ["FU", 5, [2, 3, 4]], ["AN", 5, 2, 6], ["FU", 3, [0, 1, 2]], ["SP", 3, 0, 38, [1], 1], ["AN", 3, 1, 2], ["FFSP", 3, 0, [3, 2, 1], 1, 1], ["AN", 3, 1, 6], ["FU", 1, [0, 1, 2]], ["SP", 1, 0, 38, [1], 1], ["AN", 1, 1, 2], ["FFSP", 1, 0, [3, 2, 1], 1, 1], ["AN", 1, 1, 6], ["PR", 4, 0, "auto_unroll_max_step$0"]]]], "r": [[6.36388e-06], 0, 0.553158, 1691318034], "v": "v0.6"}
{"i": [["[\"matmul\", 41, 38, 38, 3, \"float32\"]", "cuda -keys=cuda,gpu -arch=sm_75 -max_num_threads=1024 -thread_warp_size=32", [-1, 16, 64, 49152, 2147483647, 1024, 8, 32], "", 0, []], [[], [["CHW", 2, "local"], ["SP", 2, 0, 41, [1, 1, 1, 1], 1], ["SP", 2, 5, 38, [1, 19, 1, 2], 1], ["SP", 2, 10, 3, [1, 1, 1, 1], 1], ["SP", 2, 15, 38, [1, 1], 1], ["RE", 2, [0, 5, 10, 1, 6, 11, 2, 7, 12, 15, 16, 3, 8, 13, 17, 4, 9, 14]], ["FSP", 3, 0, 1, 3], ["FSP", 3, 4, 2, 3], ["FSP", 3, 8, 3, 3], ["RE", 3, [0, 4, 8, 1, 5, 9, 2, 6, 10, 3, 7, 11]], ["CA", 2, 3, 8], ["CHR", 1, "shared", [2]], ["CA", 2, 3, 9], ["CHR", 0, "shared", [3]], ["CA", 1, 4, 9], ["FU", 5, [0, 1, 2]], ["AN", 5, 0, 5], ["FU", 5, [1, 2, 3]], ["AN", 5, 1, 4], ["FU", 5, [2, 3, 4]], ["AN", 5, 2, 6], ["FU", 3, [0, 1, 2]], ["SP", 3, 0, 6, [2], 1], ["AN", 3, 1, 2], ["FFSP", 3, 0, [3, 2, 1], 1, 1], ["AN", 3, 1, 6], ["FU", 1, [0, 1, 2]], ["SP", 1, 0, 4, [1], 1], ["AN", 1, 1, 2], ["FFSP", 1, 0, [3, 2, 1], 1, 1], ["AN", 1, 1, 6], ["PR", 4, 0, "auto_unroll_max_step$1024"]]]], "r": [[8.63979e-06], 0, 0.759902, 1691318034], "v": "v0.6"}
{"i": [["[\"matmul\", 41, 38, 38, 3, \"float32\"]", "cuda -keys=cuda,gpu -arch=sm_75 -max_num_threads=1024 -thread_warp_size=32", [-1, 16, 64, 49152, 2147483647, 1024, 8, 32], "", 0, []], [[], [["CHW", 2, "local"], ["SP", 2, 0, 41, [1, 41, 1, 1], 1], ["SP", 2, 5, 38, [1, 1, 2, 1], 1], ["SP", 2, 10, 3, [3, 1, 1, 1], 1], ["SP", 2, 15, 38, [19, 1], 1], ["RE", 2, [0, 5, 10, 1, 6, 11, 2, 7, 12, 15, 16, 3, 8, 13, 17, 4, 9, 14]], ["FSP", 3, 0, 1, 3], ["FSP", 3, 4, 2, 3], ["FSP", 3, 8, 3, 3], ["RE", 3, [0, 4, 8, 1, 5, 9, 2, 6, 10, 3, 7, 11]], ["CA", 2, 3, 8], ["CHR", 1, "shared", [2]], ["CA", 2, 3, 9], ["CHR", 0, "shared", [3]], ["CA", 1, 4, 9], ["FU", 5, [0, 1, 2]], ["AN", 5, 0, 5], ["FU", 5, [1, 2, 3]], ["AN", 5, 1, 4], ["FU", 5, [2, 3, 4]], ["AN", 5, 2, 6], ["FU", 3, [0, 1, 2]], ["SP", 3, 0, 114, [1], 1], ["AN", 3, 1, 2], ["FFSP", 3, 0, [3, 2, 1], 1, 1], ["AN", 3, 1, 6], ["FU", 1, [0, 1, 2]], ["SP", 1, 0, 76, [1], 1], ["AN", 1, 1, 2], ["FFSP", 1, 0, [3, 2, 1], 1, 1], ["AN", 1, 1, 6], ["PR", 4, 0, "auto_unroll_max_step$16"]]]], "r": [[8.19784e-06], 0, 0.641918, 1691318035], "v": "v0.6"}
{"i": [["[\"matmul\", 41, 38, 38, 3, \"float32\"]", "cuda -keys=cuda,gpu -arch=sm_75 -max_num_threads=1024 -thread_warp_size=32", [-1, 16, 64, 49152, 2147483647, 1024, 8, 32], "", 0, []], [[], [["CHW", 2, "local"], ["SP", 2, 0, 41, [1, 1, 1, 1], 1], ["SP", 2, 5, 38, [1, 38, 1, 1], 1], ["SP", 2, 10, 3, [1, 1, 1, 1], 1], ["SP", 2, 15, 38, [1, 1], 1], ["RE", 2, [0, 5, 10, 1, 6, 11, 2, 7, 12, 15, 16, 3, 8, 13, 17, 4, 9, 14]], ["FSP", 3, 0, 1, 3], ["FSP", 3, 4, 2, 3], ["FSP", 3, 8, 3, 3], ["RE", 3, [0, 4, 8, 1, 5, 9, 2, 6, 10, 3, 7, 11]], ["CA", 2, 3, 8], ["CHR", 1, "shared", [2]], ["CA", 2, 3, 9], ["CHR", 0, "shared", [3]], ["CA", 1, 4, 9], ["FU", 5, [0, 1, 2]], ["AN", 5, 0, 5], ["FU", 5, [1, 2, 3]], ["AN", 5, 1, 4], ["FU", 5, [2, 3, 4]], ["AN", 5, 2, 6], ["FU", 3, [0, 1, 2]], ["SP", 3, 0, 38, [1], 1], ["AN", 3, 1, 2], ["FFSP", 3, 0, [3, 2, 1], 1, 1], ["AN", 3, 1, 6], ["FU", 1, [0, 1, 2]], ["SP", 1, 0, 38, [1], 1], ["AN", 1, 1, 2], ["FFSP", 1, 0, [3, 2, 1], 1, 1], ["AN", 1, 1, 6], ["PR", 4, 0, "auto_unroll_max_step$16"]]]], "r": [[9.47818e-06], 0, 0.584838, 1691318035], "v": "v0.6"}
{"i": [["[\"matmul\", 41, 38, 38, 3, \"float32\"]", "cuda -keys=cuda,gpu -arch=sm_75 -max_num_threads=1024 -thread_warp_size=32", [-1, 16, 64, 49152, 2147483647, 1024, 8, 32], "", 0, []], [[], [["CHW", 2, "local"], ["SP", 2, 0, 41, [1, 41, 1, 1], 1], ["SP", 2, 5, 38, [1, 19, 1, 1], 1], ["SP", 2, 10, 3, [3, 1, 1, 1], 1], ["SP", 2, 15, 38, [2, 1], 1], ["RE", 2, [0, 5, 10, 1, 6, 11, 2, 7, 12, 15, 16, 3, 8, 13, 17, 4, 9, 14]], ["FSP", 3, 0, 1, 3], ["FSP", 3, 4, 2, 3], ["FSP", 3, 8, 3, 3], ["RE", 3, [0, 4, 8, 1, 5, 9, 2, 6, 10, 3, 7, 11]], ["CA", 2, 3, 8], ["CHR", 1, "shared", [2]], ["CA", 2, 3, 9], ["CHR", 0, "shared", [3]], ["CA", 1, 4, 9], ["FU", 5, [0, 1, 2]], ["AN", 5, 0, 5], ["FU", 5, [1, 2, 3]], ["AN", 5, 1, 4], ["FU", 5, [2, 3, 4]], ["AN", 5, 2, 6], ["FU", 3, [0, 1, 2]], ["SP", 3, 0, 6, [1], 1], ["AN", 3, 1, 2], ["FFSP", 3, 0, [3, 2, 1], 1, 1], ["AN", 3, 1, 6], ["FU", 1, [0, 1, 2]], ["SP", 1, 0, 2, [1], 1], ["AN", 1, 1, 2], ["FFSP", 1, 0, [3, 2, 1], 1, 1], ["AN", 1, 1, 6], ["PR", 4, 0, "auto_unroll_max_step$16"]]]], "r": [[1.23648e-05], 0, 0.608671, 1691318035], "v": "v0.6"}
{"i": [["[\"matmul\", 41, 38, 38, 3, \"float32\"]", "cuda -keys=cuda,gpu -arch=sm_75 -max_num_threads=1024 -thread_warp_size=32", [-1, 16, 64, 49152, 2147483647, 1024, 8, 32], "", 0, []], [[], [["CHW", 2, "local"], ["SP", 2, 0, 41, [1, 41, 1, 1], 1], ["SP", 2, 5, 38, [1, 1, 1, 1], 1], ["SP", 2, 10, 3, [1, 1, 1, 1], 1], ["SP", 2, 15, 38, [1, 1], 1], ["RE", 2, [0, 5, 10, 1, 6, 11, 2, 7, 12, 15, 16, 3, 8, 13, 17, 4, 9, 14]], ["FSP", 3, 0, 1, 3], ["FSP", 3, 4, 2, 3], ["FSP", 3, 8, 3, 3], ["RE", 3, [0, 4, 8, 1, 5, 9, 2, 6, 10, 3, 7, 11]], ["CA", 2, 3, 8], ["CHR", 1, "shared", [2]], ["CA", 2, 3, 9], ["CHR", 0, "shared", [3]], ["CA", 1, 4, 9], ["FU", 5, [0, 1, 2]], ["AN", 5, 0, 5], ["FU", 5, [1, 2, 3]], ["AN", 5, 1, 4], ["FU", 5, [2, 3, 4]], ["AN", 5, 2, 6], ["FU", 3, [0, 1, 2]], ["SP", 3, 0, 1, [1], 1], ["AN", 3, 1, 2], ["FFSP", 3, 0, [3, 2, 1], 1, 1], ["AN", 3, 1, 6], ["FU", 1, [0, 1, 2]], ["SP", 1, 0, 19, [19], 1], ["AN", 1, 1, 2], ["FFSP", 1, 0, [3, 2, 1], 1, 1], ["AN", 1, 1, 6], ["PR", 4, 0, "auto_unroll_max_step$16"]]]], "r": [[3.18049e-05], 0, 0.615988, 1691318035], "v": "v0.6"}
{"i": [["[\"matmul\", 41, 38, 38, 3, \"float32\"]", "cuda -keys=cuda,gpu -arch=sm_75 -max_num_threads=1024 -thread_warp_size=32", [-1, 16, 64, 49152, 2147483647, 1024, 8, 32], "", 0, []], [[], [["CHW", 2, "local"], ["SP", 2, 0, 41, [1, 41, 1, 1], 1], ["SP", 2, 5, 38, [1, 1, 1, 19], 1], ["SP", 2, 10, 3, [3, 1, 1, 1], 1], ["SP", 2, 15, 38, [1, 1], 1], ["RE", 2, [0, 5, 10, 1, 6, 11, 2, 7, 12, 15, 16, 3, 8, 13, 17, 4, 9, 14]], ["FSP", 3, 0, 1, 3], ["FSP", 3, 4, 2, 3], ["FSP", 3, 8, 3, 3], ["RE", 3, [0, 4, 8, 1, 5, 9, 2, 6, 10, 3, 7, 11]], ["CA", 2, 3, 8], ["CHR", 1, "shared", [2]], ["CA", 2, 3, 9], ["CHR", 0, "shared", [3]], ["CA", 1, 4, 9], ["FU", 5, [0, 1, 2]], ["AN", 5, 0, 5], ["FU", 5, [1, 2, 3]], ["AN", 5, 1, 4], ["FU", 5, [2, 3, 4]], ["AN", 5, 2, 6], ["FU", 3, [0, 1, 2]], ["SP", 3, 0, 1, [1], 1], ["AN", 3, 1, 2], ["FFSP", 3, 0, [3, 2, 1], 1, 1], ["AN", 3, 1, 6], ["FU", 1, [0, 1, 2]], ["SP", 1, 0, 38, [1], 1], ["AN", 1, 1, 2], ["FFSP", 1, 0, [3, 2, 1], 1, 1], ["AN", 1, 1, 6], ["PR", 4, 0, "auto_unroll_max_step$1024"]]]], "r": [[2.93682e-05], 0, 0.68052, 1691318036], "v": "v0.6"}
{"i": [["[\"matmul\", 41, 38, 38, 3, \"float32\"]", "cuda -keys=cuda,gpu -arch=sm_75 -max_num_threads=1024 -thread_warp_size=32", [-1, 16, 64, 49152, 2147483647, 1024, 8, 32], "", 0, []], [[], [["CHW", 2, "local"], ["SP", 2, 0, 41, [1, 41, 1, 1], 1], ["SP", 2, 5, 38, [1, 2, 1, 1], 1], ["SP", 2, 10, 3, [1, 1, 1, 1], 1], ["SP", 2, 15, 38, [1, 1], 1], ["RE", 2, [0, 5, 10, 1, 6, 11, 2, 7, 12, 15, 16, 3, 8, 13, 17, 4, 9, 14]], ["FSP", 3, 0, 1, 3], ["FSP", 3, 4, 2, 3], ["FSP", 3, 8, 3, 3], ["RE", 3, [0, 4, 8, 1, 5, 9, 2, 6, 10, 3, 7, 11]], ["CA", 2, 3, 8], ["CHR", 1, "shared", [2]], ["CA", 2, 3, 9], ["CHR", 0, "shared", [3]], ["CA", 1, 4, 9], ["FU", 5, [0, 1, 2]], ["AN", 5, 0, 5], ["FU", 5, [1, 2, 3]], ["AN", 5, 1, 4], ["FU", 5, [2, 3, 4]], ["AN", 5, 2, 6], ["FU", 3, [0, 1, 2]], ["SP", 3, 0, 3, [1], 1], ["AN", 3, 1, 2], ["FFSP", 3, 0, [3, 2, 1], 1, 1], ["AN", 3, 1, 6], ["FU", 1, [0, 1, 2]], ["SP", 1, 0, 1, [1], 1], ["AN", 1, 1, 2], ["FFSP", 1, 0, [3, 2, 1], 1, 1], ["AN", 1, 1, 6], ["PR", 4, 0, "auto_unroll_max_step$0"]]]], "r": [[1.1408e-05], 0, 0.572258, 1691318036], "v": "v0.6"}
{"i": [["[\"matmul\", 41, 38, 38, 3, \"float32\"]", "cuda -keys=cuda,gpu -arch=sm_75 -max_num_threads=1024 -thread_warp_size=32", [-1, 16, 64, 49152, 2147483647, 1024, 8, 32], "", 0, []], [[], [["CHW", 2, "local"], ["SP", 2, 0, 41, [1, 1, 1, 1], 1], ["SP", 2, 5, 38, [1, 19, 1, 1], 1], ["SP", 2, 10, 3, [1, 1, 1, 3], 1], ["SP", 2, 15, 38, [1, 1], 1], ["RE", 2, [0, 5, 10, 1, 6, 11, 2, 7, 12, 15, 16, 3, 8, 13, 17, 4, 9, 14]], ["FSP", 3, 0, 1, 3], ["FSP", 3, 4, 2, 3], ["FSP", 3, 8, 3, 3], ["RE", 3, [0, 4, 8, 1, 5, 9, 2, 6, 10, 3, 7, 11]], ["CA", 2, 3, 8], ["CHR", 1, "shared", [2]], ["CA", 2, 3, 9], ["CHR", 0, "shared", [3]], ["CA", 1, 4, 9], ["FU", 5, [0, 1, 2]], ["AN", 5, 0, 5], ["FU", 5, [1, 2, 3]], ["AN", 5, 1, 4], ["FU", 5, [2, 3, 4]], ["AN", 5, 2, 6], ["FU", 3, [0, 1, 2]], ["SP", 3, 0, 1, [1], 1], ["AN", 3, 1, 2], ["FFSP", 3, 0, [3, 2, 1], 1, 1], ["AN", 3, 1, 6], ["FU", 1, [0, 1, 2]], ["SP", 1, 0, 1, [1], 1], ["AN", 1, 1, 2], ["FFSP", 1, 0, [3, 2, 1], 1, 1], ["AN", 1, 1, 6], ["PR", 4, 0, "auto_unroll_max_step$0"]]]], "r": [[5.91832e-06], 0, 0.690001, 1691318040], "v": "v0.6"}
{"i": [["[\"matmul\", 41, 38, 38, 3, \"float32\"]", "cuda -keys=cuda,gpu -arch=sm_75 -max_num_threads=1024 -thread_warp_size=32", [-1, 16, 64, 49152, 2147483647, 1024, 8, 32], "", 0, []], [[], [["CHW", 2, "local"], ["SP", 2, 0, 41, [1, 41, 1, 1], 1], ["SP", 2, 5, 38, [2, 1, 1, 1], 1], ["SP", 2, 10, 3, [1, 1, 3, 1], 1], ["SP", 2, 15, 38, [2, 1], 1], ["RE", 2, [0, 5, 10, 1, 6, 11, 2, 7, 12, 15, 16, 3, 8, 13, 17, 4, 9, 14]], ["FSP", 3, 0, 1, 3], ["FSP", 3, 4, 2, 3], ["FSP", 3, 8, 3, 3], ["RE", 3, [0, 4, 8, 1, 5, 9, 2, 6, 10, 3, 7, 11]], ["CA", 2, 3, 8], ["CHR", 1, "shared", [2]], ["CA", 2, 3, 9], ["CHR", 0, "shared", [3]], ["CA", 1, 4, 9], ["FU", 5, [0, 1, 2]], ["AN", 5, 0, 5], ["FU", 5, [1, 2, 3]], ["AN", 5, 1, 4], ["FU", 5, [2, 3, 4]], ["AN", 5, 2, 6], ["FU", 3, [0, 1, 2]], ["SP", 3, 0, 6, [1], 1], ["AN", 3, 1, 2], ["FFSP", 3, 0, [3, 2, 1], 1, 1], ["AN", 3, 1, 6], ["FU", 1, [0, 1, 2]], ["SP", 1, 0, 2, [1], 1], ["AN", 1, 1, 2], ["FFSP", 1, 0, [3, 2, 1], 1, 1], ["AN", 1, 1, 6], ["PR", 4, 0, "auto_unroll_max_step$64"]]]], "r": [[6.54229e-06], 0, 0.618708, 1691318040], "v": "v0.6"}
{"i": [["[\"matmul\", 41, 38, 38, 3, \"float32\"]", "cuda -keys=cuda,gpu -arch=sm_75 -max_num_threads=1024 -thread_warp_size=32", [-1, 16, 64, 49152, 2147483647, 1024, 8, 32], "", 0, []], [[], [["CHW", 2, "local"], ["SP", 2, 0, 41, [1, 41, 1, 1], 1], ["SP", 2, 5, 38, [1, 1, 2, 1], 1], ["SP", 2, 10, 3, [1, 1, 1, 1], 1], ["SP", 2, 15, 38, [19, 2], 1], ["RE", 2, [0, 5, 10, 1, 6, 11, 2, 7, 12, 15, 16, 3, 8, 13, 17, 4, 9, 14]], ["FSP", 3, 0, 1, 3], ["FSP", 3, 4, 2, 3], ["FSP", 3, 8, 3, 3], ["RE", 3, [0, 4, 8, 1, 5, 9, 2, 6, 10, 3, 7, 11]], ["CA", 2, 3, 8], ["CHR", 1, "shared", [2]], ["CA", 2, 3, 9], ["CHR", 0, "shared", [3]], ["CA", 1, 4, 9], ["FU", 5, [0, 1, 2]], ["AN", 5, 0, 5], ["FU", 5, [1, 2, 3]], ["AN", 5, 1, 4], ["FU", 5, [2, 3, 4]], ["AN", 5, 2, 6], ["FU", 3, [0, 1, 2]], ["SP", 3, 0, 38, [1], 1], ["AN", 3, 1, 2], ["FFSP", 3, 0, [3, 2, 1], 1, 1], ["AN", 3, 1, 6], ["FU", 1, [0, 1, 2]], ["SP", 1, 0, 38, [1], 1], ["AN", 1, 1, 2], ["FFSP", 1, 0, [3, 2, 1], 1, 1], ["AN", 1, 1, 6], ["PR", 4, 0, "auto_unroll_max_step$64"]]]], "r": [[5.71843e-06], 0, 0.644335, 1691318040], "v": "v0.6"}
{"i": [["[\"matmul\", 41, 38, 38, 3, \"float32\"]", "cuda -keys=cuda,gpu -arch=sm_75 -max_num_threads=1024 -thread_warp_size=32", [-1, 16, 64, 49152, 2147483647, 1024, 8, 32], "", 0, []], [[], [["CHW", 2, "local"], ["SP", 2, 0, 41, [1, 41, 1, 1], 1], ["SP", 2, 5, 38, [1, 1, 19, 1], 1], ["SP", 2, 10, 3, [3, 1, 1, 1], 1], ["SP", 2, 15, 38, [1, 2], 1], ["RE", 2, [0, 5, 10, 1, 6, 11, 2, 7, 12, 15, 16, 3, 8, 13, 17, 4, 9, 14]], ["FSP", 3, 0, 1, 3], ["FSP", 3, 4, 2, 3], ["FSP", 3, 8, 3, 3], ["RE", 3, [0, 4, 8, 1, 5, 9, 2, 6, 10, 3, 7, 11]], ["CA", 2, 3, 8], ["CHR", 1, "shared", [2]], ["CA", 2, 3, 9], ["CHR", 0, "shared", [3]], ["CA", 1, 4, 9], ["FU", 5, [0, 1, 2]], ["AN", 5, 0, 5], ["FU", 5, [1, 2, 3]], ["AN", 5, 1, 4], ["FU", 5, [2, 3, 4]], ["AN", 5, 2, 6], ["FU", 3, [0, 1, 2]], ["SP", 3, 0, 2, [2], 1], ["AN", 3, 1, 2], ["FFSP", 3, 0, [3, 2, 1], 1, 1], ["AN", 3, 1, 6], ["FU", 1, [0, 1, 2]], ["SP", 1, 0, 38, [1], 1], ["AN", 1, 1, 2], ["FFSP", 1, 0, [3, 2, 1], 1, 1], ["AN", 1, 1, 6], ["PR", 4, 0, "auto_unroll_max_step$64"]]]], "r": [[2.37483e-05], 0, 0.918535, 1691318041], "v": "v0.6"}
{"i": [["[\"matmul\", 41, 38, 38, 3, \"float32\"]", "cuda -keys=cuda,gpu -arch=sm_75 -max_num_threads=1024 -thread_warp_size=32", [-1, 16, 64, 49152, 2147483647, 1024, 8, 32], "", 0, []], [[], [["CHW", 2, "local"], ["SP", 2, 0, 41, [1, 41, 1, 1], 1], ["SP", 2, 5, 38, [1, 1, 2, 1], 1], ["SP", 2, 10, 3, [1, 1, 1, 3], 1], ["SP", 2, 15, 38, [1, 1], 1], ["RE", 2, [0, 5, 10, 1, 6, 11, 2, 7, 12, 15, 16, 3, 8, 13, 17, 4, 9, 14]], ["FSP", 3, 0, 1, 3], ["FSP", 3, 4, 2, 3], ["FSP", 3, 8, 3, 3], ["RE", 3, [0, 4, 8, 1, 5, 9, 2, 6, 10, 3, 7, 11]], ["CA", 2, 3, 8], ["CHR", 1, "shared", [2]], ["CA", 2, 3, 9], ["CHR", 0, "shared", [3]], ["CA", 1, 4, 9], ["FU", 5, [0, 1, 2]], ["AN", 5, 0, 5], ["FU", 5, [1, 2, 3]], ["AN", 5, 1, 4], ["FU", 5, [2, 3, 4]], ["AN", 5, 2, 6], ["FU", 3, [0, 1, 2]], ["SP", 3, 0, 2, [1], 1], ["AN", 3, 1, 2], ["FFSP", 3, 0, [3, 2, 1], 1, 1], ["AN", 3, 1, 6], ["FU", 1, [0, 1, 2]], ["SP", 1, 0, 4, [1], 1], ["AN", 1, 1, 2], ["FFSP", 1, 0, [3, 2, 1], 1, 1], ["AN", 1, 1, 6], ["PR", 4, 0, "auto_unroll_max_step$512"]]]], "r": [[6.11101e-06], 0, 1.04302, 1691318041], "v": "v0.6"}
{"i": [["[\"matmul\", 41, 38, 38, 3, \"float32\"]", "cuda -keys=cuda,gpu -arch=sm_75 -max_num_threads=1024 -thread_warp_size=32", [-1, 16, 64, 49152, 2147483647, 1024, 8, 32], "", 0, []], [[], [["CHW", 2, "local"], ["SP", 2, 0, 41, [1, 1, 1, 1], 1], ["SP", 2, 5, 38, [1, 1, 1, 1], 1], ["SP", 2, 10, 3, [1, 3, 1, 1], 1], ["SP", 2, 15, 38, [2, 1], 1], ["RE", 2, [0, 5, 10, 1, 6, 11, 2, 7, 12, 15, 16, 3, 8, 13, 17, 4, 9, 14]], ["FSP", 3, 0, 1, 3], ["FSP", 3, 4, 2, 3], ["FSP", 3, 8, 3, 3], ["RE", 3, [0, 4, 8, 1, 5, 9, 2, 6, 10, 3, 7, 11]], ["CA", 2, 3, 8], ["CHR", 1, "shared", [2]], ["CA", 2, 3, 9], ["CHR", 0, "shared", [3]], ["CA", 1, 4, 9], ["FU", 5, [0, 1, 2]], ["AN", 5, 0, 5], ["FU", 5, [1, 2, 3]], ["AN", 5, 1, 4], ["FU", 5, [2, 3, 4]], ["AN", 5, 2, 6], ["FU", 3, [0, 1, 2]], ["SP", 3, 0, 2, [1], 1], ["AN", 3, 1, 2], ["FFSP", 3, 0, [3, 2, 1], 1, 1], ["AN", 3, 1, 6], ["FU", 1, [0, 1, 2]], ["SP", 1, 0, 4, [1], 1], ["AN", 1, 1, 2], ["FFSP", 1, 0, [3, 2, 1], 1, 1], ["AN", 1, 1, 6], ["PR", 4, 0, "auto_unroll_max_step$1024"]]]], "r": [[2.34945e-05], 0, 0.681225, 1691318041], "v": "v0.6"}
{"i": [["[\"matmul\", 41, 38, 38, 3, \"float32\"]", "cuda -keys=cuda,gpu -arch=sm_75 -max_num_threads=1024 -thread_warp_size=32", [-1, 16, 64, 49152, 2147483647, 1024, 8, 32], "", 0, []], [[], [["CHW", 2, "local"], ["SP", 2, 0, 41, [1, 41, 1, 1], 1], ["SP", 2, 5, 38, [1, 2, 19, 1], 1], ["SP", 2, 10, 3, [1, 1, 1, 1], 1], ["SP", 2, 15, 38, [2, 1], 1], ["RE", 2, [0, 5, 10, 1, 6, 11, 2, 7, 12, 15, 16, 3, 8, 13, 17, 4, 9, 14]], ["FSP", 3, 0, 1, 3], ["FSP", 3, 4, 2, 3], ["FSP", 3, 8, 3, 3], ["RE", 3, [0, 4, 8, 1, 5, 9, 2, 6, 10, 3, 7, 11]], ["CA", 2, 3, 8], ["CHR", 1, "shared", [2]], ["CA", 2, 3, 9], ["CHR", 0, "shared", [3]], ["CA", 1, 4, 9], ["FU", 5, [0, 1, 2]], ["AN", 5, 0, 5], ["FU", 5, [1, 2, 3]], ["AN", 5, 1, 4], ["FU", 5, [2, 3, 4]], ["AN", 5, 2, 6], ["FU", 3, [0, 1, 2]], ["SP", 3, 0, 2, [1], 1], ["AN", 3, 1, 2], ["FFSP", 3, 0, [3, 2, 1], 1, 1], ["AN", 3, 1, 6], ["FU", 1, [0, 1, 2]], ["SP", 1, 0, 38, [1], 1], ["AN", 1, 1, 2], ["FFSP", 1, 0, [3, 2, 1], 1, 1], ["AN", 1, 1, 6], ["PR", 4, 0, "auto_unroll_max_step$64"]]]], "r": [[2.6766e-05], 0, 0.689629, 1691318042], "v": "v0.6"}
{"i": [["[\"matmul\", 41, 38, 38, 3, \"float32\"]", "cuda -keys=cuda,gpu -arch=sm_75 -max_num_threads=1024 -thread_warp_size=32", [-1, 16, 64, 49152, 2147483647, 1024, 8, 32], "", 0, []], [[], [["CHW", 2, "local"], ["SP", 2, 0, 41, [1, 41, 1, 1], 1], ["SP", 2, 5, 38, [1, 1, 1, 1], 1], ["SP", 2, 10, 3, [1, 1, 3, 1], 1], ["SP", 2, 15, 38, [19, 1], 1], ["RE", 2, [0, 5, 10, 1, 6, 11, 2, 7, 12, 15, 16, 3, 8, 13, 17, 4, 9, 14]], ["FSP", 3, 0, 1, 3], ["FSP", 3, 4, 2, 3], ["FSP", 3, 8, 3, 3], ["RE", 3, [0, 4, 8, 1, 5, 9, 2, 6, 10, 3, 7, 11]], ["CA", 2, 3, 8], ["CHR", 1, "shared", [2]], ["CA", 2, 3, 9], ["CHR", 0, "shared", [3]], ["CA", 1, 4, 9], ["FU", 5, [0, 1, 2]], ["AN", 5, 0, 5], ["FU", 5, [1, 2, 3]], ["AN", 5, 1, 4], ["FU", 5, [2, 3, 4]], ["AN", 5, 2, 6], ["FU", 3, [0, 1, 2]], ["SP", 3, 0, 19, [1], 1], ["AN", 3, 1, 2], ["FFSP", 3, 0, [3, 2, 1], 1, 1], ["AN", 3, 1, 6], ["FU", 1, [0, 1, 2]], ["SP", 1, 0, 19, [1], 1], ["AN", 1, 1, 2], ["FFSP", 1, 0, [3, 2, 1], 1, 1], ["AN", 1, 1, 6], ["PR", 4, 0, "auto_unroll_max_step$16"]]]], "r": [[5.76437e-06], 0, 0.710656, 1691318042], "v": "v0.6"}
{"i": [["[\"matmul\", 41, 38, 38, 3, \"float32\"]", "cuda -keys=cuda,gpu -arch=sm_75 -max_num_threads=1024 -thread_warp_size=32", [-1, 16, 64, 49152, 2147483647, 1024, 8, 32], "", 0, []], [[], [["CHW", 2, "local"], ["SP", 2, 0, 41, [1, 1, 1, 1], 1], ["SP", 2, 5, 38, [1, 38, 1, 1], 1], ["SP", 2, 10, 3, [1, 1, 3, 1], 1], ["SP", 2, 15, 38, [19, 2], 1], ["RE", 2, [0, 5, 10, 1, 6, 11, 2, 7, 12, 15, 16, 3, 8, 13, 17, 4, 9, 14]], ["FSP", 3, 0, 1, 3], ["FSP", 3, 4, 2, 3], ["FSP", 3, 8, 3, 3], ["RE", 3, [0, 4, 8, 1, 5, 9, 2, 6, 10, 3, 7, 11]], ["CA", 2, 3, 8], ["CHR", 1, "shared", [2]], ["CA", 2, 3, 9], ["CHR", 0, "shared", [3]], ["CA", 1, 4, 9], ["FU", 5, [0, 1, 2]], ["AN", 5, 0, 5], ["FU", 5, [1, 2, 3]], ["AN", 5, 1, 4], ["FU", 5, [2, 3, 4]], ["AN", 5, 2, 6], ["FU", 3, [0, 1, 2]], ["SP", 3, 0, 114, [1], 1], ["AN", 3, 1, 2], ["FFSP", 3, 0, [3, 2, 1], 1, 1], ["AN", 3, 1, 6], ["FU", 1, [0, 1, 2]], ["SP", 1, 0, 38, [1], 1], ["AN", 1, 1, 2], ["FFSP", 1, 0, [3, 2, 1], 1, 1], ["AN", 1, 1, 6], ["PR", 4, 0, "auto_unroll_max_step$512"]]]], "r": [[2.61414e-06], 0, 0.689253, 1691318042], "v": "v0.6"}
{"i": [["[\"matmul\", 41, 38, 38, 3, \"float32\"]", "cuda -keys=cuda,gpu -arch=sm_75 -max_num_threads=1024 -thread_warp_size=32", [-1, 16, 64, 49152, 2147483647, 1024, 8, 32], "", 0, []], [[], [["CHW", 2, "local"], ["SP", 2, 0, 41, [1, 41, 1, 1], 1], ["SP", 2, 5, 38, [1, 1, 19, 2], 1], ["SP", 2, 10, 3, [3, 1, 1, 1], 1], ["SP", 2, 15, 38, [1, 1], 1], ["RE", 2, [0, 5, 10, 1, 6, 11, 2, 7, 12, 15, 16, 3, 8, 13, 17, 4, 9, 14]], ["FSP", 3, 0, 1, 3], ["FSP", 3, 4, 2, 3], ["FSP", 3, 8, 3, 3], ["RE", 3, [0, 4, 8, 1, 5, 9, 2, 6, 10, 3, 7, 11]], ["CA", 2, 3, 8], ["CHR", 1, "shared", [2]], ["CA", 2, 3, 9], ["CHR", 0, "shared", [3]], ["CA", 1, 4, 9], ["FU", 5, [0, 1, 2]], ["AN", 5, 0, 5], ["FU", 5, [1, 2, 3]], ["AN", 5, 1, 4], ["FU", 5, [2, 3, 4]], ["AN", 5, 2, 6], ["FU", 3, [0, 1, 2]], ["SP", 3, 0, 1, [1], 1], ["AN", 3, 1, 2], ["FFSP", 3, 0, [3, 2, 1], 1, 1], ["AN", 3, 1, 6], ["FU", 1, [0, 1, 2]], ["SP", 1, 0, 38, [1], 1], ["AN", 1, 1, 2], ["FFSP", 1, 0, [3, 2, 1], 1, 1], ["AN", 1, 1, 6], ["PR", 4, 0, "auto_unroll_max_step$512"]]]], "r": [[5.46242e-05], 0, 0.871422, 1691318042], "v": "v0.6"}
{"i": [["[\"matmul\", 41, 38, 38, 3, \"float32\"]", "cuda -keys=cuda,gpu -arch=sm_75 -max_num_threads=1024 -thread_warp_size=32", [-1, 16, 64, 49152, 2147483647, 1024, 8, 32], "", 0, []], [[], [["CHW", 2, "local"], ["SP", 2, 0, 41, [1, 41, 1, 1], 1], ["SP", 2, 5, 38, [1, 2, 1, 19], 1], ["SP", 2, 10, 3, [1, 1, 1, 3], 1], ["SP", 2, 15, 38, [1, 2], 1], ["RE", 2, [0, 5, 10, 1, 6, 11, 2, 7, 12, 15, 16, 3, 8, 13, 17, 4, 9, 14]], ["FSP", 3, 0, 1, 3], ["FSP", 3, 4, 2, 3], ["FSP", 3, 8, 3, 3], ["RE", 3, [0, 4, 8, 1, 5, 9, 2, 6, 10, 3, 7, 11]], ["CA", 2, 3, 8], ["CHR", 1, "shared", [2]], ["CA", 2, 3, 9], ["CHR", 0, "shared", [3]], ["CA", 1, 4, 9], ["FU", 5, [0, 1, 2]], ["AN", 5, 0, 5], ["FU", 5, [1, 2, 3]], ["AN", 5, 1, 4], ["FU", 5, [2, 3, 4]], ["AN", 5, 2, 6], ["FU", 3, [0, 1, 2]], ["SP", 3, 0, 6, [1], 1], ["AN", 3, 1, 2], ["FFSP", 3, 0, [3, 2, 1], 1, 1], ["AN", 3, 1, 6], ["FU", 1, [0, 1, 2]], ["SP", 1, 0, 76, [1], 1], ["AN", 1, 1, 2], ["FFSP", 1, 0, [3, 2, 1], 1, 1], ["AN", 1, 1, 6], ["PR", 4, 0, "auto_unroll_max_step$0"]]]], "r": [[3.20233e-05], 0, 0.747292, 1691318043], "v": "v0.6"}
{"i": [["[\"matmul\", 41, 38, 38, 3, \"float32\"]", "cuda -keys=cuda,gpu -arch=sm_75 -max_num_threads=1024 -thread_warp_size=32", [-1, 16, 64, 49152, 2147483647, 1024, 8, 32], "", 0, []], [[], [["CHW", 2, "local"], ["SP", 2, 0, 41, [1, 1, 1, 1], 1], ["SP", 2, 5, 38, [1, 1, 1, 19], 1], ["SP", 2, 10, 3, [1, 3, 1, 1], 1], ["SP", 2, 15, 38, [1, 2], 1], ["RE", 2, [0, 5, 10, 1, 6, 11, 2, 7, 12, 15, 16, 3, 8, 13, 17, 4, 9, 14]], ["FSP", 3, 0, 1, 3], ["FSP", 3, 4, 2, 3], ["FSP", 3, 8, 3, 3], ["RE", 3, [0, 4, 8, 1, 5, 9, 2, 6, 10, 3, 7, 11]], ["CA", 2, 3, 8], ["CHR", 1, "shared", [2]], ["CA", 2, 3, 9], ["CHR", 0, "shared", [3]], ["CA", 1, 4, 9], ["FU", 5, [0, 1, 2]], ["AN", 5, 0, 5], ["FU", 5, [1, 2, 3]], ["AN", 5, 1, 4], ["FU", 5, [2, 3, 4]], ["AN", 5, 2, 6], ["FU", 3, [0, 1, 2]], ["SP", 3, 0, 2, [2], 1], ["AN", 3, 1, 2], ["FFSP", 3, 0, [3, 2, 1], 1, 1], ["AN", 3, 1, 6], ["FU", 1, [0, 1, 2]], ["SP", 1, 0, 38, [1], 1], ["AN", 1, 1, 2], ["FFSP", 1, 0, [3, 2, 1], 1, 1], ["AN", 1, 1, 6], ["PR", 4, 0, "auto_unroll_max_step$16"]]]], "r": [[7.74271e-06], 0, 0.65277, 1691318043], "v": "v0.6"}
{"i": [["[\"matmul\", 41, 38, 38, 3, \"float32\"]", "cuda -keys=cuda,gpu -arch=sm_75 -max_num_threads=1024 -thread_warp_size=32", [-1, 16, 64, 49152, 2147483647, 1024, 8, 32], "", 0, []], [[], [["CHW", 2, "local"], ["SP", 2, 0, 41, [1, 41, 1, 1], 1], ["SP", 2, 5, 38, [2, 19, 1, 1], 1], ["SP", 2, 10, 3, [3, 1, 1, 1], 1], ["SP", 2, 15, 38, [2, 1], 1], ["RE", 2, [0, 5, 10, 1, 6, 11, 2, 7, 12, 15, 16, 3, 8, 13, 17, 4, 9, 14]], ["FSP", 3, 0, 1, 3], ["FSP", 3, 4, 2, 3], ["FSP", 3, 8, 3, 3], ["RE", 3, [0, 4, 8, 1, 5, 9, 2, 6, 10, 3, 7, 11]], ["CA", 2, 3, 8], ["CHR", 1, "shared", [2]], ["CA", 2, 3, 9], ["CHR", 0, "shared", [3]], ["CA", 1, 4, 9], ["FU", 5, [0, 1, 2]], ["AN", 5, 0, 5], ["FU", 5, [1, 2, 3]], ["AN", 5, 1, 4], ["FU", 5, [2, 3, 4]], ["AN", 5, 2, 6], ["FU", 3, [0, 1, 2]], ["SP", 3, 0, 2, [2], 1], ["AN", 3, 1, 2], ["FFSP", 3, 0, [3, 2, 1], 1, 1], ["AN", 3, 1, 6], ["FU", 1, [0, 1, 2]], ["SP", 1, 0, 2, [1], 1], ["AN", 1, 1, 2], ["FFSP", 1, 0, [3, 2, 1], 1, 1], ["AN", 1, 1, 6], ["PR", 4, 0, "auto_unroll_max_step$512"]]]], "r": [[2.37499e-05], 0, 0.961043, 1691318043], "v": "v0.6"}
{"i": [["[\"matmul\", 41, 38, 38, 3, \"float32\"]", "cuda -keys=cuda,gpu -arch=sm_75 -max_num_threads=1024 -thread_warp_size=32", [-1, 16, 64, 49152, 2147483647, 1024, 8, 32], "", 0, []], [[], [["CHW", 2, "local"], ["SP", 2, 0, 41, [1, 1, 1, 1], 1], ["SP", 2, 5, 38, [2, 1, 19, 1], 1], ["SP", 2, 10, 3, [3, 1, 1, 1], 1], ["SP", 2, 15, 38, [2, 1], 1], ["RE", 2, [0, 5, 10, 1, 6, 11, 2, 7, 12, 15, 16, 3, 8, 13, 17, 4, 9, 14]], ["FSP", 3, 0, 1, 3], ["FSP", 3, 4, 2, 3], ["FSP", 3, 8, 3, 3], ["RE", 3, [0, 4, 8, 1, 5, 9, 2, 6, 10, 3, 7, 11]], ["CA", 2, 3, 8], ["CHR", 1, "shared", [2]], ["CA", 2, 3, 9], ["CHR", 0, "shared", [3]], ["CA", 1, 4, 9], ["FU", 5, [0, 1, 2]], ["AN", 5, 0, 5], ["FU", 5, [1, 2, 3]], ["AN", 5, 1, 4], ["FU", 5, [2, 3, 4]], ["AN", 5, 2, 6], ["FU", 3, [0, 1, 2]], ["SP", 3, 0, 2, [2], 1], ["AN", 3, 1, 2], ["FFSP", 3, 0, [3, 2, 1], 1, 1], ["AN", 3, 1, 6], ["FU", 1, [0, 1, 2]], ["SP", 1, 0, 38, [1], 1], ["AN", 1, 1, 2], ["FFSP", 1, 0, [3, 2, 1], 1, 1], ["AN", 1, 1, 6], ["PR", 4, 0, "auto_unroll_max_step$16"]]]], "r": [[2.13599e-05], 0, 1.25266, 1691318043], "v": "v0.6"}
{"i": [["[\"matmul\", 41, 38, 38, 3, \"float32\"]", "cuda -keys=cuda,gpu -arch=sm_75 -max_num_threads=1024 -thread_warp_size=32", [-1, 16, 64, 49152, 2147483647, 1024, 8, 32], "", 0, []], [[], [["CHW", 2, "local"], ["SP", 2, 0, 41, [1, 1, 1, 1], 1], ["SP", 2, 5, 38, [2, 19, 1, 1], 1], ["SP", 2, 10, 3, [1, 3, 1, 1], 1], ["SP", 2, 15, 38, [1, 19], 1], ["RE", 2, [0, 5, 10, 1, 6, 11, 2, 7, 12, 15, 16, 3, 8, 13, 17, 4, 9, 14]], ["FSP", 3, 0, 1, 3], ["FSP", 3, 4, 2, 3], ["FSP", 3, 8, 3, 3], ["RE", 3, [0, 4, 8, 1, 5, 9, 2, 6, 10, 3, 7, 11]], ["CA", 2, 3, 8], ["CHR", 1, "shared", [2]], ["CA", 2, 3, 9], ["CHR", 0, "shared", [3]], ["CA", 1, 4, 9], ["FU", 5, [0, 1, 2]], ["AN", 5, 0, 5], ["FU", 5, [1, 2, 3]], ["AN", 5, 1, 4], ["FU", 5, [2, 3, 4]], ["AN", 5, 2, 6], ["FU", 3, [0, 1, 2]], ["SP", 3, 0, 19, [19], 1], ["AN", 3, 1, 2], ["FFSP", 3, 0, [3, 2, 1], 1, 1], ["AN", 3, 1, 6], ["FU", 1, [0, 1, 2]], ["SP", 1, 0, 19, [1], 1], ["AN", 1, 1, 2], ["FFSP", 1, 0, [3, 2, 1], 1, 1], ["AN", 1, 1, 6], ["PR", 4, 0, "auto_unroll_max_step$64"]]]], "r": [[2.97369e-06], 0, 0.602827, 1691318044], "v": "v0.6"}
{"i": [["[\"matmul\", 41, 38, 38, 3, \"float32\"]", "cuda -keys=cuda,gpu -arch=sm_75 -max_num_threads=1024 -thread_warp_size=32", [-1, 16, 64, 49152, 2147483647, 1024, 8, 32], "", 0, []], [[], [["CHW", 2, "local"], ["SP", 2, 0, 41, [1, 1, 1, 1], 1], ["SP", 2, 5, 38, [1, 38, 1, 1], 1], ["SP", 2, 10, 3, [3, 1, 1, 1], 1], ["SP", 2, 15, 38, [1, 1], 1], ["RE", 2, [0, 5, 10, 1, 6, 11, 2, 7, 12, 15, 16, 3, 8, 13, 17, 4, 9, 14]], ["FSP", 3, 0, 1, 3], ["FSP", 3, 4, 2, 3], ["FSP", 3, 8, 3, 3], ["RE", 3, [0, 4, 8, 1, 5, 9, 2, 6, 10, 3, 7, 11]], ["CA", 2, 3, 8], ["CHR", 1, "shared", [2]], ["CA", 2, 3, 9], ["CHR", 0, "shared", [3]], ["CA", 1, 4, 9], ["FU", 5, [0, 1, 2]], ["AN", 5, 0, 5], ["FU", 5, [1, 2, 3]], ["AN", 5, 1, 4], ["FU", 5, [2, 3, 4]], ["AN", 5, 2, 6], ["FU", 3, [0, 1, 2]], ["SP", 3, 0, 1, [1], 1], ["AN", 3, 1, 2], ["FFSP", 3, 0, [3, 2, 1], 1, 1], ["AN", 3, 1, 6], ["FU", 1, [0, 1, 2]], ["SP", 1, 0, 1, [1], 1], ["AN", 1, 1, 2], ["FFSP", 1, 0, [3, 2, 1], 1, 1], ["AN", 1, 1, 6], ["PR", 4, 0, "auto_unroll_max_step$64"]]]], "r": [[4.42255e-06], 0, 0.558894, 1691318044], "v": "v0.6"}
{"i": [["[\"matmul\", 41, 38, 38, 3, \"float32\"]", "cuda -keys=cuda,gpu -arch=sm_75 -max_num_threads=1024 -thread_warp_size=32", [-1, 16, 64, 49152, 2147483647, 1024, 8, 32], "", 0, []], [[], [["CHW", 2, "local"], ["SP", 2, 0, 41, [1, 1, 1, 1], 1], ["SP", 2, 5, 38, [2, 1, 1, 1], 1], ["SP", 2, 10, 3, [1, 1, 1, 3], 1], ["SP", 2, 15, 38, [19, 2], 1], ["RE", 2, [0, 5, 10, 1, 6, 11, 2, 7, 12, 15, 16, 3, 8, 13, 17, 4, 9, 14]], ["FSP", 3, 0, 1, 3], ["FSP", 3, 4, 2, 3], ["FSP", 3, 8, 3, 3], ["RE", 3, [0, 4, 8, 1, 5, 9, 2, 6, 10, 3, 7, 11]], ["CA", 2, 3, 8], ["CHR", 1, "shared", [2]], ["CA", 2, 3, 9], ["CHR", 0, "shared", [3]], ["CA", 1, 4, 9], ["FU", 5, [0, 1, 2]], ["AN", 5, 0, 5], ["FU", 5, [1, 2, 3]], ["AN", 5, 1, 4], ["FU", 5, [2, 3, 4]], ["AN", 5, 2, 6], ["FU", 3, [0, 1, 2]], ["SP", 3, 0, 114, [1], 1], ["AN", 3, 1, 2], ["FFSP", 3, 0, [3, 2, 1], 1, 1], ["AN", 3, 1, 6], ["FU", 1, [0, 1, 2]], ["SP", 1, 0, 76, [1], 1], ["AN", 1, 1, 2], ["FFSP", 1, 0, [3, 2, 1], 1, 1], ["AN", 1, 1, 6], ["PR", 4, 0, "auto_unroll_max_step$16"]]]], "r": [[1.60245e-05], 0, 0.666295, 1691318048], "v": "v0.6"}
{"i": [["[\"matmul\", 41, 38, 38, 3, \"float32\"]", "cuda -keys=cuda,gpu -arch=sm_75 -max_num_threads=1024 -thread_warp_size=32", [-1, 16, 64, 49152, 2147483647, 1024, 8, 32], "", 0, []], [[], [["CHW", 2, "local"], ["SP", 2, 0, 41, [1, 1, 41, 1], 1], ["SP", 2, 5, 38, [1, 1, 19, 2], 1], ["SP", 2, 10, 3, [1, 1, 1, 3], 1], ["SP", 2, 15, 38, [1, 2], 1], ["RE", 2, [0, 5, 10, 1, 6, 11, 2, 7, 12, 15, 16, 3, 8, 13, 17, 4, 9, 14]], ["FSP", 3, 0, 1, 3], ["FSP", 3, 4, 2, 3], ["FSP", 3, 8, 3, 3], ["RE", 3, [0, 4, 8, 1, 5, 9, 2, 6, 10, 3, 7, 11]], ["CA", 2, 3, 8], ["CHR", 1, "shared", [2]], ["CA", 2, 3, 9], ["CHR", 0, "shared", [3]], ["CA", 1, 4, 9], ["FU", 5, [0, 1, 2]], ["AN", 5, 0, 5], ["FU", 5, [1, 2, 3]], ["AN", 5, 1, 4], ["FU", 5, [2, 3, 4]], ["AN", 5, 2, 6], ["FU", 3, [0, 1, 2]], ["SP", 3, 0, 2, [2], 1], ["AN", 3, 1, 2], ["FFSP", 3, 0, [3, 2, 1], 1, 1], ["AN", 3, 1, 6], ["FU", 1, [0, 1, 2]], ["SP", 1, 0, 76, [1], 1], ["AN", 1, 1, 2], ["FFSP", 1, 0, [3, 2, 1], 1, 1], ["AN", 1, 1, 6], ["PR", 4, 0, "auto_unroll_max_step$1024"]]]], "r": [[0.00105844], 0, 1.98558, 1691318048], "v": "v0.6"}
{"i": [["[\"matmul\", 41, 38, 38, 3, \"float32\"]", "cuda -keys=cuda,gpu -arch=sm_75 -max_num_threads=1024 -thread_warp_size=32", [-1, 16, 64, 49152, 2147483647, 1024, 8, 32], "", 0, []], [[], [["CHW", 2, "local"], ["SP", 2, 0, 41, [1, 41, 1, 1], 1], ["SP", 2, 5, 38, [1, 1, 1, 2], 1], ["SP", 2, 10, 3, [3, 1, 1, 1], 1], ["SP", 2, 15, 38, [2, 1], 1], ["RE", 2, [0, 5, 10, 1, 6, 11, 2, 7, 12, 15, 16, 3, 8, 13, 17, 4, 9, 14]], ["FSP", 3, 0, 1, 3], ["FSP", 3, 4, 2, 3], ["FSP", 3, 8, 3, 3], ["RE", 3, [0, 4, 8, 1, 5, 9, 2, 6, 10, 3, 7, 11]], ["CA", 2, 3, 8], ["CHR", 1, "shared", [2]], ["CA", 2, 3, 9], ["CHR", 0, "shared", [3]], ["CA", 1, 4, 9], ["FU", 5, [0, 1, 2]], ["AN", 5, 0, 5], ["FU", 5, [1, 2, 3]], ["AN", 5, 1, 4], ["FU", 5, [2, 3, 4]], ["AN", 5, 2, 6], ["FU", 3, [0, 1, 2]], ["SP", 3, 0, 2, [1], 1], ["AN", 3, 1, 2], ["FFSP", 3, 0, [3, 2, 1], 1, 1], ["AN", 3, 1, 6], ["FU", 1, [0, 1, 2]], ["SP", 1, 0, 4, [1], 1], ["AN", 1, 1, 2], ["FFSP", 1, 0, [3, 2, 1], 1, 1], ["AN", 1, 1, 6], ["PR", 4, 0, "auto_unroll_max_step$512"]]]], "r": [[6.51569e-06], 0, 1.06035, 1691318049], "v": "v0.6"}
{"i": [["[\"matmul\", 41, 38, 38, 3, \"float32\"]", "cuda -keys=cuda,gpu -arch=sm_75 -max_num_threads=1024 -thread_warp_size=32", [-1, 16, 64, 49152, 2147483647, 1024, 8, 32], "", 0, []], [[], [["CHW", 2, "local"], ["SP", 2, 0, 41, [1, 1, 1, 1], 1], ["SP", 2, 5, 38, [1, 19, 2, 1], 1], ["SP", 2, 10, 3, [1, 3, 1, 1], 1], ["SP", 2, 15, 38, [1, 2], 1], ["RE", 2, [0, 5, 10, 1, 6, 11, 2, 7, 12, 15, 16, 3, 8, 13, 17, 4, 9, 14]], ["FSP", 3, 0, 1, 3], ["FSP", 3, 4, 2, 3], ["FSP", 3, 8, 3, 3], ["RE", 3, [0, 4, 8, 1, 5, 9, 2, 6, 10, 3, 7, 11]], ["CA", 2, 3, 8], ["CHR", 1, "shared", [2]], ["CA", 2, 3, 9], ["CHR", 0, "shared", [3]], ["CA", 1, 4, 9], ["FU", 5, [0, 1, 2]], ["AN", 5, 0, 5], ["FU", 5, [1, 2, 3]], ["AN", 5, 1, 4], ["FU", 5, [2, 3, 4]], ["AN", 5, 2, 6], ["FU", 3, [0, 1, 2]], ["SP", 3, 0, 2, [1], 1], ["AN", 3, 1, 2], ["FFSP", 3, 0, [3, 2, 1], 1, 1], ["AN", 3, 1, 6], ["FU", 1, [0, 1, 2]], ["SP", 1, 0, 4, [1], 1], ["AN", 1, 1, 2], ["FFSP", 1, 0, [3, 2, 1], 1, 1], ["AN", 1, 1, 6], ["PR", 4, 0, "auto_unroll_max_step$1024"]]]], "r": [[3.81247e-06], 0, 0.66501, 1691318049], "v": "v0.6"}
{"i": [["[\"matmul\", 41, 38, 38, 3, \"float32\"]", "cuda -keys=cuda,gpu -arch=sm_75 -max_num_threads=1024 -thread_warp_size=32", [-1, 16, 64, 49152, 2147483647, 1024, 8, 32], "", 0, []], [[], [["CHW", 2, "local"], ["SP", 2, 0, 41, [1, 1, 41, 1], 1], ["SP", 2, 5, 38, [1, 19, 2, 1], 1], ["SP", 2, 10, 3, [1, 1, 1, 3], 1], ["SP", 2, 15, 38, [2, 1], 1], ["RE", 2, [0, 5, 10, 1, 6, 11, 2, 7, 12, 15, 16, 3, 8, 13, 17, 4, 9, 14]], ["FSP", 3, 0, 1, 3], ["FSP", 3, 4, 2, 3], ["FSP", 3, 8, 3, 3], ["RE", 3, [0, 4, 8, 1, 5, 9, 2, 6, 10, 3, 7, 11]], ["CA", 2, 3, 8], ["CHR", 1, "shared", [2]], ["CA", 2, 3, 9], ["CHR", 0, "shared", [3]], ["CA", 1, 4, 9], ["FU", 5, [0, 1, 2]], ["AN", 5, 0, 5], ["FU", 5, [1, 2, 3]], ["AN", 5, 1, 4], ["FU", 5, [2, 3, 4]], ["AN", 5, 2, 6], ["FU", 3, [0, 1, 2]], ["SP", 3, 0, 3, [1], 1], ["AN", 3, 1, 2], ["FFSP", 3, 0, [3, 2, 1], 1, 1], ["AN", 3, 1, 6], ["FU", 1, [0, 1, 2]], ["SP", 1, 0, 1, [1], 1], ["AN", 1, 1, 2], ["FFSP", 1, 0, [3, 2, 1], 1, 1], ["AN", 1, 1, 6], ["PR", 4, 0, "auto_unroll_max_step$512"]]]], "r": [[6.96459e-05], 0, 1.73956, 1691318049], "v": "v0.6"}
{"i": [["[\"matmul\", 41, 38, 38, 3, \"float32\"]", "cuda -keys=cuda,gpu -arch=sm_75 -max_num_threads=1024 -thread_warp_size=32", [-1, 16, 64, 49152, 2147483647, 1024, 8, 32], "", 0, []], [[], [["CHW", 2, "local"], ["SP", 2, 0, 41, [1, 1, 1, 41], 1], ["SP", 2, 5, 38, [1, 19, 2, 1], 1], ["SP", 2, 10, 3, [1, 1, 1, 3], 1], ["SP", 2, 15, 38, [1, 1], 1], ["RE", 2, [0, 5, 10, 1, 6, 11, 2, 7, 12, 15, 16, 3, 8, 13, 17, 4, 9, 14]], ["FSP", 3, 0, 1, 3], ["FSP", 3, 4, 2, 3], ["FSP", 3, 8, 3, 3], ["RE", 3, [0, 4, 8, 1, 5, 9, 2, 6, 10, 3, 7, 11]], ["CA", 2, 3, 8], ["CHR", 1, "shared", [2]], ["CA", 2, 3, 9], ["CHR", 0, "shared", [3]], ["CA", 1, 4, 9], ["FU", 5, [0, 1, 2]], ["AN", 5, 0, 5], ["FU", 5, [1, 2, 3]], ["AN", 5, 1, 4], ["FU", 5, [2, 3, 4]], ["AN", 5, 2, 6], ["FU", 3, [0, 1, 2]], ["SP", 3, 0, 123, [1], 1], ["AN", 3, 1, 2], ["FFSP", 3, 0, [3, 2, 1], 1, 1], ["AN", 3, 1, 6], ["FU", 1, [0, 1, 2]], ["SP", 1, 0, 41, [1], 1], ["AN", 1, 1, 2], ["FFSP", 1, 0, [3, 2, 1], 1, 1], ["AN", 1, 1, 6], ["PR", 4, 0, "auto_unroll_max_step$16"]]]], "r": [[0.00011279], 0, 0.811878, 1691318050], "v": "v0.6"}
{"i": [["[\"matmul\", 41, 38, 38, 3, \"float32\"]", "cuda -keys=cuda,gpu -arch=sm_75 -max_num_threads=1024 -thread_warp_size=32", [-1, 16, 64, 49152, 2147483647, 1024, 8, 32], "", 0, []], [[], [["CHW", 2, "local"], ["SP", 2, 0, 41, [1, 1, 1, 41], 1], ["SP", 2, 5, 38, [1, 1, 2, 1], 1], ["SP", 2, 10, 3, [1, 1, 1, 3], 1], ["SP", 2, 15, 38, [1, 2], 1], ["RE", 2, [0, 5, 10, 1, 6, 11, 2, 7, 12, 15, 16, 3, 8, 13, 17, 4, 9, 14]], ["FSP", 3, 0, 1, 3], ["FSP", 3, 4, 2, 3], ["FSP", 3, 8, 3, 3], ["RE", 3, [0, 4, 8, 1, 5, 9, 2, 6, 10, 3, 7, 11]], ["CA", 2, 3, 8], ["CHR", 1, "shared", [2]], ["CA", 2, 3, 9], ["CHR", 0, "shared", [3]], ["CA", 1, 4, 9], ["FU", 5, [0, 1, 2]], ["AN", 5, 0, 5], ["FU", 5, [1, 2, 3]], ["AN", 5, 1, 4], ["FU", 5, [2, 3, 4]], ["AN", 5, 2, 6], ["FU", 3, [0, 1, 2]], ["SP", 3, 0, 6, [3], 1], ["AN", 3, 1, 2], ["FFSP", 3, 0, [3, 2, 1], 1, 1], ["AN", 3, 1, 6], ["FU", 1, [0, 1, 2]], ["SP", 1, 0, 2, [1], 1], ["AN", 1, 1, 2], ["FFSP", 1, 0, [3, 2, 1], 1, 1], ["AN", 1, 1, 6], ["PR", 4, 0, "auto_unroll_max_step$512"]]]], "r": [[5.45287e-05], 0, 1.70363, 1691318050], "v": "v0.6"}
{"i": [["[\"matmul\", 41, 38, 38, 3, \"float32\"]", "cuda -keys=cuda,gpu -arch=sm_75 -max_num_threads=1024 -thread_warp_size=32", [-1, 16, 64, 49152, 2147483647, 1024, 8, 32], "", 0, []], [[], [["CHW", 2, "local"], ["SP", 2, 0, 41, [1, 41, 1, 1], 1], ["SP", 2, 5, 38, [1, 1, 2, 1], 1], ["SP", 2, 10, 3, [3, 1, 1, 1], 1], ["SP", 2, 15, 38, [1, 1], 1], ["RE", 2, [0, 5, 10, 1, 6, 11, 2, 7, 12, 15, 16, 3, 8, 13, 17, 4, 9, 14]], ["FSP", 3, 0, 1, 3], ["FSP", 3, 4, 2, 3], ["FSP", 3, 8, 3, 3], ["RE", 3, [0, 4, 8, 1, 5, 9, 2, 6, 10, 3, 7, 11]], ["CA", 2, 3, 8], ["CHR", 1, "shared", [2]], ["CA", 2, 3, 9], ["CHR", 0, "shared", [3]], ["CA", 1, 4, 9], ["FU", 5, [0, 1, 2]], ["AN", 5, 0, 5], ["FU", 5, [1, 2, 3]], ["AN", 5, 1, 4], ["FU", 5, [2, 3, 4]], ["AN", 5, 2, 6], ["FU", 3, [0, 1, 2]], ["SP", 3, 0, 2, [1], 1], ["AN", 3, 1, 2], ["FFSP", 3, 0, [3, 2, 1], 1, 1], ["AN", 3, 1, 6], ["FU", 1, [0, 1, 2]], ["SP", 1, 0, 4, [1], 1], ["AN", 1, 1, 2], ["FFSP", 1, 0, [3, 2, 1], 1, 1], ["AN", 1, 1, 6], ["PR", 4, 0, "auto_unroll_max_step$512"]]]], "r": [[6.11008e-06], 0, 0.96258, 1691318050], "v": "v0.6"}
{"i": [["[\"matmul\", 41, 38, 38, 3, \"float32\"]", "cuda -keys=cuda,gpu -arch=sm_75 -max_num_threads=1024 -thread_warp_size=32", [-1, 16, 64, 49152, 2147483647, 1024, 8, 32], "", 0, []], [[], [["CHW", 2, "local"], ["SP", 2, 0, 41, [1, 41, 1, 1], 1], ["SP", 2, 5, 38, [1, 1, 38, 1], 1], ["SP", 2, 10, 3, [1, 1, 3, 1], 1], ["SP", 2, 15, 38, [1, 2], 1], ["RE", 2, [0, 5, 10, 1, 6, 11, 2, 7, 12, 15, 16, 3, 8, 13, 17, 4, 9, 14]], ["FSP", 3, 0, 1, 3], ["FSP", 3, 4, 2, 3], ["FSP", 3, 8, 3, 3], ["RE", 3, [0, 4, 8, 1, 5, 9, 2, 6, 10, 3, 7, 11]], ["CA", 2, 3, 8], ["CHR", 1, "shared", [2]], ["CA", 2, 3, 9], ["CHR", 0, "shared", [3]], ["CA", 1, 4, 9], ["FU", 5, [0, 1, 2]], ["AN", 5, 0, 5], ["FU", 5, [1, 2, 3]], ["AN", 5, 1, 4], ["FU", 5, [2, 3, 4]], ["AN", 5, 2, 6], ["FU", 3, [0, 1, 2]], ["SP", 3, 0, 2, [1], 1], ["AN", 3, 1, 2], ["FFSP", 3, 0, [3, 2, 1], 1, 1], ["AN", 3, 1, 6], ["FU", 1, [0, 1, 2]], ["SP", 1, 0, 76, [1], 1], ["AN", 1, 1, 2], ["FFSP", 1, 0, [3, 2, 1], 1, 1], ["AN", 1, 1, 6], ["PR", 4, 0, "auto_unroll_max_step$512"]]]], "r": [[3.60647e-05], 0, 0.997007, 1691318050], "v": "v0.6"}
{"i": [["[\"matmul\", 41, 38, 38, 3, \"float32\"]", "cuda -keys=cuda,gpu -arch=sm_75 -max_num_threads=1024 -thread_warp_size=32", [-1, 16, 64, 49152, 2147483647, 1024, 8, 32], "", 0, []], [[], [["CHW", 2, "local"], ["SP", 2, 0, 41, [1, 1, 41, 1], 1], ["SP", 2, 5, 38, [2, 19, 1, 1], 1], ["SP", 2, 10, 3, [3, 1, 1, 1], 1], ["SP", 2, 15, 38, [2, 1], 1], ["RE", 2, [0, 5, 10, 1, 6, 11, 2, 7, 12, 15, 16, 3, 8, 13, 17, 4, 9, 14]], ["FSP", 3, 0, 1, 3], ["FSP", 3, 4, 2, 3], ["FSP", 3, 8, 3, 3], ["RE", 3, [0, 4, 8, 1, 5, 9, 2, 6, 10, 3, 7, 11]], ["CA", 2, 3, 8], ["CHR", 1, "shared", [2]], ["CA", 2, 3, 9], ["CHR", 0, "shared", [3]], ["CA", 1, 4, 9], ["FU", 5, [0, 1, 2]], ["AN", 5, 0, 5], ["FU", 5, [1, 2, 3]], ["AN", 5, 1, 4], ["FU", 5, [2, 3, 4]], ["AN", 5, 2, 6], ["FU", 3, [0, 1, 2]], ["SP", 3, 0, 2, [2], 1], ["AN", 3, 1, 2], ["FFSP", 3, 0, [3, 2, 1], 1, 1], ["AN", 3, 1, 6], ["FU", 1, [0, 1, 2]], ["SP", 1, 0, 2, [1], 1], ["AN", 1, 1, 2], ["FFSP", 1, 0, [3, 2, 1], 1, 1], ["AN", 1, 1, 6], ["PR", 4, 0, "auto_unroll_max_step$512"]]]], "r": [[7.6832e-05], 0, 1.70994, 1691318051], "v": "v0.6"}
{"i": [["[\"matmul\", 41, 38, 38, 3, \"float32\"]", "cuda -keys=cuda,gpu -arch=sm_75 -max_num_threads=1024 -thread_warp_size=32", [-1, 16, 64, 49152, 2147483647, 1024, 8, 32], "", 0, []], [[], [["CHW", 2, "local"], ["SP", 2, 0, 41, [1, 1, 1, 1], 1], ["SP", 2, 5, 38, [1, 38, 1, 1], 1], ["SP", 2, 10, 3, [1, 3, 1, 1], 1], ["SP", 2, 15, 38, [1, 38], 1], ["RE", 2, [0, 5, 10, 1, 6, 11, 2, 7, 12, 15, 16, 3, 8, 13, 17, 4, 9, 14]], ["FSP", 3, 0, 1, 3], ["FSP", 3, 4, 2, 3], ["FSP", 3, 8, 3, 3], ["RE", 3, [0, 4, 8, 1, 5, 9, 2, 6, 10, 3, 7, 11]], ["CA", 2, 3, 8], ["CHR", 1, "shared", [2]], ["CA", 2, 3, 9], ["CHR", 0, "shared", [3]], ["CA", 1, 4, 9], ["FU", 5, [0, 1, 2]], ["AN", 5, 0, 5], ["FU", 5, [1, 2, 3]], ["AN", 5, 1, 4], ["FU", 5, [2, 3, 4]], ["AN", 5, 2, 6], ["FU", 3, [0, 1, 2]], ["SP", 3, 0, 1, [1], 1], ["AN", 3, 1, 2], ["FFSP", 3, 0, [3, 2, 1], 1, 1], ["AN", 3, 1, 6], ["FU", 1, [0, 1, 2]], ["SP", 1, 0, 1, [1], 1], ["AN", 1, 1, 2], ["FFSP", 1, 0, [3, 2, 1], 1, 1], ["AN", 1, 1, 6], ["PR", 4, 0, "auto_unroll_max_step$64"]]]], "r": [[2.49078e-06], 0, 0.582537, 1691318051], "v": "v0.6"}
