op-work/GPU_expr/Ansor_batch/AIDS-origin/matmul_6_65_65_4.json
{"i": [["[\"matmul\", 6, 65, 65, 4, \"float32\"]", "cuda -keys=cuda,gpu -arch=sm_75 -max_num_threads=1024 -thread_warp_size=32", [-1, 16, 64, 49152, 2147483647, 1024, 8, 32], "", 0, []], [[], [["CHW", 2, "local"], ["SP", 2, 0, 6, [1, 2, 3, 1], 1], ["SP", 2, 5, 65, [1, 13, 1, 5], 1], ["SP", 2, 10, 4, [1, 4, 1, 1], 1], ["SP", 2, 15, 65, [1, 13], 1], ["RE", 2, [0, 5, 10, 1, 6, 11, 2, 7, 12, 15, 16, 3, 8, 13, 17, 4, 9, 14]], ["FSP", 3, 0, 1, 3], ["FSP", 3, 4, 2, 3], ["FSP", 3, 8, 3, 3], ["RE", 3, [0, 4, 8, 1, 5, 9, 2, 6, 10, 3, 7, 11]], ["CA", 2, 3, 8], ["CHR", 1, "shared", [2]], ["CA", 2, 3, 9], ["CHR", 0, "shared", [3]], ["CA", 1, 4, 9], ["FU", 5, [0, 1, 2]], ["AN", 5, 0, 5], ["FU", 5, [1, 2, 3]], ["AN", 5, 1, 4], ["FU", 5, [2, 3, 4]], ["AN", 5, 2, 6], ["FU", 3, [0, 1, 2]], ["SP", 3, 0, 39, [1], 1], ["AN", 3, 1, 2], ["FFSP", 3, 0, [3, 2, 1], 1, 1], ["AN", 3, 1, 6], ["FU", 1, [0, 1, 2]], ["SP", 1, 0, 195, [5], 1], ["AN", 1, 1, 2], ["FFSP", 1, 0, [3, 2, 1], 1, 1], ["AN", 1, 1, 6], ["PR", 4, 0, "auto_unroll_max_step$0"]]]], "r": [[1.51297e-05], 0, 0.801924, 1692122139], "v": "v0.6"}
{"i": [["[\"matmul\", 6, 65, 65, 4, \"float32\"]", "cuda -keys=cuda,gpu -arch=sm_75 -max_num_threads=1024 -thread_warp_size=32", [-1, 16, 64, 49152, 2147483647, 1024, 8, 32], "", 0, []], [[], [["CHW", 2, "local"], ["SP", 2, 0, 6, [1, 2, 3, 1], 1], ["SP", 2, 5, 65, [1, 13, 1, 5], 1], ["SP", 2, 10, 4, [1, 4, 1, 1], 1], ["SP", 2, 15, 65, [1, 13], 1], ["RE", 2, [0, 5, 10, 1, 6, 11, 2, 7, 12, 15, 16, 3, 8, 13, 17, 4, 9, 14]], ["FSP", 3, 0, 1, 3], ["FSP", 3, 4, 2, 3], ["FSP", 3, 8, 3, 3], ["RE", 3, [0, 4, 8, 1, 5, 9, 2, 6, 10, 3, 7, 11]], ["CA", 2, 3, 8], ["CHR", 1, "shared", [2]], ["CA", 2, 3, 9], ["CHR", 0, "shared", [3]], ["CA", 1, 4, 9], ["FU", 5, [0, 1, 2]], ["AN", 5, 0, 5], ["FU", 5, [1, 2, 3]], ["AN", 5, 1, 4], ["FU", 5, [2, 3, 4]], ["AN", 5, 2, 6], ["FU", 3, [0, 1, 2]], ["SP", 3, 0, 39, [1], 1], ["AN", 3, 1, 2], ["FFSP", 3, 0, [3, 2, 1], 1, 1], ["AN", 3, 1, 6], ["FU", 1, [0, 1, 2]], ["SP", 1, 0, 195, [1], 1], ["AN", 1, 1, 2], ["FFSP", 1, 0, [3, 2, 1], 1, 1], ["AN", 1, 1, 6], ["PR", 4, 0, "auto_unroll_max_step$16"]]]], "r": [[2.52544e-05], 0, 0.660547, 1692122139], "v": "v0.6"}
{"i": [["[\"matmul\", 6, 65, 65, 4, \"float32\"]", "cuda -keys=cuda,gpu -arch=sm_75 -max_num_threads=1024 -thread_warp_size=32", [-1, 16, 64, 49152, 2147483647, 1024, 8, 32], "", 0, []], [[], [["CHW", 2, "local"], ["SP", 2, 0, 6, [1, 6, 1, 1], 1], ["SP", 2, 5, 65, [1, 5, 1, 13], 1], ["SP", 2, 10, 4, [1, 2, 1, 1], 1], ["SP", 2, 15, 65, [1, 1], 1], ["RE", 2, [0, 5, 10, 1, 6, 11, 2, 7, 12, 15, 16, 3, 8, 13, 17, 4, 9, 14]], ["FSP", 3, 0, 1, 3], ["FSP", 3, 4, 2, 3], ["FSP", 3, 8, 3, 3], ["RE", 3, [0, 4, 8, 1, 5, 9, 2, 6, 10, 3, 7, 11]], ["CA", 2, 3, 8], ["CHR", 1, "shared", [2]], ["CA", 2, 3, 9], ["CHR", 0, "shared", [3]], ["CA", 1, 4, 9], ["FU", 5, [0, 1, 2]], ["AN", 5, 0, 5], ["FU", 5, [1, 2, 3]], ["AN", 5, 1, 4], ["FU", 5, [2, 3, 4]], ["AN", 5, 2, 6], ["FU", 3, [0, 1, 2]], ["SP", 3, 0, 5, [1], 1], ["AN", 3, 1, 2], ["FFSP", 3, 0, [3, 2, 1], 1, 1], ["AN", 3, 1, 6], ["FU", 1, [0, 1, 2]], ["SP", 1, 0, 65, [1], 1], ["AN", 1, 1, 2], ["FFSP", 1, 0, [3, 2, 1], 1, 1], ["AN", 1, 1, 6], ["PR", 4, 0, "auto_unroll_max_step$0"]]]], "r": [[2.65534e-05], 0, 0.595973, 1692122139], "v": "v0.6"}
{"i": [["[\"matmul\", 6, 65, 65, 4, \"float32\"]", "cuda -keys=cuda,gpu -arch=sm_75 -max_num_threads=1024 -thread_warp_size=32", [-1, 16, 64, 49152, 2147483647, 1024, 8, 32], "", 0, []], [[], [["CHW", 2, "local"], ["SP", 2, 0, 6, [1, 3, 1, 1], 1], ["SP", 2, 5, 65, [1, 65, 1, 1], 1], ["SP", 2, 10, 4, [1, 1, 2, 2], 1], ["SP", 2, 15, 65, [13, 1], 1], ["RE", 2, [0, 5, 10, 1, 6, 11, 2, 7, 12, 15, 16, 3, 8, 13, 17, 4, 9, 14]], ["FSP", 3, 0, 1, 3], ["FSP", 3, 4, 2, 3], ["FSP", 3, 8, 3, 3], ["RE", 3, [0, 4, 8, 1, 5, 9, 2, 6, 10, 3, 7, 11]], ["CA", 2, 3, 8], ["CHR", 1, "shared", [2]], ["CA", 2, 3, 9], ["CHR", 0, "shared", [3]], ["CA", 1, 4, 9], ["FU", 5, [0, 1, 2]], ["AN", 5, 0, 5], ["FU", 5, [1, 2, 3]], ["AN", 5, 1, 4], ["FU", 5, [2, 3, 4]], ["AN", 5, 2, 6], ["FU", 3, [0, 1, 2]], ["SP", 3, 0, 26, [1], 1], ["AN", 3, 1, 2], ["FFSP", 3, 0, [3, 2, 1], 1, 1], ["AN", 3, 1, 6], ["FU", 1, [0, 1, 2]], ["SP", 1, 0, 13, [1], 1], ["AN", 1, 1, 2], ["FFSP", 1, 0, [3, 2, 1], 1, 1], ["AN", 1, 1, 6], ["PR", 4, 0, "auto_unroll_max_step$1024"]]]], "r": [[5.15146e-06], 0, 0.852803, 1692122139], "v": "v0.6"}
{"i": [["[\"matmul\", 6, 65, 65, 4, \"float32\"]", "cuda -keys=cuda,gpu -arch=sm_75 -max_num_threads=1024 -thread_warp_size=32", [-1, 16, 64, 49152, 2147483647, 1024, 8, 32], "", 0, []], [[], [["CHW", 2, "local"], ["SP", 2, 0, 6, [1, 1, 1, 6], 1], ["SP", 2, 5, 65, [1, 65, 1, 1], 1], ["SP", 2, 10, 4, [1, 1, 2, 1], 1], ["SP", 2, 15, 65, [1, 1], 1], ["RE", 2, [0, 5, 10, 1, 6, 11, 2, 7, 12, 15, 16, 3, 8, 13, 17, 4, 9, 14]], ["FSP", 3, 0, 1, 3], ["FSP", 3, 4, 2, 3], ["FSP", 3, 8, 3, 3], ["RE", 3, [0, 4, 8, 1, 5, 9, 2, 6, 10, 3, 7, 11]], ["CA", 2, 3, 8], ["CHR", 1, "shared", [2]], ["CA", 2, 3, 9], ["CHR", 0, "shared", [3]], ["CA", 1, 4, 9], ["FU", 5, [0, 1, 2]], ["AN", 5, 0, 5], ["FU", 5, [1, 2, 3]], ["AN", 5, 1, 4], ["FU", 5, [2, 3, 4]], ["AN", 5, 2, 6], ["FU", 3, [0, 1, 2]], ["SP", 3, 0, 60, [1], 1], ["AN", 3, 1, 2], ["FFSP", 3, 0, [3, 2, 1], 1, 1], ["AN", 3, 1, 6], ["FU", 1, [0, 1, 2]], ["SP", 1, 0, 30, [1], 1], ["AN", 1, 1, 2], ["FFSP", 1, 0, [3, 2, 1], 1, 1], ["AN", 1, 1, 6], ["PR", 4, 0, "auto_unroll_max_step$16"]]]], "r": [[1.99311e-05], 0, 0.595968, 1692122140], "v": "v0.6"}
{"i": [["[\"matmul\", 6, 65, 65, 4, \"float32\"]", "cuda -keys=cuda,gpu -arch=sm_75 -max_num_threads=1024 -thread_warp_size=32", [-1, 16, 64, 49152, 2147483647, 1024, 8, 32], "", 0, []], [[], [["CHW", 2, "local"], ["SP", 2, 0, 6, [1, 2, 3, 1], 1], ["SP", 2, 5, 65, [1, 13, 1, 1], 1], ["SP", 2, 10, 4, [1, 4, 1, 1], 1], ["SP", 2, 15, 65, [5, 1], 1], ["RE", 2, [0, 5, 10, 1, 6, 11, 2, 7, 12, 15, 16, 3, 8, 13, 17, 4, 9, 14]], ["FSP", 3, 0, 1, 3], ["FSP", 3, 4, 2, 3], ["FSP", 3, 8, 3, 3], ["RE", 3, [0, 4, 8, 1, 5, 9, 2, 6, 10, 3, 7, 11]], ["CA", 2, 3, 8], ["CHR", 1, "shared", [2]], ["CA", 2, 3, 9], ["CHR", 0, "shared", [3]], ["CA", 1, 4, 9], ["FU", 5, [0, 1, 2]], ["AN", 5, 0, 5], ["FU", 5, [1, 2, 3]], ["AN", 5, 1, 4], ["FU", 5, [2, 3, 4]], ["AN", 5, 2, 6], ["FU", 3, [0, 1, 2]], ["SP", 3, 0, 30, [1], 1], ["AN", 3, 1, 2], ["FFSP", 3, 0, [3, 2, 1], 1, 1], ["AN", 3, 1, 6], ["FU", 1, [0, 1, 2]], ["SP", 1, 0, 15, [1], 1], ["AN", 1, 1, 2], ["FFSP", 1, 0, [3, 2, 1], 1, 1], ["AN", 1, 1, 6], ["PR", 4, 0, "auto_unroll_max_step$1024"]]]], "r": [[6.83625e-06], 0, 1.01384, 1692122140], "v": "v0.6"}
{"i": [["[\"matmul\", 6, 65, 65, 4, \"float32\"]", "cuda -keys=cuda,gpu -arch=sm_75 -max_num_threads=1024 -thread_warp_size=32", [-1, 16, 64, 49152, 2147483647, 1024, 8, 32], "", 0, []], [[], [["CHW", 2, "local"], ["SP", 2, 0, 6, [1, 1, 2, 3], 1], ["SP", 2, 5, 65, [1, 65, 1, 1], 1], ["SP", 2, 10, 4, [1, 1, 1, 4], 1], ["SP", 2, 15, 65, [1, 1], 1], ["RE", 2, [0, 5, 10, 1, 6, 11, 2, 7, 12, 15, 16, 3, 8, 13, 17, 4, 9, 14]], ["FSP", 3, 0, 1, 3], ["FSP", 3, 4, 2, 3], ["FSP", 3, 8, 3, 3], ["RE", 3, [0, 4, 8, 1, 5, 9, 2, 6, 10, 3, 7, 11]], ["CA", 2, 3, 8], ["CHR", 1, "shared", [2]], ["CA", 2, 3, 9], ["CHR", 0, "shared", [3]], ["CA", 1, 4, 9], ["FU", 5, [0, 1, 2]], ["AN", 5, 0, 5], ["FU", 5, [1, 2, 3]], ["AN", 5, 1, 4], ["FU", 5, [2, 3, 4]], ["AN", 5, 2, 6], ["FU", 3, [0, 1, 2]], ["SP", 3, 0, 12, [6], 1], ["AN", 3, 1, 2], ["FFSP", 3, 0, [3, 2, 1], 1, 1], ["AN", 3, 1, 6], ["FU", 1, [0, 1, 2]], ["SP", 1, 0, 3, [1], 1], ["AN", 1, 1, 2], ["FFSP", 1, 0, [3, 2, 1], 1, 1], ["AN", 1, 1, 6], ["PR", 4, 0, "auto_unroll_max_step$64"]]]], "r": [[2.18729e-05], 0, 0.613491, 1692122140], "v": "v0.6"}
{"i": [["[\"matmul\", 6, 65, 65, 4, \"float32\"]", "cuda -keys=cuda,gpu -arch=sm_75 -max_num_threads=1024 -thread_warp_size=32", [-1, 16, 64, 49152, 2147483647, 1024, 8, 32], "", 0, []], [[], [["CHW", 2, "local"], ["SP", 2, 0, 6, [1, 1, 1, 1], 1], ["SP", 2, 5, 65, [1, 13, 1, 1], 1], ["SP", 2, 10, 4, [2, 2, 1, 1], 1], ["SP", 2, 15, 65, [1, 13], 1], ["RE", 2, [0, 5, 10, 1, 6, 11, 2, 7, 12, 15, 16, 3, 8, 13, 17, 4, 9, 14]], ["FSP", 3, 0, 1, 3], ["FSP", 3, 4, 2, 3], ["FSP", 3, 8, 3, 3], ["RE", 3, [0, 4, 8, 1, 5, 9, 2, 6, 10, 3, 7, 11]], ["CA", 2, 3, 8], ["CHR", 1, "shared", [2]], ["CA", 2, 3, 9], ["CHR", 0, "shared", [3]], ["CA", 1, 4, 9], ["FU", 5, [0, 1, 2]], ["AN", 5, 0, 5], ["FU", 5, [1, 2, 3]], ["AN", 5, 1, 4], ["FU", 5, [2, 3, 4]], ["AN", 5, 2, 6], ["FU", 3, [0, 1, 2]], ["SP", 3, 0, 1, [1], 1], ["AN", 3, 1, 2], ["FFSP", 3, 0, [3, 2, 1], 1, 1], ["AN", 3, 1, 6], ["FU", 1, [0, 1, 2]], ["SP", 1, 0, 1, [1], 1], ["AN", 1, 1, 2], ["FFSP", 1, 0, [3, 2, 1], 1, 1], ["AN", 1, 1, 6], ["PR", 4, 0, "auto_unroll_max_step$16"]]]], "r": [[2.65103e-06], 0, 0.517529, 1692122140], "v": "v0.6"}
{"i": [["[\"matmul\", 6, 65, 65, 4, \"float32\"]", "cuda -keys=cuda,gpu -arch=sm_75 -max_num_threads=1024 -thread_warp_size=32", [-1, 16, 64, 49152, 2147483647, 1024, 8, 32], "", 0, []], [[], [["CHW", 2, "local"], ["SP", 2, 0, 6, [1, 2, 1, 3], 1], ["SP", 2, 5, 65, [1, 65, 1, 1], 1], ["SP", 2, 10, 4, [1, 2, 2, 1], 1], ["SP", 2, 15, 65, [1, 5], 1], ["RE", 2, [0, 5, 10, 1, 6, 11, 2, 7, 12, 15, 16, 3, 8, 13, 17, 4, 9, 14]], ["FSP", 3, 0, 1, 3], ["FSP", 3, 4, 2, 3], ["FSP", 3, 8, 3, 3], ["RE", 3, [0, 4, 8, 1, 5, 9, 2, 6, 10, 3, 7, 11]], ["CA", 2, 3, 8], ["CHR", 1, "shared", [2]], ["CA", 2, 3, 9], ["CHR", 0, "shared", [3]], ["CA", 1, 4, 9], ["FU", 5, [0, 1, 2]], ["AN", 5, 0, 5], ["FU", 5, [1, 2, 3]], ["AN", 5, 1, 4], ["FU", 5, [2, 3, 4]], ["AN", 5, 2, 6], ["FU", 3, [0, 1, 2]], ["SP", 3, 0, 30, [1], 1], ["AN", 3, 1, 2], ["FFSP", 3, 0, [3, 2, 1], 1, 1], ["AN", 3, 1, 6], ["FU", 1, [0, 1, 2]], ["SP", 1, 0, 15, [5], 1], ["AN", 1, 1, 2], ["FFSP", 1, 0, [3, 2, 1], 1, 1], ["AN", 1, 1, 6], ["PR", 4, 0, "auto_unroll_max_step$1024"]]]], "r": [[1.31223e-05], 0, 1.14047, 1692122141], "v": "v0.6"}
{"i": [["[\"matmul\", 6, 65, 65, 4, \"float32\"]", "cuda -keys=cuda,gpu -arch=sm_75 -max_num_threads=1024 -thread_warp_size=32", [-1, 16, 64, 49152, 2147483647, 1024, 8, 32], "", 0, []], [[], [["CHW", 2, "local"], ["SP", 2, 0, 6, [1, 2, 3, 1], 1], ["SP", 2, 5, 65, [5, 13, 1, 1], 1], ["SP", 2, 10, 4, [1, 2, 1, 1], 1], ["SP", 2, 15, 65, [13, 1], 1], ["RE", 2, [0, 5, 10, 1, 6, 11, 2, 7, 12, 15, 16, 3, 8, 13, 17, 4, 9, 14]], ["FSP", 3, 0, 1, 3], ["FSP", 3, 4, 2, 3], ["FSP", 3, 8, 3, 3], ["RE", 3, [0, 4, 8, 1, 5, 9, 2, 6, 10, 3, 7, 11]], ["CA", 2, 3, 8], ["CHR", 1, "shared", [2]], ["CA", 2, 3, 9], ["CHR", 0, "shared", [3]], ["CA", 1, 4, 9], ["FU", 5, [0, 1, 2]], ["AN", 5, 0, 5], ["FU", 5, [1, 2, 3]], ["AN", 5, 1, 4], ["FU", 5, [2, 3, 4]], ["AN", 5, 2, 6], ["FU", 3, [0, 1, 2]], ["SP", 3, 0, 39, [1], 1], ["AN", 3, 1, 2], ["FFSP", 3, 0, [3, 2, 1], 1, 1], ["AN", 3, 1, 6], ["FU", 1, [0, 1, 2]], ["SP", 1, 0, 39, [1], 1], ["AN", 1, 1, 2], ["FFSP", 1, 0, [3, 2, 1], 1, 1], ["AN", 1, 1, 6], ["PR", 4, 0, "auto_unroll_max_step$16"]]]], "r": [[1.53153e-05], 0, 0.661134, 1692122141], "v": "v0.6"}
{"i": [["[\"matmul\", 6, 65, 65, 4, \"float32\"]", "cuda -keys=cuda,gpu -arch=sm_75 -max_num_threads=1024 -thread_warp_size=32", [-1, 16, 64, 49152, 2147483647, 1024, 8, 32], "", 0, []], [[], [["CHW", 2, "local"], ["SP", 2, 0, 6, [1, 1, 3, 2], 1], ["SP", 2, 5, 65, [1, 65, 1, 1], 1], ["SP", 2, 10, 4, [1, 2, 1, 1], 1], ["SP", 2, 15, 65, [1, 1], 1], ["RE", 2, [0, 5, 10, 1, 6, 11, 2, 7, 12, 15, 16, 3, 8, 13, 17, 4, 9, 14]], ["FSP", 3, 0, 1, 3], ["FSP", 3, 4, 2, 3], ["FSP", 3, 8, 3, 3], ["RE", 3, [0, 4, 8, 1, 5, 9, 2, 6, 10, 3, 7, 11]], ["CA", 2, 3, 8], ["CHR", 1, "shared", [2]], ["CA", 2, 3, 9], ["CHR", 0, "shared", [3]], ["CA", 1, 4, 9], ["FU", 5, [0, 1, 2]], ["AN", 5, 0, 5], ["FU", 5, [1, 2, 3]], ["AN", 5, 1, 4], ["FU", 5, [2, 3, 4]], ["AN", 5, 2, 6], ["FU", 3, [0, 1, 2]], ["SP", 3, 0, 78, [1], 1], ["AN", 3, 1, 2], ["FFSP", 3, 0, [3, 2, 1], 1, 1], ["AN", 3, 1, 6], ["FU", 1, [0, 1, 2]], ["SP", 1, 0, 78, [1], 1], ["AN", 1, 1, 2], ["FFSP", 1, 0, [3, 2, 1], 1, 1], ["AN", 1, 1, 6], ["PR", 4, 0, "auto_unroll_max_step$0"]]]], "r": [[2.1038e-05], 0, 0.654113, 1692122141], "v": "v0.6"}
{"i": [["[\"matmul\", 6, 65, 65, 4, \"float32\"]", "cuda -keys=cuda,gpu -arch=sm_75 -max_num_threads=1024 -thread_warp_size=32", [-1, 16, 64, 49152, 2147483647, 1024, 8, 32], "", 0, []], [[], [["CHW", 2, "local"], ["SP", 2, 0, 6, [1, 6, 1, 1], 1], ["SP", 2, 5, 65, [1, 13, 1, 5], 1], ["SP", 2, 10, 4, [1, 1, 1, 4], 1], ["SP", 2, 15, 65, [5, 1], 1], ["RE", 2, [0, 5, 10, 1, 6, 11, 2, 7, 12, 15, 16, 3, 8, 13, 17, 4, 9, 14]], ["FSP", 3, 0, 1, 3], ["FSP", 3, 4, 2, 3], ["FSP", 3, 8, 3, 3], ["RE", 3, [0, 4, 8, 1, 5, 9, 2, 6, 10, 3, 7, 11]], ["CA", 2, 3, 8], ["CHR", 1, "shared", [2]], ["CA", 2, 3, 9], ["CHR", 0, "shared", [3]], ["CA", 1, 4, 9], ["FU", 5, [0, 1, 2]], ["AN", 5, 0, 5], ["FU", 5, [1, 2, 3]], ["AN", 5, 1, 4], ["FU", 5, [2, 3, 4]], ["AN", 5, 2, 6], ["FU", 3, [0, 1, 2]], ["SP", 3, 0, 20, [1], 1], ["AN", 3, 1, 2], ["FFSP", 3, 0, [3, 2, 1], 1, 1], ["AN", 3, 1, 6], ["FU", 1, [0, 1, 2]], ["SP", 1, 0, 25, [1], 1], ["AN", 1, 1, 2], ["FFSP", 1, 0, [3, 2, 1], 1, 1], ["AN", 1, 1, 6], ["PR", 4, 0, "auto_unroll_max_step$1024"]]]], "r": [[1.23376e-05], 0, 0.717121, 1692122142], "v": "v0.6"}
{"i": [["[\"matmul\", 6, 65, 65, 4, \"float32\"]", "cuda -keys=cuda,gpu -arch=sm_75 -max_num_threads=1024 -thread_warp_size=32", [-1, 16, 64, 49152, 2147483647, 1024, 8, 32], "", 0, []], [[], [["CHW", 2, "local"], ["SP", 2, 0, 6, [1, 2, 3, 1], 1], ["SP", 2, 5, 65, [1, 5, 1, 1], 1], ["SP", 2, 10, 4, [1, 4, 1, 1], 1], ["SP", 2, 15, 65, [1, 13], 1], ["RE", 2, [0, 5, 10, 1, 6, 11, 2, 7, 12, 15, 16, 3, 8, 13, 17, 4, 9, 14]], ["FSP", 3, 0, 1, 3], ["FSP", 3, 4, 2, 3], ["FSP", 3, 8, 3, 3], ["RE", 3, [0, 4, 8, 1, 5, 9, 2, 6, 10, 3, 7, 11]], ["CA", 2, 3, 8], ["CHR", 1, "shared", [2]], ["CA", 2, 3, 9], ["CHR", 0, "shared", [3]], ["CA", 1, 4, 9], ["FU", 5, [0, 1, 2]], ["AN", 5, 0, 5], ["FU", 5, [1, 2, 3]], ["AN", 5, 1, 4], ["FU", 5, [2, 3, 4]], ["AN", 5, 2, 6], ["FU", 3, [0, 1, 2]], ["SP", 3, 0, 39, [1], 1], ["AN", 3, 1, 2], ["FFSP", 3, 0, [3, 2, 1], 1, 1], ["AN", 3, 1, 6], ["FU", 1, [0, 1, 2]], ["SP", 1, 0, 39, [1], 1], ["AN", 1, 1, 2], ["FFSP", 1, 0, [3, 2, 1], 1, 1], ["AN", 1, 1, 6], ["PR", 4, 0, "auto_unroll_max_step$0"]]]], "r": [[4.89015e-06], 0, 0.63342, 1692122142], "v": "v0.6"}
{"i": [["[\"matmul\", 6, 65, 65, 4, \"float32\"]", "cuda -keys=cuda,gpu -arch=sm_75 -max_num_threads=1024 -thread_warp_size=32", [-1, 16, 64, 49152, 2147483647, 1024, 8, 32], "", 0, []], [[], [["CHW", 2, "local"], ["SP", 2, 0, 6, [1, 1, 1, 1], 1], ["SP", 2, 5, 65, [1, 65, 1, 1], 1], ["SP", 2, 10, 4, [1, 2, 1, 1], 1], ["SP", 2, 15, 65, [1, 1], 1], ["RE", 2, [0, 5, 10, 1, 6, 11, 2, 7, 12, 15, 16, 3, 8, 13, 17, 4, 9, 14]], ["FSP", 3, 0, 1, 3], ["FSP", 3, 4, 2, 3], ["FSP", 3, 8, 3, 3], ["RE", 3, [0, 4, 8, 1, 5, 9, 2, 6, 10, 3, 7, 11]], ["CA", 2, 3, 8], ["CHR", 1, "shared", [2]], ["CA", 2, 3, 9], ["CHR", 0, "shared", [3]], ["CA", 1, 4, 9], ["FU", 5, [0, 1, 2]], ["AN", 5, 0, 5], ["FU", 5, [1, 2, 3]], ["AN", 5, 1, 4], ["FU", 5, [2, 3, 4]], ["AN", 5, 2, 6], ["FU", 3, [0, 1, 2]], ["SP", 3, 0, 1, [1], 1], ["AN", 3, 1, 2], ["FFSP", 3, 0, [3, 2, 1], 1, 1], ["AN", 3, 1, 6], ["FU", 1, [0, 1, 2]], ["SP", 1, 0, 1, [1], 1], ["AN", 1, 1, 2], ["FFSP", 1, 0, [3, 2, 1], 1, 1], ["AN", 1, 1, 6], ["PR", 4, 0, "auto_unroll_max_step$1024"]]]], "r": [[6.12326e-06], 0, 0.842046, 1692122142], "v": "v0.6"}
{"i": [["[\"matmul\", 6, 65, 65, 4, \"float32\"]", "cuda -keys=cuda,gpu -arch=sm_75 -max_num_threads=1024 -thread_warp_size=32", [-1, 16, 64, 49152, 2147483647, 1024, 8, 32], "", 0, []], [[], [["CHW", 2, "local"], ["SP", 2, 0, 6, [1, 3, 1, 1], 1], ["SP", 2, 5, 65, [1, 65, 1, 1], 1], ["SP", 2, 10, 4, [4, 1, 1, 1], 1], ["SP", 2, 15, 65, [1, 5], 1], ["RE", 2, [0, 5, 10, 1, 6, 11, 2, 7, 12, 15, 16, 3, 8, 13, 17, 4, 9, 14]], ["FSP", 3, 0, 1, 3], ["FSP", 3, 4, 2, 3], ["FSP", 3, 8, 3, 3], ["RE", 3, [0, 4, 8, 1, 5, 9, 2, 6, 10, 3, 7, 11]], ["CA", 2, 3, 8], ["CHR", 1, "shared", [2]], ["CA", 2, 3, 9], ["CHR", 0, "shared", [3]], ["CA", 1, 4, 9], ["FU", 5, [0, 1, 2]], ["AN", 5, 0, 5], ["FU", 5, [1, 2, 3]], ["AN", 5, 1, 4], ["FU", 5, [2, 3, 4]], ["AN", 5, 2, 6], ["FU", 3, [0, 1, 2]], ["SP", 3, 0, 15, [1], 1], ["AN", 3, 1, 2], ["FFSP", 3, 0, [3, 2, 1], 1, 1], ["AN", 3, 1, 6], ["FU", 1, [0, 1, 2]], ["SP", 1, 0, 15, [1], 1], ["AN", 1, 1, 2], ["FFSP", 1, 0, [3, 2, 1], 1, 1], ["AN", 1, 1, 6], ["PR", 4, 0, "auto_unroll_max_step$16"]]]], "r": [[7.37719e-06], 0, 0.571137, 1692122142], "v": "v0.6"}
{"i": [["[\"matmul\", 6, 65, 65, 4, \"float32\"]", "cuda -keys=cuda,gpu -arch=sm_75 -max_num_threads=1024 -thread_warp_size=32", [-1, 16, 64, 49152, 2147483647, 1024, 8, 32], "", 0, []], [[], [["CHW", 2, "local"], ["SP", 2, 0, 6, [3, 2, 1, 1], 1], ["SP", 2, 5, 65, [1, 1, 1, 5], 1], ["SP", 2, 10, 4, [1, 4, 1, 1], 1], ["SP", 2, 15, 65, [1, 5], 1], ["RE", 2, [0, 5, 10, 1, 6, 11, 2, 7, 12, 15, 16, 3, 8, 13, 17, 4, 9, 14]], ["FSP", 3, 0, 1, 3], ["FSP", 3, 4, 2, 3], ["FSP", 3, 8, 3, 3], ["RE", 3, [0, 4, 8, 1, 5, 9, 2, 6, 10, 3, 7, 11]], ["CA", 2, 3, 8], ["CHR", 1, "shared", [2]], ["CA", 2, 3, 9], ["CHR", 0, "shared", [3]], ["CA", 1, 4, 9], ["FU", 5, [0, 1, 2]], ["AN", 5, 0, 5], ["FU", 5, [1, 2, 3]], ["AN", 5, 1, 4], ["FU", 5, [2, 3, 4]], ["AN", 5, 2, 6], ["FU", 3, [0, 1, 2]], ["SP", 3, 0, 1, [1], 1], ["AN", 3, 1, 2], ["FFSP", 3, 0, [3, 2, 1], 1, 1], ["AN", 3, 1, 6], ["FU", 1, [0, 1, 2]], ["SP", 1, 0, 5, [1], 1], ["AN", 1, 1, 2], ["FFSP", 1, 0, [3, 2, 1], 1, 1], ["AN", 1, 1, 6], ["PR", 4, 0, "auto_unroll_max_step$512"]]]], "r": [[8.4461e-06], 0, 0.681454, 1692122143], "v": "v0.6"}
{"i": [["[\"matmul\", 6, 65, 65, 4, \"float32\"]", "cuda -keys=cuda,gpu -arch=sm_75 -max_num_threads=1024 -thread_warp_size=32", [-1, 16, 64, 49152, 2147483647, 1024, 8, 32], "", 0, []], [[], [["CHW", 2, "local"], ["SP", 2, 0, 6, [1, 1, 2, 3], 1], ["SP", 2, 5, 65, [1, 1, 1, 1], 1], ["SP", 2, 10, 4, [1, 4, 1, 1], 1], ["SP", 2, 15, 65, [5, 1], 1], ["RE", 2, [0, 5, 10, 1, 6, 11, 2, 7, 12, 15, 16, 3, 8, 13, 17, 4, 9, 14]], ["FSP", 3, 0, 1, 3], ["FSP", 3, 4, 2, 3], ["FSP", 3, 8, 3, 3], ["RE", 3, [0, 4, 8, 1, 5, 9, 2, 6, 10, 3, 7, 11]], ["CA", 2, 3, 8], ["CHR", 1, "shared", [2]], ["CA", 2, 3, 9], ["CHR", 0, "shared", [3]], ["CA", 1, 4, 9], ["FU", 5, [0, 1, 2]], ["AN", 5, 0, 5], ["FU", 5, [1, 2, 3]], ["AN", 5, 1, 4], ["FU", 5, [2, 3, 4]], ["AN", 5, 2, 6], ["FU", 3, [0, 1, 2]], ["SP", 3, 0, 30, [1], 1], ["AN", 3, 1, 2], ["FFSP", 3, 0, [3, 2, 1], 1, 1], ["AN", 3, 1, 6], ["FU", 1, [0, 1, 2]], ["SP", 1, 0, 30, [1], 1], ["AN", 1, 1, 2], ["FFSP", 1, 0, [3, 2, 1], 1, 1], ["AN", 1, 1, 6], ["PR", 4, 0, "auto_unroll_max_step$16"]]]], "r": [[1.06616e-05], 0, 0.634084, 1692122149], "v": "v0.6"}
{"i": [["[\"matmul\", 6, 65, 65, 4, \"float32\"]", "cuda -keys=cuda,gpu -arch=sm_75 -max_num_threads=1024 -thread_warp_size=32", [-1, 16, 64, 49152, 2147483647, 1024, 8, 32], "", 0, []], [[], [["CHW", 2, "local"], ["SP", 2, 0, 6, [1, 3, 2, 1], 1], ["SP", 2, 5, 65, [1, 13, 1, 1], 1], ["SP", 2, 10, 4, [2, 2, 1, 1], 1], ["SP", 2, 15, 65, [1, 13], 1], ["RE", 2, [0, 5, 10, 1, 6, 11, 2, 7, 12, 15, 16, 3, 8, 13, 17, 4, 9, 14]], ["FSP", 3, 0, 1, 3], ["FSP", 3, 4, 2, 3], ["FSP", 3, 8, 3, 3], ["RE", 3, [0, 4, 8, 1, 5, 9, 2, 6, 10, 3, 7, 11]], ["CA", 2, 3, 8], ["CHR", 1, "shared", [2]], ["CA", 2, 3, 9], ["CHR", 0, "shared", [3]], ["CA", 1, 4, 9], ["FU", 5, [0, 1, 2]], ["AN", 5, 0, 5], ["FU", 5, [1, 2, 3]], ["AN", 5, 1, 4], ["FU", 5, [2, 3, 4]], ["AN", 5, 2, 6], ["FU", 3, [0, 1, 2]], ["SP", 3, 0, 26, [26], 1], ["AN", 3, 1, 2], ["FFSP", 3, 0, [3, 2, 1], 1, 1], ["AN", 3, 1, 6], ["FU", 1, [0, 1, 2]], ["SP", 1, 0, 26, [1], 1], ["AN", 1, 1, 2], ["FFSP", 1, 0, [3, 2, 1], 1, 1], ["AN", 1, 1, 6], ["PR", 4, 0, "auto_unroll_max_step$1024"]]]], "r": [[5.04401e-06], 0, 1.07089, 1692122150], "v": "v0.6"}
{"i": [["[\"matmul\", 6, 65, 65, 4, \"float32\"]", "cuda -keys=cuda,gpu -arch=sm_75 -max_num_threads=1024 -thread_warp_size=32", [-1, 16, 64, 49152, 2147483647, 1024, 8, 32], "", 0, []], [[], [["CHW", 2, "local"], ["SP", 2, 0, 6, [1, 2, 3, 1], 1], ["SP", 2, 5, 65, [5, 13, 1, 1], 1], ["SP", 2, 10, 4, [2, 2, 1, 1], 1], ["SP", 2, 15, 65, [1, 13], 1], ["RE", 2, [0, 5, 10, 1, 6, 11, 2, 7, 12, 15, 16, 3, 8, 13, 17, 4, 9, 14]], ["FSP", 3, 0, 1, 3], ["FSP", 3, 4, 2, 3], ["FSP", 3, 8, 3, 3], ["RE", 3, [0, 4, 8, 1, 5, 9, 2, 6, 10, 3, 7, 11]], ["CA", 2, 3, 8], ["CHR", 1, "shared", [2]], ["CA", 2, 3, 9], ["CHR", 0, "shared", [3]], ["CA", 1, 4, 9], ["FU", 5, [0, 1, 2]], ["AN", 5, 0, 5], ["FU", 5, [1, 2, 3]], ["AN", 5, 1, 4], ["FU", 5, [2, 3, 4]], ["AN", 5, 2, 6], ["FU", 3, [0, 1, 2]], ["SP", 3, 0, 39, [1], 1], ["AN", 3, 1, 2], ["FFSP", 3, 0, [3, 2, 1], 1, 1], ["AN", 3, 1, 6], ["FU", 1, [0, 1, 2]], ["SP", 1, 0, 39, [1], 1], ["AN", 1, 1, 2], ["FFSP", 1, 0, [3, 2, 1], 1, 1], ["AN", 1, 1, 6], ["PR", 4, 0, "auto_unroll_max_step$16"]]]], "r": [[1.56434e-05], 0, 0.657033, 1692122150], "v": "v0.6"}
{"i": [["[\"matmul\", 6, 65, 65, 4, \"float32\"]", "cuda -keys=cuda,gpu -arch=sm_75 -max_num_threads=1024 -thread_warp_size=32", [-1, 16, 64, 49152, 2147483647, 1024, 8, 32], "", 0, []], [[], [["CHW", 2, "local"], ["SP", 2, 0, 6, [1, 3, 1, 2], 1], ["SP", 2, 5, 65, [1, 13, 5, 1], 1], ["SP", 2, 10, 4, [2, 1, 1, 1], 1], ["SP", 2, 15, 65, [1, 1], 1], ["RE", 2, [0, 5, 10, 1, 6, 11, 2, 7, 12, 15, 16, 3, 8, 13, 17, 4, 9, 14]], ["FSP", 3, 0, 1, 3], ["FSP", 3, 4, 2, 3], ["FSP", 3, 8, 3, 3], ["RE", 3, [0, 4, 8, 1, 5, 9, 2, 6, 10, 3, 7, 11]], ["CA", 2, 3, 8], ["CHR", 1, "shared", [2]], ["CA", 2, 3, 9], ["CHR", 0, "shared", [3]], ["CA", 1, 4, 9], ["FU", 5, [0, 1, 2]], ["AN", 5, 0, 5], ["FU", 5, [1, 2, 3]], ["AN", 5, 1, 4], ["FU", 5, [2, 3, 4]], ["AN", 5, 2, 6], ["FU", 3, [0, 1, 2]], ["SP", 3, 0, 10, [1], 1], ["AN", 3, 1, 2], ["FFSP", 3, 0, [3, 2, 1], 1, 1], ["AN", 3, 1, 6], ["FU", 1, [0, 1, 2]], ["SP", 1, 0, 50, [2], 1], ["AN", 1, 1, 2], ["FFSP", 1, 0, [3, 2, 1], 1, 1], ["AN", 1, 1, 6], ["PR", 4, 0, "auto_unroll_max_step$0"]]]], "r": [[2.01971e-05], 0, 0.604623, 1692122150], "v": "v0.6"}
{"i": [["[\"matmul\", 6, 65, 65, 4, \"float32\"]", "cuda -keys=cuda,gpu -arch=sm_75 -max_num_threads=1024 -thread_warp_size=32", [-1, 16, 64, 49152, 2147483647, 1024, 8, 32], "", 0, []], [[], [["CHW", 2, "local"], ["SP", 2, 0, 6, [1, 2, 1, 1], 1], ["SP", 2, 5, 65, [1, 65, 1, 1], 1], ["SP", 2, 10, 4, [2, 1, 1, 1], 1], ["SP", 2, 15, 65, [5, 1], 1], ["RE", 2, [0, 5, 10, 1, 6, 11, 2, 7, 12, 15, 16, 3, 8, 13, 17, 4, 9, 14]], ["FSP", 3, 0, 1, 3], ["FSP", 3, 4, 2, 3], ["FSP", 3, 8, 3, 3], ["RE", 3, [0, 4, 8, 1, 5, 9, 2, 6, 10, 3, 7, 11]], ["CA", 2, 3, 8], ["CHR", 1, "shared", [2]], ["CA", 2, 3, 9], ["CHR", 0, "shared", [3]], ["CA", 1, 4, 9], ["FU", 5, [0, 1, 2]], ["AN", 5, 0, 5], ["FU", 5, [1, 2, 3]], ["AN", 5, 1, 4], ["FU", 5, [2, 3, 4]], ["AN", 5, 2, 6], ["FU", 3, [0, 1, 2]], ["SP", 3, 0, 5, [5], 1], ["AN", 3, 1, 2], ["FFSP", 3, 0, [3, 2, 1], 1, 1], ["AN", 3, 1, 6], ["FU", 1, [0, 1, 2]], ["SP", 1, 0, 5, [1], 1], ["AN", 1, 1, 2], ["FFSP", 1, 0, [3, 2, 1], 1, 1], ["AN", 1, 1, 6], ["PR", 4, 0, "auto_unroll_max_step$512"]]]], "r": [[5.8912e-06], 0, 0.821801, 1692122151], "v": "v0.6"}
{"i": [["[\"matmul\", 6, 65, 65, 4, \"float32\"]", "cuda -keys=cuda,gpu -arch=sm_75 -max_num_threads=1024 -thread_warp_size=32", [-1, 16, 64, 49152, 2147483647, 1024, 8, 32], "", 0, []], [[], [["CHW", 2, "local"], ["SP", 2, 0, 6, [1, 6, 1, 1], 1], ["SP", 2, 5, 65, [1, 5, 1, 1], 1], ["SP", 2, 10, 4, [1, 2, 1, 1], 1], ["SP", 2, 15, 65, [1, 13], 1], ["RE", 2, [0, 5, 10, 1, 6, 11, 2, 7, 12, 15, 16, 3, 8, 13, 17, 4, 9, 14]], ["FSP", 3, 0, 1, 3], ["FSP", 3, 4, 2, 3], ["FSP", 3, 8, 3, 3], ["RE", 3, [0, 4, 8, 1, 5, 9, 2, 6, 10, 3, 7, 11]], ["CA", 2, 3, 8], ["CHR", 1, "shared", [2]], ["CA", 2, 3, 9], ["CHR", 0, "shared", [3]], ["CA", 1, 4, 9], ["FU", 5, [0, 1, 2]], ["AN", 5, 0, 5], ["FU", 5, [1, 2, 3]], ["AN", 5, 1, 4], ["FU", 5, [2, 3, 4]], ["AN", 5, 2, 6], ["FU", 3, [0, 1, 2]], ["SP", 3, 0, 6, [1], 1], ["AN", 3, 1, 2], ["FFSP", 3, 0, [3, 2, 1], 1, 1], ["AN", 3, 1, 6], ["FU", 1, [0, 1, 2]], ["SP", 1, 0, 6, [1], 1], ["AN", 1, 1, 2], ["FFSP", 1, 0, [3, 2, 1], 1, 1], ["AN", 1, 1, 6], ["PR", 4, 0, "auto_unroll_max_step$512"]]]], "r": [[3.14769e-06], 0, 0.658548, 1692122151], "v": "v0.6"}
{"i": [["[\"matmul\", 6, 65, 65, 4, \"float32\"]", "cuda -keys=cuda,gpu -arch=sm_75 -max_num_threads=1024 -thread_warp_size=32", [-1, 16, 64, 49152, 2147483647, 1024, 8, 32], "", 0, []], [[], [["CHW", 2, "local"], ["SP", 2, 0, 6, [6, 1, 1, 1], 1], ["SP", 2, 5, 65, [1, 65, 1, 1], 1], ["SP", 2, 10, 4, [1, 2, 1, 1], 1], ["SP", 2, 15, 65, [1, 1], 1], ["RE", 2, [0, 5, 10, 1, 6, 11, 2, 7, 12, 15, 16, 3, 8, 13, 17, 4, 9, 14]], ["FSP", 3, 0, 1, 3], ["FSP", 3, 4, 2, 3], ["FSP", 3, 8, 3, 3], ["RE", 3, [0, 4, 8, 1, 5, 9, 2, 6, 10, 3, 7, 11]], ["CA", 2, 3, 8], ["CHR", 1, "shared", [2]], ["CA", 2, 3, 9], ["CHR", 0, "shared", [3]], ["CA", 1, 4, 9], ["FU", 5, [0, 1, 2]], ["AN", 5, 0, 5], ["FU", 5, [1, 2, 3]], ["AN", 5, 1, 4], ["FU", 5, [2, 3, 4]], ["AN", 5, 2, 6], ["FU", 3, [0, 1, 2]], ["SP", 3, 0, 6, [1], 1], ["AN", 3, 1, 2], ["FFSP", 3, 0, [3, 2, 1], 1, 1], ["AN", 3, 1, 6], ["FU", 1, [0, 1, 2]], ["SP", 1, 0, 6, [1], 1], ["AN", 1, 1, 2], ["FFSP", 1, 0, [3, 2, 1], 1, 1], ["AN", 1, 1, 6], ["PR", 4, 0, "auto_unroll_max_step$512"]]]], "r": [[1.8205e-05], 0, 0.659281, 1692122152], "v": "v0.6"}
{"i": [["[\"matmul\", 6, 65, 65, 4, \"float32\"]", "cuda -keys=cuda,gpu -arch=sm_75 -max_num_threads=1024 -thread_warp_size=32", [-1, 16, 64, 49152, 2147483647, 1024, 8, 32], "", 0, []], [[], [["CHW", 2, "local"], ["SP", 2, 0, 6, [6, 1, 1, 1], 1], ["SP", 2, 5, 65, [1, 65, 1, 1], 1], ["SP", 2, 10, 4, [2, 1, 1, 1], 1], ["SP", 2, 15, 65, [5, 1], 1], ["RE", 2, [0, 5, 10, 1, 6, 11, 2, 7, 12, 15, 16, 3, 8, 13, 17, 4, 9, 14]], ["FSP", 3, 0, 1, 3], ["FSP", 3, 4, 2, 3], ["FSP", 3, 8, 3, 3], ["RE", 3, [0, 4, 8, 1, 5, 9, 2, 6, 10, 3, 7, 11]], ["CA", 2, 3, 8], ["CHR", 1, "shared", [2]], ["CA", 2, 3, 9], ["CHR", 0, "shared", [3]], ["CA", 1, 4, 9], ["FU", 5, [0, 1, 2]], ["AN", 5, 0, 5], ["FU", 5, [1, 2, 3]], ["AN", 5, 1, 4], ["FU", 5, [2, 3, 4]], ["AN", 5, 2, 6], ["FU", 3, [0, 1, 2]], ["SP", 3, 0, 5, [1], 1], ["AN", 3, 1, 2], ["FFSP", 3, 0, [3, 2, 1], 1, 1], ["AN", 3, 1, 6], ["FU", 1, [0, 1, 2]], ["SP", 1, 0, 5, [1], 1], ["AN", 1, 1, 2], ["FFSP", 1, 0, [3, 2, 1], 1, 1], ["AN", 1, 1, 6], ["PR", 4, 0, "auto_unroll_max_step$512"]]]], "r": [[1.06376e-05], 0, 0.651511, 1692122152], "v": "v0.6"}
{"i": [["[\"matmul\", 6, 65, 65, 4, \"float32\"]", "cuda -keys=cuda,gpu -arch=sm_75 -max_num_threads=1024 -thread_warp_size=32", [-1, 16, 64, 49152, 2147483647, 1024, 8, 32], "", 0, []], [[], [["CHW", 2, "local"], ["SP", 2, 0, 6, [1, 1, 6, 1], 1], ["SP", 2, 5, 65, [1, 65, 1, 1], 1], ["SP", 2, 10, 4, [2, 2, 1, 1], 1], ["SP", 2, 15, 65, [1, 5], 1], ["RE", 2, [0, 5, 10, 1, 6, 11, 2, 7, 12, 15, 16, 3, 8, 13, 17, 4, 9, 14]], ["FSP", 3, 0, 1, 3], ["FSP", 3, 4, 2, 3], ["FSP", 3, 8, 3, 3], ["RE", 3, [0, 4, 8, 1, 5, 9, 2, 6, 10, 3, 7, 11]], ["CA", 2, 3, 8], ["CHR", 1, "shared", [2]], ["CA", 2, 3, 9], ["CHR", 0, "shared", [3]], ["CA", 1, 4, 9], ["FU", 5, [0, 1, 2]], ["AN", 5, 0, 5], ["FU", 5, [1, 2, 3]], ["AN", 5, 1, 4], ["FU", 5, [2, 3, 4]], ["AN", 5, 2, 6], ["FU", 3, [0, 1, 2]], ["SP", 3, 0, 30, [1], 1], ["AN", 3, 1, 2], ["FFSP", 3, 0, [3, 2, 1], 1, 1], ["AN", 3, 1, 6], ["FU", 1, [0, 1, 2]], ["SP", 1, 0, 30, [1], 1], ["AN", 1, 1, 2], ["FFSP", 1, 0, [3, 2, 1], 1, 1], ["AN", 1, 1, 6], ["PR", 4, 0, "auto_unroll_max_step$16"]]]], "r": [[1.40841e-05], 0, 0.608961, 1692122153], "v": "v0.6"}
{"i": [["[\"matmul\", 6, 65, 65, 4, \"float32\"]", "cuda -keys=cuda,gpu -arch=sm_75 -max_num_threads=1024 -thread_warp_size=32", [-1, 16, 64, 49152, 2147483647, 1024, 8, 32], "", 0, []], [[], [["CHW", 2, "local"], ["SP", 2, 0, 6, [1, 2, 3, 1], 1], ["SP", 2, 5, 65, [5, 13, 1, 1], 1], ["SP", 2, 10, 4, [1, 4, 1, 1], 1], ["SP", 2, 15, 65, [1, 1], 1], ["RE", 2, [0, 5, 10, 1, 6, 11, 2, 7, 12, 15, 16, 3, 8, 13, 17, 4, 9, 14]], ["FSP", 3, 0, 1, 3], ["FSP", 3, 4, 2, 3], ["FSP", 3, 8, 3, 3], ["RE", 3, [0, 4, 8, 1, 5, 9, 2, 6, 10, 3, 7, 11]], ["CA", 2, 3, 8], ["CHR", 1, "shared", [2]], ["CA", 2, 3, 9], ["CHR", 0, "shared", [3]], ["CA", 1, 4, 9], ["FU", 5, [0, 1, 2]], ["AN", 5, 0, 5], ["FU", 5, [1, 2, 3]], ["AN", 5, 1, 4], ["FU", 5, [2, 3, 4]], ["AN", 5, 2, 6], ["FU", 3, [0, 1, 2]], ["SP", 3, 0, 39, [1], 1], ["AN", 3, 1, 2], ["FFSP", 3, 0, [3, 2, 1], 1, 1], ["AN", 3, 1, 6], ["FU", 1, [0, 1, 2]], ["SP", 1, 0, 195, [1], 1], ["AN", 1, 1, 2], ["FFSP", 1, 0, [3, 2, 1], 1, 1], ["AN", 1, 1, 6], ["PR", 4, 0, "auto_unroll_max_step$512"]]]], "r": [[2.17643e-05], 0, 0.587364, 1692122153], "v": "v0.6"}
{"i": [["[\"matmul\", 6, 65, 65, 4, \"float32\"]", "cuda -keys=cuda,gpu -arch=sm_75 -max_num_threads=1024 -thread_warp_size=32", [-1, 16, 64, 49152, 2147483647, 1024, 8, 32], "", 0, []], [[], [["CHW", 2, "local"], ["SP", 2, 0, 6, [1, 3, 2, 1], 1], ["SP", 2, 5, 65, [1, 13, 5, 1], 1], ["SP", 2, 10, 4, [1, 1, 2, 1], 1], ["SP", 2, 15, 65, [13, 1], 1], ["RE", 2, [0, 5, 10, 1, 6, 11, 2, 7, 12, 15, 16, 3, 8, 13, 17, 4, 9, 14]], ["FSP", 3, 0, 1, 3], ["FSP", 3, 4, 2, 3], ["FSP", 3, 8, 3, 3], ["RE", 3, [0, 4, 8, 1, 5, 9, 2, 6, 10, 3, 7, 11]], ["CA", 2, 3, 8], ["CHR", 1, "shared", [2]], ["CA", 2, 3, 9], ["CHR", 0, "shared", [3]], ["CA", 1, 4, 9], ["FU", 5, [0, 1, 2]], ["AN", 5, 0, 5], ["FU", 5, [1, 2, 3]], ["AN", 5, 1, 4], ["FU", 5, [2, 3, 4]], ["AN", 5, 2, 6], ["FU", 3, [0, 1, 2]], ["SP", 3, 0, 52, [1], 1], ["AN", 3, 1, 2], ["FFSP", 3, 0, [3, 2, 1], 1, 1], ["AN", 3, 1, 6], ["FU", 1, [0, 1, 2]], ["SP", 1, 0, 26, [1], 1], ["AN", 1, 1, 2], ["FFSP", 1, 0, [3, 2, 1], 1, 1], ["AN", 1, 1, 6], ["PR", 4, 0, "auto_unroll_max_step$64"]]]], "r": [[8.87145e-06], 0, 0.613813, 1692122153], "v": "v0.6"}
{"i": [["[\"matmul\", 6, 65, 65, 4, \"float32\"]", "cuda -keys=cuda,gpu -arch=sm_75 -max_num_threads=1024 -thread_warp_size=32", [-1, 16, 64, 49152, 2147483647, 1024, 8, 32], "", 0, []], [[], [["CHW", 2, "local"], ["SP", 2, 0, 6, [1, 3, 1, 1], 1], ["SP", 2, 5, 65, [1, 1, 1, 1], 1], ["SP", 2, 10, 4, [1, 1, 2, 1], 1], ["SP", 2, 15, 65, [13, 1], 1], ["RE", 2, [0, 5, 10, 1, 6, 11, 2, 7, 12, 15, 16, 3, 8, 13, 17, 4, 9, 14]], ["FSP", 3, 0, 1, 3], ["FSP", 3, 4, 2, 3], ["FSP", 3, 8, 3, 3], ["RE", 3, [0, 4, 8, 1, 5, 9, 2, 6, 10, 3, 7, 11]], ["CA", 2, 3, 8], ["CHR", 1, "shared", [2]], ["CA", 2, 3, 9], ["CHR", 0, "shared", [3]], ["CA", 1, 4, 9], ["FU", 5, [0, 1, 2]], ["AN", 5, 0, 5], ["FU", 5, [1, 2, 3]], ["AN", 5, 1, 4], ["FU", 5, [2, 3, 4]], ["AN", 5, 2, 6], ["FU", 3, [0, 1, 2]], ["SP", 3, 0, 26, [1], 1], ["AN", 3, 1, 2], ["FFSP", 3, 0, [3, 2, 1], 1, 1], ["AN", 3, 1, 6], ["FU", 1, [0, 1, 2]], ["SP", 1, 0, 13, [1], 1], ["AN", 1, 1, 2], ["FFSP", 1, 0, [3, 2, 1], 1, 1], ["AN", 1, 1, 6], ["PR", 4, 0, "auto_unroll_max_step$0"]]]], "r": [[1.04338e-05], 0, 0.602375, 1692122153], "v": "v0.6"}
{"i": [["[\"matmul\", 6, 65, 65, 4, \"float32\"]", "cuda -keys=cuda,gpu -arch=sm_75 -max_num_threads=1024 -thread_warp_size=32", [-1, 16, 64, 49152, 2147483647, 1024, 8, 32], "", 0, []], [[], [["CHW", 2, "local"], ["SP", 2, 0, 6, [1, 6, 1, 1], 1], ["SP", 2, 5, 65, [1, 13, 1, 1], 1], ["SP", 2, 10, 4, [1, 2, 1, 1], 1], ["SP", 2, 15, 65, [13, 5], 1], ["RE", 2, [0, 5, 10, 1, 6, 11, 2, 7, 12, 15, 16, 3, 8, 13, 17, 4, 9, 14]], ["FSP", 3, 0, 1, 3], ["FSP", 3, 4, 2, 3], ["FSP", 3, 8, 3, 3], ["RE", 3, [0, 4, 8, 1, 5, 9, 2, 6, 10, 3, 7, 11]], ["CA", 2, 3, 8], ["CHR", 1, "shared", [2]], ["CA", 2, 3, 9], ["CHR", 0, "shared", [3]], ["CA", 1, 4, 9], ["FU", 5, [0, 1, 2]], ["AN", 5, 0, 5], ["FU", 5, [1, 2, 3]], ["AN", 5, 1, 4], ["FU", 5, [2, 3, 4]], ["AN", 5, 2, 6], ["FU", 3, [0, 1, 2]], ["SP", 3, 0, 130, [1], 1], ["AN", 3, 1, 2], ["FFSP", 3, 0, [3, 2, 1], 1, 1], ["AN", 3, 1, 6], ["FU", 1, [0, 1, 2]], ["SP", 1, 0, 65, [1], 1], ["AN", 1, 1, 2], ["FFSP", 1, 0, [3, 2, 1], 1, 1], ["AN", 1, 1, 6], ["PR", 4, 0, "auto_unroll_max_step$16"]]]], "r": [[5.18485e-06], 0, 0.551478, 1692122154], "v": "v0.6"}
{"i": [["[\"matmul\", 6, 65, 65, 4, \"float32\"]", "cuda -keys=cuda,gpu -arch=sm_75 -max_num_threads=1024 -thread_warp_size=32", [-1, 16, 64, 49152, 2147483647, 1024, 8, 32], "", 0, []], [[], [["CHW", 2, "local"], ["SP", 2, 0, 6, [1, 1, 1, 6], 1], ["SP", 2, 5, 65, [1, 5, 1, 13], 1], ["SP", 2, 10, 4, [1, 2, 1, 1], 1], ["SP", 2, 15, 65, [1, 13], 1], ["RE", 2, [0, 5, 10, 1, 6, 11, 2, 7, 12, 15, 16, 3, 8, 13, 17, 4, 9, 14]], ["FSP", 3, 0, 1, 3], ["FSP", 3, 4, 2, 3], ["FSP", 3, 8, 3, 3], ["RE", 3, [0, 4, 8, 1, 5, 9, 2, 6, 10, 3, 7, 11]], ["CA", 2, 3, 8], ["CHR", 1, "shared", [2]], ["CA", 2, 3, 9], ["CHR", 0, "shared", [3]], ["CA", 1, 4, 9], ["FU", 5, [0, 1, 2]], ["AN", 5, 0, 5], ["FU", 5, [1, 2, 3]], ["AN", 5, 1, 4], ["FU", 5, [2, 3, 4]], ["AN", 5, 2, 6], ["FU", 3, [0, 1, 2]], ["SP", 3, 0, 6, [6], 1], ["AN", 3, 1, 2], ["FFSP", 3, 0, [3, 2, 1], 1, 1], ["AN", 3, 1, 6], ["FU", 1, [0, 1, 2]], ["SP", 1, 0, 6, [1], 1], ["AN", 1, 1, 2], ["FFSP", 1, 0, [3, 2, 1], 1, 1], ["AN", 1, 1, 6], ["PR", 4, 0, "auto_unroll_max_step$512"]]]], "r": [[0.000113972], 0, 4.01636, 1692122154], "v": "v0.6"}
{"i": [["[\"matmul\", 6, 65, 65, 4, \"float32\"]", "cuda -keys=cuda,gpu -arch=sm_75 -max_num_threads=1024 -thread_warp_size=32", [-1, 16, 64, 49152, 2147483647, 1024, 8, 32], "", 0, []], [[], [["CHW", 2, "local"], ["SP", 2, 0, 6, [1, 3, 2, 1], 1], ["SP", 2, 5, 65, [1, 13, 1, 1], 1], ["SP", 2, 10, 4, [1, 2, 2, 1], 1], ["SP", 2, 15, 65, [13, 5], 1], ["RE", 2, [0, 5, 10, 1, 6, 11, 2, 7, 12, 15, 16, 3, 8, 13, 17, 4, 9, 14]], ["FSP", 3, 0, 1, 3], ["FSP", 3, 4, 2, 3], ["FSP", 3, 8, 3, 3], ["RE", 3, [0, 4, 8, 1, 5, 9, 2, 6, 10, 3, 7, 11]], ["CA", 2, 3, 8], ["CHR", 1, "shared", [2]], ["CA", 2, 3, 9], ["CHR", 0, "shared", [3]], ["CA", 1, 4, 9], ["FU", 5, [0, 1, 2]], ["AN", 5, 0, 5], ["FU", 5, [1, 2, 3]], ["AN", 5, 1, 4], ["FU", 5, [2, 3, 4]], ["AN", 5, 2, 6], ["FU", 3, [0, 1, 2]], ["SP", 3, 0, 260, [1], 1], ["AN", 3, 1, 2], ["FFSP", 3, 0, [3, 2, 1], 1, 1], ["AN", 3, 1, 6], ["FU", 1, [0, 1, 2]], ["SP", 1, 0, 130, [1], 1], ["AN", 1, 1, 2], ["FFSP", 1, 0, [3, 2, 1], 1, 1], ["AN", 1, 1, 6], ["PR", 4, 0, "auto_unroll_max_step$512"]]]], "r": [[3.1155e-06], 0, 1.19911, 1692122154], "v": "v0.6"}
{"i": [["[\"matmul\", 6, 65, 65, 4, \"float32\"]", "cuda -keys=cuda,gpu -arch=sm_75 -max_num_threads=1024 -thread_warp_size=32", [-1, 16, 64, 49152, 2147483647, 1024, 8, 32], "", 0, []], [[], [["CHW", 2, "local"], ["SP", 2, 0, 6, [1, 2, 3, 1], 1], ["SP", 2, 5, 65, [1, 13, 1, 1], 1], ["SP", 2, 10, 4, [1, 2, 1, 2], 1], ["SP", 2, 15, 65, [5, 1], 1], ["RE", 2, [0, 5, 10, 1, 6, 11, 2, 7, 12, 15, 16, 3, 8, 13, 17, 4, 9, 14]], ["FSP", 3, 0, 1, 3], ["FSP", 3, 4, 2, 3], ["FSP", 3, 8, 3, 3], ["RE", 3, [0, 4, 8, 1, 5, 9, 2, 6, 10, 3, 7, 11]], ["CA", 2, 3, 8], ["CHR", 1, "shared", [2]], ["CA", 2, 3, 9], ["CHR", 0, "shared", [3]], ["CA", 1, 4, 9], ["FU", 5, [0, 1, 2]], ["AN", 5, 0, 5], ["FU", 5, [1, 2, 3]], ["AN", 5, 1, 4], ["FU", 5, [2, 3, 4]], ["AN", 5, 2, 6], ["FU", 3, [0, 1, 2]], ["SP", 3, 0, 30, [10], 1], ["AN", 3, 1, 2], ["FFSP", 3, 0, [3, 2, 1], 1, 1], ["AN", 3, 1, 6], ["FU", 1, [0, 1, 2]], ["SP", 1, 0, 15, [5], 1], ["AN", 1, 1, 2], ["FFSP", 1, 0, [3, 2, 1], 1, 1], ["AN", 1, 1, 6], ["PR", 4, 0, "auto_unroll_max_step$64"]]]], "r": [[6.39495e-06], 0, 0.673676, 1692122158], "v": "v0.6"}
{"i": [["[\"matmul\", 6, 65, 65, 4, \"float32\"]", "cuda -keys=cuda,gpu -arch=sm_75 -max_num_threads=1024 -thread_warp_size=32", [-1, 16, 64, 49152, 2147483647, 1024, 8, 32], "", 0, []], [[], [["CHW", 2, "local"], ["SP", 2, 0, 6, [1, 2, 1, 1], 1], ["SP", 2, 5, 65, [5, 13, 1, 1], 1], ["SP", 2, 10, 4, [1, 4, 1, 1], 1], ["SP", 2, 15, 65, [5, 13], 1], ["RE", 2, [0, 5, 10, 1, 6, 11, 2, 7, 12, 15, 16, 3, 8, 13, 17, 4, 9, 14]], ["FSP", 3, 0, 1, 3], ["FSP", 3, 4, 2, 3], ["FSP", 3, 8, 3, 3], ["RE", 3, [0, 4, 8, 1, 5, 9, 2, 6, 10, 3, 7, 11]], ["CA", 2, 3, 8], ["CHR", 1, "shared", [2]], ["CA", 2, 3, 9], ["CHR", 0, "shared", [3]], ["CA", 1, 4, 9], ["FU", 5, [0, 1, 2]], ["AN", 5, 0, 5], ["FU", 5, [1, 2, 3]], ["AN", 5, 1, 4], ["FU", 5, [2, 3, 4]], ["AN", 5, 2, 6], ["FU", 3, [0, 1, 2]], ["SP", 3, 0, 65, [1], 1], ["AN", 3, 1, 2], ["FFSP", 3, 0, [3, 2, 1], 1, 1], ["AN", 3, 1, 6], ["FU", 1, [0, 1, 2]], ["SP", 1, 0, 65, [1], 1], ["AN", 1, 1, 2], ["FFSP", 1, 0, [3, 2, 1], 1, 1], ["AN", 1, 1, 6], ["PR", 4, 0, "auto_unroll_max_step$512"]]]], "r": [[3.92471e-06], 0, 1.31165, 1692122158], "v": "v0.6"}
{"i": [["[\"matmul\", 6, 65, 65, 4, \"float32\"]", "cuda -keys=cuda,gpu -arch=sm_75 -max_num_threads=1024 -thread_warp_size=32", [-1, 16, 64, 49152, 2147483647, 1024, 8, 32], "", 0, []], [[], [["CHW", 2, "local"], ["SP", 2, 0, 6, [6, 1, 1, 1], 1], ["SP", 2, 5, 65, [1, 13, 5, 1], 1], ["SP", 2, 10, 4, [1, 2, 2, 1], 1], ["SP", 2, 15, 65, [1, 13], 1], ["RE", 2, [0, 5, 10, 1, 6, 11, 2, 7, 12, 15, 16, 3, 8, 13, 17, 4, 9, 14]], ["FSP", 3, 0, 1, 3], ["FSP", 3, 4, 2, 3], ["FSP", 3, 8, 3, 3], ["RE", 3, [0, 4, 8, 1, 5, 9, 2, 6, 10, 3, 7, 11]], ["CA", 2, 3, 8], ["CHR", 1, "shared", [2]], ["CA", 2, 3, 9], ["CHR", 0, "shared", [3]], ["CA", 1, 4, 9], ["FU", 5, [0, 1, 2]], ["AN", 5, 0, 5], ["FU", 5, [1, 2, 3]], ["AN", 5, 1, 4], ["FU", 5, [2, 3, 4]], ["AN", 5, 2, 6], ["FU", 3, [0, 1, 2]], ["SP", 3, 0, 13, [1], 1], ["AN", 3, 1, 2], ["FFSP", 3, 0, [3, 2, 1], 1, 1], ["AN", 3, 1, 6], ["FU", 1, [0, 1, 2]], ["SP", 1, 0, 65, [1], 1], ["AN", 1, 1, 2], ["FFSP", 1, 0, [3, 2, 1], 1, 1], ["AN", 1, 1, 6], ["PR", 4, 0, "auto_unroll_max_step$0"]]]], "r": [[1.47473e-05], 0, 0.913232, 1692122159], "v": "v0.6"}
{"i": [["[\"matmul\", 6, 65, 65, 4, \"float32\"]", "cuda -keys=cuda,gpu -arch=sm_75 -max_num_threads=1024 -thread_warp_size=32", [-1, 16, 64, 49152, 2147483647, 1024, 8, 32], "", 0, []], [[], [["CHW", 2, "local"], ["SP", 2, 0, 6, [2, 1, 3, 1], 1], ["SP", 2, 5, 65, [1, 65, 1, 1], 1], ["SP", 2, 10, 4, [2, 1, 1, 1], 1], ["SP", 2, 15, 65, [1, 1], 1], ["RE", 2, [0, 5, 10, 1, 6, 11, 2, 7, 12, 15, 16, 3, 8, 13, 17, 4, 9, 14]], ["FSP", 3, 0, 1, 3], ["FSP", 3, 4, 2, 3], ["FSP", 3, 8, 3, 3], ["RE", 3, [0, 4, 8, 1, 5, 9, 2, 6, 10, 3, 7, 11]], ["CA", 2, 3, 8], ["CHR", 1, "shared", [2]], ["CA", 2, 3, 9], ["CHR", 0, "shared", [3]], ["CA", 1, 4, 9], ["FU", 5, [0, 1, 2]], ["AN", 5, 0, 5], ["FU", 5, [1, 2, 3]], ["AN", 5, 1, 4], ["FU", 5, [2, 3, 4]], ["AN", 5, 2, 6], ["FU", 3, [0, 1, 2]], ["SP", 3, 0, 3, [1], 1], ["AN", 3, 1, 2], ["FFSP", 3, 0, [3, 2, 1], 1, 1], ["AN", 3, 1, 6], ["FU", 1, [0, 1, 2]], ["SP", 1, 0, 3, [1], 1], ["AN", 1, 1, 2], ["FFSP", 1, 0, [3, 2, 1], 1, 1], ["AN", 1, 1, 6], ["PR", 4, 0, "auto_unroll_max_step$16"]]]], "r": [[1.99179e-05], 0, 0.568864, 1692122159], "v": "v0.6"}
{"i": [["[\"matmul\", 6, 65, 65, 4, \"float32\"]", "cuda -keys=cuda,gpu -arch=sm_75 -max_num_threads=1024 -thread_warp_size=32", [-1, 16, 64, 49152, 2147483647, 1024, 8, 32], "", 0, []], [[], [["CHW", 2, "local"], ["SP", 2, 0, 6, [1, 3, 1, 2], 1], ["SP", 2, 5, 65, [1, 5, 1, 13], 1], ["SP", 2, 10, 4, [1, 2, 1, 1], 1], ["SP", 2, 15, 65, [1, 1], 1], ["RE", 2, [0, 5, 10, 1, 6, 11, 2, 7, 12, 15, 16, 3, 8, 13, 17, 4, 9, 14]], ["FSP", 3, 0, 1, 3], ["FSP", 3, 4, 2, 3], ["FSP", 3, 8, 3, 3], ["RE", 3, [0, 4, 8, 1, 5, 9, 2, 6, 10, 3, 7, 11]], ["CA", 2, 3, 8], ["CHR", 1, "shared", [2]], ["CA", 2, 3, 9], ["CHR", 0, "shared", [3]], ["CA", 1, 4, 9], ["FU", 5, [0, 1, 2]], ["AN", 5, 0, 5], ["FU", 5, [1, 2, 3]], ["AN", 5, 1, 4], ["FU", 5, [2, 3, 4]], ["AN", 5, 2, 6], ["FU", 3, [0, 1, 2]], ["SP", 3, 0, 6, [1], 1], ["AN", 3, 1, 2], ["FFSP", 3, 0, [3, 2, 1], 1, 1], ["AN", 3, 1, 6], ["FU", 1, [0, 1, 2]], ["SP", 1, 0, 6, [6], 1], ["AN", 1, 1, 2], ["FFSP", 1, 0, [3, 2, 1], 1, 1], ["AN", 1, 1, 6], ["PR", 4, 0, "auto_unroll_max_step$512"]]]], "r": [[2.43838e-05], 0, 0.606459, 1692122159], "v": "v0.6"}
{"i": [["[\"matmul\", 6, 65, 65, 4, \"float32\"]", "cuda -keys=cuda,gpu -arch=sm_75 -max_num_threads=1024 -thread_warp_size=32", [-1, 16, 64, 49152, 2147483647, 1024, 8, 32], "", 0, []], [[], [["CHW", 2, "local"], ["SP", 2, 0, 6, [1, 2, 1, 3], 1], ["SP", 2, 5, 65, [1, 13, 5, 1], 1], ["SP", 2, 10, 4, [1, 2, 2, 1], 1], ["SP", 2, 15, 65, [1, 13], 1], ["RE", 2, [0, 5, 10, 1, 6, 11, 2, 7, 12, 15, 16, 3, 8, 13, 17, 4, 9, 14]], ["FSP", 3, 0, 1, 3], ["FSP", 3, 4, 2, 3], ["FSP", 3, 8, 3, 3], ["RE", 3, [0, 4, 8, 1, 5, 9, 2, 6, 10, 3, 7, 11]], ["CA", 2, 3, 8], ["CHR", 1, "shared", [2]], ["CA", 2, 3, 9], ["CHR", 0, "shared", [3]], ["CA", 1, 4, 9], ["FU", 5, [0, 1, 2]], ["AN", 5, 0, 5], ["FU", 5, [1, 2, 3]], ["AN", 5, 1, 4], ["FU", 5, [2, 3, 4]], ["AN", 5, 2, 6], ["FU", 3, [0, 1, 2]], ["SP", 3, 0, 78, [1], 1], ["AN", 3, 1, 2], ["FFSP", 3, 0, [3, 2, 1], 1, 1], ["AN", 3, 1, 6], ["FU", 1, [0, 1, 2]], ["SP", 1, 0, 195, [1], 1], ["AN", 1, 1, 2], ["FFSP", 1, 0, [3, 2, 1], 1, 1], ["AN", 1, 1, 6], ["PR", 4, 0, "auto_unroll_max_step$16"]]]], "r": [[2.10468e-05], 0, 0.672604, 1692122160], "v": "v0.6"}
{"i": [["[\"matmul\", 6, 65, 65, 4, \"float32\"]", "cuda -keys=cuda,gpu -arch=sm_75 -max_num_threads=1024 -thread_warp_size=32", [-1, 16, 64, 49152, 2147483647, 1024, 8, 32], "", 0, []], [[], [["CHW", 2, "local"], ["SP", 2, 0, 6, [3, 1, 1, 2], 1], ["SP", 2, 5, 65, [1, 65, 1, 1], 1], ["SP", 2, 10, 4, [1, 2, 2, 1], 1], ["SP", 2, 15, 65, [13, 1], 1], ["RE", 2, [0, 5, 10, 1, 6, 11, 2, 7, 12, 15, 16, 3, 8, 13, 17, 4, 9, 14]], ["FSP", 3, 0, 1, 3], ["FSP", 3, 4, 2, 3], ["FSP", 3, 8, 3, 3], ["RE", 3, [0, 4, 8, 1, 5, 9, 2, 6, 10, 3, 7, 11]], ["CA", 2, 3, 8], ["CHR", 1, "shared", [2]], ["CA", 2, 3, 9], ["CHR", 0, "shared", [3]], ["CA", 1, 4, 9], ["FU", 5, [0, 1, 2]], ["AN", 5, 0, 5], ["FU", 5, [1, 2, 3]], ["AN", 5, 1, 4], ["FU", 5, [2, 3, 4]], ["AN", 5, 2, 6], ["FU", 3, [0, 1, 2]], ["SP", 3, 0, 78, [1], 1], ["AN", 3, 1, 2], ["FFSP", 3, 0, [3, 2, 1], 1, 1], ["AN", 3, 1, 6], ["FU", 1, [0, 1, 2]], ["SP", 1, 0, 78, [1], 1], ["AN", 1, 1, 2], ["FFSP", 1, 0, [3, 2, 1], 1, 1], ["AN", 1, 1, 6], ["PR", 4, 0, "auto_unroll_max_step$0"]]]], "r": [[1.04144e-05], 0, 0.609133, 1692122160], "v": "v0.6"}
{"i": [["[\"matmul\", 6, 65, 65, 4, \"float32\"]", "cuda -keys=cuda,gpu -arch=sm_75 -max_num_threads=1024 -thread_warp_size=32", [-1, 16, 64, 49152, 2147483647, 1024, 8, 32], "", 0, []], [[], [["CHW", 2, "local"], ["SP", 2, 0, 6, [1, 2, 1, 1], 1], ["SP", 2, 5, 65, [5, 13, 1, 1], 1], ["SP", 2, 10, 4, [1, 4, 1, 1], 1], ["SP", 2, 15, 65, [5, 1], 1], ["RE", 2, [0, 5, 10, 1, 6, 11, 2, 7, 12, 15, 16, 3, 8, 13, 17, 4, 9, 14]], ["FSP", 3, 0, 1, 3], ["FSP", 3, 4, 2, 3], ["FSP", 3, 8, 3, 3], ["RE", 3, [0, 4, 8, 1, 5, 9, 2, 6, 10, 3, 7, 11]], ["CA", 2, 3, 8], ["CHR", 1, "shared", [2]], ["CA", 2, 3, 9], ["CHR", 0, "shared", [3]], ["CA", 1, 4, 9], ["FU", 5, [0, 1, 2]], ["AN", 5, 0, 5], ["FU", 5, [1, 2, 3]], ["AN", 5, 1, 4], ["FU", 5, [2, 3, 4]], ["AN", 5, 2, 6], ["FU", 3, [0, 1, 2]], ["SP", 3, 0, 65, [1], 1], ["AN", 3, 1, 2], ["FFSP", 3, 0, [3, 2, 1], 1, 1], ["AN", 3, 1, 6], ["FU", 1, [0, 1, 2]], ["SP", 1, 0, 65, [1], 1], ["AN", 1, 1, 2], ["FFSP", 1, 0, [3, 2, 1], 1, 1], ["AN", 1, 1, 6], ["PR", 4, 0, "auto_unroll_max_step$512"]]]], "r": [[4.77202e-06], 0, 1.03145, 1692122160], "v": "v0.6"}
{"i": [["[\"matmul\", 6, 65, 65, 4, \"float32\"]", "cuda -keys=cuda,gpu -arch=sm_75 -max_num_threads=1024 -thread_warp_size=32", [-1, 16, 64, 49152, 2147483647, 1024, 8, 32], "", 0, []], [[], [["CHW", 2, "local"], ["SP", 2, 0, 6, [1, 2, 1, 1], 1], ["SP", 2, 5, 65, [1, 1, 13, 5], 1], ["SP", 2, 10, 4, [1, 2, 1, 1], 1], ["SP", 2, 15, 65, [1, 1], 1], ["RE", 2, [0, 5, 10, 1, 6, 11, 2, 7, 12, 15, 16, 3, 8, 13, 17, 4, 9, 14]], ["FSP", 3, 0, 1, 3], ["FSP", 3, 4, 2, 3], ["FSP", 3, 8, 3, 3], ["RE", 3, [0, 4, 8, 1, 5, 9, 2, 6, 10, 3, 7, 11]], ["CA", 2, 3, 8], ["CHR", 1, "shared", [2]], ["CA", 2, 3, 9], ["CHR", 0, "shared", [3]], ["CA", 1, 4, 9], ["FU", 5, [0, 1, 2]], ["AN", 5, 0, 5], ["FU", 5, [1, 2, 3]], ["AN", 5, 1, 4], ["FU", 5, [2, 3, 4]], ["AN", 5, 2, 6], ["FU", 3, [0, 1, 2]], ["SP", 3, 0, 5, [1], 1], ["AN", 3, 1, 2], ["FFSP", 3, 0, [3, 2, 1], 1, 1], ["AN", 3, 1, 6], ["FU", 1, [0, 1, 2]], ["SP", 1, 0, 25, [25], 1], ["AN", 1, 1, 2], ["FFSP", 1, 0, [3, 2, 1], 1, 1], ["AN", 1, 1, 6], ["PR", 4, 0, "auto_unroll_max_step$64"]]]], "r": [[4.09967e-05], 0, 0.683609, 1692122160], "v": "v0.6"}
{"i": [["[\"matmul\", 6, 65, 65, 4, \"float32\"]", "cuda -keys=cuda,gpu -arch=sm_75 -max_num_threads=1024 -thread_warp_size=32", [-1, 16, 64, 49152, 2147483647, 1024, 8, 32], "", 0, []], [[], [["CHW", 2, "local"], ["SP", 2, 0, 6, [1, 3, 1, 2], 1], ["SP", 2, 5, 65, [1, 13, 1, 1], 1], ["SP", 2, 10, 4, [4, 1, 1, 1], 1], ["SP", 2, 15, 65, [5, 1], 1], ["RE", 2, [0, 5, 10, 1, 6, 11, 2, 7, 12, 15, 16, 3, 8, 13, 17, 4, 9, 14]], ["FSP", 3, 0, 1, 3], ["FSP", 3, 4, 2, 3], ["FSP", 3, 8, 3, 3], ["RE", 3, [0, 4, 8, 1, 5, 9, 2, 6, 10, 3, 7, 11]], ["CA", 2, 3, 8], ["CHR", 1, "shared", [2]], ["CA", 2, 3, 9], ["CHR", 0, "shared", [3]], ["CA", 1, 4, 9], ["FU", 5, [0, 1, 2]], ["AN", 5, 0, 5], ["FU", 5, [1, 2, 3]], ["AN", 5, 1, 4], ["FU", 5, [2, 3, 4]], ["AN", 5, 2, 6], ["FU", 3, [0, 1, 2]], ["SP", 3, 0, 2, [1], 1], ["AN", 3, 1, 2], ["FFSP", 3, 0, [3, 2, 1], 1, 1], ["AN", 3, 1, 6], ["FU", 1, [0, 1, 2]], ["SP", 1, 0, 2, [1], 1], ["AN", 1, 1, 2], ["FFSP", 1, 0, [3, 2, 1], 1, 1], ["AN", 1, 1, 6], ["PR", 4, 0, "auto_unroll_max_step$0"]]]], "r": [[5.27043e-06], 0, 0.615597, 1692122161], "v": "v0.6"}
{"i": [["[\"matmul\", 6, 65, 65, 4, \"float32\"]", "cuda -keys=cuda,gpu -arch=sm_75 -max_num_threads=1024 -thread_warp_size=32", [-1, 16, 64, 49152, 2147483647, 1024, 8, 32], "", 0, []], [[], [["CHW", 2, "local"], ["SP", 2, 0, 6, [1, 6, 1, 1], 1], ["SP", 2, 5, 65, [1, 13, 1, 5], 1], ["SP", 2, 10, 4, [2, 1, 1, 1], 1], ["SP", 2, 15, 65, [1, 1], 1], ["RE", 2, [0, 5, 10, 1, 6, 11, 2, 7, 12, 15, 16, 3, 8, 13, 17, 4, 9, 14]], ["FSP", 3, 0, 1, 3], ["FSP", 3, 4, 2, 3], ["FSP", 3, 8, 3, 3], ["RE", 3, [0, 4, 8, 1, 5, 9, 2, 6, 10, 3, 7, 11]], ["CA", 2, 3, 8], ["CHR", 1, "shared", [2]], ["CA", 2, 3, 9], ["CHR", 0, "shared", [3]], ["CA", 1, 4, 9], ["FU", 5, [0, 1, 2]], ["AN", 5, 0, 5], ["FU", 5, [1, 2, 3]], ["AN", 5, 1, 4], ["FU", 5, [2, 3, 4]], ["AN", 5, 2, 6], ["FU", 3, [0, 1, 2]], ["SP", 3, 0, 5, [5], 1], ["AN", 3, 1, 2], ["FFSP", 3, 0, [3, 2, 1], 1, 1], ["AN", 3, 1, 6], ["FU", 1, [0, 1, 2]], ["SP", 1, 0, 25, [1], 1], ["AN", 1, 1, 2], ["FFSP", 1, 0, [3, 2, 1], 1, 1], ["AN", 1, 1, 6], ["PR", 4, 0, "auto_unroll_max_step$512"]]]], "r": [[1.96334e-05], 0, 0.579164, 1692122161], "v": "v0.6"}
{"i": [["[\"matmul\", 6, 65, 65, 4, \"float32\"]", "cuda -keys=cuda,gpu -arch=sm_75 -max_num_threads=1024 -thread_warp_size=32", [-1, 16, 64, 49152, 2147483647, 1024, 8, 32], "", 0, []], [[], [["CHW", 2, "local"], ["SP", 2, 0, 6, [1, 2, 3, 1], 1], ["SP", 2, 5, 65, [5, 13, 1, 1], 1], ["SP", 2, 10, 4, [1, 2, 1, 2], 1], ["SP", 2, 15, 65, [1, 1], 1], ["RE", 2, [0, 5, 10, 1, 6, 11, 2, 7, 12, 15, 16, 3, 8, 13, 17, 4, 9, 14]], ["FSP", 3, 0, 1, 3], ["FSP", 3, 4, 2, 3], ["FSP", 3, 8, 3, 3], ["RE", 3, [0, 4, 8, 1, 5, 9, 2, 6, 10, 3, 7, 11]], ["CA", 2, 3, 8], ["CHR", 1, "shared", [2]], ["CA", 2, 3, 9], ["CHR", 0, "shared", [3]], ["CA", 1, 4, 9], ["FU", 5, [0, 1, 2]], ["AN", 5, 0, 5], ["FU", 5, [1, 2, 3]], ["AN", 5, 1, 4], ["FU", 5, [2, 3, 4]], ["AN", 5, 2, 6], ["FU", 3, [0, 1, 2]], ["SP", 3, 0, 78, [1], 1], ["AN", 3, 1, 2], ["FFSP", 3, 0, [3, 2, 1], 1, 1], ["AN", 3, 1, 6], ["FU", 1, [0, 1, 2]], ["SP", 1, 0, 39, [1], 1], ["AN", 1, 1, 2], ["FFSP", 1, 0, [3, 2, 1], 1, 1], ["AN", 1, 1, 6], ["PR", 4, 0, "auto_unroll_max_step$1024"]]]], "r": [[2.20362e-05], 0, 0.629109, 1692122161], "v": "v0.6"}
{"i": [["[\"matmul\", 6, 65, 65, 4, \"float32\"]", "cuda -keys=cuda,gpu -arch=sm_75 -max_num_threads=1024 -thread_warp_size=32", [-1, 16, 64, 49152, 2147483647, 1024, 8, 32], "", 0, []], [[], [["CHW", 2, "local"], ["SP", 2, 0, 6, [1, 3, 1, 2], 1], ["SP", 2, 5, 65, [1, 13, 5, 1], 1], ["SP", 2, 10, 4, [2, 1, 1, 1], 1], ["SP", 2, 15, 65, [1, 5], 1], ["RE", 2, [0, 5, 10, 1, 6, 11, 2, 7, 12, 15, 16, 3, 8, 13, 17, 4, 9, 14]], ["FSP", 3, 0, 1, 3], ["FSP", 3, 4, 2, 3], ["FSP", 3, 8, 3, 3], ["RE", 3, [0, 4, 8, 1, 5, 9, 2, 6, 10, 3, 7, 11]], ["CA", 2, 3, 8], ["CHR", 1, "shared", [2]], ["CA", 2, 3, 9], ["CHR", 0, "shared", [3]], ["CA", 1, 4, 9], ["FU", 5, [0, 1, 2]], ["AN", 5, 0, 5], ["FU", 5, [1, 2, 3]], ["AN", 5, 1, 4], ["FU", 5, [2, 3, 4]], ["AN", 5, 2, 6], ["FU", 3, [0, 1, 2]], ["SP", 3, 0, 10, [1], 1], ["AN", 3, 1, 2], ["FFSP", 3, 0, [3, 2, 1], 1, 1], ["AN", 3, 1, 6], ["FU", 1, [0, 1, 2]], ["SP", 1, 0, 50, [2], 1], ["AN", 1, 1, 2], ["FFSP", 1, 0, [3, 2, 1], 1, 1], ["AN", 1, 1, 6], ["PR", 4, 0, "auto_unroll_max_step$0"]]]], "r": [[2.95184e-05], 0, 0.625616, 1692122162], "v": "v0.6"}
{"i": [["[\"matmul\", 6, 65, 65, 4, \"float32\"]", "cuda -keys=cuda,gpu -arch=sm_75 -max_num_threads=1024 -thread_warp_size=32", [-1, 16, 64, 49152, 2147483647, 1024, 8, 32], "", 0, []], [[], [["CHW", 2, "local"], ["SP", 2, 0, 6, [1, 2, 1, 3], 1], ["SP", 2, 5, 65, [1, 5, 1, 13], 1], ["SP", 2, 10, 4, [4, 1, 1, 1], 1], ["SP", 2, 15, 65, [1, 5], 1], ["RE", 2, [0, 5, 10, 1, 6, 11, 2, 7, 12, 15, 16, 3, 8, 13, 17, 4, 9, 14]], ["FSP", 3, 0, 1, 3], ["FSP", 3, 4, 2, 3], ["FSP", 3, 8, 3, 3], ["RE", 3, [0, 4, 8, 1, 5, 9, 2, 6, 10, 3, 7, 11]], ["CA", 2, 3, 8], ["CHR", 1, "shared", [2]], ["CA", 2, 3, 9], ["CHR", 0, "shared", [3]], ["CA", 1, 4, 9], ["FU", 5, [0, 1, 2]], ["AN", 5, 0, 5], ["FU", 5, [1, 2, 3]], ["AN", 5, 1, 4], ["FU", 5, [2, 3, 4]], ["AN", 5, 2, 6], ["FU", 3, [0, 1, 2]], ["SP", 3, 0, 5, [1], 1], ["AN", 3, 1, 2], ["FFSP", 3, 0, [3, 2, 1], 1, 1], ["AN", 3, 1, 6], ["FU", 1, [0, 1, 2]], ["SP", 1, 0, 65, [1], 1], ["AN", 1, 1, 2], ["FFSP", 1, 0, [3, 2, 1], 1, 1], ["AN", 1, 1, 6], ["PR", 4, 0, "auto_unroll_max_step$16"]]]], "r": [[3.53555e-05], 0, 0.667724, 1692122162], "v": "v0.6"}
{"i": [["[\"matmul\", 6, 65, 65, 4, \"float32\"]", "cuda -keys=cuda,gpu -arch=sm_75 -max_num_threads=1024 -thread_warp_size=32", [-1, 16, 64, 49152, 2147483647, 1024, 8, 32], "", 0, []], [[], [["CHW", 2, "local"], ["SP", 2, 0, 6, [1, 1, 1, 6], 1], ["SP", 2, 5, 65, [1, 13, 1, 1], 1], ["SP", 2, 10, 4, [1, 2, 2, 1], 1], ["SP", 2, 15, 65, [65, 1], 1], ["RE", 2, [0, 5, 10, 1, 6, 11, 2, 7, 12, 15, 16, 3, 8, 13, 17, 4, 9, 14]], ["FSP", 3, 0, 1, 3], ["FSP", 3, 4, 2, 3], ["FSP", 3, 8, 3, 3], ["RE", 3, [0, 4, 8, 1, 5, 9, 2, 6, 10, 3, 7, 11]], ["CA", 2, 3, 8], ["CHR", 1, "shared", [2]], ["CA", 2, 3, 9], ["CHR", 0, "shared", [3]], ["CA", 1, 4, 9], ["FU", 5, [0, 1, 2]], ["AN", 5, 0, 5], ["FU", 5, [1, 2, 3]], ["AN", 5, 1, 4], ["FU", 5, [2, 3, 4]], ["AN", 5, 2, 6], ["FU", 3, [0, 1, 2]], ["SP", 3, 0, 260, [1], 1], ["AN", 3, 1, 2], ["FFSP", 3, 0, [3, 2, 1], 1, 1], ["AN", 3, 1, 6], ["FU", 1, [0, 1, 2]], ["SP", 1, 0, 130, [1], 1], ["AN", 1, 1, 2], ["FFSP", 1, 0, [3, 2, 1], 1, 1], ["AN", 1, 1, 6], ["PR", 4, 0, "auto_unroll_max_step$512"]]]], "r": [[5.69988e-06], 0, 1.2675, 1692122162], "v": "v0.6"}
{"i": [["[\"matmul\", 6, 65, 65, 4, \"float32\"]", "cuda -keys=cuda,gpu -arch=sm_75 -max_num_threads=1024 -thread_warp_size=32", [-1, 16, 64, 49152, 2147483647, 1024, 8, 32], "", 0, []], [[], [["CHW", 2, "local"], ["SP", 2, 0, 6, [1, 1, 1, 2], 1], ["SP", 2, 5, 65, [1, 65, 1, 1], 1], ["SP", 2, 10, 4, [1, 1, 2, 1], 1], ["SP", 2, 15, 65, [1, 13], 1], ["RE", 2, [0, 5, 10, 1, 6, 11, 2, 7, 12, 15, 16, 3, 8, 13, 17, 4, 9, 14]], ["FSP", 3, 0, 1, 3], ["FSP", 3, 4, 2, 3], ["FSP", 3, 8, 3, 3], ["RE", 3, [0, 4, 8, 1, 5, 9, 2, 6, 10, 3, 7, 11]], ["CA", 2, 3, 8], ["CHR", 1, "shared", [2]], ["CA", 2, 3, 9], ["CHR", 0, "shared", [3]], ["CA", 1, 4, 9], ["FU", 5, [0, 1, 2]], ["AN", 5, 0, 5], ["FU", 5, [1, 2, 3]], ["AN", 5, 1, 4], ["FU", 5, [2, 3, 4]], ["AN", 5, 2, 6], ["FU", 3, [0, 1, 2]], ["SP", 3, 0, 52, [4], 1], ["AN", 3, 1, 2], ["FFSP", 3, 0, [3, 2, 1], 1, 1], ["AN", 3, 1, 6], ["FU", 1, [0, 1, 2]], ["SP", 1, 0, 26, [2], 1], ["AN", 1, 1, 2], ["FFSP", 1, 0, [3, 2, 1], 1, 1], ["AN", 1, 1, 6], ["PR", 4, 0, "auto_unroll_max_step$64"]]]], "r": [[3.91717e-06], 0, 0.64712, 1692122162], "v": "v0.6"}
{"i": [["[\"matmul\", 6, 65, 65, 4, \"float32\"]", "cuda -keys=cuda,gpu -arch=sm_75 -max_num_threads=1024 -thread_warp_size=32", [-1, 16, 64, 49152, 2147483647, 1024, 8, 32], "", 0, []], [[], [["CHW", 2, "local"], ["SP", 2, 0, 6, [1, 3, 2, 1], 1], ["SP", 2, 5, 65, [1, 1, 1, 1], 1], ["SP", 2, 10, 4, [2, 2, 1, 1], 1], ["SP", 2, 15, 65, [1, 13], 1], ["RE", 2, [0, 5, 10, 1, 6, 11, 2, 7, 12, 15, 16, 3, 8, 13, 17, 4, 9, 14]], ["FSP", 3, 0, 1, 3], ["FSP", 3, 4, 2, 3], ["FSP", 3, 8, 3, 3], ["RE", 3, [0, 4, 8, 1, 5, 9, 2, 6, 10, 3, 7, 11]], ["CA", 2, 3, 8], ["CHR", 1, "shared", [2]], ["CA", 2, 3, 9], ["CHR", 0, "shared", [3]], ["CA", 1, 4, 9], ["FU", 5, [0, 1, 2]], ["AN", 5, 0, 5], ["FU", 5, [1, 2, 3]], ["AN", 5, 1, 4], ["FU", 5, [2, 3, 4]], ["AN", 5, 2, 6], ["FU", 3, [0, 1, 2]], ["SP", 3, 0, 26, [1], 1], ["AN", 3, 1, 2], ["FFSP", 3, 0, [3, 2, 1], 1, 1], ["AN", 3, 1, 6], ["FU", 1, [0, 1, 2]], ["SP", 1, 0, 26, [1], 1], ["AN", 1, 1, 2], ["FFSP", 1, 0, [3, 2, 1], 1, 1], ["AN", 1, 1, 6], ["PR", 4, 0, "auto_unroll_max_step$1024"]]]], "r": [[7.65458e-06], 0, 1.41526, 1692122169], "v": "v0.6"}
{"i": [["[\"matmul\", 6, 65, 65, 4, \"float32\"]", "cuda -keys=cuda,gpu -arch=sm_75 -max_num_threads=1024 -thread_warp_size=32", [-1, 16, 64, 49152, 2147483647, 1024, 8, 32], "", 0, []], [[], [["CHW", 2, "local"], ["SP", 2, 0, 6, [1, 2, 1, 1], 1], ["SP", 2, 5, 65, [1, 1, 5, 13], 1], ["SP", 2, 10, 4, [1, 2, 1, 2], 1], ["SP", 2, 15, 65, [1, 13], 1], ["RE", 2, [0, 5, 10, 1, 6, 11, 2, 7, 12, 15, 16, 3, 8, 13, 17, 4, 9, 14]], ["FSP", 3, 0, 1, 3], ["FSP", 3, 4, 2, 3], ["FSP", 3, 8, 3, 3], ["RE", 3, [0, 4, 8, 1, 5, 9, 2, 6, 10, 3, 7, 11]], ["CA", 2, 3, 8], ["CHR", 1, "shared", [2]], ["CA", 2, 3, 9], ["CHR", 0, "shared", [3]], ["CA", 1, 4, 9], ["FU", 5, [0, 1, 2]], ["AN", 5, 0, 5], ["FU", 5, [1, 2, 3]], ["AN", 5, 1, 4], ["FU", 5, [2, 3, 4]], ["AN", 5, 2, 6], ["FU", 3, [0, 1, 2]], ["SP", 3, 0, 26, [1], 1], ["AN", 3, 1, 2], ["FFSP", 3, 0, [3, 2, 1], 1, 1], ["AN", 3, 1, 6], ["FU", 1, [0, 1, 2]], ["SP", 1, 0, 65, [1], 1], ["AN", 1, 1, 2], ["FFSP", 1, 0, [3, 2, 1], 1, 1], ["AN", 1, 1, 6], ["PR", 4, 0, "auto_unroll_max_step$1024"]]]], "r": [[6.31647e-05], 0, 4.75393, 1692122169], "v": "v0.6"}
{"i": [["[\"matmul\", 6, 65, 65, 4, \"float32\"]", "cuda -keys=cuda,gpu -arch=sm_75 -max_num_threads=1024 -thread_warp_size=32", [-1, 16, 64, 49152, 2147483647, 1024, 8, 32], "", 0, []], [[], [["CHW", 2, "local"], ["SP", 2, 0, 6, [2, 3, 1, 1], 1], ["SP", 2, 5, 65, [1, 65, 1, 1], 1], ["SP", 2, 10, 4, [1, 1, 2, 1], 1], ["SP", 2, 15, 65, [5, 1], 1], ["RE", 2, [0, 5, 10, 1, 6, 11, 2, 7, 12, 15, 16, 3, 8, 13, 17, 4, 9, 14]], ["FSP", 3, 0, 1, 3], ["FSP", 3, 4, 2, 3], ["FSP", 3, 8, 3, 3], ["RE", 3, [0, 4, 8, 1, 5, 9, 2, 6, 10, 3, 7, 11]], ["CA", 2, 3, 8], ["CHR", 1, "shared", [2]], ["CA", 2, 3, 9], ["CHR", 0, "shared", [3]], ["CA", 1, 4, 9], ["FU", 5, [0, 1, 2]], ["AN", 5, 0, 5], ["FU", 5, [1, 2, 3]], ["AN", 5, 1, 4], ["FU", 5, [2, 3, 4]], ["AN", 5, 2, 6], ["FU", 3, [0, 1, 2]], ["SP", 3, 0, 10, [1], 1], ["AN", 3, 1, 2], ["FFSP", 3, 0, [3, 2, 1], 1, 1], ["AN", 3, 1, 6], ["FU", 1, [0, 1, 2]], ["SP", 1, 0, 5, [1], 1], ["AN", 1, 1, 2], ["FFSP", 1, 0, [3, 2, 1], 1, 1], ["AN", 1, 1, 6], ["PR", 4, 0, "auto_unroll_max_step$1024"]]]], "r": [[7.6543e-06], 0, 0.899495, 1692122170], "v": "v0.6"}
{"i": [["[\"matmul\", 6, 65, 65, 4, \"float32\"]", "cuda -keys=cuda,gpu -arch=sm_75 -max_num_threads=1024 -thread_warp_size=32", [-1, 16, 64, 49152, 2147483647, 1024, 8, 32], "", 0, []], [[], [["CHW", 2, "local"], ["SP", 2, 0, 6, [1, 3, 1, 1], 1], ["SP", 2, 5, 65, [1, 13, 1, 5], 1], ["SP", 2, 10, 4, [4, 1, 1, 1], 1], ["SP", 2, 15, 65, [13, 1], 1], ["RE", 2, [0, 5, 10, 1, 6, 11, 2, 7, 12, 15, 16, 3, 8, 13, 17, 4, 9, 14]], ["FSP", 3, 0, 1, 3], ["FSP", 3, 4, 2, 3], ["FSP", 3, 8, 3, 3], ["RE", 3, [0, 4, 8, 1, 5, 9, 2, 6, 10, 3, 7, 11]], ["CA", 2, 3, 8], ["CHR", 1, "shared", [2]], ["CA", 2, 3, 9], ["CHR", 0, "shared", [3]], ["CA", 1, 4, 9], ["FU", 5, [0, 1, 2]], ["AN", 5, 0, 5], ["FU", 5, [1, 2, 3]], ["AN", 5, 1, 4], ["FU", 5, [2, 3, 4]], ["AN", 5, 2, 6], ["FU", 3, [0, 1, 2]], ["SP", 3, 0, 26, [1], 1], ["AN", 3, 1, 2], ["FFSP", 3, 0, [3, 2, 1], 1, 1], ["AN", 3, 1, 6], ["FU", 1, [0, 1, 2]], ["SP", 1, 0, 65, [1], 1], ["AN", 1, 1, 2], ["FFSP", 1, 0, [3, 2, 1], 1, 1], ["AN", 1, 1, 6], ["PR", 4, 0, "auto_unroll_max_step$16"]]]], "r": [[6.87646e-06], 0, 0.616391, 1692122171], "v": "v0.6"}
{"i": [["[\"matmul\", 6, 65, 65, 4, \"float32\"]", "cuda -keys=cuda,gpu -arch=sm_75 -max_num_threads=1024 -thread_warp_size=32", [-1, 16, 64, 49152, 2147483647, 1024, 8, 32], "", 0, []], [[], [["CHW", 2, "local"], ["SP", 2, 0, 6, [1, 2, 3, 1], 1], ["SP", 2, 5, 65, [5, 13, 1, 1], 1], ["SP", 2, 10, 4, [1, 2, 2, 1], 1], ["SP", 2, 15, 65, [5, 1], 1], ["RE", 2, [0, 5, 10, 1, 6, 11, 2, 7, 12, 15, 16, 3, 8, 13, 17, 4, 9, 14]], ["FSP", 3, 0, 1, 3], ["FSP", 3, 4, 2, 3], ["FSP", 3, 8, 3, 3], ["RE", 3, [0, 4, 8, 1, 5, 9, 2, 6, 10, 3, 7, 11]], ["CA", 2, 3, 8], ["CHR", 1, "shared", [2]], ["CA", 2, 3, 9], ["CHR", 0, "shared", [3]], ["CA", 1, 4, 9], ["FU", 5, [0, 1, 2]], ["AN", 5, 0, 5], ["FU", 5, [1, 2, 3]], ["AN", 5, 1, 4], ["FU", 5, [2, 3, 4]], ["AN", 5, 2, 6], ["FU", 3, [0, 1, 2]], ["SP", 3, 0, 5, [1], 1], ["AN", 3, 1, 2], ["FFSP", 3, 0, [3, 2, 1], 1, 1], ["AN", 3, 1, 6], ["FU", 1, [0, 1, 2]], ["SP", 1, 0, 25, [1], 1], ["AN", 1, 1, 2], ["FFSP", 1, 0, [3, 2, 1], 1, 1], ["AN", 1, 1, 6], ["PR", 4, 0, "auto_unroll_max_step$1024"]]]], "r": [[1.20041e-05], 0, 0.834484, 1692122171], "v": "v0.6"}
{"i": [["[\"matmul\", 6, 65, 65, 4, \"float32\"]", "cuda -keys=cuda,gpu -arch=sm_75 -max_num_threads=1024 -thread_warp_size=32", [-1, 16, 64, 49152, 2147483647, 1024, 8, 32], "", 0, []], [[], [["CHW", 2, "local"], ["SP", 2, 0, 6, [1, 3, 1, 2], 1], ["SP", 2, 5, 65, [1, 65, 1, 1], 1], ["SP", 2, 10, 4, [2, 1, 1, 2], 1], ["SP", 2, 15, 65, [13, 1], 1], ["RE", 2, [0, 5, 10, 1, 6, 11, 2, 7, 12, 15, 16, 3, 8, 13, 17, 4, 9, 14]], ["FSP", 3, 0, 1, 3], ["FSP", 3, 4, 2, 3], ["FSP", 3, 8, 3, 3], ["RE", 3, [0, 4, 8, 1, 5, 9, 2, 6, 10, 3, 7, 11]], ["CA", 2, 3, 8], ["CHR", 1, "shared", [2]], ["CA", 2, 3, 9], ["CHR", 0, "shared", [3]], ["CA", 1, 4, 9], ["FU", 5, [0, 1, 2]], ["AN", 5, 0, 5], ["FU", 5, [1, 2, 3]], ["AN", 5, 1, 4], ["FU", 5, [2, 3, 4]], ["AN", 5, 2, 6], ["FU", 3, [0, 1, 2]], ["SP", 3, 0, 52, [1], 1], ["AN", 3, 1, 2], ["FFSP", 3, 0, [3, 2, 1], 1, 1], ["AN", 3, 1, 6], ["FU", 1, [0, 1, 2]], ["SP", 1, 0, 26, [1], 1], ["AN", 1, 1, 2], ["FFSP", 1, 0, [3, 2, 1], 1, 1], ["AN", 1, 1, 6], ["PR", 4, 0, "auto_unroll_max_step$16"]]]], "r": [[8.35654e-06], 0, 0.578909, 1692122172], "v": "v0.6"}
{"i": [["[\"matmul\", 6, 65, 65, 4, \"float32\"]", "cuda -keys=cuda,gpu -arch=sm_75 -max_num_threads=1024 -thread_warp_size=32", [-1, 16, 64, 49152, 2147483647, 1024, 8, 32], "", 0, []], [[], [["CHW", 2, "local"], ["SP", 2, 0, 6, [1, 2, 1, 3], 1], ["SP", 2, 5, 65, [1, 1, 1, 13], 1], ["SP", 2, 10, 4, [1, 4, 1, 1], 1], ["SP", 2, 15, 65, [65, 1], 1], ["RE", 2, [0, 5, 10, 1, 6, 11, 2, 7, 12, 15, 16, 3, 8, 13, 17, 4, 9, 14]], ["FSP", 3, 0, 1, 3], ["FSP", 3, 4, 2, 3], ["FSP", 3, 8, 3, 3], ["RE", 3, [0, 4, 8, 1, 5, 9, 2, 6, 10, 3, 7, 11]], ["CA", 2, 3, 8], ["CHR", 1, "shared", [2]], ["CA", 2, 3, 9], ["CHR", 0, "shared", [3]], ["CA", 1, 4, 9], ["FU", 5, [0, 1, 2]], ["AN", 5, 0, 5], ["FU", 5, [1, 2, 3]], ["AN", 5, 1, 4], ["FU", 5, [2, 3, 4]], ["AN", 5, 2, 6], ["FU", 3, [0, 1, 2]], ["SP", 3, 0, 65, [1], 1], ["AN", 3, 1, 2], ["FFSP", 3, 0, [3, 2, 1], 1, 1], ["AN", 3, 1, 6], ["FU", 1, [0, 1, 2]], ["SP", 1, 0, 845, [5], 1], ["AN", 1, 1, 2], ["FFSP", 1, 0, [3, 2, 1], 1, 1], ["AN", 1, 1, 6], ["PR", 4, 0, "auto_unroll_max_step$512"]]]], "r": [[3.36538e-05], 0, 0.816184, 1692122172], "v": "v0.6"}
{"i": [["[\"matmul\", 6, 65, 65, 4, \"float32\"]", "cuda -keys=cuda,gpu -arch=sm_75 -max_num_threads=1024 -thread_warp_size=32", [-1, 16, 64, 49152, 2147483647, 1024, 8, 32], "", 0, []], [[], [["CHW", 2, "local"], ["SP", 2, 0, 6, [1, 2, 3, 1], 1], ["SP", 2, 5, 65, [5, 13, 1, 1], 1], ["SP", 2, 10, 4, [1, 4, 1, 1], 1], ["SP", 2, 15, 65, [1, 13], 1], ["RE", 2, [0, 5, 10, 1, 6, 11, 2, 7, 12, 15, 16, 3, 8, 13, 17, 4, 9, 14]], ["FSP", 3, 0, 1, 3], ["FSP", 3, 4, 2, 3], ["FSP", 3, 8, 3, 3], ["RE", 3, [0, 4, 8, 1, 5, 9, 2, 6, 10, 3, 7, 11]], ["CA", 2, 3, 8], ["CHR", 1, "shared", [2]], ["CA", 2, 3, 9], ["CHR", 0, "shared", [3]], ["CA", 1, 4, 9], ["FU", 5, [0, 1, 2]], ["AN", 5, 0, 5], ["FU", 5, [1, 2, 3]], ["AN", 5, 1, 4], ["FU", 5, [2, 3, 4]], ["AN", 5, 2, 6], ["FU", 3, [0, 1, 2]], ["SP", 3, 0, 39, [1], 1], ["AN", 3, 1, 2], ["FFSP", 3, 0, [3, 2, 1], 1, 1], ["AN", 3, 1, 6], ["FU", 1, [0, 1, 2]], ["SP", 1, 0, 39, [1], 1], ["AN", 1, 1, 2], ["FFSP", 1, 0, [3, 2, 1], 1, 1], ["AN", 1, 1, 6], ["PR", 4, 0, "auto_unroll_max_step$16"]]]], "r": [[2.50026e-05], 0, 0.622227, 1692122172], "v": "v0.6"}
{"i": [["[\"matmul\", 6, 65, 65, 4, \"float32\"]", "cuda -keys=cuda,gpu -arch=sm_75 -max_num_threads=1024 -thread_warp_size=32", [-1, 16, 64, 49152, 2147483647, 1024, 8, 32], "", 0, []], [[], [["CHW", 2, "local"], ["SP", 2, 0, 6, [1, 3, 1, 2], 1], ["SP", 2, 5, 65, [1, 13, 5, 1], 1], ["SP", 2, 10, 4, [2, 1, 1, 2], 1], ["SP", 2, 15, 65, [13, 1], 1], ["RE", 2, [0, 5, 10, 1, 6, 11, 2, 7, 12, 15, 16, 3, 8, 13, 17, 4, 9, 14]], ["FSP", 3, 0, 1, 3], ["FSP", 3, 4, 2, 3], ["FSP", 3, 8, 3, 3], ["RE", 3, [0, 4, 8, 1, 5, 9, 2, 6, 10, 3, 7, 11]], ["CA", 2, 3, 8], ["CHR", 1, "shared", [2]], ["CA", 2, 3, 9], ["CHR", 0, "shared", [3]], ["CA", 1, 4, 9], ["FU", 5, [0, 1, 2]], ["AN", 5, 0, 5], ["FU", 5, [1, 2, 3]], ["AN", 5, 1, 4], ["FU", 5, [2, 3, 4]], ["AN", 5, 2, 6], ["FU", 3, [0, 1, 2]], ["SP", 3, 0, 52, [1], 1], ["AN", 3, 1, 2], ["FFSP", 3, 0, [3, 2, 1], 1, 1], ["AN", 3, 1, 6], ["FU", 1, [0, 1, 2]], ["SP", 1, 0, 130, [1], 1], ["AN", 1, 1, 2], ["FFSP", 1, 0, [3, 2, 1], 1, 1], ["AN", 1, 1, 6], ["PR", 4, 0, "auto_unroll_max_step$1024"]]]], "r": [[1.02016e-05], 0, 1.40124, 1692122172], "v": "v0.6"}
{"i": [["[\"matmul\", 6, 65, 65, 4, \"float32\"]", "cuda -keys=cuda,gpu -arch=sm_75 -max_num_threads=1024 -thread_warp_size=32", [-1, 16, 64, 49152, 2147483647, 1024, 8, 32], "", 0, []], [[], [["CHW", 2, "local"], ["SP", 2, 0, 6, [2, 1, 1, 3], 1], ["SP", 2, 5, 65, [1, 5, 1, 13], 1], ["SP", 2, 10, 4, [1, 2, 1, 1], 1], ["SP", 2, 15, 65, [1, 1], 1], ["RE", 2, [0, 5, 10, 1, 6, 11, 2, 7, 12, 15, 16, 3, 8, 13, 17, 4, 9, 14]], ["FSP", 3, 0, 1, 3], ["FSP", 3, 4, 2, 3], ["FSP", 3, 8, 3, 3], ["RE", 3, [0, 4, 8, 1, 5, 9, 2, 6, 10, 3, 7, 11]], ["CA", 2, 3, 8], ["CHR", 1, "shared", [2]], ["CA", 2, 3, 9], ["CHR", 0, "shared", [3]], ["CA", 1, 4, 9], ["FU", 5, [0, 1, 2]], ["AN", 5, 0, 5], ["FU", 5, [1, 2, 3]], ["AN", 5, 1, 4], ["FU", 5, [2, 3, 4]], ["AN", 5, 2, 6], ["FU", 3, [0, 1, 2]], ["SP", 3, 0, 3, [1], 1], ["AN", 3, 1, 2], ["FFSP", 3, 0, [3, 2, 1], 1, 1], ["AN", 3, 1, 6], ["FU", 1, [0, 1, 2]], ["SP", 1, 0, 3, [1], 1], ["AN", 1, 1, 2], ["FFSP", 1, 0, [3, 2, 1], 1, 1], ["AN", 1, 1, 6], ["PR", 4, 0, "auto_unroll_max_step$0"]]]], "r": [[4.07397e-05], 0, 0.679765, 1692122173], "v": "v0.6"}
{"i": [["[\"matmul\", 6, 65, 65, 4, \"float32\"]", "cuda -keys=cuda,gpu -arch=sm_75 -max_num_threads=1024 -thread_warp_size=32", [-1, 16, 64, 49152, 2147483647, 1024, 8, 32], "", 0, []], [[], [["CHW", 2, "local"], ["SP", 2, 0, 6, [1, 3, 2, 1], 1], ["SP", 2, 5, 65, [13, 1, 1, 1], 1], ["SP", 2, 10, 4, [1, 1, 2, 2], 1], ["SP", 2, 15, 65, [65, 1], 1], ["RE", 2, [0, 5, 10, 1, 6, 11, 2, 7, 12, 15, 16, 3, 8, 13, 17, 4, 9, 14]], ["FSP", 3, 0, 1, 3], ["FSP", 3, 4, 2, 3], ["FSP", 3, 8, 3, 3], ["RE", 3, [0, 4, 8, 1, 5, 9, 2, 6, 10, 3, 7, 11]], ["CA", 2, 3, 8], ["CHR", 1, "shared", [2]], ["CA", 2, 3, 9], ["CHR", 0, "shared", [3]], ["CA", 1, 4, 9], ["FU", 5, [0, 1, 2]], ["AN", 5, 0, 5], ["FU", 5, [1, 2, 3]], ["AN", 5, 1, 4], ["FU", 5, [2, 3, 4]], ["AN", 5, 2, 6], ["FU", 3, [0, 1, 2]], ["SP", 3, 0, 260, [1], 1], ["AN", 3, 1, 2], ["FFSP", 3, 0, [3, 2, 1], 1, 1], ["AN", 3, 1, 6], ["FU", 1, [0, 1, 2]], ["SP", 1, 0, 130, [1], 1], ["AN", 1, 1, 2], ["FFSP", 1, 0, [3, 2, 1], 1, 1], ["AN", 1, 1, 6], ["PR", 4, 0, "auto_unroll_max_step$512"]]]], "r": [[4.98885e-05], 0, 0.699603, 1692122173], "v": "v0.6"}
