op-work/GPU_expr/Ansor_batch/DHFR/matmul_19_38_38_3.json
{"i": [["[\"matmul\", 19, 38, 38, 3, \"float32\"]", "cuda -keys=cuda,gpu -arch=sm_75 -max_num_threads=1024 -thread_warp_size=32", [-1, 16, 64, 49152, 2147483647, 1024, 8, 32], "", 0, []], [[], [["CHW", 2, "local"], ["SP", 2, 0, 19, [1, 1, 1, 19], 1], ["SP", 2, 5, 38, [1, 1, 1, 2], 1], ["SP", 2, 10, 3, [1, 1, 3, 1], 1], ["SP", 2, 15, 38, [1, 1], 1], ["RE", 2, [0, 5, 10, 1, 6, 11, 2, 7, 12, 15, 16, 3, 8, 13, 17, 4, 9, 14]], ["FSP", 3, 0, 1, 3], ["FSP", 3, 4, 2, 3], ["FSP", 3, 8, 3, 3], ["RE", 3, [0, 4, 8, 1, 5, 9, 2, 6, 10, 3, 7, 11]], ["CA", 2, 3, 8], ["CHR", 1, "shared", [2]], ["CA", 2, 3, 9], ["CHR", 0, "shared", [3]], ["CA", 1, 4, 9], ["FU", 5, [0, 1, 2]], ["AN", 5, 0, 5], ["FU", 5, [1, 2, 3]], ["AN", 5, 1, 4], ["FU", 5, [2, 3, 4]], ["AN", 5, 2, 6], ["FU", 3, [0, 1, 2]], ["SP", 3, 0, 1, [1], 1], ["AN", 3, 1, 2], ["FFSP", 3, 0, [3, 2, 1], 1, 1], ["AN", 3, 1, 6], ["FU", 1, [0, 1, 2]], ["SP", 1, 0, 1, [1], 1], ["AN", 1, 1, 2], ["FFSP", 1, 0, [3, 2, 1], 1, 1], ["AN", 1, 1, 6], ["PR", 4, 0, "auto_unroll_max_step$1024"]]]], "r": [[3.2195e-05], 0, 0.821646, 1692178331], "v": "v0.6"}
{"i": [["[\"matmul\", 19, 38, 38, 3, \"float32\"]", "cuda -keys=cuda,gpu -arch=sm_75 -max_num_threads=1024 -thread_warp_size=32", [-1, 16, 64, 49152, 2147483647, 1024, 8, 32], "", 0, []], [[], [["CHW", 2, "local"], ["SP", 2, 0, 19, [1, 19, 1, 1], 1], ["SP", 2, 5, 38, [1, 2, 1, 1], 1], ["SP", 2, 10, 3, [1, 1, 1, 1], 1], ["SP", 2, 15, 38, [19, 1], 1], ["RE", 2, [0, 5, 10, 1, 6, 11, 2, 7, 12, 15, 16, 3, 8, 13, 17, 4, 9, 14]], ["FSP", 3, 0, 1, 3], ["FSP", 3, 4, 2, 3], ["FSP", 3, 8, 3, 3], ["RE", 3, [0, 4, 8, 1, 5, 9, 2, 6, 10, 3, 7, 11]], ["CA", 2, 3, 8], ["CHR", 1, "shared", [2]], ["CA", 2, 3, 9], ["CHR", 0, "shared", [3]], ["CA", 1, 4, 9], ["FU", 5, [0, 1, 2]], ["AN", 5, 0, 5], ["FU", 5, [1, 2, 3]], ["AN", 5, 1, 4], ["FU", 5, [2, 3, 4]], ["AN", 5, 2, 6], ["FU", 3, [0, 1, 2]], ["SP", 3, 0, 57, [3], 1], ["AN", 3, 1, 2], ["FFSP", 3, 0, [3, 2, 1], 1, 1], ["AN", 3, 1, 6], ["FU", 1, [0, 1, 2]], ["SP", 1, 0, 19, [1], 1], ["AN", 1, 1, 2], ["FFSP", 1, 0, [3, 2, 1], 1, 1], ["AN", 1, 1, 6], ["PR", 4, 0, "auto_unroll_max_step$16"]]]], "r": [[3.5425e-06], 0, 0.602338, 1692178331], "v": "v0.6"}
{"i": [["[\"matmul\", 19, 38, 38, 3, \"float32\"]", "cuda -keys=cuda,gpu -arch=sm_75 -max_num_threads=1024 -thread_warp_size=32", [-1, 16, 64, 49152, 2147483647, 1024, 8, 32], "", 0, []], [[], [["CHW", 2, "local"], ["SP", 2, 0, 19, [1, 1, 1, 19], 1], ["SP", 2, 5, 38, [1, 1, 2, 1], 1], ["SP", 2, 10, 3, [1, 1, 1, 3], 1], ["SP", 2, 15, 38, [1, 1], 1], ["RE", 2, [0, 5, 10, 1, 6, 11, 2, 7, 12, 15, 16, 3, 8, 13, 17, 4, 9, 14]], ["FSP", 3, 0, 1, 3], ["FSP", 3, 4, 2, 3], ["FSP", 3, 8, 3, 3], ["RE", 3, [0, 4, 8, 1, 5, 9, 2, 6, 10, 3, 7, 11]], ["CA", 2, 3, 8], ["CHR", 1, "shared", [2]], ["CA", 2, 3, 9], ["CHR", 0, "shared", [3]], ["CA", 1, 4, 9], ["FU", 5, [0, 1, 2]], ["AN", 5, 0, 5], ["FU", 5, [1, 2, 3]], ["AN", 5, 1, 4], ["FU", 5, [2, 3, 4]], ["AN", 5, 2, 6], ["FU", 3, [0, 1, 2]], ["SP", 3, 0, 57, [1], 1], ["AN", 3, 1, 2], ["FFSP", 3, 0, [3, 2, 1], 1, 1], ["AN", 3, 1, 6], ["FU", 1, [0, 1, 2]], ["SP", 1, 0, 19, [1], 1], ["AN", 1, 1, 2], ["FFSP", 1, 0, [3, 2, 1], 1, 1], ["AN", 1, 1, 6], ["PR", 4, 0, "auto_unroll_max_step$64"]]]], "r": [[2.69783e-05], 0, 0.853104, 1692178332], "v": "v0.6"}
{"i": [["[\"matmul\", 19, 38, 38, 3, \"float32\"]", "cuda -keys=cuda,gpu -arch=sm_75 -max_num_threads=1024 -thread_warp_size=32", [-1, 16, 64, 49152, 2147483647, 1024, 8, 32], "", 0, []], [[], [["CHW", 2, "local"], ["SP", 2, 0, 19, [1, 1, 1, 1], 1], ["SP", 2, 5, 38, [1, 19, 1, 1], 1], ["SP", 2, 10, 3, [1, 1, 1, 3], 1], ["SP", 2, 15, 38, [19, 1], 1], ["RE", 2, [0, 5, 10, 1, 6, 11, 2, 7, 12, 15, 16, 3, 8, 13, 17, 4, 9, 14]], ["FSP", 3, 0, 1, 3], ["FSP", 3, 4, 2, 3], ["FSP", 3, 8, 3, 3], ["RE", 3, [0, 4, 8, 1, 5, 9, 2, 6, 10, 3, 7, 11]], ["CA", 2, 3, 8], ["CHR", 1, "shared", [2]], ["CA", 2, 3, 9], ["CHR", 0, "shared", [3]], ["CA", 1, 4, 9], ["FU", 5, [0, 1, 2]], ["AN", 5, 0, 5], ["FU", 5, [1, 2, 3]], ["AN", 5, 1, 4], ["FU", 5, [2, 3, 4]], ["AN", 5, 2, 6], ["FU", 3, [0, 1, 2]], ["SP", 3, 0, 57, [1], 1], ["AN", 3, 1, 2], ["FFSP", 3, 0, [3, 2, 1], 1, 1], ["AN", 3, 1, 6], ["FU", 1, [0, 1, 2]], ["SP", 1, 0, 19, [1], 1], ["AN", 1, 1, 2], ["FFSP", 1, 0, [3, 2, 1], 1, 1], ["AN", 1, 1, 6], ["PR", 4, 0, "auto_unroll_max_step$1024"]]]], "r": [[1.90294e-06], 0, 0.584856, 1692178332], "v": "v0.6"}
{"i": [["[\"matmul\", 19, 38, 38, 3, \"float32\"]", "cuda -keys=cuda,gpu -arch=sm_75 -max_num_threads=1024 -thread_warp_size=32", [-1, 16, 64, 49152, 2147483647, 1024, 8, 32], "", 0, []], [[], [["CHW", 2, "local"], ["SP", 2, 0, 19, [1, 19, 1, 1], 1], ["SP", 2, 5, 38, [1, 19, 2, 1], 1], ["SP", 2, 10, 3, [1, 1, 1, 1], 1], ["SP", 2, 15, 38, [2, 1], 1], ["RE", 2, [0, 5, 10, 1, 6, 11, 2, 7, 12, 15, 16, 3, 8, 13, 17, 4, 9, 14]], ["FSP", 3, 0, 1, 3], ["FSP", 3, 4, 2, 3], ["FSP", 3, 8, 3, 3], ["RE", 3, [0, 4, 8, 1, 5, 9, 2, 6, 10, 3, 7, 11]], ["CA", 2, 3, 8], ["CHR", 1, "shared", [2]], ["CA", 2, 3, 9], ["CHR", 0, "shared", [3]], ["CA", 1, 4, 9], ["FU", 5, [0, 1, 2]], ["AN", 5, 0, 5], ["FU", 5, [1, 2, 3]], ["AN", 5, 1, 4], ["FU", 5, [2, 3, 4]], ["AN", 5, 2, 6], ["FU", 3, [0, 1, 2]], ["SP", 3, 0, 2, [1], 1], ["AN", 3, 1, 2], ["FFSP", 3, 0, [3, 2, 1], 1, 1], ["AN", 3, 1, 6], ["FU", 1, [0, 1, 2]], ["SP", 1, 0, 4, [2], 1], ["AN", 1, 1, 2], ["FFSP", 1, 0, [3, 2, 1], 1, 1], ["AN", 1, 1, 6], ["PR", 4, 0, "auto_unroll_max_step$16"]]]], "r": [[9.25096e-06], 0, 0.57909, 1692178332], "v": "v0.6"}
{"i": [["[\"matmul\", 19, 38, 38, 3, \"float32\"]", "cuda -keys=cuda,gpu -arch=sm_75 -max_num_threads=1024 -thread_warp_size=32", [-1, 16, 64, 49152, 2147483647, 1024, 8, 32], "", 0, []], [[], [["CHW", 2, "local"], ["SP", 2, 0, 19, [1, 1, 1, 1], 1], ["SP", 2, 5, 38, [1, 38, 1, 1], 1], ["SP", 2, 10, 3, [1, 1, 3, 1], 1], ["SP", 2, 15, 38, [1, 2], 1], ["RE", 2, [0, 5, 10, 1, 6, 11, 2, 7, 12, 15, 16, 3, 8, 13, 17, 4, 9, 14]], ["FSP", 3, 0, 1, 3], ["FSP", 3, 4, 2, 3], ["FSP", 3, 8, 3, 3], ["RE", 3, [0, 4, 8, 1, 5, 9, 2, 6, 10, 3, 7, 11]], ["CA", 2, 3, 8], ["CHR", 1, "shared", [2]], ["CA", 2, 3, 9], ["CHR", 0, "shared", [3]], ["CA", 1, 4, 9], ["FU", 5, [0, 1, 2]], ["AN", 5, 0, 5], ["FU", 5, [1, 2, 3]], ["AN", 5, 1, 4], ["FU", 5, [2, 3, 4]], ["AN", 5, 2, 6], ["FU", 3, [0, 1, 2]], ["SP", 3, 0, 2, [2], 1], ["AN", 3, 1, 2], ["FFSP", 3, 0, [3, 2, 1], 1, 1], ["AN", 3, 1, 6], ["FU", 1, [0, 1, 2]], ["SP", 1, 0, 2, [1], 1], ["AN", 1, 1, 2], ["FFSP", 1, 0, [3, 2, 1], 1, 1], ["AN", 1, 1, 6], ["PR", 4, 0, "auto_unroll_max_step$1024"]]]], "r": [[2.44306e-06], 0, 0.696373, 1692178332], "v": "v0.6"}
{"i": [["[\"matmul\", 19, 38, 38, 3, \"float32\"]", "cuda -keys=cuda,gpu -arch=sm_75 -max_num_threads=1024 -thread_warp_size=32", [-1, 16, 64, 49152, 2147483647, 1024, 8, 32], "", 0, []], [[], [["CHW", 2, "local"], ["SP", 2, 0, 19, [1, 1, 1, 1], 1], ["SP", 2, 5, 38, [1, 19, 1, 2], 1], ["SP", 2, 10, 3, [1, 1, 3, 1], 1], ["SP", 2, 15, 38, [1, 38], 1], ["RE", 2, [0, 5, 10, 1, 6, 11, 2, 7, 12, 15, 16, 3, 8, 13, 17, 4, 9, 14]], ["FSP", 3, 0, 1, 3], ["FSP", 3, 4, 2, 3], ["FSP", 3, 8, 3, 3], ["RE", 3, [0, 4, 8, 1, 5, 9, 2, 6, 10, 3, 7, 11]], ["CA", 2, 3, 8], ["CHR", 1, "shared", [2]], ["CA", 2, 3, 9], ["CHR", 0, "shared", [3]], ["CA", 1, 4, 9], ["FU", 5, [0, 1, 2]], ["AN", 5, 0, 5], ["FU", 5, [1, 2, 3]], ["AN", 5, 1, 4], ["FU", 5, [2, 3, 4]], ["AN", 5, 2, 6], ["FU", 3, [0, 1, 2]], ["SP", 3, 0, 114, [1], 1], ["AN", 3, 1, 2], ["FFSP", 3, 0, [3, 2, 1], 1, 1], ["AN", 3, 1, 6], ["FU", 1, [0, 1, 2]], ["SP", 1, 0, 38, [1], 1], ["AN", 1, 1, 2], ["FFSP", 1, 0, [3, 2, 1], 1, 1], ["AN", 1, 1, 6], ["PR", 4, 0, "auto_unroll_max_step$16"]]]], "r": [[1.97556e-06], 0, 0.549285, 1692178333], "v": "v0.6"}
{"i": [["[\"matmul\", 19, 38, 38, 3, \"float32\"]", "cuda -keys=cuda,gpu -arch=sm_75 -max_num_threads=1024 -thread_warp_size=32", [-1, 16, 64, 49152, 2147483647, 1024, 8, 32], "", 0, []], [[], [["CHW", 2, "local"], ["SP", 2, 0, 19, [1, 1, 1, 1], 1], ["SP", 2, 5, 38, [1, 1, 1, 38], 1], ["SP", 2, 10, 3, [1, 3, 1, 1], 1], ["SP", 2, 15, 38, [2, 1], 1], ["RE", 2, [0, 5, 10, 1, 6, 11, 2, 7, 12, 15, 16, 3, 8, 13, 17, 4, 9, 14]], ["FSP", 3, 0, 1, 3], ["FSP", 3, 4, 2, 3], ["FSP", 3, 8, 3, 3], ["RE", 3, [0, 4, 8, 1, 5, 9, 2, 6, 10, 3, 7, 11]], ["CA", 2, 3, 8], ["CHR", 1, "shared", [2]], ["CA", 2, 3, 9], ["CHR", 0, "shared", [3]], ["CA", 1, 4, 9], ["FU", 5, [0, 1, 2]], ["AN", 5, 0, 5], ["FU", 5, [1, 2, 3]], ["AN", 5, 1, 4], ["FU", 5, [2, 3, 4]], ["AN", 5, 2, 6], ["FU", 3, [0, 1, 2]], ["SP", 3, 0, 2, [2], 1], ["AN", 3, 1, 2], ["FFSP", 3, 0, [3, 2, 1], 1, 1], ["AN", 3, 1, 6], ["FU", 1, [0, 1, 2]], ["SP", 1, 0, 2, [1], 1], ["AN", 1, 1, 2], ["FFSP", 1, 0, [3, 2, 1], 1, 1], ["AN", 1, 1, 6], ["PR", 4, 0, "auto_unroll_max_step$0"]]]], "r": [[1.49139e-05], 0, 0.709546, 1692178333], "v": "v0.6"}
{"i": [["[\"matmul\", 19, 38, 38, 3, \"float32\"]", "cuda -keys=cuda,gpu -arch=sm_75 -max_num_threads=1024 -thread_warp_size=32", [-1, 16, 64, 49152, 2147483647, 1024, 8, 32], "", 0, []], [[], [["CHW", 2, "local"], ["SP", 2, 0, 19, [1, 1, 1, 1], 1], ["SP", 2, 5, 38, [1, 38, 1, 1], 1], ["SP", 2, 10, 3, [1, 1, 3, 1], 1], ["SP", 2, 15, 38, [1, 2], 1], ["RE", 2, [0, 5, 10, 1, 6, 11, 2, 7, 12, 15, 16, 3, 8, 13, 17, 4, 9, 14]], ["FSP", 3, 0, 1, 3], ["FSP", 3, 4, 2, 3], ["FSP", 3, 8, 3, 3], ["RE", 3, [0, 4, 8, 1, 5, 9, 2, 6, 10, 3, 7, 11]], ["CA", 2, 3, 8], ["CHR", 1, "shared", [2]], ["CA", 2, 3, 9], ["CHR", 0, "shared", [3]], ["CA", 1, 4, 9], ["FU", 5, [0, 1, 2]], ["AN", 5, 0, 5], ["FU", 5, [1, 2, 3]], ["AN", 5, 1, 4], ["FU", 5, [2, 3, 4]], ["AN", 5, 2, 6], ["FU", 3, [0, 1, 2]], ["SP", 3, 0, 2, [2], 1], ["AN", 3, 1, 2], ["FFSP", 3, 0, [3, 2, 1], 1, 1], ["AN", 3, 1, 6], ["FU", 1, [0, 1, 2]], ["SP", 1, 0, 2, [1], 1], ["AN", 1, 1, 2], ["FFSP", 1, 0, [3, 2, 1], 1, 1], ["AN", 1, 1, 6], ["PR", 4, 0, "auto_unroll_max_step$64"]]]], "r": [[4.52038e-06], 0, 0.562518, 1692178333], "v": "v0.6"}
{"i": [["[\"matmul\", 19, 38, 38, 3, \"float32\"]", "cuda -keys=cuda,gpu -arch=sm_75 -max_num_threads=1024 -thread_warp_size=32", [-1, 16, 64, 49152, 2147483647, 1024, 8, 32], "", 0, []], [[], [["CHW", 2, "local"], ["SP", 2, 0, 19, [1, 19, 1, 1], 1], ["SP", 2, 5, 38, [1, 1, 1, 19], 1], ["SP", 2, 10, 3, [1, 3, 1, 1], 1], ["SP", 2, 15, 38, [1, 19], 1], ["RE", 2, [0, 5, 10, 1, 6, 11, 2, 7, 12, 15, 16, 3, 8, 13, 17, 4, 9, 14]], ["FSP", 3, 0, 1, 3], ["FSP", 3, 4, 2, 3], ["FSP", 3, 8, 3, 3], ["RE", 3, [0, 4, 8, 1, 5, 9, 2, 6, 10, 3, 7, 11]], ["CA", 2, 3, 8], ["CHR", 1, "shared", [2]], ["CA", 2, 3, 9], ["CHR", 0, "shared", [3]], ["CA", 1, 4, 9], ["FU", 5, [0, 1, 2]], ["AN", 5, 0, 5], ["FU", 5, [1, 2, 3]], ["AN", 5, 1, 4], ["FU", 5, [2, 3, 4]], ["AN", 5, 2, 6], ["FU", 3, [0, 1, 2]], ["SP", 3, 0, 19, [1], 1], ["AN", 3, 1, 2], ["FFSP", 3, 0, [3, 2, 1], 1, 1], ["AN", 3, 1, 6], ["FU", 1, [0, 1, 2]], ["SP", 1, 0, 361, [1], 1], ["AN", 1, 1, 2], ["FFSP", 1, 0, [3, 2, 1], 1, 1], ["AN", 1, 1, 6], ["PR", 4, 0, "auto_unroll_max_step$16"]]]], "r": [[2.36803e-05], 0, 0.611547, 1692178333], "v": "v0.6"}
{"i": [["[\"matmul\", 19, 38, 38, 3, \"float32\"]", "cuda -keys=cuda,gpu -arch=sm_75 -max_num_threads=1024 -thread_warp_size=32", [-1, 16, 64, 49152, 2147483647, 1024, 8, 32], "", 0, []], [[], [["CHW", 2, "local"], ["SP", 2, 0, 19, [1, 19, 1, 1], 1], ["SP", 2, 5, 38, [2, 19, 1, 1], 1], ["SP", 2, 10, 3, [1, 1, 1, 1], 1], ["SP", 2, 15, 38, [1, 2], 1], ["RE", 2, [0, 5, 10, 1, 6, 11, 2, 7, 12, 15, 16, 3, 8, 13, 17, 4, 9, 14]], ["FSP", 3, 0, 1, 3], ["FSP", 3, 4, 2, 3], ["FSP", 3, 8, 3, 3], ["RE", 3, [0, 4, 8, 1, 5, 9, 2, 6, 10, 3, 7, 11]], ["CA", 2, 3, 8], ["CHR", 1, "shared", [2]], ["CA", 2, 3, 9], ["CHR", 0, "shared", [3]], ["CA", 1, 4, 9], ["FU", 5, [0, 1, 2]], ["AN", 5, 0, 5], ["FU", 5, [1, 2, 3]], ["AN", 5, 1, 4], ["FU", 5, [2, 3, 4]], ["AN", 5, 2, 6], ["FU", 3, [0, 1, 2]], ["SP", 3, 0, 6, [1], 1], ["AN", 3, 1, 2], ["FFSP", 3, 0, [3, 2, 1], 1, 1], ["AN", 3, 1, 6], ["FU", 1, [0, 1, 2]], ["SP", 1, 0, 2, [1], 1], ["AN", 1, 1, 2], ["FFSP", 1, 0, [3, 2, 1], 1, 1], ["AN", 1, 1, 6], ["PR", 4, 0, "auto_unroll_max_step$512"]]]], "r": [[9.97916e-06], 0, 0.720263, 1692178334], "v": "v0.6"}
{"i": [["[\"matmul\", 19, 38, 38, 3, \"float32\"]", "cuda -keys=cuda,gpu -arch=sm_75 -max_num_threads=1024 -thread_warp_size=32", [-1, 16, 64, 49152, 2147483647, 1024, 8, 32], "", 0, []], [[], [["CHW", 2, "local"], ["SP", 2, 0, 19, [1, 19, 1, 1], 1], ["SP", 2, 5, 38, [1, 19, 1, 1], 1], ["SP", 2, 10, 3, [1, 1, 1, 3], 1], ["SP", 2, 15, 38, [1, 1], 1], ["RE", 2, [0, 5, 10, 1, 6, 11, 2, 7, 12, 15, 16, 3, 8, 13, 17, 4, 9, 14]], ["FSP", 3, 0, 1, 3], ["FSP", 3, 4, 2, 3], ["FSP", 3, 8, 3, 3], ["RE", 3, [0, 4, 8, 1, 5, 9, 2, 6, 10, 3, 7, 11]], ["CA", 2, 3, 8], ["CHR", 1, "shared", [2]], ["CA", 2, 3, 9], ["CHR", 0, "shared", [3]], ["CA", 1, 4, 9], ["FU", 5, [0, 1, 2]], ["AN", 5, 0, 5], ["FU", 5, [1, 2, 3]], ["AN", 5, 1, 4], ["FU", 5, [2, 3, 4]], ["AN", 5, 2, 6], ["FU", 3, [0, 1, 2]], ["SP", 3, 0, 1, [1], 1], ["AN", 3, 1, 2], ["FFSP", 3, 0, [3, 2, 1], 1, 1], ["AN", 3, 1, 6], ["FU", 1, [0, 1, 2]], ["SP", 1, 0, 1, [1], 1], ["AN", 1, 1, 2], ["FFSP", 1, 0, [3, 2, 1], 1, 1], ["AN", 1, 1, 6], ["PR", 4, 0, "auto_unroll_max_step$1024"]]]], "r": [[9.50767e-06], 0, 0.717218, 1692178334], "v": "v0.6"}
{"i": [["[\"matmul\", 19, 38, 38, 3, \"float32\"]", "cuda -keys=cuda,gpu -arch=sm_75 -max_num_threads=1024 -thread_warp_size=32", [-1, 16, 64, 49152, 2147483647, 1024, 8, 32], "", 0, []], [[], [["CHW", 2, "local"], ["SP", 2, 0, 19, [1, 1, 1, 1], 1], ["SP", 2, 5, 38, [1, 38, 1, 1], 1], ["SP", 2, 10, 3, [1, 1, 3, 1], 1], ["SP", 2, 15, 38, [19, 2], 1], ["RE", 2, [0, 5, 10, 1, 6, 11, 2, 7, 12, 15, 16, 3, 8, 13, 17, 4, 9, 14]], ["FSP", 3, 0, 1, 3], ["FSP", 3, 4, 2, 3], ["FSP", 3, 8, 3, 3], ["RE", 3, [0, 4, 8, 1, 5, 9, 2, 6, 10, 3, 7, 11]], ["CA", 2, 3, 8], ["CHR", 1, "shared", [2]], ["CA", 2, 3, 9], ["CHR", 0, "shared", [3]], ["CA", 1, 4, 9], ["FU", 5, [0, 1, 2]], ["AN", 5, 0, 5], ["FU", 5, [1, 2, 3]], ["AN", 5, 1, 4], ["FU", 5, [2, 3, 4]], ["AN", 5, 2, 6], ["FU", 3, [0, 1, 2]], ["SP", 3, 0, 19, [1], 1], ["AN", 3, 1, 2], ["FFSP", 3, 0, [3, 2, 1], 1, 1], ["AN", 3, 1, 6], ["FU", 1, [0, 1, 2]], ["SP", 1, 0, 19, [1], 1], ["AN", 1, 1, 2], ["FFSP", 1, 0, [3, 2, 1], 1, 1], ["AN", 1, 1, 6], ["PR", 4, 0, "auto_unroll_max_step$16"]]]], "r": [[1.97931e-06], 0, 0.503724, 1692178334], "v": "v0.6"}
{"i": [["[\"matmul\", 19, 38, 38, 3, \"float32\"]", "cuda -keys=cuda,gpu -arch=sm_75 -max_num_threads=1024 -thread_warp_size=32", [-1, 16, 64, 49152, 2147483647, 1024, 8, 32], "", 0, []], [[], [["CHW", 2, "local"], ["SP", 2, 0, 19, [1, 19, 1, 1], 1], ["SP", 2, 5, 38, [1, 38, 1, 1], 1], ["SP", 2, 10, 3, [3, 1, 1, 1], 1], ["SP", 2, 15, 38, [1, 1], 1], ["RE", 2, [0, 5, 10, 1, 6, 11, 2, 7, 12, 15, 16, 3, 8, 13, 17, 4, 9, 14]], ["FSP", 3, 0, 1, 3], ["FSP", 3, 4, 2, 3], ["FSP", 3, 8, 3, 3], ["RE", 3, [0, 4, 8, 1, 5, 9, 2, 6, 10, 3, 7, 11]], ["CA", 2, 3, 8], ["CHR", 1, "shared", [2]], ["CA", 2, 3, 9], ["CHR", 0, "shared", [3]], ["CA", 1, 4, 9], ["FU", 5, [0, 1, 2]], ["AN", 5, 0, 5], ["FU", 5, [1, 2, 3]], ["AN", 5, 1, 4], ["FU", 5, [2, 3, 4]], ["AN", 5, 2, 6], ["FU", 3, [0, 1, 2]], ["SP", 3, 0, 38, [1], 1], ["AN", 3, 1, 2], ["FFSP", 3, 0, [3, 2, 1], 1, 1], ["AN", 3, 1, 6], ["FU", 1, [0, 1, 2]], ["SP", 1, 0, 38, [2], 1], ["AN", 1, 1, 2], ["FFSP", 1, 0, [3, 2, 1], 1, 1], ["AN", 1, 1, 6], ["PR", 4, 0, "auto_unroll_max_step$64"]]]], "r": [[2.01957e-05], 0, 0.579084, 1692178334], "v": "v0.6"}
{"i": [["[\"matmul\", 19, 38, 38, 3, \"float32\"]", "cuda -keys=cuda,gpu -arch=sm_75 -max_num_threads=1024 -thread_warp_size=32", [-1, 16, 64, 49152, 2147483647, 1024, 8, 32], "", 0, []], [[], [["CHW", 2, "local"], ["SP", 2, 0, 19, [1, 1, 1, 1], 1], ["SP", 2, 5, 38, [1, 1, 1, 19], 1], ["SP", 2, 10, 3, [1, 1, 1, 3], 1], ["SP", 2, 15, 38, [1, 19], 1], ["RE", 2, [0, 5, 10, 1, 6, 11, 2, 7, 12, 15, 16, 3, 8, 13, 17, 4, 9, 14]], ["FSP", 3, 0, 1, 3], ["FSP", 3, 4, 2, 3], ["FSP", 3, 8, 3, 3], ["RE", 3, [0, 4, 8, 1, 5, 9, 2, 6, 10, 3, 7, 11]], ["CA", 2, 3, 8], ["CHR", 1, "shared", [2]], ["CA", 2, 3, 9], ["CHR", 0, "shared", [3]], ["CA", 1, 4, 9], ["FU", 5, [0, 1, 2]], ["AN", 5, 0, 5], ["FU", 5, [1, 2, 3]], ["AN", 5, 1, 4], ["FU", 5, [2, 3, 4]], ["AN", 5, 2, 6], ["FU", 3, [0, 1, 2]], ["SP", 3, 0, 19, [1], 1], ["AN", 3, 1, 2], ["FFSP", 3, 0, [3, 2, 1], 1, 1], ["AN", 3, 1, 6], ["FU", 1, [0, 1, 2]], ["SP", 1, 0, 361, [1], 1], ["AN", 1, 1, 2], ["FFSP", 1, 0, [3, 2, 1], 1, 1], ["AN", 1, 1, 6], ["PR", 4, 0, "auto_unroll_max_step$16"]]]], "r": [[6.01186e-05], 0, 2.12619, 1692178335], "v": "v0.6"}
{"i": [["[\"matmul\", 19, 38, 38, 3, \"float32\"]", "cuda -keys=cuda,gpu -arch=sm_75 -max_num_threads=1024 -thread_warp_size=32", [-1, 16, 64, 49152, 2147483647, 1024, 8, 32], "", 0, []], [[], [["CHW", 2, "local"], ["SP", 2, 0, 19, [1, 1, 1, 19], 1], ["SP", 2, 5, 38, [2, 1, 1, 1], 1], ["SP", 2, 10, 3, [1, 3, 1, 1], 1], ["SP", 2, 15, 38, [38, 1], 1], ["RE", 2, [0, 5, 10, 1, 6, 11, 2, 7, 12, 15, 16, 3, 8, 13, 17, 4, 9, 14]], ["FSP", 3, 0, 1, 3], ["FSP", 3, 4, 2, 3], ["FSP", 3, 8, 3, 3], ["RE", 3, [0, 4, 8, 1, 5, 9, 2, 6, 10, 3, 7, 11]], ["CA", 2, 3, 8], ["CHR", 1, "shared", [2]], ["CA", 2, 3, 9], ["CHR", 0, "shared", [3]], ["CA", 1, 4, 9], ["FU", 5, [0, 1, 2]], ["AN", 5, 0, 5], ["FU", 5, [1, 2, 3]], ["AN", 5, 1, 4], ["FU", 5, [2, 3, 4]], ["AN", 5, 2, 6], ["FU", 3, [0, 1, 2]], ["SP", 3, 0, 38, [2], 1], ["AN", 3, 1, 2], ["FFSP", 3, 0, [3, 2, 1], 1, 1], ["AN", 3, 1, 6], ["FU", 1, [0, 1, 2]], ["SP", 1, 0, 38, [1], 1], ["AN", 1, 1, 2], ["FFSP", 1, 0, [3, 2, 1], 1, 1], ["AN", 1, 1, 6], ["PR", 4, 0, "auto_unroll_max_step$16"]]]], "r": [[4.21611e-05], 0, 0.613284, 1692178335], "v": "v0.6"}
{"i": [["[\"matmul\", 19, 38, 38, 3, \"float32\"]", "cuda -keys=cuda,gpu -arch=sm_75 -max_num_threads=1024 -thread_warp_size=32", [-1, 16, 64, 49152, 2147483647, 1024, 8, 32], "", 0, []], [[], [["CHW", 2, "local"], ["SP", 2, 0, 19, [1, 19, 1, 1], 1], ["SP", 2, 5, 38, [1, 19, 2, 1], 1], ["SP", 2, 10, 3, [1, 1, 1, 1], 1], ["SP", 2, 15, 38, [1, 2], 1], ["RE", 2, [0, 5, 10, 1, 6, 11, 2, 7, 12, 15, 16, 3, 8, 13, 17, 4, 9, 14]], ["FSP", 3, 0, 1, 3], ["FSP", 3, 4, 2, 3], ["FSP", 3, 8, 3, 3], ["RE", 3, [0, 4, 8, 1, 5, 9, 2, 6, 10, 3, 7, 11]], ["CA", 2, 3, 8], ["CHR", 1, "shared", [2]], ["CA", 2, 3, 9], ["CHR", 0, "shared", [3]], ["CA", 1, 4, 9], ["FU", 5, [0, 1, 2]], ["AN", 5, 0, 5], ["FU", 5, [1, 2, 3]], ["AN", 5, 1, 4], ["FU", 5, [2, 3, 4]], ["AN", 5, 2, 6], ["FU", 3, [0, 1, 2]], ["SP", 3, 0, 2, [2], 1], ["AN", 3, 1, 2], ["FFSP", 3, 0, [3, 2, 1], 1, 1], ["AN", 3, 1, 6], ["FU", 1, [0, 1, 2]], ["SP", 1, 0, 4, [1], 1], ["AN", 1, 1, 2], ["FFSP", 1, 0, [3, 2, 1], 1, 1], ["AN", 1, 1, 6], ["PR", 4, 0, "auto_unroll_max_step$16"]]]], "r": [[1.39242e-05], 0, 0.644375, 1692178338], "v": "v0.6"}
{"i": [["[\"matmul\", 19, 38, 38, 3, \"float32\"]", "cuda -keys=cuda,gpu -arch=sm_75 -max_num_threads=1024 -thread_warp_size=32", [-1, 16, 64, 49152, 2147483647, 1024, 8, 32], "", 0, []], [[], [["CHW", 2, "local"], ["SP", 2, 0, 19, [1, 1, 1, 1], 1], ["SP", 2, 5, 38, [1, 19, 2, 1], 1], ["SP", 2, 10, 3, [1, 3, 1, 1], 1], ["SP", 2, 15, 38, [2, 1], 1], ["RE", 2, [0, 5, 10, 1, 6, 11, 2, 7, 12, 15, 16, 3, 8, 13, 17, 4, 9, 14]], ["FSP", 3, 0, 1, 3], ["FSP", 3, 4, 2, 3], ["FSP", 3, 8, 3, 3], ["RE", 3, [0, 4, 8, 1, 5, 9, 2, 6, 10, 3, 7, 11]], ["CA", 2, 3, 8], ["CHR", 1, "shared", [2]], ["CA", 2, 3, 9], ["CHR", 0, "shared", [3]], ["CA", 1, 4, 9], ["FU", 5, [0, 1, 2]], ["AN", 5, 0, 5], ["FU", 5, [1, 2, 3]], ["AN", 5, 1, 4], ["FU", 5, [2, 3, 4]], ["AN", 5, 2, 6], ["FU", 3, [0, 1, 2]], ["SP", 3, 0, 2, [1], 1], ["AN", 3, 1, 2], ["FFSP", 3, 0, [3, 2, 1], 1, 1], ["AN", 3, 1, 6], ["FU", 1, [0, 1, 2]], ["SP", 1, 0, 2, [1], 1], ["AN", 1, 1, 2], ["FFSP", 1, 0, [3, 2, 1], 1, 1], ["AN", 1, 1, 6], ["PR", 4, 0, "auto_unroll_max_step$64"]]]], "r": [[3.2008e-06], 0, 0.488124, 1692178338], "v": "v0.6"}
{"i": [["[\"matmul\", 19, 38, 38, 3, \"float32\"]", "cuda -keys=cuda,gpu -arch=sm_75 -max_num_threads=1024 -thread_warp_size=32", [-1, 16, 64, 49152, 2147483647, 1024, 8, 32], "", 0, []], [[], [["CHW", 2, "local"], ["SP", 2, 0, 19, [1, 19, 1, 1], 1], ["SP", 2, 5, 38, [1, 1, 1, 1], 1], ["SP", 2, 10, 3, [1, 1, 1, 3], 1], ["SP", 2, 15, 38, [19, 1], 1], ["RE", 2, [0, 5, 10, 1, 6, 11, 2, 7, 12, 15, 16, 3, 8, 13, 17, 4, 9, 14]], ["FSP", 3, 0, 1, 3], ["FSP", 3, 4, 2, 3], ["FSP", 3, 8, 3, 3], ["RE", 3, [0, 4, 8, 1, 5, 9, 2, 6, 10, 3, 7, 11]], ["CA", 2, 3, 8], ["CHR", 1, "shared", [2]], ["CA", 2, 3, 9], ["CHR", 0, "shared", [3]], ["CA", 1, 4, 9], ["FU", 5, [0, 1, 2]], ["AN", 5, 0, 5], ["FU", 5, [1, 2, 3]], ["AN", 5, 1, 4], ["FU", 5, [2, 3, 4]], ["AN", 5, 2, 6], ["FU", 3, [0, 1, 2]], ["SP", 3, 0, 57, [1], 1], ["AN", 3, 1, 2], ["FFSP", 3, 0, [3, 2, 1], 1, 1], ["AN", 3, 1, 6], ["FU", 1, [0, 1, 2]], ["SP", 1, 0, 19, [1], 1], ["AN", 1, 1, 2], ["FFSP", 1, 0, [3, 2, 1], 1, 1], ["AN", 1, 1, 6], ["PR", 4, 0, "auto_unroll_max_step$0"]]]], "r": [[2.87891e-06], 0, 0.573742, 1692178339], "v": "v0.6"}
{"i": [["[\"matmul\", 19, 38, 38, 3, \"float32\"]", "cuda -keys=cuda,gpu -arch=sm_75 -max_num_threads=1024 -thread_warp_size=32", [-1, 16, 64, 49152, 2147483647, 1024, 8, 32], "", 0, []], [[], [["CHW", 2, "local"], ["SP", 2, 0, 19, [1, 1, 1, 1], 1], ["SP", 2, 5, 38, [1, 38, 1, 1], 1], ["SP", 2, 10, 3, [3, 1, 1, 1], 1], ["SP", 2, 15, 38, [38, 1], 1], ["RE", 2, [0, 5, 10, 1, 6, 11, 2, 7, 12, 15, 16, 3, 8, 13, 17, 4, 9, 14]], ["FSP", 3, 0, 1, 3], ["FSP", 3, 4, 2, 3], ["FSP", 3, 8, 3, 3], ["RE", 3, [0, 4, 8, 1, 5, 9, 2, 6, 10, 3, 7, 11]], ["CA", 2, 3, 8], ["CHR", 1, "shared", [2]], ["CA", 2, 3, 9], ["CHR", 0, "shared", [3]], ["CA", 1, 4, 9], ["FU", 5, [0, 1, 2]], ["AN", 5, 0, 5], ["FU", 5, [1, 2, 3]], ["AN", 5, 1, 4], ["FU", 5, [2, 3, 4]], ["AN", 5, 2, 6], ["FU", 3, [0, 1, 2]], ["SP", 3, 0, 2, [1], 1], ["AN", 3, 1, 2], ["FFSP", 3, 0, [3, 2, 1], 1, 1], ["AN", 3, 1, 6], ["FU", 1, [0, 1, 2]], ["SP", 1, 0, 2, [1], 1], ["AN", 1, 1, 2], ["FFSP", 1, 0, [3, 2, 1], 1, 1], ["AN", 1, 1, 6], ["PR", 4, 0, "auto_unroll_max_step$16"]]]], "r": [[2.05327e-06], 0, 0.494918, 1692178339], "v": "v0.6"}
{"i": [["[\"matmul\", 19, 38, 38, 3, \"float32\"]", "cuda -keys=cuda,gpu -arch=sm_75 -max_num_threads=1024 -thread_warp_size=32", [-1, 16, 64, 49152, 2147483647, 1024, 8, 32], "", 0, []], [[], [["CHW", 2, "local"], ["SP", 2, 0, 19, [1, 1, 1, 1], 1], ["SP", 2, 5, 38, [1, 1, 38, 1], 1], ["SP", 2, 10, 3, [3, 1, 1, 1], 1], ["SP", 2, 15, 38, [1, 1], 1], ["RE", 2, [0, 5, 10, 1, 6, 11, 2, 7, 12, 15, 16, 3, 8, 13, 17, 4, 9, 14]], ["FSP", 3, 0, 1, 3], ["FSP", 3, 4, 2, 3], ["FSP", 3, 8, 3, 3], ["RE", 3, [0, 4, 8, 1, 5, 9, 2, 6, 10, 3, 7, 11]], ["CA", 2, 3, 8], ["CHR", 1, "shared", [2]], ["CA", 2, 3, 9], ["CHR", 0, "shared", [3]], ["CA", 1, 4, 9], ["FU", 5, [0, 1, 2]], ["AN", 5, 0, 5], ["FU", 5, [1, 2, 3]], ["AN", 5, 1, 4], ["FU", 5, [2, 3, 4]], ["AN", 5, 2, 6], ["FU", 3, [0, 1, 2]], ["SP", 3, 0, 1, [1], 1], ["AN", 3, 1, 2], ["FFSP", 3, 0, [3, 2, 1], 1, 1], ["AN", 3, 1, 6], ["FU", 1, [0, 1, 2]], ["SP", 1, 0, 1, [1], 1], ["AN", 1, 1, 2], ["FFSP", 1, 0, [3, 2, 1], 1, 1], ["AN", 1, 1, 6], ["PR", 4, 0, "auto_unroll_max_step$1024"]]]], "r": [[1.86553e-05], 0, 0.656032, 1692178339], "v": "v0.6"}
{"i": [["[\"matmul\", 19, 38, 38, 3, \"float32\"]", "cuda -keys=cuda,gpu -arch=sm_75 -max_num_threads=1024 -thread_warp_size=32", [-1, 16, 64, 49152, 2147483647, 1024, 8, 32], "", 0, []], [[], [["CHW", 2, "local"], ["SP", 2, 0, 19, [1, 19, 1, 1], 1], ["SP", 2, 5, 38, [1, 38, 1, 1], 1], ["SP", 2, 10, 3, [1, 1, 1, 3], 1], ["SP", 2, 15, 38, [1, 1], 1], ["RE", 2, [0, 5, 10, 1, 6, 11, 2, 7, 12, 15, 16, 3, 8, 13, 17, 4, 9, 14]], ["FSP", 3, 0, 1, 3], ["FSP", 3, 4, 2, 3], ["FSP", 3, 8, 3, 3], ["RE", 3, [0, 4, 8, 1, 5, 9, 2, 6, 10, 3, 7, 11]], ["CA", 2, 3, 8], ["CHR", 1, "shared", [2]], ["CA", 2, 3, 9], ["CHR", 0, "shared", [3]], ["CA", 1, 4, 9], ["FU", 5, [0, 1, 2]], ["AN", 5, 0, 5], ["FU", 5, [1, 2, 3]], ["AN", 5, 1, 4], ["FU", 5, [2, 3, 4]], ["AN", 5, 2, 6], ["FU", 3, [0, 1, 2]], ["SP", 3, 0, 57, [1], 1], ["AN", 3, 1, 2], ["FFSP", 3, 0, [3, 2, 1], 1, 1], ["AN", 3, 1, 6], ["FU", 1, [0, 1, 2]], ["SP", 1, 0, 19, [1], 1], ["AN", 1, 1, 2], ["FFSP", 1, 0, [3, 2, 1], 1, 1], ["AN", 1, 1, 6], ["PR", 4, 0, "auto_unroll_max_step$512"]]]], "r": [[2.03458e-05], 0, 0.690585, 1692178339], "v": "v0.6"}
{"i": [["[\"matmul\", 19, 38, 38, 3, \"float32\"]", "cuda -keys=cuda,gpu -arch=sm_75 -max_num_threads=1024 -thread_warp_size=32", [-1, 16, 64, 49152, 2147483647, 1024, 8, 32], "", 0, []], [[], [["CHW", 2, "local"], ["SP", 2, 0, 19, [1, 1, 1, 1], 1], ["SP", 2, 5, 38, [1, 38, 1, 1], 1], ["SP", 2, 10, 3, [1, 3, 1, 1], 1], ["SP", 2, 15, 38, [1, 38], 1], ["RE", 2, [0, 5, 10, 1, 6, 11, 2, 7, 12, 15, 16, 3, 8, 13, 17, 4, 9, 14]], ["FSP", 3, 0, 1, 3], ["FSP", 3, 4, 2, 3], ["FSP", 3, 8, 3, 3], ["RE", 3, [0, 4, 8, 1, 5, 9, 2, 6, 10, 3, 7, 11]], ["CA", 2, 3, 8], ["CHR", 1, "shared", [2]], ["CA", 2, 3, 9], ["CHR", 0, "shared", [3]], ["CA", 1, 4, 9], ["FU", 5, [0, 1, 2]], ["AN", 5, 0, 5], ["FU", 5, [1, 2, 3]], ["AN", 5, 1, 4], ["FU", 5, [2, 3, 4]], ["AN", 5, 2, 6], ["FU", 3, [0, 1, 2]], ["SP", 3, 0, 38, [19], 1], ["AN", 3, 1, 2], ["FFSP", 3, 0, [3, 2, 1], 1, 1], ["AN", 3, 1, 6], ["FU", 1, [0, 1, 2]], ["SP", 1, 0, 38, [1], 1], ["AN", 1, 1, 2], ["FFSP", 1, 0, [3, 2, 1], 1, 1], ["AN", 1, 1, 6], ["PR", 4, 0, "auto_unroll_max_step$1024"]]]], "r": [[2.09267e-06], 0, 0.526085, 1692178340], "v": "v0.6"}
{"i": [["[\"matmul\", 19, 38, 38, 3, \"float32\"]", "cuda -keys=cuda,gpu -arch=sm_75 -max_num_threads=1024 -thread_warp_size=32", [-1, 16, 64, 49152, 2147483647, 1024, 8, 32], "", 0, []], [[], [["CHW", 2, "local"], ["SP", 2, 0, 19, [1, 1, 1, 1], 1], ["SP", 2, 5, 38, [1, 38, 1, 1], 1], ["SP", 2, 10, 3, [1, 1, 1, 1], 1], ["SP", 2, 15, 38, [2, 1], 1], ["RE", 2, [0, 5, 10, 1, 6, 11, 2, 7, 12, 15, 16, 3, 8, 13, 17, 4, 9, 14]], ["FSP", 3, 0, 1, 3], ["FSP", 3, 4, 2, 3], ["FSP", 3, 8, 3, 3], ["RE", 3, [0, 4, 8, 1, 5, 9, 2, 6, 10, 3, 7, 11]], ["CA", 2, 3, 8], ["CHR", 1, "shared", [2]], ["CA", 2, 3, 9], ["CHR", 0, "shared", [3]], ["CA", 1, 4, 9], ["FU", 5, [0, 1, 2]], ["AN", 5, 0, 5], ["FU", 5, [1, 2, 3]], ["AN", 5, 1, 4], ["FU", 5, [2, 3, 4]], ["AN", 5, 2, 6], ["FU", 3, [0, 1, 2]], ["SP", 3, 0, 2, [2], 1], ["AN", 3, 1, 2], ["FFSP", 3, 0, [3, 2, 1], 1, 1], ["AN", 3, 1, 6], ["FU", 1, [0, 1, 2]], ["SP", 1, 0, 2, [1], 1], ["AN", 1, 1, 2], ["FFSP", 1, 0, [3, 2, 1], 1, 1], ["AN", 1, 1, 6], ["PR", 4, 0, "auto_unroll_max_step$0"]]]], "r": [[3.95222e-06], 0, 0.521464, 1692178340], "v": "v0.6"}
{"i": [["[\"matmul\", 19, 38, 38, 3, \"float32\"]", "cuda -keys=cuda,gpu -arch=sm_75 -max_num_threads=1024 -thread_warp_size=32", [-1, 16, 64, 49152, 2147483647, 1024, 8, 32], "", 0, []], [[], [["CHW", 2, "local"], ["SP", 2, 0, 19, [1, 1, 1, 1], 1], ["SP", 2, 5, 38, [1, 1, 19, 1], 1], ["SP", 2, 10, 3, [3, 1, 1, 1], 1], ["SP", 2, 15, 38, [1, 1], 1], ["RE", 2, [0, 5, 10, 1, 6, 11, 2, 7, 12, 15, 16, 3, 8, 13, 17, 4, 9, 14]], ["FSP", 3, 0, 1, 3], ["FSP", 3, 4, 2, 3], ["FSP", 3, 8, 3, 3], ["RE", 3, [0, 4, 8, 1, 5, 9, 2, 6, 10, 3, 7, 11]], ["CA", 2, 3, 8], ["CHR", 1, "shared", [2]], ["CA", 2, 3, 9], ["CHR", 0, "shared", [3]], ["CA", 1, 4, 9], ["FU", 5, [0, 1, 2]], ["AN", 5, 0, 5], ["FU", 5, [1, 2, 3]], ["AN", 5, 1, 4], ["FU", 5, [2, 3, 4]], ["AN", 5, 2, 6], ["FU", 3, [0, 1, 2]], ["SP", 3, 0, 1, [1], 1], ["AN", 3, 1, 2], ["FFSP", 3, 0, [3, 2, 1], 1, 1], ["AN", 3, 1, 6], ["FU", 1, [0, 1, 2]], ["SP", 1, 0, 1, [1], 1], ["AN", 1, 1, 2], ["FFSP", 1, 0, [3, 2, 1], 1, 1], ["AN", 1, 1, 6], ["PR", 4, 0, "auto_unroll_max_step$0"]]]], "r": [[1.14785e-05], 0, 0.563935, 1692178340], "v": "v0.6"}
{"i": [["[\"matmul\", 19, 38, 38, 3, \"float32\"]", "cuda -keys=cuda,gpu -arch=sm_75 -max_num_threads=1024 -thread_warp_size=32", [-1, 16, 64, 49152, 2147483647, 1024, 8, 32], "", 0, []], [[], [["CHW", 2, "local"], ["SP", 2, 0, 19, [1, 1, 1, 19], 1], ["SP", 2, 5, 38, [1, 38, 1, 1], 1], ["SP", 2, 10, 3, [1, 1, 3, 1], 1], ["SP", 2, 15, 38, [2, 1], 1], ["RE", 2, [0, 5, 10, 1, 6, 11, 2, 7, 12, 15, 16, 3, 8, 13, 17, 4, 9, 14]], ["FSP", 3, 0, 1, 3], ["FSP", 3, 4, 2, 3], ["FSP", 3, 8, 3, 3], ["RE", 3, [0, 4, 8, 1, 5, 9, 2, 6, 10, 3, 7, 11]], ["CA", 2, 3, 8], ["CHR", 1, "shared", [2]], ["CA", 2, 3, 9], ["CHR", 0, "shared", [3]], ["CA", 1, 4, 9], ["FU", 5, [0, 1, 2]], ["AN", 5, 0, 5], ["FU", 5, [1, 2, 3]], ["AN", 5, 1, 4], ["FU", 5, [2, 3, 4]], ["AN", 5, 2, 6], ["FU", 3, [0, 1, 2]], ["SP", 3, 0, 2, [1], 1], ["AN", 3, 1, 2], ["FFSP", 3, 0, [3, 2, 1], 1, 1], ["AN", 3, 1, 6], ["FU", 1, [0, 1, 2]], ["SP", 1, 0, 2, [1], 1], ["AN", 1, 1, 2], ["FFSP", 1, 0, [3, 2, 1], 1, 1], ["AN", 1, 1, 6], ["PR", 4, 0, "auto_unroll_max_step$64"]]]], "r": [[2.00795e-05], 0, 1.02397, 1692178340], "v": "v0.6"}
{"i": [["[\"matmul\", 19, 38, 38, 3, \"float32\"]", "cuda -keys=cuda,gpu -arch=sm_75 -max_num_threads=1024 -thread_warp_size=32", [-1, 16, 64, 49152, 2147483647, 1024, 8, 32], "", 0, []], [[], [["CHW", 2, "local"], ["SP", 2, 0, 19, [1, 1, 1, 19], 1], ["SP", 2, 5, 38, [2, 19, 1, 1], 1], ["SP", 2, 10, 3, [3, 1, 1, 1], 1], ["SP", 2, 15, 38, [1, 2], 1], ["RE", 2, [0, 5, 10, 1, 6, 11, 2, 7, 12, 15, 16, 3, 8, 13, 17, 4, 9, 14]], ["FSP", 3, 0, 1, 3], ["FSP", 3, 4, 2, 3], ["FSP", 3, 8, 3, 3], ["RE", 3, [0, 4, 8, 1, 5, 9, 2, 6, 10, 3, 7, 11]], ["CA", 2, 3, 8], ["CHR", 1, "shared", [2]], ["CA", 2, 3, 9], ["CHR", 0, "shared", [3]], ["CA", 1, 4, 9], ["FU", 5, [0, 1, 2]], ["AN", 5, 0, 5], ["FU", 5, [1, 2, 3]], ["AN", 5, 1, 4], ["FU", 5, [2, 3, 4]], ["AN", 5, 2, 6], ["FU", 3, [0, 1, 2]], ["SP", 3, 0, 38, [19], 1], ["AN", 3, 1, 2], ["FFSP", 3, 0, [3, 2, 1], 1, 1], ["AN", 3, 1, 6], ["FU", 1, [0, 1, 2]], ["SP", 1, 0, 38, [1], 1], ["AN", 1, 1, 2], ["FFSP", 1, 0, [3, 2, 1], 1, 1], ["AN", 1, 1, 6], ["PR", 4, 0, "auto_unroll_max_step$16"]]]], "r": [[3.48379e-05], 0, 0.701783, 1692178341], "v": "v0.6"}
{"i": [["[\"matmul\", 19, 38, 38, 3, \"float32\"]", "cuda -keys=cuda,gpu -arch=sm_75 -max_num_threads=1024 -thread_warp_size=32", [-1, 16, 64, 49152, 2147483647, 1024, 8, 32], "", 0, []], [[], [["CHW", 2, "local"], ["SP", 2, 0, 19, [1, 1, 1, 19], 1], ["SP", 2, 5, 38, [1, 1, 1, 2], 1], ["SP", 2, 10, 3, [1, 3, 1, 1], 1], ["SP", 2, 15, 38, [1, 2], 1], ["RE", 2, [0, 5, 10, 1, 6, 11, 2, 7, 12, 15, 16, 3, 8, 13, 17, 4, 9, 14]], ["FSP", 3, 0, 1, 3], ["FSP", 3, 4, 2, 3], ["FSP", 3, 8, 3, 3], ["RE", 3, [0, 4, 8, 1, 5, 9, 2, 6, 10, 3, 7, 11]], ["CA", 2, 3, 8], ["CHR", 1, "shared", [2]], ["CA", 2, 3, 9], ["CHR", 0, "shared", [3]], ["CA", 1, 4, 9], ["FU", 5, [0, 1, 2]], ["AN", 5, 0, 5], ["FU", 5, [1, 2, 3]], ["AN", 5, 1, 4], ["FU", 5, [2, 3, 4]], ["AN", 5, 2, 6], ["FU", 3, [0, 1, 2]], ["SP", 3, 0, 2, [1], 1], ["AN", 3, 1, 2], ["FFSP", 3, 0, [3, 2, 1], 1, 1], ["AN", 3, 1, 6], ["FU", 1, [0, 1, 2]], ["SP", 1, 0, 4, [4], 1], ["AN", 1, 1, 2], ["FFSP", 1, 0, [3, 2, 1], 1, 1], ["AN", 1, 1, 6], ["PR", 4, 0, "auto_unroll_max_step$64"]]]], "r": [[1.20693e-05], 0, 0.652363, 1692178341], "v": "v0.6"}
{"i": [["[\"matmul\", 19, 38, 38, 3, \"float32\"]", "cuda -keys=cuda,gpu -arch=sm_75 -max_num_threads=1024 -thread_warp_size=32", [-1, 16, 64, 49152, 2147483647, 1024, 8, 32], "", 0, []], [[], [["CHW", 2, "local"], ["SP", 2, 0, 19, [1, 1, 1, 19], 1], ["SP", 2, 5, 38, [1, 19, 1, 2], 1], ["SP", 2, 10, 3, [1, 3, 1, 1], 1], ["SP", 2, 15, 38, [1, 2], 1], ["RE", 2, [0, 5, 10, 1, 6, 11, 2, 7, 12, 15, 16, 3, 8, 13, 17, 4, 9, 14]], ["FSP", 3, 0, 1, 3], ["FSP", 3, 4, 2, 3], ["FSP", 3, 8, 3, 3], ["RE", 3, [0, 4, 8, 1, 5, 9, 2, 6, 10, 3, 7, 11]], ["CA", 2, 3, 8], ["CHR", 1, "shared", [2]], ["CA", 2, 3, 9], ["CHR", 0, "shared", [3]], ["CA", 1, 4, 9], ["FU", 5, [0, 1, 2]], ["AN", 5, 0, 5], ["FU", 5, [1, 2, 3]], ["AN", 5, 1, 4], ["FU", 5, [2, 3, 4]], ["AN", 5, 2, 6], ["FU", 3, [0, 1, 2]], ["SP", 3, 0, 38, [1], 1], ["AN", 3, 1, 2], ["FFSP", 3, 0, [3, 2, 1], 1, 1], ["AN", 3, 1, 6], ["FU", 1, [0, 1, 2]], ["SP", 1, 0, 76, [2], 1], ["AN", 1, 1, 2], ["FFSP", 1, 0, [3, 2, 1], 1, 1], ["AN", 1, 1, 6], ["PR", 4, 0, "auto_unroll_max_step$16"]]]], "r": [[2.34837e-05], 0, 0.621947, 1692178341], "v": "v0.6"}
{"i": [["[\"matmul\", 19, 38, 38, 3, \"float32\"]", "cuda -keys=cuda,gpu -arch=sm_75 -max_num_threads=1024 -thread_warp_size=32", [-1, 16, 64, 49152, 2147483647, 1024, 8, 32], "", 0, []], [[], [["CHW", 2, "local"], ["SP", 2, 0, 19, [1, 19, 1, 1], 1], ["SP", 2, 5, 38, [1, 1, 1, 1], 1], ["SP", 2, 10, 3, [1, 3, 1, 1], 1], ["SP", 2, 15, 38, [38, 1], 1], ["RE", 2, [0, 5, 10, 1, 6, 11, 2, 7, 12, 15, 16, 3, 8, 13, 17, 4, 9, 14]], ["FSP", 3, 0, 1, 3], ["FSP", 3, 4, 2, 3], ["FSP", 3, 8, 3, 3], ["RE", 3, [0, 4, 8, 1, 5, 9, 2, 6, 10, 3, 7, 11]], ["CA", 2, 3, 8], ["CHR", 1, "shared", [2]], ["CA", 2, 3, 9], ["CHR", 0, "shared", [3]], ["CA", 1, 4, 9], ["FU", 5, [0, 1, 2]], ["AN", 5, 0, 5], ["FU", 5, [1, 2, 3]], ["AN", 5, 1, 4], ["FU", 5, [2, 3, 4]], ["AN", 5, 2, 6], ["FU", 3, [0, 1, 2]], ["SP", 3, 0, 38, [1], 1], ["AN", 3, 1, 2], ["FFSP", 3, 0, [3, 2, 1], 1, 1], ["AN", 3, 1, 6], ["FU", 1, [0, 1, 2]], ["SP", 1, 0, 38, [1], 1], ["AN", 1, 1, 2], ["FFSP", 1, 0, [3, 2, 1], 1, 1], ["AN", 1, 1, 6], ["PR", 4, 0, "auto_unroll_max_step$64"]]]], "r": [[2.74961e-06], 0, 0.615818, 1692178342], "v": "v0.6"}
{"i": [["[\"matmul\", 19, 38, 38, 3, \"float32\"]", "cuda -keys=cuda,gpu -arch=sm_75 -max_num_threads=1024 -thread_warp_size=32", [-1, 16, 64, 49152, 2147483647, 1024, 8, 32], "", 0, []], [[], [["CHW", 2, "local"], ["SP", 2, 0, 19, [1, 1, 1, 1], 1], ["SP", 2, 5, 38, [1, 19, 1, 1], 1], ["SP", 2, 10, 3, [1, 1, 1, 1], 1], ["SP", 2, 15, 38, [1, 1], 1], ["RE", 2, [0, 5, 10, 1, 6, 11, 2, 7, 12, 15, 16, 3, 8, 13, 17, 4, 9, 14]], ["FSP", 3, 0, 1, 3], ["FSP", 3, 4, 2, 3], ["FSP", 3, 8, 3, 3], ["RE", 3, [0, 4, 8, 1, 5, 9, 2, 6, 10, 3, 7, 11]], ["CA", 2, 3, 8], ["CHR", 1, "shared", [2]], ["CA", 2, 3, 9], ["CHR", 0, "shared", [3]], ["CA", 1, 4, 9], ["FU", 5, [0, 1, 2]], ["AN", 5, 0, 5], ["FU", 5, [1, 2, 3]], ["AN", 5, 1, 4], ["FU", 5, [2, 3, 4]], ["AN", 5, 2, 6], ["FU", 3, [0, 1, 2]], ["SP", 3, 0, 1, [1], 1], ["AN", 3, 1, 2], ["FFSP", 3, 0, [3, 2, 1], 1, 1], ["AN", 3, 1, 6], ["FU", 1, [0, 1, 2]], ["SP", 1, 0, 1, [1], 1], ["AN", 1, 1, 2], ["FFSP", 1, 0, [3, 2, 1], 1, 1], ["AN", 1, 1, 6], ["PR", 4, 0, "auto_unroll_max_step$1024"]]]], "r": [[5.78406e-06], 0, 0.620009, 1692178342], "v": "v0.6"}
{"i": [["[\"matmul\", 19, 38, 38, 3, \"float32\"]", "cuda -keys=cuda,gpu -arch=sm_75 -max_num_threads=1024 -thread_warp_size=32", [-1, 16, 64, 49152, 2147483647, 1024, 8, 32], "", 0, []], [[], [["CHW", 2, "local"], ["SP", 2, 0, 19, [1, 1, 1, 1], 1], ["SP", 2, 5, 38, [1, 2, 19, 1], 1], ["SP", 2, 10, 3, [3, 1, 1, 1], 1], ["SP", 2, 15, 38, [1, 1], 1], ["RE", 2, [0, 5, 10, 1, 6, 11, 2, 7, 12, 15, 16, 3, 8, 13, 17, 4, 9, 14]], ["FSP", 3, 0, 1, 3], ["FSP", 3, 4, 2, 3], ["FSP", 3, 8, 3, 3], ["RE", 3, [0, 4, 8, 1, 5, 9, 2, 6, 10, 3, 7, 11]], ["CA", 2, 3, 8], ["CHR", 1, "shared", [2]], ["CA", 2, 3, 9], ["CHR", 0, "shared", [3]], ["CA", 1, 4, 9], ["FU", 5, [0, 1, 2]], ["AN", 5, 0, 5], ["FU", 5, [1, 2, 3]], ["AN", 5, 1, 4], ["FU", 5, [2, 3, 4]], ["AN", 5, 2, 6], ["FU", 3, [0, 1, 2]], ["SP", 3, 0, 2, [2], 1], ["AN", 3, 1, 2], ["FFSP", 3, 0, [3, 2, 1], 1, 1], ["AN", 3, 1, 6], ["FU", 1, [0, 1, 2]], ["SP", 1, 0, 2, [1], 1], ["AN", 1, 1, 2], ["FFSP", 1, 0, [3, 2, 1], 1, 1], ["AN", 1, 1, 6], ["PR", 4, 0, "auto_unroll_max_step$512"]]]], "r": [[1.18048e-05], 0, 0.592599, 1692178342], "v": "v0.6"}
{"i": [["[\"matmul\", 19, 38, 38, 3, \"float32\"]", "cuda -keys=cuda,gpu -arch=sm_75 -max_num_threads=1024 -thread_warp_size=32", [-1, 16, 64, 49152, 2147483647, 1024, 8, 32], "", 0, []], [[], [["CHW", 2, "local"], ["SP", 2, 0, 19, [1, 1, 1, 1], 1], ["SP", 2, 5, 38, [1, 38, 1, 1], 1], ["SP", 2, 10, 3, [1, 3, 1, 1], 1], ["SP", 2, 15, 38, [1, 38], 1], ["RE", 2, [0, 5, 10, 1, 6, 11, 2, 7, 12, 15, 16, 3, 8, 13, 17, 4, 9, 14]], ["FSP", 3, 0, 1, 3], ["FSP", 3, 4, 2, 3], ["FSP", 3, 8, 3, 3], ["RE", 3, [0, 4, 8, 1, 5, 9, 2, 6, 10, 3, 7, 11]], ["CA", 2, 3, 8], ["CHR", 1, "shared", [2]], ["CA", 2, 3, 9], ["CHR", 0, "shared", [3]], ["CA", 1, 4, 9], ["FU", 5, [0, 1, 2]], ["AN", 5, 0, 5], ["FU", 5, [1, 2, 3]], ["AN", 5, 1, 4], ["FU", 5, [2, 3, 4]], ["AN", 5, 2, 6], ["FU", 3, [0, 1, 2]], ["SP", 3, 0, 38, [1], 1], ["AN", 3, 1, 2], ["FFSP", 3, 0, [3, 2, 1], 1, 1], ["AN", 3, 1, 6], ["FU", 1, [0, 1, 2]], ["SP", 1, 0, 38, [1], 1], ["AN", 1, 1, 2], ["FFSP", 1, 0, [3, 2, 1], 1, 1], ["AN", 1, 1, 6], ["PR", 4, 0, "auto_unroll_max_step$0"]]]], "r": [[2.25261e-06], 0, 0.555054, 1692178351], "v": "v0.6"}
{"i": [["[\"matmul\", 19, 38, 38, 3, \"float32\"]", "cuda -keys=cuda,gpu -arch=sm_75 -max_num_threads=1024 -thread_warp_size=32", [-1, 16, 64, 49152, 2147483647, 1024, 8, 32], "", 0, []], [[], [["CHW", 2, "local"], ["SP", 2, 0, 19, [1, 1, 19, 1], 1], ["SP", 2, 5, 38, [1, 1, 2, 1], 1], ["SP", 2, 10, 3, [1, 3, 1, 1], 1], ["SP", 2, 15, 38, [19, 2], 1], ["RE", 2, [0, 5, 10, 1, 6, 11, 2, 7, 12, 15, 16, 3, 8, 13, 17, 4, 9, 14]], ["FSP", 3, 0, 1, 3], ["FSP", 3, 4, 2, 3], ["FSP", 3, 8, 3, 3], ["RE", 3, [0, 4, 8, 1, 5, 9, 2, 6, 10, 3, 7, 11]], ["CA", 2, 3, 8], ["CHR", 1, "shared", [2]], ["CA", 2, 3, 9], ["CHR", 0, "shared", [3]], ["CA", 1, 4, 9], ["FU", 5, [0, 1, 2]], ["AN", 5, 0, 5], ["FU", 5, [1, 2, 3]], ["AN", 5, 1, 4], ["FU", 5, [2, 3, 4]], ["AN", 5, 2, 6], ["FU", 3, [0, 1, 2]], ["SP", 3, 0, 38, [1], 1], ["AN", 3, 1, 2], ["FFSP", 3, 0, [3, 2, 1], 1, 1], ["AN", 3, 1, 6], ["FU", 1, [0, 1, 2]], ["SP", 1, 0, 38, [1], 1], ["AN", 1, 1, 2], ["FFSP", 1, 0, [3, 2, 1], 1, 1], ["AN", 1, 1, 6], ["PR", 4, 0, "auto_unroll_max_step$1024"]]]], "r": [[1.6044e-05], 0, 6.63027, 1692178351], "v": "v0.6"}
{"i": [["[\"matmul\", 19, 38, 38, 3, \"float32\"]", "cuda -keys=cuda,gpu -arch=sm_75 -max_num_threads=1024 -thread_warp_size=32", [-1, 16, 64, 49152, 2147483647, 1024, 8, 32], "", 0, []], [[], [["CHW", 2, "local"], ["SP", 2, 0, 19, [1, 19, 1, 1], 1], ["SP", 2, 5, 38, [1, 2, 1, 19], 1], ["SP", 2, 10, 3, [1, 1, 3, 1], 1], ["SP", 2, 15, 38, [1, 1], 1], ["RE", 2, [0, 5, 10, 1, 6, 11, 2, 7, 12, 15, 16, 3, 8, 13, 17, 4, 9, 14]], ["FSP", 3, 0, 1, 3], ["FSP", 3, 4, 2, 3], ["FSP", 3, 8, 3, 3], ["RE", 3, [0, 4, 8, 1, 5, 9, 2, 6, 10, 3, 7, 11]], ["CA", 2, 3, 8], ["CHR", 1, "shared", [2]], ["CA", 2, 3, 9], ["CHR", 0, "shared", [3]], ["CA", 1, 4, 9], ["FU", 5, [0, 1, 2]], ["AN", 5, 0, 5], ["FU", 5, [1, 2, 3]], ["AN", 5, 1, 4], ["FU", 5, [2, 3, 4]], ["AN", 5, 2, 6], ["FU", 3, [0, 1, 2]], ["SP", 3, 0, 6, [1], 1], ["AN", 3, 1, 2], ["FFSP", 3, 0, [3, 2, 1], 1, 1], ["AN", 3, 1, 6], ["FU", 1, [0, 1, 2]], ["SP", 1, 0, 38, [1], 1], ["AN", 1, 1, 2], ["FFSP", 1, 0, [3, 2, 1], 1, 1], ["AN", 1, 1, 6], ["PR", 4, 0, "auto_unroll_max_step$64"]]]], "r": [[3.14333e-05], 0, 0.630044, 1692178351], "v": "v0.6"}
{"i": [["[\"matmul\", 19, 38, 38, 3, \"float32\"]", "cuda -keys=cuda,gpu -arch=sm_75 -max_num_threads=1024 -thread_warp_size=32", [-1, 16, 64, 49152, 2147483647, 1024, 8, 32], "", 0, []], [[], [["CHW", 2, "local"], ["SP", 2, 0, 19, [1, 19, 1, 1], 1], ["SP", 2, 5, 38, [1, 19, 2, 1], 1], ["SP", 2, 10, 3, [1, 1, 1, 1], 1], ["SP", 2, 15, 38, [1, 1], 1], ["RE", 2, [0, 5, 10, 1, 6, 11, 2, 7, 12, 15, 16, 3, 8, 13, 17, 4, 9, 14]], ["FSP", 3, 0, 1, 3], ["FSP", 3, 4, 2, 3], ["FSP", 3, 8, 3, 3], ["RE", 3, [0, 4, 8, 1, 5, 9, 2, 6, 10, 3, 7, 11]], ["CA", 2, 3, 8], ["CHR", 1, "shared", [2]], ["CA", 2, 3, 9], ["CHR", 0, "shared", [3]], ["CA", 1, 4, 9], ["FU", 5, [0, 1, 2]], ["AN", 5, 0, 5], ["FU", 5, [1, 2, 3]], ["AN", 5, 1, 4], ["FU", 5, [2, 3, 4]], ["AN", 5, 2, 6], ["FU", 3, [0, 1, 2]], ["SP", 3, 0, 1, [1], 1], ["AN", 3, 1, 2], ["FFSP", 3, 0, [3, 2, 1], 1, 1], ["AN", 3, 1, 6], ["FU", 1, [0, 1, 2]], ["SP", 1, 0, 2, [2], 1], ["AN", 1, 1, 2], ["FFSP", 1, 0, [3, 2, 1], 1, 1], ["AN", 1, 1, 6], ["PR", 4, 0, "auto_unroll_max_step$1024"]]]], "r": [[1.63643e-05], 0, 0.684522, 1692178351], "v": "v0.6"}
{"i": [["[\"matmul\", 19, 38, 38, 3, \"float32\"]", "cuda -keys=cuda,gpu -arch=sm_75 -max_num_threads=1024 -thread_warp_size=32", [-1, 16, 64, 49152, 2147483647, 1024, 8, 32], "", 0, []], [[], [["CHW", 2, "local"], ["SP", 2, 0, 19, [1, 19, 1, 1], 1], ["SP", 2, 5, 38, [1, 38, 1, 1], 1], ["SP", 2, 10, 3, [3, 1, 1, 1], 1], ["SP", 2, 15, 38, [1, 1], 1], ["RE", 2, [0, 5, 10, 1, 6, 11, 2, 7, 12, 15, 16, 3, 8, 13, 17, 4, 9, 14]], ["FSP", 3, 0, 1, 3], ["FSP", 3, 4, 2, 3], ["FSP", 3, 8, 3, 3], ["RE", 3, [0, 4, 8, 1, 5, 9, 2, 6, 10, 3, 7, 11]], ["CA", 2, 3, 8], ["CHR", 1, "shared", [2]], ["CA", 2, 3, 9], ["CHR", 0, "shared", [3]], ["CA", 1, 4, 9], ["FU", 5, [0, 1, 2]], ["AN", 5, 0, 5], ["FU", 5, [1, 2, 3]], ["AN", 5, 1, 4], ["FU", 5, [2, 3, 4]], ["AN", 5, 2, 6], ["FU", 3, [0, 1, 2]], ["SP", 3, 0, 2, [1], 1], ["AN", 3, 1, 2], ["FFSP", 3, 0, [3, 2, 1], 1, 1], ["AN", 3, 1, 6], ["FU", 1, [0, 1, 2]], ["SP", 1, 0, 2, [1], 1], ["AN", 1, 1, 2], ["FFSP", 1, 0, [3, 2, 1], 1, 1], ["AN", 1, 1, 6], ["PR", 4, 0, "auto_unroll_max_step$64"]]]], "r": [[1.9445e-05], 0, 0.551857, 1692178352], "v": "v0.6"}
{"i": [["[\"matmul\", 19, 38, 38, 3, \"float32\"]", "cuda -keys=cuda,gpu -arch=sm_75 -max_num_threads=1024 -thread_warp_size=32", [-1, 16, 64, 49152, 2147483647, 1024, 8, 32], "", 0, []], [[], [["CHW", 2, "local"], ["SP", 2, 0, 19, [1, 19, 1, 1], 1], ["SP", 2, 5, 38, [1, 2, 1, 19], 1], ["SP", 2, 10, 3, [1, 1, 1, 1], 1], ["SP", 2, 15, 38, [1, 1], 1], ["RE", 2, [0, 5, 10, 1, 6, 11, 2, 7, 12, 15, 16, 3, 8, 13, 17, 4, 9, 14]], ["FSP", 3, 0, 1, 3], ["FSP", 3, 4, 2, 3], ["FSP", 3, 8, 3, 3], ["RE", 3, [0, 4, 8, 1, 5, 9, 2, 6, 10, 3, 7, 11]], ["CA", 2, 3, 8], ["CHR", 1, "shared", [2]], ["CA", 2, 3, 9], ["CHR", 0, "shared", [3]], ["CA", 1, 4, 9], ["FU", 5, [0, 1, 2]], ["AN", 5, 0, 5], ["FU", 5, [1, 2, 3]], ["AN", 5, 1, 4], ["FU", 5, [2, 3, 4]], ["AN", 5, 2, 6], ["FU", 3, [0, 1, 2]], ["SP", 3, 0, 3, [1], 1], ["AN", 3, 1, 2], ["FFSP", 3, 0, [3, 2, 1], 1, 1], ["AN", 3, 1, 6], ["FU", 1, [0, 1, 2]], ["SP", 1, 0, 19, [1], 1], ["AN", 1, 1, 2], ["FFSP", 1, 0, [3, 2, 1], 1, 1], ["AN", 1, 1, 6], ["PR", 4, 0, "auto_unroll_max_step$1024"]]]], "r": [[2.64619e-05], 0, 0.603591, 1692178352], "v": "v0.6"}
{"i": [["[\"matmul\", 19, 38, 38, 3, \"float32\"]", "cuda -keys=cuda,gpu -arch=sm_75 -max_num_threads=1024 -thread_warp_size=32", [-1, 16, 64, 49152, 2147483647, 1024, 8, 32], "", 0, []], [[], [["CHW", 2, "local"], ["SP", 2, 0, 19, [1, 1, 1, 1], 1], ["SP", 2, 5, 38, [1, 38, 1, 1], 1], ["SP", 2, 10, 3, [1, 1, 3, 1], 1], ["SP", 2, 15, 38, [2, 1], 1], ["RE", 2, [0, 5, 10, 1, 6, 11, 2, 7, 12, 15, 16, 3, 8, 13, 17, 4, 9, 14]], ["FSP", 3, 0, 1, 3], ["FSP", 3, 4, 2, 3], ["FSP", 3, 8, 3, 3], ["RE", 3, [0, 4, 8, 1, 5, 9, 2, 6, 10, 3, 7, 11]], ["CA", 2, 3, 8], ["CHR", 1, "shared", [2]], ["CA", 2, 3, 9], ["CHR", 0, "shared", [3]], ["CA", 1, 4, 9], ["FU", 5, [0, 1, 2]], ["AN", 5, 0, 5], ["FU", 5, [1, 2, 3]], ["AN", 5, 1, 4], ["FU", 5, [2, 3, 4]], ["AN", 5, 2, 6], ["FU", 3, [0, 1, 2]], ["SP", 3, 0, 2, [1], 1], ["AN", 3, 1, 2], ["FFSP", 3, 0, [3, 2, 1], 1, 1], ["AN", 3, 1, 6], ["FU", 1, [0, 1, 2]], ["SP", 1, 0, 2, [1], 1], ["AN", 1, 1, 2], ["FFSP", 1, 0, [3, 2, 1], 1, 1], ["AN", 1, 1, 6], ["PR", 4, 0, "auto_unroll_max_step$64"]]]], "r": [[3.16733e-06], 0, 0.526548, 1692178352], "v": "v0.6"}
{"i": [["[\"matmul\", 19, 38, 38, 3, \"float32\"]", "cuda -keys=cuda,gpu -arch=sm_75 -max_num_threads=1024 -thread_warp_size=32", [-1, 16, 64, 49152, 2147483647, 1024, 8, 32], "", 0, []], [[], [["CHW", 2, "local"], ["SP", 2, 0, 19, [1, 1, 19, 1], 1], ["SP", 2, 5, 38, [2, 1, 1, 1], 1], ["SP", 2, 10, 3, [3, 1, 1, 1], 1], ["SP", 2, 15, 38, [19, 1], 1], ["RE", 2, [0, 5, 10, 1, 6, 11, 2, 7, 12, 15, 16, 3, 8, 13, 17, 4, 9, 14]], ["FSP", 3, 0, 1, 3], ["FSP", 3, 4, 2, 3], ["FSP", 3, 8, 3, 3], ["RE", 3, [0, 4, 8, 1, 5, 9, 2, 6, 10, 3, 7, 11]], ["CA", 2, 3, 8], ["CHR", 1, "shared", [2]], ["CA", 2, 3, 9], ["CHR", 0, "shared", [3]], ["CA", 1, 4, 9], ["FU", 5, [0, 1, 2]], ["AN", 5, 0, 5], ["FU", 5, [1, 2, 3]], ["AN", 5, 1, 4], ["FU", 5, [2, 3, 4]], ["AN", 5, 2, 6], ["FU", 3, [0, 1, 2]], ["SP", 3, 0, 38, [1], 1], ["AN", 3, 1, 2], ["FFSP", 3, 0, [3, 2, 1], 1, 1], ["AN", 3, 1, 6], ["FU", 1, [0, 1, 2]], ["SP", 1, 0, 38, [1], 1], ["AN", 1, 1, 2], ["FFSP", 1, 0, [3, 2, 1], 1, 1], ["AN", 1, 1, 6], ["PR", 4, 0, "auto_unroll_max_step$64"]]]], "r": [[8.94597e-05], 0, 1.04572, 1692178353], "v": "v0.6"}
{"i": [["[\"matmul\", 19, 38, 38, 3, \"float32\"]", "cuda -keys=cuda,gpu -arch=sm_75 -max_num_threads=1024 -thread_warp_size=32", [-1, 16, 64, 49152, 2147483647, 1024, 8, 32], "", 0, []], [[], [["CHW", 2, "local"], ["SP", 2, 0, 19, [1, 19, 1, 1], 1], ["SP", 2, 5, 38, [1, 1, 38, 1], 1], ["SP", 2, 10, 3, [1, 1, 3, 1], 1], ["SP", 2, 15, 38, [1, 2], 1], ["RE", 2, [0, 5, 10, 1, 6, 11, 2, 7, 12, 15, 16, 3, 8, 13, 17, 4, 9, 14]], ["FSP", 3, 0, 1, 3], ["FSP", 3, 4, 2, 3], ["FSP", 3, 8, 3, 3], ["RE", 3, [0, 4, 8, 1, 5, 9, 2, 6, 10, 3, 7, 11]], ["CA", 2, 3, 8], ["CHR", 1, "shared", [2]], ["CA", 2, 3, 9], ["CHR", 0, "shared", [3]], ["CA", 1, 4, 9], ["FU", 5, [0, 1, 2]], ["AN", 5, 0, 5], ["FU", 5, [1, 2, 3]], ["AN", 5, 1, 4], ["FU", 5, [2, 3, 4]], ["AN", 5, 2, 6], ["FU", 3, [0, 1, 2]], ["SP", 3, 0, 2, [1], 1], ["AN", 3, 1, 2], ["FFSP", 3, 0, [3, 2, 1], 1, 1], ["AN", 3, 1, 6], ["FU", 1, [0, 1, 2]], ["SP", 1, 0, 4, [1], 1], ["AN", 1, 1, 2], ["FFSP", 1, 0, [3, 2, 1], 1, 1], ["AN", 1, 1, 6], ["PR", 4, 0, "auto_unroll_max_step$64"]]]], "r": [[2.79977e-05], 0, 0.680658, 1692178353], "v": "v0.6"}
{"i": [["[\"matmul\", 19, 38, 38, 3, \"float32\"]", "cuda -keys=cuda,gpu -arch=sm_75 -max_num_threads=1024 -thread_warp_size=32", [-1, 16, 64, 49152, 2147483647, 1024, 8, 32], "", 0, []], [[], [["CHW", 2, "local"], ["SP", 2, 0, 19, [1, 19, 1, 1], 1], ["SP", 2, 5, 38, [1, 19, 1, 2], 1], ["SP", 2, 10, 3, [1, 1, 3, 1], 1], ["SP", 2, 15, 38, [1, 1], 1], ["RE", 2, [0, 5, 10, 1, 6, 11, 2, 7, 12, 15, 16, 3, 8, 13, 17, 4, 9, 14]], ["FSP", 3, 0, 1, 3], ["FSP", 3, 4, 2, 3], ["FSP", 3, 8, 3, 3], ["RE", 3, [0, 4, 8, 1, 5, 9, 2, 6, 10, 3, 7, 11]], ["CA", 2, 3, 8], ["CHR", 1, "shared", [2]], ["CA", 2, 3, 9], ["CHR", 0, "shared", [3]], ["CA", 1, 4, 9], ["FU", 5, [0, 1, 2]], ["AN", 5, 0, 5], ["FU", 5, [1, 2, 3]], ["AN", 5, 1, 4], ["FU", 5, [2, 3, 4]], ["AN", 5, 2, 6], ["FU", 3, [0, 1, 2]], ["SP", 3, 0, 3, [1], 1], ["AN", 3, 1, 2], ["FFSP", 3, 0, [3, 2, 1], 1, 1], ["AN", 3, 1, 6], ["FU", 1, [0, 1, 2]], ["SP", 1, 0, 2, [1], 1], ["AN", 1, 1, 2], ["FFSP", 1, 0, [3, 2, 1], 1, 1], ["AN", 1, 1, 6], ["PR", 4, 0, "auto_unroll_max_step$1024"]]]], "r": [[1.69175e-05], 0, 0.775444, 1692178353], "v": "v0.6"}
{"i": [["[\"matmul\", 19, 38, 38, 3, \"float32\"]", "cuda -keys=cuda,gpu -arch=sm_75 -max_num_threads=1024 -thread_warp_size=32", [-1, 16, 64, 49152, 2147483647, 1024, 8, 32], "", 0, []], [[], [["CHW", 2, "local"], ["SP", 2, 0, 19, [1, 1, 1, 1], 1], ["SP", 2, 5, 38, [1, 38, 1, 1], 1], ["SP", 2, 10, 3, [3, 1, 1, 1], 1], ["SP", 2, 15, 38, [2, 19], 1], ["RE", 2, [0, 5, 10, 1, 6, 11, 2, 7, 12, 15, 16, 3, 8, 13, 17, 4, 9, 14]], ["FSP", 3, 0, 1, 3], ["FSP", 3, 4, 2, 3], ["FSP", 3, 8, 3, 3], ["RE", 3, [0, 4, 8, 1, 5, 9, 2, 6, 10, 3, 7, 11]], ["CA", 2, 3, 8], ["CHR", 1, "shared", [2]], ["CA", 2, 3, 9], ["CHR", 0, "shared", [3]], ["CA", 1, 4, 9], ["FU", 5, [0, 1, 2]], ["AN", 5, 0, 5], ["FU", 5, [1, 2, 3]], ["AN", 5, 1, 4], ["FU", 5, [2, 3, 4]], ["AN", 5, 2, 6], ["FU", 3, [0, 1, 2]], ["SP", 3, 0, 2, [1], 1], ["AN", 3, 1, 2], ["FFSP", 3, 0, [3, 2, 1], 1, 1], ["AN", 3, 1, 6], ["FU", 1, [0, 1, 2]], ["SP", 1, 0, 2, [1], 1], ["AN", 1, 1, 2], ["FFSP", 1, 0, [3, 2, 1], 1, 1], ["AN", 1, 1, 6], ["PR", 4, 0, "auto_unroll_max_step$64"]]]], "r": [[2.02263e-06], 0, 0.575182, 1692178353], "v": "v0.6"}
{"i": [["[\"matmul\", 19, 38, 38, 3, \"float32\"]", "cuda -keys=cuda,gpu -arch=sm_75 -max_num_threads=1024 -thread_warp_size=32", [-1, 16, 64, 49152, 2147483647, 1024, 8, 32], "", 0, []], [[], [["CHW", 2, "local"], ["SP", 2, 0, 19, [1, 1, 1, 1], 1], ["SP", 2, 5, 38, [2, 19, 1, 1], 1], ["SP", 2, 10, 3, [1, 3, 1, 1], 1], ["SP", 2, 15, 38, [2, 19], 1], ["RE", 2, [0, 5, 10, 1, 6, 11, 2, 7, 12, 15, 16, 3, 8, 13, 17, 4, 9, 14]], ["FSP", 3, 0, 1, 3], ["FSP", 3, 4, 2, 3], ["FSP", 3, 8, 3, 3], ["RE", 3, [0, 4, 8, 1, 5, 9, 2, 6, 10, 3, 7, 11]], ["CA", 2, 3, 8], ["CHR", 1, "shared", [2]], ["CA", 2, 3, 9], ["CHR", 0, "shared", [3]], ["CA", 1, 4, 9], ["FU", 5, [0, 1, 2]], ["AN", 5, 0, 5], ["FU", 5, [1, 2, 3]], ["AN", 5, 1, 4], ["FU", 5, [2, 3, 4]], ["AN", 5, 2, 6], ["FU", 3, [0, 1, 2]], ["SP", 3, 0, 38, [1], 1], ["AN", 3, 1, 2], ["FFSP", 3, 0, [3, 2, 1], 1, 1], ["AN", 3, 1, 6], ["FU", 1, [0, 1, 2]], ["SP", 1, 0, 38, [2], 1], ["AN", 1, 1, 2], ["FFSP", 1, 0, [3, 2, 1], 1, 1], ["AN", 1, 1, 6], ["PR", 4, 0, "auto_unroll_max_step$16"]]]], "r": [[1.92479e-06], 0, 0.501848, 1692178354], "v": "v0.6"}
{"i": [["[\"matmul\", 19, 38, 38, 3, \"float32\"]", "cuda -keys=cuda,gpu -arch=sm_75 -max_num_threads=1024 -thread_warp_size=32", [-1, 16, 64, 49152, 2147483647, 1024, 8, 32], "", 0, []], [[], [["CHW", 2, "local"], ["SP", 2, 0, 19, [1, 1, 1, 1], 1], ["SP", 2, 5, 38, [1, 19, 1, 1], 1], ["SP", 2, 10, 3, [1, 1, 1, 3], 1], ["SP", 2, 15, 38, [2, 19], 1], ["RE", 2, [0, 5, 10, 1, 6, 11, 2, 7, 12, 15, 16, 3, 8, 13, 17, 4, 9, 14]], ["FSP", 3, 0, 1, 3], ["FSP", 3, 4, 2, 3], ["FSP", 3, 8, 3, 3], ["RE", 3, [0, 4, 8, 1, 5, 9, 2, 6, 10, 3, 7, 11]], ["CA", 2, 3, 8], ["CHR", 1, "shared", [2]], ["CA", 2, 3, 9], ["CHR", 0, "shared", [3]], ["CA", 1, 4, 9], ["FU", 5, [0, 1, 2]], ["AN", 5, 0, 5], ["FU", 5, [1, 2, 3]], ["AN", 5, 1, 4], ["FU", 5, [2, 3, 4]], ["AN", 5, 2, 6], ["FU", 3, [0, 1, 2]], ["SP", 3, 0, 38, [1], 1], ["AN", 3, 1, 2], ["FFSP", 3, 0, [3, 2, 1], 1, 1], ["AN", 3, 1, 6], ["FU", 1, [0, 1, 2]], ["SP", 1, 0, 38, [1], 1], ["AN", 1, 1, 2], ["FFSP", 1, 0, [3, 2, 1], 1, 1], ["AN", 1, 1, 6], ["PR", 4, 0, "auto_unroll_max_step$16"]]]], "r": [[1.85583e-06], 0, 0.503656, 1692178354], "v": "v0.6"}
{"i": [["[\"matmul\", 19, 38, 38, 3, \"float32\"]", "cuda -keys=cuda,gpu -arch=sm_75 -max_num_threads=1024 -thread_warp_size=32", [-1, 16, 64, 49152, 2147483647, 1024, 8, 32], "", 0, []], [[], [["CHW", 2, "local"], ["SP", 2, 0, 19, [1, 1, 1, 1], 1], ["SP", 2, 5, 38, [1, 19, 1, 2], 1], ["SP", 2, 10, 3, [1, 3, 1, 1], 1], ["SP", 2, 15, 38, [1, 38], 1], ["RE", 2, [0, 5, 10, 1, 6, 11, 2, 7, 12, 15, 16, 3, 8, 13, 17, 4, 9, 14]], ["FSP", 3, 0, 1, 3], ["FSP", 3, 4, 2, 3], ["FSP", 3, 8, 3, 3], ["RE", 3, [0, 4, 8, 1, 5, 9, 2, 6, 10, 3, 7, 11]], ["CA", 2, 3, 8], ["CHR", 1, "shared", [2]], ["CA", 2, 3, 9], ["CHR", 0, "shared", [3]], ["CA", 1, 4, 9], ["FU", 5, [0, 1, 2]], ["AN", 5, 0, 5], ["FU", 5, [1, 2, 3]], ["AN", 5, 1, 4], ["FU", 5, [2, 3, 4]], ["AN", 5, 2, 6], ["FU", 3, [0, 1, 2]], ["SP", 3, 0, 38, [38], 1], ["AN", 3, 1, 2], ["FFSP", 3, 0, [3, 2, 1], 1, 1], ["AN", 3, 1, 6], ["FU", 1, [0, 1, 2]], ["SP", 1, 0, 76, [1], 1], ["AN", 1, 1, 2], ["FFSP", 1, 0, [3, 2, 1], 1, 1], ["AN", 1, 1, 6], ["PR", 4, 0, "auto_unroll_max_step$64"]]]], "r": [[2.08498e-06], 0, 0.553611, 1692178354], "v": "v0.6"}
{"i": [["[\"matmul\", 19, 38, 38, 3, \"float32\"]", "cuda -keys=cuda,gpu -arch=sm_75 -max_num_threads=1024 -thread_warp_size=32", [-1, 16, 64, 49152, 2147483647, 1024, 8, 32], "", 0, []], [[], [["CHW", 2, "local"], ["SP", 2, 0, 19, [1, 1, 1, 1], 1], ["SP", 2, 5, 38, [1, 38, 1, 1], 1], ["SP", 2, 10, 3, [3, 1, 1, 1], 1], ["SP", 2, 15, 38, [1, 1], 1], ["RE", 2, [0, 5, 10, 1, 6, 11, 2, 7, 12, 15, 16, 3, 8, 13, 17, 4, 9, 14]], ["FSP", 3, 0, 1, 3], ["FSP", 3, 4, 2, 3], ["FSP", 3, 8, 3, 3], ["RE", 3, [0, 4, 8, 1, 5, 9, 2, 6, 10, 3, 7, 11]], ["CA", 2, 3, 8], ["CHR", 1, "shared", [2]], ["CA", 2, 3, 9], ["CHR", 0, "shared", [3]], ["CA", 1, 4, 9], ["FU", 5, [0, 1, 2]], ["AN", 5, 0, 5], ["FU", 5, [1, 2, 3]], ["AN", 5, 1, 4], ["FU", 5, [2, 3, 4]], ["AN", 5, 2, 6], ["FU", 3, [0, 1, 2]], ["SP", 3, 0, 1, [1], 1], ["AN", 3, 1, 2], ["FFSP", 3, 0, [3, 2, 1], 1, 1], ["AN", 3, 1, 6], ["FU", 1, [0, 1, 2]], ["SP", 1, 0, 1, [1], 1], ["AN", 1, 1, 2], ["FFSP", 1, 0, [3, 2, 1], 1, 1], ["AN", 1, 1, 6], ["PR", 4, 0, "auto_unroll_max_step$16"]]]], "r": [[3.18686e-06], 0, 0.510178, 1692178354], "v": "v0.6"}
{"i": [["[\"matmul\", 19, 38, 38, 3, \"float32\"]", "cuda -keys=cuda,gpu -arch=sm_75 -max_num_threads=1024 -thread_warp_size=32", [-1, 16, 64, 49152, 2147483647, 1024, 8, 32], "", 0, []], [[], [["CHW", 2, "local"], ["SP", 2, 0, 19, [1, 1, 1, 1], 1], ["SP", 2, 5, 38, [1, 38, 1, 1], 1], ["SP", 2, 10, 3, [1, 1, 1, 1], 1], ["SP", 2, 15, 38, [2, 1], 1], ["RE", 2, [0, 5, 10, 1, 6, 11, 2, 7, 12, 15, 16, 3, 8, 13, 17, 4, 9, 14]], ["FSP", 3, 0, 1, 3], ["FSP", 3, 4, 2, 3], ["FSP", 3, 8, 3, 3], ["RE", 3, [0, 4, 8, 1, 5, 9, 2, 6, 10, 3, 7, 11]], ["CA", 2, 3, 8], ["CHR", 1, "shared", [2]], ["CA", 2, 3, 9], ["CHR", 0, "shared", [3]], ["CA", 1, 4, 9], ["FU", 5, [0, 1, 2]], ["AN", 5, 0, 5], ["FU", 5, [1, 2, 3]], ["AN", 5, 1, 4], ["FU", 5, [2, 3, 4]], ["AN", 5, 2, 6], ["FU", 3, [0, 1, 2]], ["SP", 3, 0, 2, [1], 1], ["AN", 3, 1, 2], ["FFSP", 3, 0, [3, 2, 1], 1, 1], ["AN", 3, 1, 6], ["FU", 1, [0, 1, 2]], ["SP", 1, 0, 2, [1], 1], ["AN", 1, 1, 2], ["FFSP", 1, 0, [3, 2, 1], 1, 1], ["AN", 1, 1, 6], ["PR", 4, 0, "auto_unroll_max_step$0"]]]], "r": [[3.82831e-06], 0, 0.487493, 1692178354], "v": "v0.6"}
{"i": [["[\"matmul\", 19, 38, 38, 3, \"float32\"]", "cuda -keys=cuda,gpu -arch=sm_75 -max_num_threads=1024 -thread_warp_size=32", [-1, 16, 64, 49152, 2147483647, 1024, 8, 32], "", 0, []], [[], [["CHW", 2, "local"], ["SP", 2, 0, 19, [1, 1, 1, 1], 1], ["SP", 2, 5, 38, [1, 19, 1, 1], 1], ["SP", 2, 10, 3, [1, 1, 1, 1], 1], ["SP", 2, 15, 38, [1, 2], 1], ["RE", 2, [0, 5, 10, 1, 6, 11, 2, 7, 12, 15, 16, 3, 8, 13, 17, 4, 9, 14]], ["FSP", 3, 0, 1, 3], ["FSP", 3, 4, 2, 3], ["FSP", 3, 8, 3, 3], ["RE", 3, [0, 4, 8, 1, 5, 9, 2, 6, 10, 3, 7, 11]], ["CA", 2, 3, 8], ["CHR", 1, "shared", [2]], ["CA", 2, 3, 9], ["CHR", 0, "shared", [3]], ["CA", 1, 4, 9], ["FU", 5, [0, 1, 2]], ["AN", 5, 0, 5], ["FU", 5, [1, 2, 3]], ["AN", 5, 1, 4], ["FU", 5, [2, 3, 4]], ["AN", 5, 2, 6], ["FU", 3, [0, 1, 2]], ["SP", 3, 0, 1, [1], 1], ["AN", 3, 1, 2], ["FFSP", 3, 0, [3, 2, 1], 1, 1], ["AN", 3, 1, 6], ["FU", 1, [0, 1, 2]], ["SP", 1, 0, 1, [1], 1], ["AN", 1, 1, 2], ["FFSP", 1, 0, [3, 2, 1], 1, 1], ["AN", 1, 1, 6], ["PR", 4, 0, "auto_unroll_max_step$1024"]]]], "r": [[4.9061e-06], 0, 0.656718, 1692178358], "v": "v0.6"}
{"i": [["[\"matmul\", 19, 38, 38, 3, \"float32\"]", "cuda -keys=cuda,gpu -arch=sm_75 -max_num_threads=1024 -thread_warp_size=32", [-1, 16, 64, 49152, 2147483647, 1024, 8, 32], "", 0, []], [[], [["CHW", 2, "local"], ["SP", 2, 0, 19, [1, 19, 1, 1], 1], ["SP", 2, 5, 38, [1, 1, 38, 1], 1], ["SP", 2, 10, 3, [1, 1, 1, 3], 1], ["SP", 2, 15, 38, [1, 1], 1], ["RE", 2, [0, 5, 10, 1, 6, 11, 2, 7, 12, 15, 16, 3, 8, 13, 17, 4, 9, 14]], ["FSP", 3, 0, 1, 3], ["FSP", 3, 4, 2, 3], ["FSP", 3, 8, 3, 3], ["RE", 3, [0, 4, 8, 1, 5, 9, 2, 6, 10, 3, 7, 11]], ["CA", 2, 3, 8], ["CHR", 1, "shared", [2]], ["CA", 2, 3, 9], ["CHR", 0, "shared", [3]], ["CA", 1, 4, 9], ["FU", 5, [0, 1, 2]], ["AN", 5, 0, 5], ["FU", 5, [1, 2, 3]], ["AN", 5, 1, 4], ["FU", 5, [2, 3, 4]], ["AN", 5, 2, 6], ["FU", 3, [0, 1, 2]], ["SP", 3, 0, 3, [1], 1], ["AN", 3, 1, 2], ["FFSP", 3, 0, [3, 2, 1], 1, 1], ["AN", 3, 1, 6], ["FU", 1, [0, 1, 2]], ["SP", 1, 0, 1, [1], 1], ["AN", 1, 1, 2], ["FFSP", 1, 0, [3, 2, 1], 1, 1], ["AN", 1, 1, 6], ["PR", 4, 0, "auto_unroll_max_step$1024"]]]], "r": [[3.37808e-05], 0, 0.655719, 1692178358], "v": "v0.6"}
{"i": [["[\"matmul\", 19, 38, 38, 3, \"float32\"]", "cuda -keys=cuda,gpu -arch=sm_75 -max_num_threads=1024 -thread_warp_size=32", [-1, 16, 64, 49152, 2147483647, 1024, 8, 32], "", 0, []], [[], [["CHW", 2, "local"], ["SP", 2, 0, 19, [1, 19, 1, 1], 1], ["SP", 2, 5, 38, [1, 1, 19, 1], 1], ["SP", 2, 10, 3, [1, 1, 1, 3], 1], ["SP", 2, 15, 38, [1, 2], 1], ["RE", 2, [0, 5, 10, 1, 6, 11, 2, 7, 12, 15, 16, 3, 8, 13, 17, 4, 9, 14]], ["FSP", 3, 0, 1, 3], ["FSP", 3, 4, 2, 3], ["FSP", 3, 8, 3, 3], ["RE", 3, [0, 4, 8, 1, 5, 9, 2, 6, 10, 3, 7, 11]], ["CA", 2, 3, 8], ["CHR", 1, "shared", [2]], ["CA", 2, 3, 9], ["CHR", 0, "shared", [3]], ["CA", 1, 4, 9], ["FU", 5, [0, 1, 2]], ["AN", 5, 0, 5], ["FU", 5, [1, 2, 3]], ["AN", 5, 1, 4], ["FU", 5, [2, 3, 4]], ["AN", 5, 2, 6], ["FU", 3, [0, 1, 2]], ["SP", 3, 0, 2, [1], 1], ["AN", 3, 1, 2], ["FFSP", 3, 0, [3, 2, 1], 1, 1], ["AN", 3, 1, 6], ["FU", 1, [0, 1, 2]], ["SP", 1, 0, 38, [1], 1], ["AN", 1, 1, 2], ["FFSP", 1, 0, [3, 2, 1], 1, 1], ["AN", 1, 1, 6], ["PR", 4, 0, "auto_unroll_max_step$16"]]]], "r": [[1.30046e-05], 0, 0.623199, 1692178359], "v": "v0.6"}
{"i": [["[\"matmul\", 19, 38, 38, 3, \"float32\"]", "cuda -keys=cuda,gpu -arch=sm_75 -max_num_threads=1024 -thread_warp_size=32", [-1, 16, 64, 49152, 2147483647, 1024, 8, 32], "", 0, []], [[], [["CHW", 2, "local"], ["SP", 2, 0, 19, [1, 19, 1, 1], 1], ["SP", 2, 5, 38, [1, 1, 19, 2], 1], ["SP", 2, 10, 3, [1, 3, 1, 1], 1], ["SP", 2, 15, 38, [2, 1], 1], ["RE", 2, [0, 5, 10, 1, 6, 11, 2, 7, 12, 15, 16, 3, 8, 13, 17, 4, 9, 14]], ["FSP", 3, 0, 1, 3], ["FSP", 3, 4, 2, 3], ["FSP", 3, 8, 3, 3], ["RE", 3, [0, 4, 8, 1, 5, 9, 2, 6, 10, 3, 7, 11]], ["CA", 2, 3, 8], ["CHR", 1, "shared", [2]], ["CA", 2, 3, 9], ["CHR", 0, "shared", [3]], ["CA", 1, 4, 9], ["FU", 5, [0, 1, 2]], ["AN", 5, 0, 5], ["FU", 5, [1, 2, 3]], ["AN", 5, 1, 4], ["FU", 5, [2, 3, 4]], ["AN", 5, 2, 6], ["FU", 3, [0, 1, 2]], ["SP", 3, 0, 2, [2], 1], ["AN", 3, 1, 2], ["FFSP", 3, 0, [3, 2, 1], 1, 1], ["AN", 3, 1, 6], ["FU", 1, [0, 1, 2]], ["SP", 1, 0, 76, [4], 1], ["AN", 1, 1, 2], ["FFSP", 1, 0, [3, 2, 1], 1, 1], ["AN", 1, 1, 6], ["PR", 4, 0, "auto_unroll_max_step$0"]]]], "r": [[1.96937e-05], 0, 0.603502, 1692178359], "v": "v0.6"}
{"i": [["[\"matmul\", 19, 38, 38, 3, \"float32\"]", "cuda -keys=cuda,gpu -arch=sm_75 -max_num_threads=1024 -thread_warp_size=32", [-1, 16, 64, 49152, 2147483647, 1024, 8, 32], "", 0, []], [[], [["CHW", 2, "local"], ["SP", 2, 0, 19, [1, 1, 19, 1], 1], ["SP", 2, 5, 38, [1, 38, 1, 1], 1], ["SP", 2, 10, 3, [1, 3, 1, 1], 1], ["SP", 2, 15, 38, [1, 2], 1], ["RE", 2, [0, 5, 10, 1, 6, 11, 2, 7, 12, 15, 16, 3, 8, 13, 17, 4, 9, 14]], ["FSP", 3, 0, 1, 3], ["FSP", 3, 4, 2, 3], ["FSP", 3, 8, 3, 3], ["RE", 3, [0, 4, 8, 1, 5, 9, 2, 6, 10, 3, 7, 11]], ["CA", 2, 3, 8], ["CHR", 1, "shared", [2]], ["CA", 2, 3, 9], ["CHR", 0, "shared", [3]], ["CA", 1, 4, 9], ["FU", 5, [0, 1, 2]], ["AN", 5, 0, 5], ["FU", 5, [1, 2, 3]], ["AN", 5, 1, 4], ["FU", 5, [2, 3, 4]], ["AN", 5, 2, 6], ["FU", 3, [0, 1, 2]], ["SP", 3, 0, 2, [1], 1], ["AN", 3, 1, 2], ["FFSP", 3, 0, [3, 2, 1], 1, 1], ["AN", 3, 1, 6], ["FU", 1, [0, 1, 2]], ["SP", 1, 0, 2, [1], 1], ["AN", 1, 1, 2], ["FFSP", 1, 0, [3, 2, 1], 1, 1], ["AN", 1, 1, 6], ["PR", 4, 0, "auto_unroll_max_step$1024"]]]], "r": [[1.46572e-05], 0, 1.65016, 1692178359], "v": "v0.6"}
{"i": [["[\"matmul\", 19, 38, 38, 3, \"float32\"]", "cuda -keys=cuda,gpu -arch=sm_75 -max_num_threads=1024 -thread_warp_size=32", [-1, 16, 64, 49152, 2147483647, 1024, 8, 32], "", 0, []], [[], [["CHW", 2, "local"], ["SP", 2, 0, 19, [1, 1, 1, 1], 1], ["SP", 2, 5, 38, [1, 38, 1, 1], 1], ["SP", 2, 10, 3, [1, 1, 1, 3], 1], ["SP", 2, 15, 38, [1, 38], 1], ["RE", 2, [0, 5, 10, 1, 6, 11, 2, 7, 12, 15, 16, 3, 8, 13, 17, 4, 9, 14]], ["FSP", 3, 0, 1, 3], ["FSP", 3, 4, 2, 3], ["FSP", 3, 8, 3, 3], ["RE", 3, [0, 4, 8, 1, 5, 9, 2, 6, 10, 3, 7, 11]], ["CA", 2, 3, 8], ["CHR", 1, "shared", [2]], ["CA", 2, 3, 9], ["CHR", 0, "shared", [3]], ["CA", 1, 4, 9], ["FU", 5, [0, 1, 2]], ["AN", 5, 0, 5], ["FU", 5, [1, 2, 3]], ["AN", 5, 1, 4], ["FU", 5, [2, 3, 4]], ["AN", 5, 2, 6], ["FU", 3, [0, 1, 2]], ["SP", 3, 0, 114, [1], 1], ["AN", 3, 1, 2], ["FFSP", 3, 0, [3, 2, 1], 1, 1], ["AN", 3, 1, 6], ["FU", 1, [0, 1, 2]], ["SP", 1, 0, 38, [1], 1], ["AN", 1, 1, 2], ["FFSP", 1, 0, [3, 2, 1], 1, 1], ["AN", 1, 1, 6], ["PR", 4, 0, "auto_unroll_max_step$512"]]]], "r": [[1.75802e-06], 0, 0.579589, 1692178359], "v": "v0.6"}
{"i": [["[\"matmul\", 19, 38, 38, 3, \"float32\"]", "cuda -keys=cuda,gpu -arch=sm_75 -max_num_threads=1024 -thread_warp_size=32", [-1, 16, 64, 49152, 2147483647, 1024, 8, 32], "", 0, []], [[], [["CHW", 2, "local"], ["SP", 2, 0, 19, [1, 19, 1, 1], 1], ["SP", 2, 5, 38, [1, 2, 1, 19], 1], ["SP", 2, 10, 3, [1, 1, 1, 1], 1], ["SP", 2, 15, 38, [2, 1], 1], ["RE", 2, [0, 5, 10, 1, 6, 11, 2, 7, 12, 15, 16, 3, 8, 13, 17, 4, 9, 14]], ["FSP", 3, 0, 1, 3], ["FSP", 3, 4, 2, 3], ["FSP", 3, 8, 3, 3], ["RE", 3, [0, 4, 8, 1, 5, 9, 2, 6, 10, 3, 7, 11]], ["CA", 2, 3, 8], ["CHR", 1, "shared", [2]], ["CA", 2, 3, 9], ["CHR", 0, "shared", [3]], ["CA", 1, 4, 9], ["FU", 5, [0, 1, 2]], ["AN", 5, 0, 5], ["FU", 5, [1, 2, 3]], ["AN", 5, 1, 4], ["FU", 5, [2, 3, 4]], ["AN", 5, 2, 6], ["FU", 3, [0, 1, 2]], ["SP", 3, 0, 3, [1], 1], ["AN", 3, 1, 2], ["FFSP", 3, 0, [3, 2, 1], 1, 1], ["AN", 3, 1, 6], ["FU", 1, [0, 1, 2]], ["SP", 1, 0, 19, [1], 1], ["AN", 1, 1, 2], ["FFSP", 1, 0, [3, 2, 1], 1, 1], ["AN", 1, 1, 6], ["PR", 4, 0, "auto_unroll_max_step$64"]]]], "r": [[1.53856e-05], 0, 0.606668, 1692178360], "v": "v0.6"}
{"i": [["[\"matmul\", 19, 38, 38, 3, \"float32\"]", "cuda -keys=cuda,gpu -arch=sm_75 -max_num_threads=1024 -thread_warp_size=32", [-1, 16, 64, 49152, 2147483647, 1024, 8, 32], "", 0, []], [[], [["CHW", 2, "local"], ["SP", 2, 0, 19, [1, 1, 1, 1], 1], ["SP", 2, 5, 38, [1, 19, 1, 2], 1], ["SP", 2, 10, 3, [3, 1, 1, 1], 1], ["SP", 2, 15, 38, [2, 1], 1], ["RE", 2, [0, 5, 10, 1, 6, 11, 2, 7, 12, 15, 16, 3, 8, 13, 17, 4, 9, 14]], ["FSP", 3, 0, 1, 3], ["FSP", 3, 4, 2, 3], ["FSP", 3, 8, 3, 3], ["RE", 3, [0, 4, 8, 1, 5, 9, 2, 6, 10, 3, 7, 11]], ["CA", 2, 3, 8], ["CHR", 1, "shared", [2]], ["CA", 2, 3, 9], ["CHR", 0, "shared", [3]], ["CA", 1, 4, 9], ["FU", 5, [0, 1, 2]], ["AN", 5, 0, 5], ["FU", 5, [1, 2, 3]], ["AN", 5, 1, 4], ["FU", 5, [2, 3, 4]], ["AN", 5, 2, 6], ["FU", 3, [0, 1, 2]], ["SP", 3, 0, 2, [1], 1], ["AN", 3, 1, 2], ["FFSP", 3, 0, [3, 2, 1], 1, 1], ["AN", 3, 1, 6], ["FU", 1, [0, 1, 2]], ["SP", 1, 0, 2, [2], 1], ["AN", 1, 1, 2], ["FFSP", 1, 0, [3, 2, 1], 1, 1], ["AN", 1, 1, 6], ["PR", 4, 0, "auto_unroll_max_step$512"]]]], "r": [[2.49685e-06], 0, 0.636723, 1692178360], "v": "v0.6"}
{"i": [["[\"matmul\", 19, 38, 38, 3, \"float32\"]", "cuda -keys=cuda,gpu -arch=sm_75 -max_num_threads=1024 -thread_warp_size=32", [-1, 16, 64, 49152, 2147483647, 1024, 8, 32], "", 0, []], [[], [["CHW", 2, "local"], ["SP", 2, 0, 19, [1, 1, 1, 19], 1], ["SP", 2, 5, 38, [1, 19, 1, 1], 1], ["SP", 2, 10, 3, [3, 1, 1, 1], 1], ["SP", 2, 15, 38, [19, 1], 1], ["RE", 2, [0, 5, 10, 1, 6, 11, 2, 7, 12, 15, 16, 3, 8, 13, 17, 4, 9, 14]], ["FSP", 3, 0, 1, 3], ["FSP", 3, 4, 2, 3], ["FSP", 3, 8, 3, 3], ["RE", 3, [0, 4, 8, 1, 5, 9, 2, 6, 10, 3, 7, 11]], ["CA", 2, 3, 8], ["CHR", 1, "shared", [2]], ["CA", 2, 3, 9], ["CHR", 0, "shared", [3]], ["CA", 1, 4, 9], ["FU", 5, [0, 1, 2]], ["AN", 5, 0, 5], ["FU", 5, [1, 2, 3]], ["AN", 5, 1, 4], ["FU", 5, [2, 3, 4]], ["AN", 5, 2, 6], ["FU", 3, [0, 1, 2]], ["SP", 3, 0, 361, [1], 1], ["AN", 3, 1, 2], ["FFSP", 3, 0, [3, 2, 1], 1, 1], ["AN", 3, 1, 6], ["FU", 1, [0, 1, 2]], ["SP", 1, 0, 361, [1], 1], ["AN", 1, 1, 2], ["FFSP", 1, 0, [3, 2, 1], 1, 1], ["AN", 1, 1, 6], ["PR", 4, 0, "auto_unroll_max_step$64"]]]], "r": [[1.897e-05], 0, 0.816542, 1692178360], "v": "v0.6"}
{"i": [["[\"matmul\", 19, 38, 38, 3, \"float32\"]", "cuda -keys=cuda,gpu -arch=sm_75 -max_num_threads=1024 -thread_warp_size=32", [-1, 16, 64, 49152, 2147483647, 1024, 8, 32], "", 0, []], [[], [["CHW", 2, "local"], ["SP", 2, 0, 19, [1, 1, 1, 1], 1], ["SP", 2, 5, 38, [2, 19, 1, 1], 1], ["SP", 2, 10, 3, [1, 3, 1, 1], 1], ["SP", 2, 15, 38, [19, 2], 1], ["RE", 2, [0, 5, 10, 1, 6, 11, 2, 7, 12, 15, 16, 3, 8, 13, 17, 4, 9, 14]], ["FSP", 3, 0, 1, 3], ["FSP", 3, 4, 2, 3], ["FSP", 3, 8, 3, 3], ["RE", 3, [0, 4, 8, 1, 5, 9, 2, 6, 10, 3, 7, 11]], ["CA", 2, 3, 8], ["CHR", 1, "shared", [2]], ["CA", 2, 3, 9], ["CHR", 0, "shared", [3]], ["CA", 1, 4, 9], ["FU", 5, [0, 1, 2]], ["AN", 5, 0, 5], ["FU", 5, [1, 2, 3]], ["AN", 5, 1, 4], ["FU", 5, [2, 3, 4]], ["AN", 5, 2, 6], ["FU", 3, [0, 1, 2]], ["SP", 3, 0, 38, [2], 1], ["AN", 3, 1, 2], ["FFSP", 3, 0, [3, 2, 1], 1, 1], ["AN", 3, 1, 6], ["FU", 1, [0, 1, 2]], ["SP", 1, 0, 38, [1], 1], ["AN", 1, 1, 2], ["FFSP", 1, 0, [3, 2, 1], 1, 1], ["AN", 1, 1, 6], ["PR", 4, 0, "auto_unroll_max_step$64"]]]], "r": [[1.83367e-06], 0, 0.578906, 1692178360], "v": "v0.6"}
