op-work/GPU_expr/Ansor_batch/D3/matmul_9_1_1_6.json
{"i": [["[\"matmul\", 9, 1, 1, 6, \"float32\"]", "cuda -keys=cuda,gpu -arch=sm_75 -max_num_threads=1024 -thread_warp_size=32", [-1, 16, 64, 49152, 2147483647, 1024, 8, 32], "", 0, []], [[], [["CHW", 2, "local"], ["SP", 2, 0, 9, [9, 1, 1, 1], 1], ["SP", 2, 5, 1, [1, 1, 1, 1], 1], ["SP", 2, 10, 6, [1, 2, 1, 3], 1], ["SP", 2, 15, 1, [1, 1], 1], ["RE", 2, [0, 5, 10, 1, 6, 11, 2, 7, 12, 15, 16, 3, 8, 13, 17, 4, 9, 14]], ["FSP", 3, 0, 1, 3], ["FSP", 3, 4, 2, 3], ["FSP", 3, 8, 3, 3], ["RE", 3, [0, 4, 8, 1, 5, 9, 2, 6, 10, 3, 7, 11]], ["CA", 2, 3, 8], ["CHR", 1, "shared", [2]], ["CA", 2, 3, 9], ["CHR", 0, "shared", [3]], ["CA", 1, 4, 9], ["FU", 5, [0, 1, 2]], ["AN", 5, 0, 5], ["FU", 5, [1, 2, 3]], ["AN", 5, 1, 4], ["FU", 5, [2, 3, 4]], ["AN", 5, 2, 6], ["FU", 3, [0, 1, 2]], ["SP", 3, 0, 3, [1], 1], ["AN", 3, 1, 2], ["FFSP", 3, 0, [3, 2, 1], 1, 1], ["AN", 3, 1, 6], ["FU", 1, [0, 1, 2]], ["SP", 1, 0, 1, [1], 1], ["AN", 1, 1, 2], ["FFSP", 1, 0, [3, 2, 1], 1, 1], ["AN", 1, 1, 6], ["PR", 4, 0, "auto_unroll_max_step$1024"]]]], "r": [[2.15921e-06], 0, 0.638479, 1691939107], "v": "v0.6"}
{"i": [["[\"matmul\", 9, 1, 1, 6, \"float32\"]", "cuda -keys=cuda,gpu -arch=sm_75 -max_num_threads=1024 -thread_warp_size=32", [-1, 16, 64, 49152, 2147483647, 1024, 8, 32], "", 0, []], [[], [["CHW", 2, "local"], ["SP", 2, 0, 9, [9, 1, 1, 1], 1], ["SP", 2, 5, 1, [1, 1, 1, 1], 1], ["SP", 2, 10, 6, [1, 1, 3, 2], 1], ["SP", 2, 15, 1, [1, 1], 1], ["RE", 2, [0, 5, 10, 1, 6, 11, 2, 7, 12, 15, 16, 3, 8, 13, 17, 4, 9, 14]], ["FSP", 3, 0, 1, 3], ["FSP", 3, 4, 2, 3], ["FSP", 3, 8, 3, 3], ["RE", 3, [0, 4, 8, 1, 5, 9, 2, 6, 10, 3, 7, 11]], ["CA", 2, 3, 8], ["CHR", 1, "shared", [2]], ["CA", 2, 3, 9], ["CHR", 0, "shared", [3]], ["CA", 1, 4, 9], ["FU", 5, [0, 1, 2]], ["AN", 5, 0, 5], ["FU", 5, [1, 2, 3]], ["AN", 5, 1, 4], ["FU", 5, [2, 3, 4]], ["AN", 5, 2, 6], ["FU", 3, [0, 1, 2]], ["SP", 3, 0, 6, [1], 1], ["AN", 3, 1, 2], ["FFSP", 3, 0, [3, 2, 1], 1, 1], ["AN", 3, 1, 6], ["FU", 1, [0, 1, 2]], ["SP", 1, 0, 1, [1], 1], ["AN", 1, 1, 2], ["FFSP", 1, 0, [3, 2, 1], 1, 1], ["AN", 1, 1, 6], ["PR", 4, 0, "auto_unroll_max_step$512"]]]], "r": [[1.74175e-06], 0, 0.55687, 1691939107], "v": "v0.6"}
{"i": [["[\"matmul\", 9, 1, 1, 6, \"float32\"]", "cuda -keys=cuda,gpu -arch=sm_75 -max_num_threads=1024 -thread_warp_size=32", [-1, 16, 64, 49152, 2147483647, 1024, 8, 32], "", 0, []], [[], [["CHW", 2, "local"], ["SP", 2, 0, 9, [1, 1, 9, 1], 1], ["SP", 2, 5, 1, [1, 1, 1, 1], 1], ["SP", 2, 10, 6, [1, 1, 1, 1], 1], ["SP", 2, 15, 1, [1, 1], 1], ["RE", 2, [0, 5, 10, 1, 6, 11, 2, 7, 12, 15, 16, 3, 8, 13, 17, 4, 9, 14]], ["FSP", 3, 0, 1, 3], ["FSP", 3, 4, 2, 3], ["FSP", 3, 8, 3, 3], ["RE", 3, [0, 4, 8, 1, 5, 9, 2, 6, 10, 3, 7, 11]], ["CA", 2, 3, 8], ["CHR", 1, "shared", [2]], ["CA", 2, 3, 9], ["CHR", 0, "shared", [3]], ["CA", 1, 4, 9], ["FU", 5, [0, 1, 2]], ["AN", 5, 0, 5], ["FU", 5, [1, 2, 3]], ["AN", 5, 1, 4], ["FU", 5, [2, 3, 4]], ["AN", 5, 2, 6], ["FU", 3, [0, 1, 2]], ["SP", 3, 0, 9, [1], 1], ["AN", 3, 1, 2], ["FFSP", 3, 0, [3, 2, 1], 1, 1], ["AN", 3, 1, 6], ["FU", 1, [0, 1, 2]], ["SP", 1, 0, 3, [3], 1], ["AN", 1, 1, 2], ["FFSP", 1, 0, [3, 2, 1], 1, 1], ["AN", 1, 1, 6], ["PR", 4, 0, "auto_unroll_max_step$512"]]]], "r": [[1.37777e-06], 0, 0.682958, 1691939108], "v": "v0.6"}
{"i": [["[\"matmul\", 9, 1, 1, 6, \"float32\"]", "cuda -keys=cuda,gpu -arch=sm_75 -max_num_threads=1024 -thread_warp_size=32", [-1, 16, 64, 49152, 2147483647, 1024, 8, 32], "", 0, []], [[], [["CHW", 2, "local"], ["SP", 2, 0, 9, [1, 1, 3, 3], 1], ["SP", 2, 5, 1, [1, 1, 1, 1], 1], ["SP", 2, 10, 6, [2, 1, 1, 1], 1], ["SP", 2, 15, 1, [1, 1], 1], ["RE", 2, [0, 5, 10, 1, 6, 11, 2, 7, 12, 15, 16, 3, 8, 13, 17, 4, 9, 14]], ["FSP", 3, 0, 1, 3], ["FSP", 3, 4, 2, 3], ["FSP", 3, 8, 3, 3], ["RE", 3, [0, 4, 8, 1, 5, 9, 2, 6, 10, 3, 7, 11]], ["CA", 2, 3, 8], ["CHR", 1, "shared", [2]], ["CA", 2, 3, 9], ["CHR", 0, "shared", [3]], ["CA", 1, 4, 9], ["FU", 5, [0, 1, 2]], ["AN", 5, 0, 5], ["FU", 5, [1, 2, 3]], ["AN", 5, 1, 4], ["FU", 5, [2, 3, 4]], ["AN", 5, 2, 6], ["FU", 3, [0, 1, 2]], ["SP", 3, 0, 9, [1], 1], ["AN", 3, 1, 2], ["FFSP", 3, 0, [3, 2, 1], 1, 1], ["AN", 3, 1, 6], ["FU", 1, [0, 1, 2]], ["SP", 1, 0, 9, [3], 1], ["AN", 1, 1, 2], ["FFSP", 1, 0, [3, 2, 1], 1, 1], ["AN", 1, 1, 6], ["PR", 4, 0, "auto_unroll_max_step$1024"]]]], "r": [[1.4085e-06], 0, 0.524476, 1691939108], "v": "v0.6"}
{"i": [["[\"matmul\", 9, 1, 1, 6, \"float32\"]", "cuda -keys=cuda,gpu -arch=sm_75 -max_num_threads=1024 -thread_warp_size=32", [-1, 16, 64, 49152, 2147483647, 1024, 8, 32], "", 0, []], [[], [["CHW", 2, "local"], ["SP", 2, 0, 9, [3, 1, 3, 1], 1], ["SP", 2, 5, 1, [1, 1, 1, 1], 1], ["SP", 2, 10, 6, [3, 1, 1, 1], 1], ["SP", 2, 15, 1, [1, 1], 1], ["RE", 2, [0, 5, 10, 1, 6, 11, 2, 7, 12, 15, 16, 3, 8, 13, 17, 4, 9, 14]], ["FSP", 3, 0, 1, 3], ["FSP", 3, 4, 2, 3], ["FSP", 3, 8, 3, 3], ["RE", 3, [0, 4, 8, 1, 5, 9, 2, 6, 10, 3, 7, 11]], ["CA", 2, 3, 8], ["CHR", 1, "shared", [2]], ["CA", 2, 3, 9], ["CHR", 0, "shared", [3]], ["CA", 1, 4, 9], ["FU", 5, [0, 1, 2]], ["AN", 5, 0, 5], ["FU", 5, [1, 2, 3]], ["AN", 5, 1, 4], ["FU", 5, [2, 3, 4]], ["AN", 5, 2, 6], ["FU", 3, [0, 1, 2]], ["SP", 3, 0, 6, [1], 1], ["AN", 3, 1, 2], ["FFSP", 3, 0, [3, 2, 1], 1, 1], ["AN", 3, 1, 6], ["FU", 1, [0, 1, 2]], ["SP", 1, 0, 3, [1], 1], ["AN", 1, 1, 2], ["FFSP", 1, 0, [3, 2, 1], 1, 1], ["AN", 1, 1, 6], ["PR", 4, 0, "auto_unroll_max_step$16"]]]], "r": [[2.34893e-06], 0, 0.551855, 1691939108], "v": "v0.6"}
{"i": [["[\"matmul\", 9, 1, 1, 6, \"float32\"]", "cuda -keys=cuda,gpu -arch=sm_75 -max_num_threads=1024 -thread_warp_size=32", [-1, 16, 64, 49152, 2147483647, 1024, 8, 32], "", 0, []], [[], [["CHW", 2, "local"], ["SP", 2, 0, 9, [1, 9, 1, 1], 1], ["SP", 2, 5, 1, [1, 1, 1, 1], 1], ["SP", 2, 10, 6, [2, 3, 1, 1], 1], ["SP", 2, 15, 1, [1, 1], 1], ["RE", 2, [0, 5, 10, 1, 6, 11, 2, 7, 12, 15, 16, 3, 8, 13, 17, 4, 9, 14]], ["FSP", 3, 0, 1, 3], ["FSP", 3, 4, 2, 3], ["FSP", 3, 8, 3, 3], ["RE", 3, [0, 4, 8, 1, 5, 9, 2, 6, 10, 3, 7, 11]], ["CA", 2, 3, 8], ["CHR", 1, "shared", [2]], ["CA", 2, 3, 9], ["CHR", 0, "shared", [3]], ["CA", 1, 4, 9], ["FU", 5, [0, 1, 2]], ["AN", 5, 0, 5], ["FU", 5, [1, 2, 3]], ["AN", 5, 1, 4], ["FU", 5, [2, 3, 4]], ["AN", 5, 2, 6], ["FU", 3, [0, 1, 2]], ["SP", 3, 0, 3, [1], 1], ["AN", 3, 1, 2], ["FFSP", 3, 0, [3, 2, 1], 1, 1], ["AN", 3, 1, 6], ["FU", 1, [0, 1, 2]], ["SP", 1, 0, 1, [1], 1], ["AN", 1, 1, 2], ["FFSP", 1, 0, [3, 2, 1], 1, 1], ["AN", 1, 1, 6], ["PR", 4, 0, "auto_unroll_max_step$512"]]]], "r": [[1.30765e-06], 0, 0.550574, 1691939108], "v": "v0.6"}
{"i": [["[\"matmul\", 9, 1, 1, 6, \"float32\"]", "cuda -keys=cuda,gpu -arch=sm_75 -max_num_threads=1024 -thread_warp_size=32", [-1, 16, 64, 49152, 2147483647, 1024, 8, 32], "", 0, []], [[], [["CHW", 2, "local"], ["SP", 2, 0, 9, [1, 3, 3, 1], 1], ["SP", 2, 5, 1, [1, 1, 1, 1], 1], ["SP", 2, 10, 6, [2, 3, 1, 1], 1], ["SP", 2, 15, 1, [1, 1], 1], ["RE", 2, [0, 5, 10, 1, 6, 11, 2, 7, 12, 15, 16, 3, 8, 13, 17, 4, 9, 14]], ["FSP", 3, 0, 1, 3], ["FSP", 3, 4, 2, 3], ["FSP", 3, 8, 3, 3], ["RE", 3, [0, 4, 8, 1, 5, 9, 2, 6, 10, 3, 7, 11]], ["CA", 2, 3, 8], ["CHR", 1, "shared", [2]], ["CA", 2, 3, 9], ["CHR", 0, "shared", [3]], ["CA", 1, 4, 9], ["FU", 5, [0, 1, 2]], ["AN", 5, 0, 5], ["FU", 5, [1, 2, 3]], ["AN", 5, 1, 4], ["FU", 5, [2, 3, 4]], ["AN", 5, 2, 6], ["FU", 3, [0, 1, 2]], ["SP", 3, 0, 1, [1], 1], ["AN", 3, 1, 2], ["FFSP", 3, 0, [3, 2, 1], 1, 1], ["AN", 3, 1, 6], ["FU", 1, [0, 1, 2]], ["SP", 1, 0, 1, [1], 1], ["AN", 1, 1, 2], ["FFSP", 1, 0, [3, 2, 1], 1, 1], ["AN", 1, 1, 6], ["PR", 4, 0, "auto_unroll_max_step$64"]]]], "r": [[1.36649e-06], 0, 0.726165, 1691939109], "v": "v0.6"}
{"i": [["[\"matmul\", 9, 1, 1, 6, \"float32\"]", "cuda -keys=cuda,gpu -arch=sm_75 -max_num_threads=1024 -thread_warp_size=32", [-1, 16, 64, 49152, 2147483647, 1024, 8, 32], "", 0, []], [[], [["CHW", 2, "local"], ["SP", 2, 0, 9, [1, 3, 3, 1], 1], ["SP", 2, 5, 1, [1, 1, 1, 1], 1], ["SP", 2, 10, 6, [1, 1, 1, 6], 1], ["SP", 2, 15, 1, [1, 1], 1], ["RE", 2, [0, 5, 10, 1, 6, 11, 2, 7, 12, 15, 16, 3, 8, 13, 17, 4, 9, 14]], ["FSP", 3, 0, 1, 3], ["FSP", 3, 4, 2, 3], ["FSP", 3, 8, 3, 3], ["RE", 3, [0, 4, 8, 1, 5, 9, 2, 6, 10, 3, 7, 11]], ["CA", 2, 3, 8], ["CHR", 1, "shared", [2]], ["CA", 2, 3, 9], ["CHR", 0, "shared", [3]], ["CA", 1, 4, 9], ["FU", 5, [0, 1, 2]], ["AN", 5, 0, 5], ["FU", 5, [1, 2, 3]], ["AN", 5, 1, 4], ["FU", 5, [2, 3, 4]], ["AN", 5, 2, 6], ["FU", 3, [0, 1, 2]], ["SP", 3, 0, 9, [3], 1], ["AN", 3, 1, 2], ["FFSP", 3, 0, [3, 2, 1], 1, 1], ["AN", 3, 1, 6], ["FU", 1, [0, 1, 2]], ["SP", 1, 0, 3, [1], 1], ["AN", 1, 1, 2], ["FFSP", 1, 0, [3, 2, 1], 1, 1], ["AN", 1, 1, 6], ["PR", 4, 0, "auto_unroll_max_step$512"]]]], "r": [[1.43992e-06], 0, 0.518492, 1691939109], "v": "v0.6"}
{"i": [["[\"matmul\", 9, 1, 1, 6, \"float32\"]", "cuda -keys=cuda,gpu -arch=sm_75 -max_num_threads=1024 -thread_warp_size=32", [-1, 16, 64, 49152, 2147483647, 1024, 8, 32], "", 0, []], [[], [["CHW", 2, "local"], ["SP", 2, 0, 9, [1, 1, 1, 3], 1], ["SP", 2, 5, 1, [1, 1, 1, 1], 1], ["SP", 2, 10, 6, [2, 3, 1, 1], 1], ["SP", 2, 15, 1, [1, 1], 1], ["RE", 2, [0, 5, 10, 1, 6, 11, 2, 7, 12, 15, 16, 3, 8, 13, 17, 4, 9, 14]], ["FSP", 3, 0, 1, 3], ["FSP", 3, 4, 2, 3], ["FSP", 3, 8, 3, 3], ["RE", 3, [0, 4, 8, 1, 5, 9, 2, 6, 10, 3, 7, 11]], ["CA", 2, 3, 8], ["CHR", 1, "shared", [2]], ["CA", 2, 3, 9], ["CHR", 0, "shared", [3]], ["CA", 1, 4, 9], ["FU", 5, [0, 1, 2]], ["AN", 5, 0, 5], ["FU", 5, [1, 2, 3]], ["AN", 5, 1, 4], ["FU", 5, [2, 3, 4]], ["AN", 5, 2, 6], ["FU", 3, [0, 1, 2]], ["SP", 3, 0, 3, [3], 1], ["AN", 3, 1, 2], ["FFSP", 3, 0, [3, 2, 1], 1, 1], ["AN", 3, 1, 6], ["FU", 1, [0, 1, 2]], ["SP", 1, 0, 3, [1], 1], ["AN", 1, 1, 2], ["FFSP", 1, 0, [3, 2, 1], 1, 1], ["AN", 1, 1, 6], ["PR", 4, 0, "auto_unroll_max_step$64"]]]], "r": [[1.36811e-06], 0, 0.670721, 1691939109], "v": "v0.6"}
{"i": [["[\"matmul\", 9, 1, 1, 6, \"float32\"]", "cuda -keys=cuda,gpu -arch=sm_75 -max_num_threads=1024 -thread_warp_size=32", [-1, 16, 64, 49152, 2147483647, 1024, 8, 32], "", 0, []], [[], [["CHW", 2, "local"], ["SP", 2, 0, 9, [1, 9, 1, 1], 1], ["SP", 2, 5, 1, [1, 1, 1, 1], 1], ["SP", 2, 10, 6, [1, 1, 2, 3], 1], ["SP", 2, 15, 1, [1, 1], 1], ["RE", 2, [0, 5, 10, 1, 6, 11, 2, 7, 12, 15, 16, 3, 8, 13, 17, 4, 9, 14]], ["FSP", 3, 0, 1, 3], ["FSP", 3, 4, 2, 3], ["FSP", 3, 8, 3, 3], ["RE", 3, [0, 4, 8, 1, 5, 9, 2, 6, 10, 3, 7, 11]], ["CA", 2, 3, 8], ["CHR", 1, "shared", [2]], ["CA", 2, 3, 9], ["CHR", 0, "shared", [3]], ["CA", 1, 4, 9], ["FU", 5, [0, 1, 2]], ["AN", 5, 0, 5], ["FU", 5, [1, 2, 3]], ["AN", 5, 1, 4], ["FU", 5, [2, 3, 4]], ["AN", 5, 2, 6], ["FU", 3, [0, 1, 2]], ["SP", 3, 0, 6, [1], 1], ["AN", 3, 1, 2], ["FFSP", 3, 0, [3, 2, 1], 1, 1], ["AN", 3, 1, 6], ["FU", 1, [0, 1, 2]], ["SP", 1, 0, 1, [1], 1], ["AN", 1, 1, 2], ["FFSP", 1, 0, [3, 2, 1], 1, 1], ["AN", 1, 1, 6], ["PR", 4, 0, "auto_unroll_max_step$0"]]]], "r": [[1.35241e-06], 0, 0.489463, 1691939109], "v": "v0.6"}
{"i": [["[\"matmul\", 9, 1, 1, 6, \"float32\"]", "cuda -keys=cuda,gpu -arch=sm_75 -max_num_threads=1024 -thread_warp_size=32", [-1, 16, 64, 49152, 2147483647, 1024, 8, 32], "", 0, []], [[], [["CHW", 2, "local"], ["SP", 2, 0, 9, [1, 1, 9, 1], 1], ["SP", 2, 5, 1, [1, 1, 1, 1], 1], ["SP", 2, 10, 6, [1, 1, 3, 2], 1], ["SP", 2, 15, 1, [1, 1], 1], ["RE", 2, [0, 5, 10, 1, 6, 11, 2, 7, 12, 15, 16, 3, 8, 13, 17, 4, 9, 14]], ["FSP", 3, 0, 1, 3], ["FSP", 3, 4, 2, 3], ["FSP", 3, 8, 3, 3], ["RE", 3, [0, 4, 8, 1, 5, 9, 2, 6, 10, 3, 7, 11]], ["CA", 2, 3, 8], ["CHR", 1, "shared", [2]], ["CA", 2, 3, 9], ["CHR", 0, "shared", [3]], ["CA", 1, 4, 9], ["FU", 5, [0, 1, 2]], ["AN", 5, 0, 5], ["FU", 5, [1, 2, 3]], ["AN", 5, 1, 4], ["FU", 5, [2, 3, 4]], ["AN", 5, 2, 6], ["FU", 3, [0, 1, 2]], ["SP", 3, 0, 54, [1], 1], ["AN", 3, 1, 2], ["FFSP", 3, 0, [3, 2, 1], 1, 1], ["AN", 3, 1, 6], ["FU", 1, [0, 1, 2]], ["SP", 1, 0, 9, [1], 1], ["AN", 1, 1, 2], ["FFSP", 1, 0, [3, 2, 1], 1, 1], ["AN", 1, 1, 6], ["PR", 4, 0, "auto_unroll_max_step$64"]]]], "r": [[1.6445e-06], 0, 0.713273, 1691939110], "v": "v0.6"}
{"i": [["[\"matmul\", 9, 1, 1, 6, \"float32\"]", "cuda -keys=cuda,gpu -arch=sm_75 -max_num_threads=1024 -thread_warp_size=32", [-1, 16, 64, 49152, 2147483647, 1024, 8, 32], "", 0, []], [[], [["CHW", 2, "local"], ["SP", 2, 0, 9, [3, 1, 1, 1], 1], ["SP", 2, 5, 1, [1, 1, 1, 1], 1], ["SP", 2, 10, 6, [1, 2, 1, 3], 1], ["SP", 2, 15, 1, [1, 1], 1], ["RE", 2, [0, 5, 10, 1, 6, 11, 2, 7, 12, 15, 16, 3, 8, 13, 17, 4, 9, 14]], ["FSP", 3, 0, 1, 3], ["FSP", 3, 4, 2, 3], ["FSP", 3, 8, 3, 3], ["RE", 3, [0, 4, 8, 1, 5, 9, 2, 6, 10, 3, 7, 11]], ["CA", 2, 3, 8], ["CHR", 1, "shared", [2]], ["CA", 2, 3, 9], ["CHR", 0, "shared", [3]], ["CA", 1, 4, 9], ["FU", 5, [0, 1, 2]], ["AN", 5, 0, 5], ["FU", 5, [1, 2, 3]], ["AN", 5, 1, 4], ["FU", 5, [2, 3, 4]], ["AN", 5, 2, 6], ["FU", 3, [0, 1, 2]], ["SP", 3, 0, 3, [1], 1], ["AN", 3, 1, 2], ["FFSP", 3, 0, [3, 2, 1], 1, 1], ["AN", 3, 1, 6], ["FU", 1, [0, 1, 2]], ["SP", 1, 0, 1, [1], 1], ["AN", 1, 1, 2], ["FFSP", 1, 0, [3, 2, 1], 1, 1], ["AN", 1, 1, 6], ["PR", 4, 0, "auto_unroll_max_step$0"]]]], "r": [[1.44273e-06], 0, 0.516212, 1691939110], "v": "v0.6"}
{"i": [["[\"matmul\", 9, 1, 1, 6, \"float32\"]", "cuda -keys=cuda,gpu -arch=sm_75 -max_num_threads=1024 -thread_warp_size=32", [-1, 16, 64, 49152, 2147483647, 1024, 8, 32], "", 0, []], [[], [["CHW", 2, "local"], ["SP", 2, 0, 9, [1, 3, 3, 1], 1], ["SP", 2, 5, 1, [1, 1, 1, 1], 1], ["SP", 2, 10, 6, [6, 1, 1, 1], 1], ["SP", 2, 15, 1, [1, 1], 1], ["RE", 2, [0, 5, 10, 1, 6, 11, 2, 7, 12, 15, 16, 3, 8, 13, 17, 4, 9, 14]], ["FSP", 3, 0, 1, 3], ["FSP", 3, 4, 2, 3], ["FSP", 3, 8, 3, 3], ["RE", 3, [0, 4, 8, 1, 5, 9, 2, 6, 10, 3, 7, 11]], ["CA", 2, 3, 8], ["CHR", 1, "shared", [2]], ["CA", 2, 3, 9], ["CHR", 0, "shared", [3]], ["CA", 1, 4, 9], ["FU", 5, [0, 1, 2]], ["AN", 5, 0, 5], ["FU", 5, [1, 2, 3]], ["AN", 5, 1, 4], ["FU", 5, [2, 3, 4]], ["AN", 5, 2, 6], ["FU", 3, [0, 1, 2]], ["SP", 3, 0, 3, [1], 1], ["AN", 3, 1, 2], ["FFSP", 3, 0, [3, 2, 1], 1, 1], ["AN", 3, 1, 6], ["FU", 1, [0, 1, 2]], ["SP", 1, 0, 3, [1], 1], ["AN", 1, 1, 2], ["FFSP", 1, 0, [3, 2, 1], 1, 1], ["AN", 1, 1, 6], ["PR", 4, 0, "auto_unroll_max_step$64"]]]], "r": [[1.43973e-06], 0, 0.53566, 1691939110], "v": "v0.6"}
{"i": [["[\"matmul\", 9, 1, 1, 6, \"float32\"]", "cuda -keys=cuda,gpu -arch=sm_75 -max_num_threads=1024 -thread_warp_size=32", [-1, 16, 64, 49152, 2147483647, 1024, 8, 32], "", 0, []], [[], [["CHW", 2, "local"], ["SP", 2, 0, 9, [1, 1, 3, 3], 1], ["SP", 2, 5, 1, [1, 1, 1, 1], 1], ["SP", 2, 10, 6, [3, 1, 1, 2], 1], ["SP", 2, 15, 1, [1, 1], 1], ["RE", 2, [0, 5, 10, 1, 6, 11, 2, 7, 12, 15, 16, 3, 8, 13, 17, 4, 9, 14]], ["FSP", 3, 0, 1, 3], ["FSP", 3, 4, 2, 3], ["FSP", 3, 8, 3, 3], ["RE", 3, [0, 4, 8, 1, 5, 9, 2, 6, 10, 3, 7, 11]], ["CA", 2, 3, 8], ["CHR", 1, "shared", [2]], ["CA", 2, 3, 9], ["CHR", 0, "shared", [3]], ["CA", 1, 4, 9], ["FU", 5, [0, 1, 2]], ["AN", 5, 0, 5], ["FU", 5, [1, 2, 3]], ["AN", 5, 1, 4], ["FU", 5, [2, 3, 4]], ["AN", 5, 2, 6], ["FU", 3, [0, 1, 2]], ["SP", 3, 0, 18, [1], 1], ["AN", 3, 1, 2], ["FFSP", 3, 0, [3, 2, 1], 1, 1], ["AN", 3, 1, 6], ["FU", 1, [0, 1, 2]], ["SP", 1, 0, 9, [1], 1], ["AN", 1, 1, 2], ["FFSP", 1, 0, [3, 2, 1], 1, 1], ["AN", 1, 1, 6], ["PR", 4, 0, "auto_unroll_max_step$1024"]]]], "r": [[1.64853e-06], 0, 0.556634, 1691939110], "v": "v0.6"}
{"i": [["[\"matmul\", 9, 1, 1, 6, \"float32\"]", "cuda -keys=cuda,gpu -arch=sm_75 -max_num_threads=1024 -thread_warp_size=32", [-1, 16, 64, 49152, 2147483647, 1024, 8, 32], "", 0, []], [[], [["CHW", 2, "local"], ["SP", 2, 0, 9, [1, 3, 1, 3], 1], ["SP", 2, 5, 1, [1, 1, 1, 1], 1], ["SP", 2, 10, 6, [1, 1, 1, 6], 1], ["SP", 2, 15, 1, [1, 1], 1], ["RE", 2, [0, 5, 10, 1, 6, 11, 2, 7, 12, 15, 16, 3, 8, 13, 17, 4, 9, 14]], ["FSP", 3, 0, 1, 3], ["FSP", 3, 4, 2, 3], ["FSP", 3, 8, 3, 3], ["RE", 3, [0, 4, 8, 1, 5, 9, 2, 6, 10, 3, 7, 11]], ["CA", 2, 3, 8], ["CHR", 1, "shared", [2]], ["CA", 2, 3, 9], ["CHR", 0, "shared", [3]], ["CA", 1, 4, 9], ["FU", 5, [0, 1, 2]], ["AN", 5, 0, 5], ["FU", 5, [1, 2, 3]], ["AN", 5, 1, 4], ["FU", 5, [2, 3, 4]], ["AN", 5, 2, 6], ["FU", 3, [0, 1, 2]], ["SP", 3, 0, 3, [3], 1], ["AN", 3, 1, 2], ["FFSP", 3, 0, [3, 2, 1], 1, 1], ["AN", 3, 1, 6], ["FU", 1, [0, 1, 2]], ["SP", 1, 0, 3, [3], 1], ["AN", 1, 1, 2], ["FFSP", 1, 0, [3, 2, 1], 1, 1], ["AN", 1, 1, 6], ["PR", 4, 0, "auto_unroll_max_step$0"]]]], "r": [[1.43204e-06], 0, 0.66755, 1691939111], "v": "v0.6"}
{"i": [["[\"matmul\", 9, 1, 1, 6, \"float32\"]", "cuda -keys=cuda,gpu -arch=sm_75 -max_num_threads=1024 -thread_warp_size=32", [-1, 16, 64, 49152, 2147483647, 1024, 8, 32], "", 0, []], [[], [["CHW", 2, "local"], ["SP", 2, 0, 9, [3, 1, 1, 3], 1], ["SP", 2, 5, 1, [1, 1, 1, 1], 1], ["SP", 2, 10, 6, [1, 1, 1, 2], 1], ["SP", 2, 15, 1, [1, 1], 1], ["RE", 2, [0, 5, 10, 1, 6, 11, 2, 7, 12, 15, 16, 3, 8, 13, 17, 4, 9, 14]], ["FSP", 3, 0, 1, 3], ["FSP", 3, 4, 2, 3], ["FSP", 3, 8, 3, 3], ["RE", 3, [0, 4, 8, 1, 5, 9, 2, 6, 10, 3, 7, 11]], ["CA", 2, 3, 8], ["CHR", 1, "shared", [2]], ["CA", 2, 3, 9], ["CHR", 0, "shared", [3]], ["CA", 1, 4, 9], ["FU", 5, [0, 1, 2]], ["AN", 5, 0, 5], ["FU", 5, [1, 2, 3]], ["AN", 5, 1, 4], ["FU", 5, [2, 3, 4]], ["AN", 5, 2, 6], ["FU", 3, [0, 1, 2]], ["SP", 3, 0, 18, [1], 1], ["AN", 3, 1, 2], ["FFSP", 3, 0, [3, 2, 1], 1, 1], ["AN", 3, 1, 6], ["FU", 1, [0, 1, 2]], ["SP", 1, 0, 3, [1], 1], ["AN", 1, 1, 2], ["FFSP", 1, 0, [3, 2, 1], 1, 1], ["AN", 1, 1, 6], ["PR", 4, 0, "auto_unroll_max_step$1024"]]]], "r": [[1.41057e-06], 0, 0.670584, 1691939111], "v": "v0.6"}
{"i": [["[\"matmul\", 9, 1, 1, 6, \"float32\"]", "cuda -keys=cuda,gpu -arch=sm_75 -max_num_threads=1024 -thread_warp_size=32", [-1, 16, 64, 49152, 2147483647, 1024, 8, 32], "", 0, []], [[], [["CHW", 2, "local"], ["SP", 2, 0, 9, [1, 1, 3, 1], 1], ["SP", 2, 5, 1, [1, 1, 1, 1], 1], ["SP", 2, 10, 6, [2, 1, 1, 3], 1], ["SP", 2, 15, 1, [1, 1], 1], ["RE", 2, [0, 5, 10, 1, 6, 11, 2, 7, 12, 15, 16, 3, 8, 13, 17, 4, 9, 14]], ["FSP", 3, 0, 1, 3], ["FSP", 3, 4, 2, 3], ["FSP", 3, 8, 3, 3], ["RE", 3, [0, 4, 8, 1, 5, 9, 2, 6, 10, 3, 7, 11]], ["CA", 2, 3, 8], ["CHR", 1, "shared", [2]], ["CA", 2, 3, 9], ["CHR", 0, "shared", [3]], ["CA", 1, 4, 9], ["FU", 5, [0, 1, 2]], ["AN", 5, 0, 5], ["FU", 5, [1, 2, 3]], ["AN", 5, 1, 4], ["FU", 5, [2, 3, 4]], ["AN", 5, 2, 6], ["FU", 3, [0, 1, 2]], ["SP", 3, 0, 1, [1], 1], ["AN", 3, 1, 2], ["FFSP", 3, 0, [3, 2, 1], 1, 1], ["AN", 3, 1, 6], ["FU", 1, [0, 1, 2]], ["SP", 1, 0, 1, [1], 1], ["AN", 1, 1, 2], ["FFSP", 1, 0, [3, 2, 1], 1, 1], ["AN", 1, 1, 6], ["PR", 4, 0, "auto_unroll_max_step$0"]]]], "r": [[1.50122e-06], 0, 0.791084, 1691939114], "v": "v0.6"}
{"i": [["[\"matmul\", 9, 1, 1, 6, \"float32\"]", "cuda -keys=cuda,gpu -arch=sm_75 -max_num_threads=1024 -thread_warp_size=32", [-1, 16, 64, 49152, 2147483647, 1024, 8, 32], "", 0, []], [[], [["CHW", 2, "local"], ["SP", 2, 0, 9, [1, 1, 9, 1], 1], ["SP", 2, 5, 1, [1, 1, 1, 1], 1], ["SP", 2, 10, 6, [1, 1, 1, 1], 1], ["SP", 2, 15, 1, [1, 1], 1], ["RE", 2, [0, 5, 10, 1, 6, 11, 2, 7, 12, 15, 16, 3, 8, 13, 17, 4, 9, 14]], ["FSP", 3, 0, 1, 3], ["FSP", 3, 4, 2, 3], ["FSP", 3, 8, 3, 3], ["RE", 3, [0, 4, 8, 1, 5, 9, 2, 6, 10, 3, 7, 11]], ["CA", 2, 3, 8], ["CHR", 1, "shared", [2]], ["CA", 2, 3, 9], ["CHR", 0, "shared", [3]], ["CA", 1, 4, 9], ["FU", 5, [0, 1, 2]], ["AN", 5, 0, 5], ["FU", 5, [1, 2, 3]], ["AN", 5, 1, 4], ["FU", 5, [2, 3, 4]], ["AN", 5, 2, 6], ["FU", 3, [0, 1, 2]], ["SP", 3, 0, 1, [1], 1], ["AN", 3, 1, 2], ["FFSP", 3, 0, [3, 2, 1], 1, 1], ["AN", 3, 1, 6], ["FU", 1, [0, 1, 2]], ["SP", 1, 0, 1, [1], 1], ["AN", 1, 1, 2], ["FFSP", 1, 0, [3, 2, 1], 1, 1], ["AN", 1, 1, 6], ["PR", 4, 0, "auto_unroll_max_step$64"]]]], "r": [[1.36182e-06], 0, 0.717139, 1691939115], "v": "v0.6"}
{"i": [["[\"matmul\", 9, 1, 1, 6, \"float32\"]", "cuda -keys=cuda,gpu -arch=sm_75 -max_num_threads=1024 -thread_warp_size=32", [-1, 16, 64, 49152, 2147483647, 1024, 8, 32], "", 0, []], [[], [["CHW", 2, "local"], ["SP", 2, 0, 9, [1, 1, 1, 1], 1], ["SP", 2, 5, 1, [1, 1, 1, 1], 1], ["SP", 2, 10, 6, [3, 1, 1, 2], 1], ["SP", 2, 15, 1, [1, 1], 1], ["RE", 2, [0, 5, 10, 1, 6, 11, 2, 7, 12, 15, 16, 3, 8, 13, 17, 4, 9, 14]], ["FSP", 3, 0, 1, 3], ["FSP", 3, 4, 2, 3], ["FSP", 3, 8, 3, 3], ["RE", 3, [0, 4, 8, 1, 5, 9, 2, 6, 10, 3, 7, 11]], ["CA", 2, 3, 8], ["CHR", 1, "shared", [2]], ["CA", 2, 3, 9], ["CHR", 0, "shared", [3]], ["CA", 1, 4, 9], ["FU", 5, [0, 1, 2]], ["AN", 5, 0, 5], ["FU", 5, [1, 2, 3]], ["AN", 5, 1, 4], ["FU", 5, [2, 3, 4]], ["AN", 5, 2, 6], ["FU", 3, [0, 1, 2]], ["SP", 3, 0, 2, [1], 1], ["AN", 3, 1, 2], ["FFSP", 3, 0, [3, 2, 1], 1, 1], ["AN", 3, 1, 6], ["FU", 1, [0, 1, 2]], ["SP", 1, 0, 1, [1], 1], ["AN", 1, 1, 2], ["FFSP", 1, 0, [3, 2, 1], 1, 1], ["AN", 1, 1, 6], ["PR", 4, 0, "auto_unroll_max_step$64"]]]], "r": [[1.30588e-06], 0, 0.681667, 1691939115], "v": "v0.6"}
{"i": [["[\"matmul\", 9, 1, 1, 6, \"float32\"]", "cuda -keys=cuda,gpu -arch=sm_75 -max_num_threads=1024 -thread_warp_size=32", [-1, 16, 64, 49152, 2147483647, 1024, 8, 32], "", 0, []], [[], [["CHW", 2, "local"], ["SP", 2, 0, 9, [1, 1, 1, 3], 1], ["SP", 2, 5, 1, [1, 1, 1, 1], 1], ["SP", 2, 10, 6, [1, 1, 3, 1], 1], ["SP", 2, 15, 1, [1, 1], 1], ["RE", 2, [0, 5, 10, 1, 6, 11, 2, 7, 12, 15, 16, 3, 8, 13, 17, 4, 9, 14]], ["FSP", 3, 0, 1, 3], ["FSP", 3, 4, 2, 3], ["FSP", 3, 8, 3, 3], ["RE", 3, [0, 4, 8, 1, 5, 9, 2, 6, 10, 3, 7, 11]], ["CA", 2, 3, 8], ["CHR", 1, "shared", [2]], ["CA", 2, 3, 9], ["CHR", 0, "shared", [3]], ["CA", 1, 4, 9], ["FU", 5, [0, 1, 2]], ["AN", 5, 0, 5], ["FU", 5, [1, 2, 3]], ["AN", 5, 1, 4], ["FU", 5, [2, 3, 4]], ["AN", 5, 2, 6], ["FU", 3, [0, 1, 2]], ["SP", 3, 0, 3, [3], 1], ["AN", 3, 1, 2], ["FFSP", 3, 0, [3, 2, 1], 1, 1], ["AN", 3, 1, 6], ["FU", 1, [0, 1, 2]], ["SP", 1, 0, 1, [1], 1], ["AN", 1, 1, 2], ["FFSP", 1, 0, [3, 2, 1], 1, 1], ["AN", 1, 1, 6], ["PR", 4, 0, "auto_unroll_max_step$16"]]]], "r": [[1.35755e-06], 0, 0.73515, 1691939115], "v": "v0.6"}
{"i": [["[\"matmul\", 9, 1, 1, 6, \"float32\"]", "cuda -keys=cuda,gpu -arch=sm_75 -max_num_threads=1024 -thread_warp_size=32", [-1, 16, 64, 49152, 2147483647, 1024, 8, 32], "", 0, []], [[], [["CHW", 2, "local"], ["SP", 2, 0, 9, [3, 1, 1, 1], 1], ["SP", 2, 5, 1, [1, 1, 1, 1], 1], ["SP", 2, 10, 6, [1, 6, 1, 1], 1], ["SP", 2, 15, 1, [1, 1], 1], ["RE", 2, [0, 5, 10, 1, 6, 11, 2, 7, 12, 15, 16, 3, 8, 13, 17, 4, 9, 14]], ["FSP", 3, 0, 1, 3], ["FSP", 3, 4, 2, 3], ["FSP", 3, 8, 3, 3], ["RE", 3, [0, 4, 8, 1, 5, 9, 2, 6, 10, 3, 7, 11]], ["CA", 2, 3, 8], ["CHR", 1, "shared", [2]], ["CA", 2, 3, 9], ["CHR", 0, "shared", [3]], ["CA", 1, 4, 9], ["FU", 5, [0, 1, 2]], ["AN", 5, 0, 5], ["FU", 5, [1, 2, 3]], ["AN", 5, 1, 4], ["FU", 5, [2, 3, 4]], ["AN", 5, 2, 6], ["FU", 3, [0, 1, 2]], ["SP", 3, 0, 3, [1], 1], ["AN", 3, 1, 2], ["FFSP", 3, 0, [3, 2, 1], 1, 1], ["AN", 3, 1, 6], ["FU", 1, [0, 1, 2]], ["SP", 1, 0, 1, [1], 1], ["AN", 1, 1, 2], ["FFSP", 1, 0, [3, 2, 1], 1, 1], ["AN", 1, 1, 6], ["PR", 4, 0, "auto_unroll_max_step$16"]]]], "r": [[1.34726e-06], 0, 0.685294, 1691939116], "v": "v0.6"}
{"i": [["[\"matmul\", 9, 1, 1, 6, \"float32\"]", "cuda -keys=cuda,gpu -arch=sm_75 -max_num_threads=1024 -thread_warp_size=32", [-1, 16, 64, 49152, 2147483647, 1024, 8, 32], "", 0, []], [[], [["CHW", 2, "local"], ["SP", 2, 0, 9, [1, 3, 3, 1], 1], ["SP", 2, 5, 1, [1, 1, 1, 1], 1], ["SP", 2, 10, 6, [1, 1, 3, 2], 1], ["SP", 2, 15, 1, [1, 1], 1], ["RE", 2, [0, 5, 10, 1, 6, 11, 2, 7, 12, 15, 16, 3, 8, 13, 17, 4, 9, 14]], ["FSP", 3, 0, 1, 3], ["FSP", 3, 4, 2, 3], ["FSP", 3, 8, 3, 3], ["RE", 3, [0, 4, 8, 1, 5, 9, 2, 6, 10, 3, 7, 11]], ["CA", 2, 3, 8], ["CHR", 1, "shared", [2]], ["CA", 2, 3, 9], ["CHR", 0, "shared", [3]], ["CA", 1, 4, 9], ["FU", 5, [0, 1, 2]], ["AN", 5, 0, 5], ["FU", 5, [1, 2, 3]], ["AN", 5, 1, 4], ["FU", 5, [2, 3, 4]], ["AN", 5, 2, 6], ["FU", 3, [0, 1, 2]], ["SP", 3, 0, 6, [1], 1], ["AN", 3, 1, 2], ["FFSP", 3, 0, [3, 2, 1], 1, 1], ["AN", 3, 1, 6], ["FU", 1, [0, 1, 2]], ["SP", 1, 0, 3, [1], 1], ["AN", 1, 1, 2], ["FFSP", 1, 0, [3, 2, 1], 1, 1], ["AN", 1, 1, 6], ["PR", 4, 0, "auto_unroll_max_step$512"]]]], "r": [[1.45252e-06], 0, 0.748307, 1691939116], "v": "v0.6"}
{"i": [["[\"matmul\", 9, 1, 1, 6, \"float32\"]", "cuda -keys=cuda,gpu -arch=sm_75 -max_num_threads=1024 -thread_warp_size=32", [-1, 16, 64, 49152, 2147483647, 1024, 8, 32], "", 0, []], [[], [["CHW", 2, "local"], ["SP", 2, 0, 9, [1, 3, 1, 1], 1], ["SP", 2, 5, 1, [1, 1, 1, 1], 1], ["SP", 2, 10, 6, [1, 1, 1, 3], 1], ["SP", 2, 15, 1, [1, 1], 1], ["RE", 2, [0, 5, 10, 1, 6, 11, 2, 7, 12, 15, 16, 3, 8, 13, 17, 4, 9, 14]], ["FSP", 3, 0, 1, 3], ["FSP", 3, 4, 2, 3], ["FSP", 3, 8, 3, 3], ["RE", 3, [0, 4, 8, 1, 5, 9, 2, 6, 10, 3, 7, 11]], ["CA", 2, 3, 8], ["CHR", 1, "shared", [2]], ["CA", 2, 3, 9], ["CHR", 0, "shared", [3]], ["CA", 1, 4, 9], ["FU", 5, [0, 1, 2]], ["AN", 5, 0, 5], ["FU", 5, [1, 2, 3]], ["AN", 5, 1, 4], ["FU", 5, [2, 3, 4]], ["AN", 5, 2, 6], ["FU", 3, [0, 1, 2]], ["SP", 3, 0, 3, [1], 1], ["AN", 3, 1, 2], ["FFSP", 3, 0, [3, 2, 1], 1, 1], ["AN", 3, 1, 6], ["FU", 1, [0, 1, 2]], ["SP", 1, 0, 1, [1], 1], ["AN", 1, 1, 2], ["FFSP", 1, 0, [3, 2, 1], 1, 1], ["AN", 1, 1, 6], ["PR", 4, 0, "auto_unroll_max_step$64"]]]], "r": [[1.34255e-06], 0, 0.713609, 1691939116], "v": "v0.6"}
{"i": [["[\"matmul\", 9, 1, 1, 6, \"float32\"]", "cuda -keys=cuda,gpu -arch=sm_75 -max_num_threads=1024 -thread_warp_size=32", [-1, 16, 64, 49152, 2147483647, 1024, 8, 32], "", 0, []], [[], [["CHW", 2, "local"], ["SP", 2, 0, 9, [1, 1, 1, 9], 1], ["SP", 2, 5, 1, [1, 1, 1, 1], 1], ["SP", 2, 10, 6, [1, 6, 1, 1], 1], ["SP", 2, 15, 1, [1, 1], 1], ["RE", 2, [0, 5, 10, 1, 6, 11, 2, 7, 12, 15, 16, 3, 8, 13, 17, 4, 9, 14]], ["FSP", 3, 0, 1, 3], ["FSP", 3, 4, 2, 3], ["FSP", 3, 8, 3, 3], ["RE", 3, [0, 4, 8, 1, 5, 9, 2, 6, 10, 3, 7, 11]], ["CA", 2, 3, 8], ["CHR", 1, "shared", [2]], ["CA", 2, 3, 9], ["CHR", 0, "shared", [3]], ["CA", 1, 4, 9], ["FU", 5, [0, 1, 2]], ["AN", 5, 0, 5], ["FU", 5, [1, 2, 3]], ["AN", 5, 1, 4], ["FU", 5, [2, 3, 4]], ["AN", 5, 2, 6], ["FU", 3, [0, 1, 2]], ["SP", 3, 0, 9, [1], 1], ["AN", 3, 1, 2], ["FFSP", 3, 0, [3, 2, 1], 1, 1], ["AN", 3, 1, 6], ["FU", 1, [0, 1, 2]], ["SP", 1, 0, 9, [1], 1], ["AN", 1, 1, 2], ["FFSP", 1, 0, [3, 2, 1], 1, 1], ["AN", 1, 1, 6], ["PR", 4, 0, "auto_unroll_max_step$512"]]]], "r": [[1.36865e-06], 0, 0.712324, 1691939117], "v": "v0.6"}
{"i": [["[\"matmul\", 9, 1, 1, 6, \"float32\"]", "cuda -keys=cuda,gpu -arch=sm_75 -max_num_threads=1024 -thread_warp_size=32", [-1, 16, 64, 49152, 2147483647, 1024, 8, 32], "", 0, []], [[], [["CHW", 2, "local"], ["SP", 2, 0, 9, [1, 3, 3, 1], 1], ["SP", 2, 5, 1, [1, 1, 1, 1], 1], ["SP", 2, 10, 6, [1, 1, 1, 3], 1], ["SP", 2, 15, 1, [1, 1], 1], ["RE", 2, [0, 5, 10, 1, 6, 11, 2, 7, 12, 15, 16, 3, 8, 13, 17, 4, 9, 14]], ["FSP", 3, 0, 1, 3], ["FSP", 3, 4, 2, 3], ["FSP", 3, 8, 3, 3], ["RE", 3, [0, 4, 8, 1, 5, 9, 2, 6, 10, 3, 7, 11]], ["CA", 2, 3, 8], ["CHR", 1, "shared", [2]], ["CA", 2, 3, 9], ["CHR", 0, "shared", [3]], ["CA", 1, 4, 9], ["FU", 5, [0, 1, 2]], ["AN", 5, 0, 5], ["FU", 5, [1, 2, 3]], ["AN", 5, 1, 4], ["FU", 5, [2, 3, 4]], ["AN", 5, 2, 6], ["FU", 3, [0, 1, 2]], ["SP", 3, 0, 9, [1], 1], ["AN", 3, 1, 2], ["FFSP", 3, 0, [3, 2, 1], 1, 1], ["AN", 3, 1, 6], ["FU", 1, [0, 1, 2]], ["SP", 1, 0, 3, [1], 1], ["AN", 1, 1, 2], ["FFSP", 1, 0, [3, 2, 1], 1, 1], ["AN", 1, 1, 6], ["PR", 4, 0, "auto_unroll_max_step$0"]]]], "r": [[1.38416e-06], 0, 0.517006, 1691939117], "v": "v0.6"}
{"i": [["[\"matmul\", 9, 1, 1, 6, \"float32\"]", "cuda -keys=cuda,gpu -arch=sm_75 -max_num_threads=1024 -thread_warp_size=32", [-1, 16, 64, 49152, 2147483647, 1024, 8, 32], "", 0, []], [[], [["CHW", 2, "local"], ["SP", 2, 0, 9, [1, 1, 1, 1], 1], ["SP", 2, 5, 1, [1, 1, 1, 1], 1], ["SP", 2, 10, 6, [2, 1, 1, 3], 1], ["SP", 2, 15, 1, [1, 1], 1], ["RE", 2, [0, 5, 10, 1, 6, 11, 2, 7, 12, 15, 16, 3, 8, 13, 17, 4, 9, 14]], ["FSP", 3, 0, 1, 3], ["FSP", 3, 4, 2, 3], ["FSP", 3, 8, 3, 3], ["RE", 3, [0, 4, 8, 1, 5, 9, 2, 6, 10, 3, 7, 11]], ["CA", 2, 3, 8], ["CHR", 1, "shared", [2]], ["CA", 2, 3, 9], ["CHR", 0, "shared", [3]], ["CA", 1, 4, 9], ["FU", 5, [0, 1, 2]], ["AN", 5, 0, 5], ["FU", 5, [1, 2, 3]], ["AN", 5, 1, 4], ["FU", 5, [2, 3, 4]], ["AN", 5, 2, 6], ["FU", 3, [0, 1, 2]], ["SP", 3, 0, 6, [1], 1], ["AN", 3, 1, 2], ["FFSP", 3, 0, [3, 2, 1], 1, 1], ["AN", 3, 1, 6], ["FU", 1, [0, 1, 2]], ["SP", 1, 0, 1, [1], 1], ["AN", 1, 1, 2], ["FFSP", 1, 0, [3, 2, 1], 1, 1], ["AN", 1, 1, 6], ["PR", 4, 0, "auto_unroll_max_step$16"]]]], "r": [[1.30656e-06], 0, 0.517352, 1691939117], "v": "v0.6"}
{"i": [["[\"matmul\", 9, 1, 1, 6, \"float32\"]", "cuda -keys=cuda,gpu -arch=sm_75 -max_num_threads=1024 -thread_warp_size=32", [-1, 16, 64, 49152, 2147483647, 1024, 8, 32], "", 0, []], [[], [["CHW", 2, "local"], ["SP", 2, 0, 9, [3, 1, 3, 1], 1], ["SP", 2, 5, 1, [1, 1, 1, 1], 1], ["SP", 2, 10, 6, [1, 1, 3, 1], 1], ["SP", 2, 15, 1, [1, 1], 1], ["RE", 2, [0, 5, 10, 1, 6, 11, 2, 7, 12, 15, 16, 3, 8, 13, 17, 4, 9, 14]], ["FSP", 3, 0, 1, 3], ["FSP", 3, 4, 2, 3], ["FSP", 3, 8, 3, 3], ["RE", 3, [0, 4, 8, 1, 5, 9, 2, 6, 10, 3, 7, 11]], ["CA", 2, 3, 8], ["CHR", 1, "shared", [2]], ["CA", 2, 3, 9], ["CHR", 0, "shared", [3]], ["CA", 1, 4, 9], ["FU", 5, [0, 1, 2]], ["AN", 5, 0, 5], ["FU", 5, [1, 2, 3]], ["AN", 5, 1, 4], ["FU", 5, [2, 3, 4]], ["AN", 5, 2, 6], ["FU", 3, [0, 1, 2]], ["SP", 3, 0, 9, [1], 1], ["AN", 3, 1, 2], ["FFSP", 3, 0, [3, 2, 1], 1, 1], ["AN", 3, 1, 6], ["FU", 1, [0, 1, 2]], ["SP", 1, 0, 3, [1], 1], ["AN", 1, 1, 2], ["FFSP", 1, 0, [3, 2, 1], 1, 1], ["AN", 1, 1, 6], ["PR", 4, 0, "auto_unroll_max_step$0"]]]], "r": [[2.33082e-06], 0, 0.59091, 1691939117], "v": "v0.6"}
{"i": [["[\"matmul\", 9, 1, 1, 6, \"float32\"]", "cuda -keys=cuda,gpu -arch=sm_75 -max_num_threads=1024 -thread_warp_size=32", [-1, 16, 64, 49152, 2147483647, 1024, 8, 32], "", 0, []], [[], [["CHW", 2, "local"], ["SP", 2, 0, 9, [1, 1, 9, 1], 1], ["SP", 2, 5, 1, [1, 1, 1, 1], 1], ["SP", 2, 10, 6, [1, 1, 6, 1], 1], ["SP", 2, 15, 1, [1, 1], 1], ["RE", 2, [0, 5, 10, 1, 6, 11, 2, 7, 12, 15, 16, 3, 8, 13, 17, 4, 9, 14]], ["FSP", 3, 0, 1, 3], ["FSP", 3, 4, 2, 3], ["FSP", 3, 8, 3, 3], ["RE", 3, [0, 4, 8, 1, 5, 9, 2, 6, 10, 3, 7, 11]], ["CA", 2, 3, 8], ["CHR", 1, "shared", [2]], ["CA", 2, 3, 9], ["CHR", 0, "shared", [3]], ["CA", 1, 4, 9], ["FU", 5, [0, 1, 2]], ["AN", 5, 0, 5], ["FU", 5, [1, 2, 3]], ["AN", 5, 1, 4], ["FU", 5, [2, 3, 4]], ["AN", 5, 2, 6], ["FU", 3, [0, 1, 2]], ["SP", 3, 0, 18, [1], 1], ["AN", 3, 1, 2], ["FFSP", 3, 0, [3, 2, 1], 1, 1], ["AN", 3, 1, 6], ["FU", 1, [0, 1, 2]], ["SP", 1, 0, 9, [3], 1], ["AN", 1, 1, 2], ["FFSP", 1, 0, [3, 2, 1], 1, 1], ["AN", 1, 1, 6], ["PR", 4, 0, "auto_unroll_max_step$1024"]]]], "r": [[1.64501e-06], 0, 0.529296, 1691939117], "v": "v0.6"}
{"i": [["[\"matmul\", 9, 1, 1, 6, \"float32\"]", "cuda -keys=cuda,gpu -arch=sm_75 -max_num_threads=1024 -thread_warp_size=32", [-1, 16, 64, 49152, 2147483647, 1024, 8, 32], "", 0, []], [[], [["CHW", 2, "local"], ["SP", 2, 0, 9, [1, 1, 1, 1], 1], ["SP", 2, 5, 1, [1, 1, 1, 1], 1], ["SP", 2, 10, 6, [1, 3, 1, 2], 1], ["SP", 2, 15, 1, [1, 1], 1], ["RE", 2, [0, 5, 10, 1, 6, 11, 2, 7, 12, 15, 16, 3, 8, 13, 17, 4, 9, 14]], ["FSP", 3, 0, 1, 3], ["FSP", 3, 4, 2, 3], ["FSP", 3, 8, 3, 3], ["RE", 3, [0, 4, 8, 1, 5, 9, 2, 6, 10, 3, 7, 11]], ["CA", 2, 3, 8], ["CHR", 1, "shared", [2]], ["CA", 2, 3, 9], ["CHR", 0, "shared", [3]], ["CA", 1, 4, 9], ["FU", 5, [0, 1, 2]], ["AN", 5, 0, 5], ["FU", 5, [1, 2, 3]], ["AN", 5, 1, 4], ["FU", 5, [2, 3, 4]], ["AN", 5, 2, 6], ["FU", 3, [0, 1, 2]], ["SP", 3, 0, 2, [1], 1], ["AN", 3, 1, 2], ["FFSP", 3, 0, [3, 2, 1], 1, 1], ["AN", 3, 1, 6], ["FU", 1, [0, 1, 2]], ["SP", 1, 0, 1, [1], 1], ["AN", 1, 1, 2], ["FFSP", 1, 0, [3, 2, 1], 1, 1], ["AN", 1, 1, 6], ["PR", 4, 0, "auto_unroll_max_step$16"]]]], "r": [[1.31461e-06], 0, 0.655401, 1691939118], "v": "v0.6"}
{"i": [["[\"matmul\", 9, 1, 1, 6, \"float32\"]", "cuda -keys=cuda,gpu -arch=sm_75 -max_num_threads=1024 -thread_warp_size=32", [-1, 16, 64, 49152, 2147483647, 1024, 8, 32], "", 0, []], [[], [["CHW", 2, "local"], ["SP", 2, 0, 9, [1, 3, 3, 1], 1], ["SP", 2, 5, 1, [1, 1, 1, 1], 1], ["SP", 2, 10, 6, [2, 1, 1, 1], 1], ["SP", 2, 15, 1, [1, 1], 1], ["RE", 2, [0, 5, 10, 1, 6, 11, 2, 7, 12, 15, 16, 3, 8, 13, 17, 4, 9, 14]], ["FSP", 3, 0, 1, 3], ["FSP", 3, 4, 2, 3], ["FSP", 3, 8, 3, 3], ["RE", 3, [0, 4, 8, 1, 5, 9, 2, 6, 10, 3, 7, 11]], ["CA", 2, 3, 8], ["CHR", 1, "shared", [2]], ["CA", 2, 3, 9], ["CHR", 0, "shared", [3]], ["CA", 1, 4, 9], ["FU", 5, [0, 1, 2]], ["AN", 5, 0, 5], ["FU", 5, [1, 2, 3]], ["AN", 5, 1, 4], ["FU", 5, [2, 3, 4]], ["AN", 5, 2, 6], ["FU", 3, [0, 1, 2]], ["SP", 3, 0, 3, [1], 1], ["AN", 3, 1, 2], ["FFSP", 3, 0, [3, 2, 1], 1, 1], ["AN", 3, 1, 6], ["FU", 1, [0, 1, 2]], ["SP", 1, 0, 3, [1], 1], ["AN", 1, 1, 2], ["FFSP", 1, 0, [3, 2, 1], 1, 1], ["AN", 1, 1, 6], ["PR", 4, 0, "auto_unroll_max_step$16"]]]], "r": [[1.3737e-06], 0, 0.684246, 1691939118], "v": "v0.6"}
{"i": [["[\"matmul\", 9, 1, 1, 6, \"float32\"]", "cuda -keys=cuda,gpu -arch=sm_75 -max_num_threads=1024 -thread_warp_size=32", [-1, 16, 64, 49152, 2147483647, 1024, 8, 32], "", 0, []], [[], [["CHW", 2, "local"], ["SP", 2, 0, 9, [1, 1, 3, 3], 1], ["SP", 2, 5, 1, [1, 1, 1, 1], 1], ["SP", 2, 10, 6, [1, 2, 1, 3], 1], ["SP", 2, 15, 1, [1, 1], 1], ["RE", 2, [0, 5, 10, 1, 6, 11, 2, 7, 12, 15, 16, 3, 8, 13, 17, 4, 9, 14]], ["FSP", 3, 0, 1, 3], ["FSP", 3, 4, 2, 3], ["FSP", 3, 8, 3, 3], ["RE", 3, [0, 4, 8, 1, 5, 9, 2, 6, 10, 3, 7, 11]], ["CA", 2, 3, 8], ["CHR", 1, "shared", [2]], ["CA", 2, 3, 9], ["CHR", 0, "shared", [3]], ["CA", 1, 4, 9], ["FU", 5, [0, 1, 2]], ["AN", 5, 0, 5], ["FU", 5, [1, 2, 3]], ["AN", 5, 1, 4], ["FU", 5, [2, 3, 4]], ["AN", 5, 2, 6], ["FU", 3, [0, 1, 2]], ["SP", 3, 0, 9, [1], 1], ["AN", 3, 1, 2], ["FFSP", 3, 0, [3, 2, 1], 1, 1], ["AN", 3, 1, 6], ["FU", 1, [0, 1, 2]], ["SP", 1, 0, 9, [9], 1], ["AN", 1, 1, 2], ["FFSP", 1, 0, [3, 2, 1], 1, 1], ["AN", 1, 1, 6], ["PR", 4, 0, "auto_unroll_max_step$0"]]]], "r": [[1.60857e-06], 0, 0.675632, 1691939118], "v": "v0.6"}
{"i": [["[\"matmul\", 9, 1, 1, 6, \"float32\"]", "cuda -keys=cuda,gpu -arch=sm_75 -max_num_threads=1024 -thread_warp_size=32", [-1, 16, 64, 49152, 2147483647, 1024, 8, 32], "", 0, []], [[], [["CHW", 2, "local"], ["SP", 2, 0, 9, [1, 9, 1, 1], 1], ["SP", 2, 5, 1, [1, 1, 1, 1], 1], ["SP", 2, 10, 6, [1, 6, 1, 1], 1], ["SP", 2, 15, 1, [1, 1], 1], ["RE", 2, [0, 5, 10, 1, 6, 11, 2, 7, 12, 15, 16, 3, 8, 13, 17, 4, 9, 14]], ["FSP", 3, 0, 1, 3], ["FSP", 3, 4, 2, 3], ["FSP", 3, 8, 3, 3], ["RE", 3, [0, 4, 8, 1, 5, 9, 2, 6, 10, 3, 7, 11]], ["CA", 2, 3, 8], ["CHR", 1, "shared", [2]], ["CA", 2, 3, 9], ["CHR", 0, "shared", [3]], ["CA", 1, 4, 9], ["FU", 5, [0, 1, 2]], ["AN", 5, 0, 5], ["FU", 5, [1, 2, 3]], ["AN", 5, 1, 4], ["FU", 5, [2, 3, 4]], ["AN", 5, 2, 6], ["FU", 3, [0, 1, 2]], ["SP", 3, 0, 6, [3], 1], ["AN", 3, 1, 2], ["FFSP", 3, 0, [3, 2, 1], 1, 1], ["AN", 3, 1, 6], ["FU", 1, [0, 1, 2]], ["SP", 1, 0, 3, [1], 1], ["AN", 1, 1, 2], ["FFSP", 1, 0, [3, 2, 1], 1, 1], ["AN", 1, 1, 6], ["PR", 4, 0, "auto_unroll_max_step$64"]]]], "r": [[1.31573e-06], 0, 0.625143, 1691939119], "v": "v0.6"}
{"i": [["[\"matmul\", 9, 1, 1, 6, \"float32\"]", "cuda -keys=cuda,gpu -arch=sm_75 -max_num_threads=1024 -thread_warp_size=32", [-1, 16, 64, 49152, 2147483647, 1024, 8, 32], "", 0, []], [[], [["CHW", 2, "local"], ["SP", 2, 0, 9, [1, 1, 9, 1], 1], ["SP", 2, 5, 1, [1, 1, 1, 1], 1], ["SP", 2, 10, 6, [1, 1, 1, 6], 1], ["SP", 2, 15, 1, [1, 1], 1], ["RE", 2, [0, 5, 10, 1, 6, 11, 2, 7, 12, 15, 16, 3, 8, 13, 17, 4, 9, 14]], ["FSP", 3, 0, 1, 3], ["FSP", 3, 4, 2, 3], ["FSP", 3, 8, 3, 3], ["RE", 3, [0, 4, 8, 1, 5, 9, 2, 6, 10, 3, 7, 11]], ["CA", 2, 3, 8], ["CHR", 1, "shared", [2]], ["CA", 2, 3, 9], ["CHR", 0, "shared", [3]], ["CA", 1, 4, 9], ["FU", 5, [0, 1, 2]], ["AN", 5, 0, 5], ["FU", 5, [1, 2, 3]], ["AN", 5, 1, 4], ["FU", 5, [2, 3, 4]], ["AN", 5, 2, 6], ["FU", 3, [0, 1, 2]], ["SP", 3, 0, 18, [1], 1], ["AN", 3, 1, 2], ["FFSP", 3, 0, [3, 2, 1], 1, 1], ["AN", 3, 1, 6], ["FU", 1, [0, 1, 2]], ["SP", 1, 0, 3, [1], 1], ["AN", 1, 1, 2], ["FFSP", 1, 0, [3, 2, 1], 1, 1], ["AN", 1, 1, 6], ["PR", 4, 0, "auto_unroll_max_step$0"]]]], "r": [[1.92042e-06], 0, 0.58852, 1691939122], "v": "v0.6"}
{"i": [["[\"matmul\", 9, 1, 1, 6, \"float32\"]", "cuda -keys=cuda,gpu -arch=sm_75 -max_num_threads=1024 -thread_warp_size=32", [-1, 16, 64, 49152, 2147483647, 1024, 8, 32], "", 0, []], [[], [["CHW", 2, "local"], ["SP", 2, 0, 9, [3, 3, 1, 1], 1], ["SP", 2, 5, 1, [1, 1, 1, 1], 1], ["SP", 2, 10, 6, [2, 1, 1, 3], 1], ["SP", 2, 15, 1, [1, 1], 1], ["RE", 2, [0, 5, 10, 1, 6, 11, 2, 7, 12, 15, 16, 3, 8, 13, 17, 4, 9, 14]], ["FSP", 3, 0, 1, 3], ["FSP", 3, 4, 2, 3], ["FSP", 3, 8, 3, 3], ["RE", 3, [0, 4, 8, 1, 5, 9, 2, 6, 10, 3, 7, 11]], ["CA", 2, 3, 8], ["CHR", 1, "shared", [2]], ["CA", 2, 3, 9], ["CHR", 0, "shared", [3]], ["CA", 1, 4, 9], ["FU", 5, [0, 1, 2]], ["AN", 5, 0, 5], ["FU", 5, [1, 2, 3]], ["AN", 5, 1, 4], ["FU", 5, [2, 3, 4]], ["AN", 5, 2, 6], ["FU", 3, [0, 1, 2]], ["SP", 3, 0, 3, [1], 1], ["AN", 3, 1, 2], ["FFSP", 3, 0, [3, 2, 1], 1, 1], ["AN", 3, 1, 6], ["FU", 1, [0, 1, 2]], ["SP", 1, 0, 1, [1], 1], ["AN", 1, 1, 2], ["FFSP", 1, 0, [3, 2, 1], 1, 1], ["AN", 1, 1, 6], ["PR", 4, 0, "auto_unroll_max_step$16"]]]], "r": [[1.45036e-06], 0, 0.639831, 1691939122], "v": "v0.6"}
{"i": [["[\"matmul\", 9, 1, 1, 6, \"float32\"]", "cuda -keys=cuda,gpu -arch=sm_75 -max_num_threads=1024 -thread_warp_size=32", [-1, 16, 64, 49152, 2147483647, 1024, 8, 32], "", 0, []], [[], [["CHW", 2, "local"], ["SP", 2, 0, 9, [1, 1, 1, 3], 1], ["SP", 2, 5, 1, [1, 1, 1, 1], 1], ["SP", 2, 10, 6, [1, 6, 1, 1], 1], ["SP", 2, 15, 1, [1, 1], 1], ["RE", 2, [0, 5, 10, 1, 6, 11, 2, 7, 12, 15, 16, 3, 8, 13, 17, 4, 9, 14]], ["FSP", 3, 0, 1, 3], ["FSP", 3, 4, 2, 3], ["FSP", 3, 8, 3, 3], ["RE", 3, [0, 4, 8, 1, 5, 9, 2, 6, 10, 3, 7, 11]], ["CA", 2, 3, 8], ["CHR", 1, "shared", [2]], ["CA", 2, 3, 9], ["CHR", 0, "shared", [3]], ["CA", 1, 4, 9], ["FU", 5, [0, 1, 2]], ["AN", 5, 0, 5], ["FU", 5, [1, 2, 3]], ["AN", 5, 1, 4], ["FU", 5, [2, 3, 4]], ["AN", 5, 2, 6], ["FU", 3, [0, 1, 2]], ["SP", 3, 0, 9, [1], 1], ["AN", 3, 1, 2], ["FFSP", 3, 0, [3, 2, 1], 1, 1], ["AN", 3, 1, 6], ["FU", 1, [0, 1, 2]], ["SP", 1, 0, 3, [1], 1], ["AN", 1, 1, 2], ["FFSP", 1, 0, [3, 2, 1], 1, 1], ["AN", 1, 1, 6], ["PR", 4, 0, "auto_unroll_max_step$0"]]]], "r": [[1.3308e-06], 0, 0.493801, 1691939122], "v": "v0.6"}
{"i": [["[\"matmul\", 9, 1, 1, 6, \"float32\"]", "cuda -keys=cuda,gpu -arch=sm_75 -max_num_threads=1024 -thread_warp_size=32", [-1, 16, 64, 49152, 2147483647, 1024, 8, 32], "", 0, []], [[], [["CHW", 2, "local"], ["SP", 2, 0, 9, [1, 3, 1, 3], 1], ["SP", 2, 5, 1, [1, 1, 1, 1], 1], ["SP", 2, 10, 6, [3, 1, 1, 1], 1], ["SP", 2, 15, 1, [1, 1], 1], ["RE", 2, [0, 5, 10, 1, 6, 11, 2, 7, 12, 15, 16, 3, 8, 13, 17, 4, 9, 14]], ["FSP", 3, 0, 1, 3], ["FSP", 3, 4, 2, 3], ["FSP", 3, 8, 3, 3], ["RE", 3, [0, 4, 8, 1, 5, 9, 2, 6, 10, 3, 7, 11]], ["CA", 2, 3, 8], ["CHR", 1, "shared", [2]], ["CA", 2, 3, 9], ["CHR", 0, "shared", [3]], ["CA", 1, 4, 9], ["FU", 5, [0, 1, 2]], ["AN", 5, 0, 5], ["FU", 5, [1, 2, 3]], ["AN", 5, 1, 4], ["FU", 5, [2, 3, 4]], ["AN", 5, 2, 6], ["FU", 3, [0, 1, 2]], ["SP", 3, 0, 3, [1], 1], ["AN", 3, 1, 2], ["FFSP", 3, 0, [3, 2, 1], 1, 1], ["AN", 3, 1, 6], ["FU", 1, [0, 1, 2]], ["SP", 1, 0, 3, [1], 1], ["AN", 1, 1, 2], ["FFSP", 1, 0, [3, 2, 1], 1, 1], ["AN", 1, 1, 6], ["PR", 4, 0, "auto_unroll_max_step$16"]]]], "r": [[1.38622e-06], 0, 0.504119, 1691939123], "v": "v0.6"}
{"i": [["[\"matmul\", 9, 1, 1, 6, \"float32\"]", "cuda -keys=cuda,gpu -arch=sm_75 -max_num_threads=1024 -thread_warp_size=32", [-1, 16, 64, 49152, 2147483647, 1024, 8, 32], "", 0, []], [[], [["CHW", 2, "local"], ["SP", 2, 0, 9, [1, 3, 1, 3], 1], ["SP", 2, 5, 1, [1, 1, 1, 1], 1], ["SP", 2, 10, 6, [1, 2, 1, 3], 1], ["SP", 2, 15, 1, [1, 1], 1], ["RE", 2, [0, 5, 10, 1, 6, 11, 2, 7, 12, 15, 16, 3, 8, 13, 17, 4, 9, 14]], ["FSP", 3, 0, 1, 3], ["FSP", 3, 4, 2, 3], ["FSP", 3, 8, 3, 3], ["RE", 3, [0, 4, 8, 1, 5, 9, 2, 6, 10, 3, 7, 11]], ["CA", 2, 3, 8], ["CHR", 1, "shared", [2]], ["CA", 2, 3, 9], ["CHR", 0, "shared", [3]], ["CA", 1, 4, 9], ["FU", 5, [0, 1, 2]], ["AN", 5, 0, 5], ["FU", 5, [1, 2, 3]], ["AN", 5, 1, 4], ["FU", 5, [2, 3, 4]], ["AN", 5, 2, 6], ["FU", 3, [0, 1, 2]], ["SP", 3, 0, 9, [1], 1], ["AN", 3, 1, 2], ["FFSP", 3, 0, [3, 2, 1], 1, 1], ["AN", 3, 1, 6], ["FU", 1, [0, 1, 2]], ["SP", 1, 0, 3, [3], 1], ["AN", 1, 1, 2], ["FFSP", 1, 0, [3, 2, 1], 1, 1], ["AN", 1, 1, 6], ["PR", 4, 0, "auto_unroll_max_step$1024"]]]], "r": [[1.38873e-06], 0, 0.491203, 1691939123], "v": "v0.6"}
{"i": [["[\"matmul\", 9, 1, 1, 6, \"float32\"]", "cuda -keys=cuda,gpu -arch=sm_75 -max_num_threads=1024 -thread_warp_size=32", [-1, 16, 64, 49152, 2147483647, 1024, 8, 32], "", 0, []], [[], [["CHW", 2, "local"], ["SP", 2, 0, 9, [1, 3, 1, 3], 1], ["SP", 2, 5, 1, [1, 1, 1, 1], 1], ["SP", 2, 10, 6, [1, 3, 1, 2], 1], ["SP", 2, 15, 1, [1, 1], 1], ["RE", 2, [0, 5, 10, 1, 6, 11, 2, 7, 12, 15, 16, 3, 8, 13, 17, 4, 9, 14]], ["FSP", 3, 0, 1, 3], ["FSP", 3, 4, 2, 3], ["FSP", 3, 8, 3, 3], ["RE", 3, [0, 4, 8, 1, 5, 9, 2, 6, 10, 3, 7, 11]], ["CA", 2, 3, 8], ["CHR", 1, "shared", [2]], ["CA", 2, 3, 9], ["CHR", 0, "shared", [3]], ["CA", 1, 4, 9], ["FU", 5, [0, 1, 2]], ["AN", 5, 0, 5], ["FU", 5, [1, 2, 3]], ["AN", 5, 1, 4], ["FU", 5, [2, 3, 4]], ["AN", 5, 2, 6], ["FU", 3, [0, 1, 2]], ["SP", 3, 0, 6, [1], 1], ["AN", 3, 1, 2], ["FFSP", 3, 0, [3, 2, 1], 1, 1], ["AN", 3, 1, 6], ["FU", 1, [0, 1, 2]], ["SP", 1, 0, 3, [1], 1], ["AN", 1, 1, 2], ["FFSP", 1, 0, [3, 2, 1], 1, 1], ["AN", 1, 1, 6], ["PR", 4, 0, "auto_unroll_max_step$16"]]]], "r": [[1.36444e-06], 0, 0.640649, 1691939123], "v": "v0.6"}
{"i": [["[\"matmul\", 9, 1, 1, 6, \"float32\"]", "cuda -keys=cuda,gpu -arch=sm_75 -max_num_threads=1024 -thread_warp_size=32", [-1, 16, 64, 49152, 2147483647, 1024, 8, 32], "", 0, []], [[], [["CHW", 2, "local"], ["SP", 2, 0, 9, [1, 1, 1, 3], 1], ["SP", 2, 5, 1, [1, 1, 1, 1], 1], ["SP", 2, 10, 6, [2, 1, 3, 1], 1], ["SP", 2, 15, 1, [1, 1], 1], ["RE", 2, [0, 5, 10, 1, 6, 11, 2, 7, 12, 15, 16, 3, 8, 13, 17, 4, 9, 14]], ["FSP", 3, 0, 1, 3], ["FSP", 3, 4, 2, 3], ["FSP", 3, 8, 3, 3], ["RE", 3, [0, 4, 8, 1, 5, 9, 2, 6, 10, 3, 7, 11]], ["CA", 2, 3, 8], ["CHR", 1, "shared", [2]], ["CA", 2, 3, 9], ["CHR", 0, "shared", [3]], ["CA", 1, 4, 9], ["FU", 5, [0, 1, 2]], ["AN", 5, 0, 5], ["FU", 5, [1, 2, 3]], ["AN", 5, 1, 4], ["FU", 5, [2, 3, 4]], ["AN", 5, 2, 6], ["FU", 3, [0, 1, 2]], ["SP", 3, 0, 9, [1], 1], ["AN", 3, 1, 2], ["FFSP", 3, 0, [3, 2, 1], 1, 1], ["AN", 3, 1, 6], ["FU", 1, [0, 1, 2]], ["SP", 1, 0, 3, [1], 1], ["AN", 1, 1, 2], ["FFSP", 1, 0, [3, 2, 1], 1, 1], ["AN", 1, 1, 6], ["PR", 4, 0, "auto_unroll_max_step$16"]]]], "r": [[1.37853e-06], 0, 0.509246, 1691939123], "v": "v0.6"}
{"i": [["[\"matmul\", 9, 1, 1, 6, \"float32\"]", "cuda -keys=cuda,gpu -arch=sm_75 -max_num_threads=1024 -thread_warp_size=32", [-1, 16, 64, 49152, 2147483647, 1024, 8, 32], "", 0, []], [[], [["CHW", 2, "local"], ["SP", 2, 0, 9, [1, 3, 3, 1], 1], ["SP", 2, 5, 1, [1, 1, 1, 1], 1], ["SP", 2, 10, 6, [3, 1, 2, 1], 1], ["SP", 2, 15, 1, [1, 1], 1], ["RE", 2, [0, 5, 10, 1, 6, 11, 2, 7, 12, 15, 16, 3, 8, 13, 17, 4, 9, 14]], ["FSP", 3, 0, 1, 3], ["FSP", 3, 4, 2, 3], ["FSP", 3, 8, 3, 3], ["RE", 3, [0, 4, 8, 1, 5, 9, 2, 6, 10, 3, 7, 11]], ["CA", 2, 3, 8], ["CHR", 1, "shared", [2]], ["CA", 2, 3, 9], ["CHR", 0, "shared", [3]], ["CA", 1, 4, 9], ["FU", 5, [0, 1, 2]], ["AN", 5, 0, 5], ["FU", 5, [1, 2, 3]], ["AN", 5, 1, 4], ["FU", 5, [2, 3, 4]], ["AN", 5, 2, 6], ["FU", 3, [0, 1, 2]], ["SP", 3, 0, 18, [1], 1], ["AN", 3, 1, 2], ["FFSP", 3, 0, [3, 2, 1], 1, 1], ["AN", 3, 1, 6], ["FU", 1, [0, 1, 2]], ["SP", 1, 0, 3, [3], 1], ["AN", 1, 1, 2], ["FFSP", 1, 0, [3, 2, 1], 1, 1], ["AN", 1, 1, 6], ["PR", 4, 0, "auto_unroll_max_step$64"]]]], "r": [[1.45401e-06], 0, 0.705507, 1691939124], "v": "v0.6"}
{"i": [["[\"matmul\", 9, 1, 1, 6, \"float32\"]", "cuda -keys=cuda,gpu -arch=sm_75 -max_num_threads=1024 -thread_warp_size=32", [-1, 16, 64, 49152, 2147483647, 1024, 8, 32], "", 0, []], [[], [["CHW", 2, "local"], ["SP", 2, 0, 9, [1, 3, 3, 1], 1], ["SP", 2, 5, 1, [1, 1, 1, 1], 1], ["SP", 2, 10, 6, [1, 6, 1, 1], 1], ["SP", 2, 15, 1, [1, 1], 1], ["RE", 2, [0, 5, 10, 1, 6, 11, 2, 7, 12, 15, 16, 3, 8, 13, 17, 4, 9, 14]], ["FSP", 3, 0, 1, 3], ["FSP", 3, 4, 2, 3], ["FSP", 3, 8, 3, 3], ["RE", 3, [0, 4, 8, 1, 5, 9, 2, 6, 10, 3, 7, 11]], ["CA", 2, 3, 8], ["CHR", 1, "shared", [2]], ["CA", 2, 3, 9], ["CHR", 0, "shared", [3]], ["CA", 1, 4, 9], ["FU", 5, [0, 1, 2]], ["AN", 5, 0, 5], ["FU", 5, [1, 2, 3]], ["AN", 5, 1, 4], ["FU", 5, [2, 3, 4]], ["AN", 5, 2, 6], ["FU", 3, [0, 1, 2]], ["SP", 3, 0, 9, [1], 1], ["AN", 3, 1, 2], ["FFSP", 3, 0, [3, 2, 1], 1, 1], ["AN", 3, 1, 6], ["FU", 1, [0, 1, 2]], ["SP", 1, 0, 3, [3], 1], ["AN", 1, 1, 2], ["FFSP", 1, 0, [3, 2, 1], 1, 1], ["AN", 1, 1, 6], ["PR", 4, 0, "auto_unroll_max_step$512"]]]], "r": [[1.33879e-06], 0, 0.656559, 1691939124], "v": "v0.6"}
{"i": [["[\"matmul\", 9, 1, 1, 6, \"float32\"]", "cuda -keys=cuda,gpu -arch=sm_75 -max_num_threads=1024 -thread_warp_size=32", [-1, 16, 64, 49152, 2147483647, 1024, 8, 32], "", 0, []], [[], [["CHW", 2, "local"], ["SP", 2, 0, 9, [1, 3, 1, 1], 1], ["SP", 2, 5, 1, [1, 1, 1, 1], 1], ["SP", 2, 10, 6, [1, 3, 2, 1], 1], ["SP", 2, 15, 1, [1, 1], 1], ["RE", 2, [0, 5, 10, 1, 6, 11, 2, 7, 12, 15, 16, 3, 8, 13, 17, 4, 9, 14]], ["FSP", 3, 0, 1, 3], ["FSP", 3, 4, 2, 3], ["FSP", 3, 8, 3, 3], ["RE", 3, [0, 4, 8, 1, 5, 9, 2, 6, 10, 3, 7, 11]], ["CA", 2, 3, 8], ["CHR", 1, "shared", [2]], ["CA", 2, 3, 9], ["CHR", 0, "shared", [3]], ["CA", 1, 4, 9], ["FU", 5, [0, 1, 2]], ["AN", 5, 0, 5], ["FU", 5, [1, 2, 3]], ["AN", 5, 1, 4], ["FU", 5, [2, 3, 4]], ["AN", 5, 2, 6], ["FU", 3, [0, 1, 2]], ["SP", 3, 0, 6, [1], 1], ["AN", 3, 1, 2], ["FFSP", 3, 0, [3, 2, 1], 1, 1], ["AN", 3, 1, 6], ["FU", 1, [0, 1, 2]], ["SP", 1, 0, 3, [1], 1], ["AN", 1, 1, 2], ["FFSP", 1, 0, [3, 2, 1], 1, 1], ["AN", 1, 1, 6], ["PR", 4, 0, "auto_unroll_max_step$16"]]]], "r": [[1.30903e-06], 0, 0.629348, 1691939124], "v": "v0.6"}
{"i": [["[\"matmul\", 9, 1, 1, 6, \"float32\"]", "cuda -keys=cuda,gpu -arch=sm_75 -max_num_threads=1024 -thread_warp_size=32", [-1, 16, 64, 49152, 2147483647, 1024, 8, 32], "", 0, []], [[], [["CHW", 2, "local"], ["SP", 2, 0, 9, [1, 1, 3, 3], 1], ["SP", 2, 5, 1, [1, 1, 1, 1], 1], ["SP", 2, 10, 6, [1, 6, 1, 1], 1], ["SP", 2, 15, 1, [1, 1], 1], ["RE", 2, [0, 5, 10, 1, 6, 11, 2, 7, 12, 15, 16, 3, 8, 13, 17, 4, 9, 14]], ["FSP", 3, 0, 1, 3], ["FSP", 3, 4, 2, 3], ["FSP", 3, 8, 3, 3], ["RE", 3, [0, 4, 8, 1, 5, 9, 2, 6, 10, 3, 7, 11]], ["CA", 2, 3, 8], ["CHR", 1, "shared", [2]], ["CA", 2, 3, 9], ["CHR", 0, "shared", [3]], ["CA", 1, 4, 9], ["FU", 5, [0, 1, 2]], ["AN", 5, 0, 5], ["FU", 5, [1, 2, 3]], ["AN", 5, 1, 4], ["FU", 5, [2, 3, 4]], ["AN", 5, 2, 6], ["FU", 3, [0, 1, 2]], ["SP", 3, 0, 1, [1], 1], ["AN", 3, 1, 2], ["FFSP", 3, 0, [3, 2, 1], 1, 1], ["AN", 3, 1, 6], ["FU", 1, [0, 1, 2]], ["SP", 1, 0, 1, [1], 1], ["AN", 1, 1, 2], ["FFSP", 1, 0, [3, 2, 1], 1, 1], ["AN", 1, 1, 6], ["PR", 4, 0, "auto_unroll_max_step$0"]]]], "r": [[1.38771e-06], 0, 0.484039, 1691939125], "v": "v0.6"}
{"i": [["[\"matmul\", 9, 1, 1, 6, \"float32\"]", "cuda -keys=cuda,gpu -arch=sm_75 -max_num_threads=1024 -thread_warp_size=32", [-1, 16, 64, 49152, 2147483647, 1024, 8, 32], "", 0, []], [[], [["CHW", 2, "local"], ["SP", 2, 0, 9, [9, 1, 1, 1], 1], ["SP", 2, 5, 1, [1, 1, 1, 1], 1], ["SP", 2, 10, 6, [1, 3, 2, 1], 1], ["SP", 2, 15, 1, [1, 1], 1], ["RE", 2, [0, 5, 10, 1, 6, 11, 2, 7, 12, 15, 16, 3, 8, 13, 17, 4, 9, 14]], ["FSP", 3, 0, 1, 3], ["FSP", 3, 4, 2, 3], ["FSP", 3, 8, 3, 3], ["RE", 3, [0, 4, 8, 1, 5, 9, 2, 6, 10, 3, 7, 11]], ["CA", 2, 3, 8], ["CHR", 1, "shared", [2]], ["CA", 2, 3, 9], ["CHR", 0, "shared", [3]], ["CA", 1, 4, 9], ["FU", 5, [0, 1, 2]], ["AN", 5, 0, 5], ["FU", 5, [1, 2, 3]], ["AN", 5, 1, 4], ["FU", 5, [2, 3, 4]], ["AN", 5, 2, 6], ["FU", 3, [0, 1, 2]], ["SP", 3, 0, 1, [1], 1], ["AN", 3, 1, 2], ["FFSP", 3, 0, [3, 2, 1], 1, 1], ["AN", 3, 1, 6], ["FU", 1, [0, 1, 2]], ["SP", 1, 0, 1, [1], 1], ["AN", 1, 1, 2], ["FFSP", 1, 0, [3, 2, 1], 1, 1], ["AN", 1, 1, 6], ["PR", 4, 0, "auto_unroll_max_step$0"]]]], "r": [[1.44971e-06], 0, 0.503785, 1691939125], "v": "v0.6"}
{"i": [["[\"matmul\", 9, 1, 1, 6, \"float32\"]", "cuda -keys=cuda,gpu -arch=sm_75 -max_num_threads=1024 -thread_warp_size=32", [-1, 16, 64, 49152, 2147483647, 1024, 8, 32], "", 0, []], [[], [["CHW", 2, "local"], ["SP", 2, 0, 9, [1, 1, 1, 3], 1], ["SP", 2, 5, 1, [1, 1, 1, 1], 1], ["SP", 2, 10, 6, [1, 1, 3, 2], 1], ["SP", 2, 15, 1, [1, 1], 1], ["RE", 2, [0, 5, 10, 1, 6, 11, 2, 7, 12, 15, 16, 3, 8, 13, 17, 4, 9, 14]], ["FSP", 3, 0, 1, 3], ["FSP", 3, 4, 2, 3], ["FSP", 3, 8, 3, 3], ["RE", 3, [0, 4, 8, 1, 5, 9, 2, 6, 10, 3, 7, 11]], ["CA", 2, 3, 8], ["CHR", 1, "shared", [2]], ["CA", 2, 3, 9], ["CHR", 0, "shared", [3]], ["CA", 1, 4, 9], ["FU", 5, [0, 1, 2]], ["AN", 5, 0, 5], ["FU", 5, [1, 2, 3]], ["AN", 5, 1, 4], ["FU", 5, [2, 3, 4]], ["AN", 5, 2, 6], ["FU", 3, [0, 1, 2]], ["SP", 3, 0, 18, [1], 1], ["AN", 3, 1, 2], ["FFSP", 3, 0, [3, 2, 1], 1, 1], ["AN", 3, 1, 6], ["FU", 1, [0, 1, 2]], ["SP", 1, 0, 3, [1], 1], ["AN", 1, 1, 2], ["FFSP", 1, 0, [3, 2, 1], 1, 1], ["AN", 1, 1, 6], ["PR", 4, 0, "auto_unroll_max_step$16"]]]], "r": [[1.3791e-06], 0, 0.646575, 1691939125], "v": "v0.6"}
{"i": [["[\"matmul\", 9, 1, 1, 6, \"float32\"]", "cuda -keys=cuda,gpu -arch=sm_75 -max_num_threads=1024 -thread_warp_size=32", [-1, 16, 64, 49152, 2147483647, 1024, 8, 32], "", 0, []], [[], [["CHW", 2, "local"], ["SP", 2, 0, 9, [1, 9, 1, 1], 1], ["SP", 2, 5, 1, [1, 1, 1, 1], 1], ["SP", 2, 10, 6, [1, 1, 1, 3], 1], ["SP", 2, 15, 1, [1, 1], 1], ["RE", 2, [0, 5, 10, 1, 6, 11, 2, 7, 12, 15, 16, 3, 8, 13, 17, 4, 9, 14]], ["FSP", 3, 0, 1, 3], ["FSP", 3, 4, 2, 3], ["FSP", 3, 8, 3, 3], ["RE", 3, [0, 4, 8, 1, 5, 9, 2, 6, 10, 3, 7, 11]], ["CA", 2, 3, 8], ["CHR", 1, "shared", [2]], ["CA", 2, 3, 9], ["CHR", 0, "shared", [3]], ["CA", 1, 4, 9], ["FU", 5, [0, 1, 2]], ["AN", 5, 0, 5], ["FU", 5, [1, 2, 3]], ["AN", 5, 1, 4], ["FU", 5, [2, 3, 4]], ["AN", 5, 2, 6], ["FU", 3, [0, 1, 2]], ["SP", 3, 0, 3, [3], 1], ["AN", 3, 1, 2], ["FFSP", 3, 0, [3, 2, 1], 1, 1], ["AN", 3, 1, 6], ["FU", 1, [0, 1, 2]], ["SP", 1, 0, 1, [1], 1], ["AN", 1, 1, 2], ["FFSP", 1, 0, [3, 2, 1], 1, 1], ["AN", 1, 1, 6], ["PR", 4, 0, "auto_unroll_max_step$1024"]]]], "r": [[1.31931e-06], 0, 0.626561, 1691939125], "v": "v0.6"}
{"i": [["[\"matmul\", 9, 1, 1, 6, \"float32\"]", "cuda -keys=cuda,gpu -arch=sm_75 -max_num_threads=1024 -thread_warp_size=32", [-1, 16, 64, 49152, 2147483647, 1024, 8, 32], "", 0, []], [[], [["CHW", 2, "local"], ["SP", 2, 0, 9, [1, 3, 1, 1], 1], ["SP", 2, 5, 1, [1, 1, 1, 1], 1], ["SP", 2, 10, 6, [2, 3, 1, 1], 1], ["SP", 2, 15, 1, [1, 1], 1], ["RE", 2, [0, 5, 10, 1, 6, 11, 2, 7, 12, 15, 16, 3, 8, 13, 17, 4, 9, 14]], ["FSP", 3, 0, 1, 3], ["FSP", 3, 4, 2, 3], ["FSP", 3, 8, 3, 3], ["RE", 3, [0, 4, 8, 1, 5, 9, 2, 6, 10, 3, 7, 11]], ["CA", 2, 3, 8], ["CHR", 1, "shared", [2]], ["CA", 2, 3, 9], ["CHR", 0, "shared", [3]], ["CA", 1, 4, 9], ["FU", 5, [0, 1, 2]], ["AN", 5, 0, 5], ["FU", 5, [1, 2, 3]], ["AN", 5, 1, 4], ["FU", 5, [2, 3, 4]], ["AN", 5, 2, 6], ["FU", 3, [0, 1, 2]], ["SP", 3, 0, 3, [1], 1], ["AN", 3, 1, 2], ["FFSP", 3, 0, [3, 2, 1], 1, 1], ["AN", 3, 1, 6], ["FU", 1, [0, 1, 2]], ["SP", 1, 0, 3, [1], 1], ["AN", 1, 1, 2], ["FFSP", 1, 0, [3, 2, 1], 1, 1], ["AN", 1, 1, 6], ["PR", 4, 0, "auto_unroll_max_step$0"]]]], "r": [[1.31295e-06], 0, 0.650363, 1691939126], "v": "v0.6"}
{"i": [["[\"matmul\", 9, 1, 1, 6, \"float32\"]", "cuda -keys=cuda,gpu -arch=sm_75 -max_num_threads=1024 -thread_warp_size=32", [-1, 16, 64, 49152, 2147483647, 1024, 8, 32], "", 0, []], [[], [["CHW", 2, "local"], ["SP", 2, 0, 9, [1, 3, 1, 3], 1], ["SP", 2, 5, 1, [1, 1, 1, 1], 1], ["SP", 2, 10, 6, [1, 3, 1, 1], 1], ["SP", 2, 15, 1, [1, 1], 1], ["RE", 2, [0, 5, 10, 1, 6, 11, 2, 7, 12, 15, 16, 3, 8, 13, 17, 4, 9, 14]], ["FSP", 3, 0, 1, 3], ["FSP", 3, 4, 2, 3], ["FSP", 3, 8, 3, 3], ["RE", 3, [0, 4, 8, 1, 5, 9, 2, 6, 10, 3, 7, 11]], ["CA", 2, 3, 8], ["CHR", 1, "shared", [2]], ["CA", 2, 3, 9], ["CHR", 0, "shared", [3]], ["CA", 1, 4, 9], ["FU", 5, [0, 1, 2]], ["AN", 5, 0, 5], ["FU", 5, [1, 2, 3]], ["AN", 5, 1, 4], ["FU", 5, [2, 3, 4]], ["AN", 5, 2, 6], ["FU", 3, [0, 1, 2]], ["SP", 3, 0, 3, [1], 1], ["AN", 3, 1, 2], ["FFSP", 3, 0, [3, 2, 1], 1, 1], ["AN", 3, 1, 6], ["FU", 1, [0, 1, 2]], ["SP", 1, 0, 3, [1], 1], ["AN", 1, 1, 2], ["FFSP", 1, 0, [3, 2, 1], 1, 1], ["AN", 1, 1, 6], ["PR", 4, 0, "auto_unroll_max_step$16"]]]], "r": [[1.32845e-06], 0, 0.606769, 1691939126], "v": "v0.6"}
{"i": [["[\"matmul\", 9, 1, 1, 6, \"float32\"]", "cuda -keys=cuda,gpu -arch=sm_75 -max_num_threads=1024 -thread_warp_size=32", [-1, 16, 64, 49152, 2147483647, 1024, 8, 32], "", 0, []], [[], [["CHW", 2, "local"], ["SP", 2, 0, 9, [1, 1, 9, 1], 1], ["SP", 2, 5, 1, [1, 1, 1, 1], 1], ["SP", 2, 10, 6, [1, 2, 1, 3], 1], ["SP", 2, 15, 1, [1, 1], 1], ["RE", 2, [0, 5, 10, 1, 6, 11, 2, 7, 12, 15, 16, 3, 8, 13, 17, 4, 9, 14]], ["FSP", 3, 0, 1, 3], ["FSP", 3, 4, 2, 3], ["FSP", 3, 8, 3, 3], ["RE", 3, [0, 4, 8, 1, 5, 9, 2, 6, 10, 3, 7, 11]], ["CA", 2, 3, 8], ["CHR", 1, "shared", [2]], ["CA", 2, 3, 9], ["CHR", 0, "shared", [3]], ["CA", 1, 4, 9], ["FU", 5, [0, 1, 2]], ["AN", 5, 0, 5], ["FU", 5, [1, 2, 3]], ["AN", 5, 1, 4], ["FU", 5, [2, 3, 4]], ["AN", 5, 2, 6], ["FU", 3, [0, 1, 2]], ["SP", 3, 0, 54, [1], 1], ["AN", 3, 1, 2], ["FFSP", 3, 0, [3, 2, 1], 1, 1], ["AN", 3, 1, 6], ["FU", 1, [0, 1, 2]], ["SP", 1, 0, 9, [1], 1], ["AN", 1, 1, 2], ["FFSP", 1, 0, [3, 2, 1], 1, 1], ["AN", 1, 1, 6], ["PR", 4, 0, "auto_unroll_max_step$0"]]]], "r": [[1.60809e-06], 0, 0.789693, 1691939129], "v": "v0.6"}
{"i": [["[\"matmul\", 9, 1, 1, 6, \"float32\"]", "cuda -keys=cuda,gpu -arch=sm_75 -max_num_threads=1024 -thread_warp_size=32", [-1, 16, 64, 49152, 2147483647, 1024, 8, 32], "", 0, []], [[], [["CHW", 2, "local"], ["SP", 2, 0, 9, [1, 1, 3, 3], 1], ["SP", 2, 5, 1, [1, 1, 1, 1], 1], ["SP", 2, 10, 6, [1, 1, 3, 1], 1], ["SP", 2, 15, 1, [1, 1], 1], ["RE", 2, [0, 5, 10, 1, 6, 11, 2, 7, 12, 15, 16, 3, 8, 13, 17, 4, 9, 14]], ["FSP", 3, 0, 1, 3], ["FSP", 3, 4, 2, 3], ["FSP", 3, 8, 3, 3], ["RE", 3, [0, 4, 8, 1, 5, 9, 2, 6, 10, 3, 7, 11]], ["CA", 2, 3, 8], ["CHR", 1, "shared", [2]], ["CA", 2, 3, 9], ["CHR", 0, "shared", [3]], ["CA", 1, 4, 9], ["FU", 5, [0, 1, 2]], ["AN", 5, 0, 5], ["FU", 5, [1, 2, 3]], ["AN", 5, 1, 4], ["FU", 5, [2, 3, 4]], ["AN", 5, 2, 6], ["FU", 3, [0, 1, 2]], ["SP", 3, 0, 27, [1], 1], ["AN", 3, 1, 2], ["FFSP", 3, 0, [3, 2, 1], 1, 1], ["AN", 3, 1, 6], ["FU", 1, [0, 1, 2]], ["SP", 1, 0, 9, [1], 1], ["AN", 1, 1, 2], ["FFSP", 1, 0, [3, 2, 1], 1, 1], ["AN", 1, 1, 6], ["PR", 4, 0, "auto_unroll_max_step$512"]]]], "r": [[1.47752e-06], 0, 0.5483, 1691939130], "v": "v0.6"}
{"i": [["[\"matmul\", 9, 1, 1, 6, \"float32\"]", "cuda -keys=cuda,gpu -arch=sm_75 -max_num_threads=1024 -thread_warp_size=32", [-1, 16, 64, 49152, 2147483647, 1024, 8, 32], "", 0, []], [[], [["CHW", 2, "local"], ["SP", 2, 0, 9, [3, 1, 1, 3], 1], ["SP", 2, 5, 1, [1, 1, 1, 1], 1], ["SP", 2, 10, 6, [3, 1, 1, 1], 1], ["SP", 2, 15, 1, [1, 1], 1], ["RE", 2, [0, 5, 10, 1, 6, 11, 2, 7, 12, 15, 16, 3, 8, 13, 17, 4, 9, 14]], ["FSP", 3, 0, 1, 3], ["FSP", 3, 4, 2, 3], ["FSP", 3, 8, 3, 3], ["RE", 3, [0, 4, 8, 1, 5, 9, 2, 6, 10, 3, 7, 11]], ["CA", 2, 3, 8], ["CHR", 1, "shared", [2]], ["CA", 2, 3, 9], ["CHR", 0, "shared", [3]], ["CA", 1, 4, 9], ["FU", 5, [0, 1, 2]], ["AN", 5, 0, 5], ["FU", 5, [1, 2, 3]], ["AN", 5, 1, 4], ["FU", 5, [2, 3, 4]], ["AN", 5, 2, 6], ["FU", 3, [0, 1, 2]], ["SP", 3, 0, 3, [1], 1], ["AN", 3, 1, 2], ["FFSP", 3, 0, [3, 2, 1], 1, 1], ["AN", 3, 1, 6], ["FU", 1, [0, 1, 2]], ["SP", 1, 0, 3, [3], 1], ["AN", 1, 1, 2], ["FFSP", 1, 0, [3, 2, 1], 1, 1], ["AN", 1, 1, 6], ["PR", 4, 0, "auto_unroll_max_step$0"]]]], "r": [[2.34942e-06], 0, 0.596467, 1691939130], "v": "v0.6"}
{"i": [["[\"matmul\", 9, 1, 1, 6, \"float32\"]", "cuda -keys=cuda,gpu -arch=sm_75 -max_num_threads=1024 -thread_warp_size=32", [-1, 16, 64, 49152, 2147483647, 1024, 8, 32], "", 0, []], [[], [["CHW", 2, "local"], ["SP", 2, 0, 9, [9, 1, 1, 1], 1], ["SP", 2, 5, 1, [1, 1, 1, 1], 1], ["SP", 2, 10, 6, [1, 1, 2, 1], 1], ["SP", 2, 15, 1, [1, 1], 1], ["RE", 2, [0, 5, 10, 1, 6, 11, 2, 7, 12, 15, 16, 3, 8, 13, 17, 4, 9, 14]], ["FSP", 3, 0, 1, 3], ["FSP", 3, 4, 2, 3], ["FSP", 3, 8, 3, 3], ["RE", 3, [0, 4, 8, 1, 5, 9, 2, 6, 10, 3, 7, 11]], ["CA", 2, 3, 8], ["CHR", 1, "shared", [2]], ["CA", 2, 3, 9], ["CHR", 0, "shared", [3]], ["CA", 1, 4, 9], ["FU", 5, [0, 1, 2]], ["AN", 5, 0, 5], ["FU", 5, [1, 2, 3]], ["AN", 5, 1, 4], ["FU", 5, [2, 3, 4]], ["AN", 5, 2, 6], ["FU", 3, [0, 1, 2]], ["SP", 3, 0, 6, [1], 1], ["AN", 3, 1, 2], ["FFSP", 3, 0, [3, 2, 1], 1, 1], ["AN", 3, 1, 6], ["FU", 1, [0, 1, 2]], ["SP", 1, 0, 3, [1], 1], ["AN", 1, 1, 2], ["FFSP", 1, 0, [3, 2, 1], 1, 1], ["AN", 1, 1, 6], ["PR", 4, 0, "auto_unroll_max_step$512"]]]], "r": [[1.4118e-06], 0, 0.70166, 1691939130], "v": "v0.6"}
{"i": [["[\"matmul\", 9, 1, 1, 6, \"float32\"]", "cuda -keys=cuda,gpu -arch=sm_75 -max_num_threads=1024 -thread_warp_size=32", [-1, 16, 64, 49152, 2147483647, 1024, 8, 32], "", 0, []], [[], [["CHW", 2, "local"], ["SP", 2, 0, 9, [1, 9, 1, 1], 1], ["SP", 2, 5, 1, [1, 1, 1, 1], 1], ["SP", 2, 10, 6, [1, 1, 3, 2], 1], ["SP", 2, 15, 1, [1, 1], 1], ["RE", 2, [0, 5, 10, 1, 6, 11, 2, 7, 12, 15, 16, 3, 8, 13, 17, 4, 9, 14]], ["FSP", 3, 0, 1, 3], ["FSP", 3, 4, 2, 3], ["FSP", 3, 8, 3, 3], ["RE", 3, [0, 4, 8, 1, 5, 9, 2, 6, 10, 3, 7, 11]], ["CA", 2, 3, 8], ["CHR", 1, "shared", [2]], ["CA", 2, 3, 9], ["CHR", 0, "shared", [3]], ["CA", 1, 4, 9], ["FU", 5, [0, 1, 2]], ["AN", 5, 0, 5], ["FU", 5, [1, 2, 3]], ["AN", 5, 1, 4], ["FU", 5, [2, 3, 4]], ["AN", 5, 2, 6], ["FU", 3, [0, 1, 2]], ["SP", 3, 0, 18, [1], 1], ["AN", 3, 1, 2], ["FFSP", 3, 0, [3, 2, 1], 1, 1], ["AN", 3, 1, 6], ["FU", 1, [0, 1, 2]], ["SP", 1, 0, 3, [1], 1], ["AN", 1, 1, 2], ["FFSP", 1, 0, [3, 2, 1], 1, 1], ["AN", 1, 1, 6], ["PR", 4, 0, "auto_unroll_max_step$512"]]]], "r": [[1.35356e-06], 0, 0.722382, 1691939131], "v": "v0.6"}
{"i": [["[\"matmul\", 9, 1, 1, 6, \"float32\"]", "cuda -keys=cuda,gpu -arch=sm_75 -max_num_threads=1024 -thread_warp_size=32", [-1, 16, 64, 49152, 2147483647, 1024, 8, 32], "", 0, []], [[], [["CHW", 2, "local"], ["SP", 2, 0, 9, [1, 1, 1, 1], 1], ["SP", 2, 5, 1, [1, 1, 1, 1], 1], ["SP", 2, 10, 6, [1, 1, 1, 2], 1], ["SP", 2, 15, 1, [1, 1], 1], ["RE", 2, [0, 5, 10, 1, 6, 11, 2, 7, 12, 15, 16, 3, 8, 13, 17, 4, 9, 14]], ["FSP", 3, 0, 1, 3], ["FSP", 3, 4, 2, 3], ["FSP", 3, 8, 3, 3], ["RE", 3, [0, 4, 8, 1, 5, 9, 2, 6, 10, 3, 7, 11]], ["CA", 2, 3, 8], ["CHR", 1, "shared", [2]], ["CA", 2, 3, 9], ["CHR", 0, "shared", [3]], ["CA", 1, 4, 9], ["FU", 5, [0, 1, 2]], ["AN", 5, 0, 5], ["FU", 5, [1, 2, 3]], ["AN", 5, 1, 4], ["FU", 5, [2, 3, 4]], ["AN", 5, 2, 6], ["FU", 3, [0, 1, 2]], ["SP", 3, 0, 2, [2], 1], ["AN", 3, 1, 2], ["FFSP", 3, 0, [3, 2, 1], 1, 1], ["AN", 3, 1, 6], ["FU", 1, [0, 1, 2]], ["SP", 1, 0, 1, [1], 1], ["AN", 1, 1, 2], ["FFSP", 1, 0, [3, 2, 1], 1, 1], ["AN", 1, 1, 6], ["PR", 4, 0, "auto_unroll_max_step$16"]]]], "r": [[1.34276e-06], 0, 0.541988, 1691939131], "v": "v0.6"}
{"i": [["[\"matmul\", 9, 1, 1, 6, \"float32\"]", "cuda -keys=cuda,gpu -arch=sm_75 -max_num_threads=1024 -thread_warp_size=32", [-1, 16, 64, 49152, 2147483647, 1024, 8, 32], "", 0, []], [[], [["CHW", 2, "local"], ["SP", 2, 0, 9, [1, 1, 1, 1], 1], ["SP", 2, 5, 1, [1, 1, 1, 1], 1], ["SP", 2, 10, 6, [1, 3, 1, 1], 1], ["SP", 2, 15, 1, [1, 1], 1], ["RE", 2, [0, 5, 10, 1, 6, 11, 2, 7, 12, 15, 16, 3, 8, 13, 17, 4, 9, 14]], ["FSP", 3, 0, 1, 3], ["FSP", 3, 4, 2, 3], ["FSP", 3, 8, 3, 3], ["RE", 3, [0, 4, 8, 1, 5, 9, 2, 6, 10, 3, 7, 11]], ["CA", 2, 3, 8], ["CHR", 1, "shared", [2]], ["CA", 2, 3, 9], ["CHR", 0, "shared", [3]], ["CA", 1, 4, 9], ["FU", 5, [0, 1, 2]], ["AN", 5, 0, 5], ["FU", 5, [1, 2, 3]], ["AN", 5, 1, 4], ["FU", 5, [2, 3, 4]], ["AN", 5, 2, 6], ["FU", 3, [0, 1, 2]], ["SP", 3, 0, 9, [1], 1], ["AN", 3, 1, 2], ["FFSP", 3, 0, [3, 2, 1], 1, 1], ["AN", 3, 1, 6], ["FU", 1, [0, 1, 2]], ["SP", 1, 0, 9, [1], 1], ["AN", 1, 1, 2], ["FFSP", 1, 0, [3, 2, 1], 1, 1], ["AN", 1, 1, 6], ["PR", 4, 0, "auto_unroll_max_step$0"]]]], "r": [[1.32708e-06], 0, 0.76625, 1691939131], "v": "v0.6"}
{"i": [["[\"matmul\", 9, 1, 1, 6, \"float32\"]", "cuda -keys=cuda,gpu -arch=sm_75 -max_num_threads=1024 -thread_warp_size=32", [-1, 16, 64, 49152, 2147483647, 1024, 8, 32], "", 0, []], [[], [["CHW", 2, "local"], ["SP", 2, 0, 9, [1, 1, 3, 1], 1], ["SP", 2, 5, 1, [1, 1, 1, 1], 1], ["SP", 2, 10, 6, [1, 1, 2, 1], 1], ["SP", 2, 15, 1, [1, 1], 1], ["RE", 2, [0, 5, 10, 1, 6, 11, 2, 7, 12, 15, 16, 3, 8, 13, 17, 4, 9, 14]], ["FSP", 3, 0, 1, 3], ["FSP", 3, 4, 2, 3], ["FSP", 3, 8, 3, 3], ["RE", 3, [0, 4, 8, 1, 5, 9, 2, 6, 10, 3, 7, 11]], ["CA", 2, 3, 8], ["CHR", 1, "shared", [2]], ["CA", 2, 3, 9], ["CHR", 0, "shared", [3]], ["CA", 1, 4, 9], ["FU", 5, [0, 1, 2]], ["AN", 5, 0, 5], ["FU", 5, [1, 2, 3]], ["AN", 5, 1, 4], ["FU", 5, [2, 3, 4]], ["AN", 5, 2, 6], ["FU", 3, [0, 1, 2]], ["SP", 3, 0, 6, [1], 1], ["AN", 3, 1, 2], ["FFSP", 3, 0, [3, 2, 1], 1, 1], ["AN", 3, 1, 6], ["FU", 1, [0, 1, 2]], ["SP", 1, 0, 3, [1], 1], ["AN", 1, 1, 2], ["FFSP", 1, 0, [3, 2, 1], 1, 1], ["AN", 1, 1, 6], ["PR", 4, 0, "auto_unroll_max_step$64"]]]], "r": [[1.37178e-06], 0, 0.534101, 1691939131], "v": "v0.6"}
{"i": [["[\"matmul\", 9, 1, 1, 6, \"float32\"]", "cuda -keys=cuda,gpu -arch=sm_75 -max_num_threads=1024 -thread_warp_size=32", [-1, 16, 64, 49152, 2147483647, 1024, 8, 32], "", 0, []], [[], [["CHW", 2, "local"], ["SP", 2, 0, 9, [3, 1, 1, 3], 1], ["SP", 2, 5, 1, [1, 1, 1, 1], 1], ["SP", 2, 10, 6, [1, 1, 1, 3], 1], ["SP", 2, 15, 1, [1, 1], 1], ["RE", 2, [0, 5, 10, 1, 6, 11, 2, 7, 12, 15, 16, 3, 8, 13, 17, 4, 9, 14]], ["FSP", 3, 0, 1, 3], ["FSP", 3, 4, 2, 3], ["FSP", 3, 8, 3, 3], ["RE", 3, [0, 4, 8, 1, 5, 9, 2, 6, 10, 3, 7, 11]], ["CA", 2, 3, 8], ["CHR", 1, "shared", [2]], ["CA", 2, 3, 9], ["CHR", 0, "shared", [3]], ["CA", 1, 4, 9], ["FU", 5, [0, 1, 2]], ["AN", 5, 0, 5], ["FU", 5, [1, 2, 3]], ["AN", 5, 1, 4], ["FU", 5, [2, 3, 4]], ["AN", 5, 2, 6], ["FU", 3, [0, 1, 2]], ["SP", 3, 0, 9, [1], 1], ["AN", 3, 1, 2], ["FFSP", 3, 0, [3, 2, 1], 1, 1], ["AN", 3, 1, 6], ["FU", 1, [0, 1, 2]], ["SP", 1, 0, 3, [1], 1], ["AN", 1, 1, 2], ["FFSP", 1, 0, [3, 2, 1], 1, 1], ["AN", 1, 1, 6], ["PR", 4, 0, "auto_unroll_max_step$1024"]]]], "r": [[1.48245e-06], 0, 0.713198, 1691939132], "v": "v0.6"}
{"i": [["[\"matmul\", 9, 1, 1, 6, \"float32\"]", "cuda -keys=cuda,gpu -arch=sm_75 -max_num_threads=1024 -thread_warp_size=32", [-1, 16, 64, 49152, 2147483647, 1024, 8, 32], "", 0, []], [[], [["CHW", 2, "local"], ["SP", 2, 0, 9, [1, 1, 1, 3], 1], ["SP", 2, 5, 1, [1, 1, 1, 1], 1], ["SP", 2, 10, 6, [1, 1, 3, 2], 1], ["SP", 2, 15, 1, [1, 1], 1], ["RE", 2, [0, 5, 10, 1, 6, 11, 2, 7, 12, 15, 16, 3, 8, 13, 17, 4, 9, 14]], ["FSP", 3, 0, 1, 3], ["FSP", 3, 4, 2, 3], ["FSP", 3, 8, 3, 3], ["RE", 3, [0, 4, 8, 1, 5, 9, 2, 6, 10, 3, 7, 11]], ["CA", 2, 3, 8], ["CHR", 1, "shared", [2]], ["CA", 2, 3, 9], ["CHR", 0, "shared", [3]], ["CA", 1, 4, 9], ["FU", 5, [0, 1, 2]], ["AN", 5, 0, 5], ["FU", 5, [1, 2, 3]], ["AN", 5, 1, 4], ["FU", 5, [2, 3, 4]], ["AN", 5, 2, 6], ["FU", 3, [0, 1, 2]], ["SP", 3, 0, 6, [2], 1], ["AN", 3, 1, 2], ["FFSP", 3, 0, [3, 2, 1], 1, 1], ["AN", 3, 1, 6], ["FU", 1, [0, 1, 2]], ["SP", 1, 0, 3, [1], 1], ["AN", 1, 1, 2], ["FFSP", 1, 0, [3, 2, 1], 1, 1], ["AN", 1, 1, 6], ["PR", 4, 0, "auto_unroll_max_step$64"]]]], "r": [[1.37988e-06], 0, 0.501272, 1691939132], "v": "v0.6"}
