op-work/GPU_expr/Ansor_naive/记录文件/matmul_67_67_3.json
{"i": [["[\"matmul\", 67, 67, 3, \"float32\"]", "cuda -keys=cuda,gpu -arch=sm_75 -max_num_threads=1024 -thread_warp_size=32", [-1, 16, 64, 49152, 2147483647, 1024, 8, 32], "", 0, []], [[], [["CHW", 2, "local"], ["SP", 2, 0, 67, [1, 67, 1, 1], 1], ["SP", 2, 5, 3, [1, 3, 1, 1], 1], ["SP", 2, 10, 67, [1, 1], 1], ["RE", 2, [0, 5, 1, 6, 2, 7, 10, 11, 3, 8, 12, 4, 9]], ["FSP", 3, 0, 1, 3], ["FSP", 3, 4, 2, 3], ["RE", 3, [0, 4, 1, 5, 2, 6, 3, 7]], ["CA", 2, 3, 5], ["CHR", 1, "shared", [2]], ["CA", 2, 3, 6], ["CHR", 0, "shared", [3]], ["CA", 1, 4, 6], ["FU", 5, [0, 1]], ["AN", 5, 0, 5], ["FU", 5, [1, 2]], ["AN", 5, 1, 4], ["FU", 5, [2, 3]], ["AN", 5, 2, 6], ["FU", 3, [0, 1]], ["SP", 3, 0, 201, [3], 1], ["AN", 3, 1, 2], ["FFSP", 3, 0, [2, 1], 1, 1], ["AN", 3, 1, 6], ["FU", 1, [0, 1]], ["SP", 1, 0, 67, [1], 1], ["AN", 1, 1, 2], ["FFSP", 1, 0, [2, 1], 1, 1], ["AN", 1, 1, 6], ["PR", 4, 0, "auto_unroll_max_step$1024"]]]], "r": [[8.52187e-06], 0, 0.830069, 1692824954], "v": "v0.6"}
{"i": [["[\"matmul\", 67, 67, 3, \"float32\"]", "cuda -keys=cuda,gpu -arch=sm_75 -max_num_threads=1024 -thread_warp_size=32", [-1, 16, 64, 49152, 2147483647, 1024, 8, 32], "", 0, []], [[], [["CHW", 2, "local"], ["SP", 2, 0, 67, [1, 67, 1, 1], 1], ["SP", 2, 5, 3, [3, 1, 1, 1], 1], ["SP", 2, 10, 67, [1, 1], 1], ["RE", 2, [0, 5, 1, 6, 2, 7, 10, 11, 3, 8, 12, 4, 9]], ["FSP", 3, 0, 1, 3], ["FSP", 3, 4, 2, 3], ["RE", 3, [0, 4, 1, 5, 2, 6, 3, 7]], ["CA", 2, 3, 5], ["CHR", 1, "shared", [2]], ["CA", 2, 3, 6], ["CHR", 0, "shared", [3]], ["CA", 1, 4, 6], ["FU", 5, [0, 1]], ["AN", 5, 0, 5], ["FU", 5, [1, 2]], ["AN", 5, 1, 4], ["FU", 5, [2, 3]], ["AN", 5, 2, 6], ["FU", 3, [0, 1]], ["SP", 3, 0, 1, [1], 1], ["AN", 3, 1, 2], ["FFSP", 3, 0, [2, 1], 1, 1], ["AN", 3, 1, 6], ["FU", 1, [0, 1]], ["SP", 1, 0, 1, [1], 1], ["AN", 1, 1, 2], ["FFSP", 1, 0, [2, 1], 1, 1], ["AN", 1, 1, 6], ["PR", 4, 0, "auto_unroll_max_step$64"]]]], "r": [[7.93524e-06], 0, 0.553724, 1692824954], "v": "v0.6"}
{"i": [["[\"matmul\", 67, 67, 3, \"float32\"]", "cuda -keys=cuda,gpu -arch=sm_75 -max_num_threads=1024 -thread_warp_size=32", [-1, 16, 64, 49152, 2147483647, 1024, 8, 32], "", 0, []], [[], [["CHW", 2, "local"], ["SP", 2, 0, 67, [1, 67, 1, 1], 1], ["SP", 2, 5, 3, [1, 3, 1, 1], 1], ["SP", 2, 10, 67, [67, 1], 1], ["RE", 2, [0, 5, 1, 6, 2, 7, 10, 11, 3, 8, 12, 4, 9]], ["FSP", 3, 0, 1, 3], ["FSP", 3, 4, 2, 3], ["RE", 3, [0, 4, 1, 5, 2, 6, 3, 7]], ["CA", 2, 3, 5], ["CHR", 1, "shared", [2]], ["CA", 2, 3, 6], ["CHR", 0, "shared", [3]], ["CA", 1, 4, 6], ["FU", 5, [0, 1]], ["AN", 5, 0, 5], ["FU", 5, [1, 2]], ["AN", 5, 1, 4], ["FU", 5, [2, 3]], ["AN", 5, 2, 6], ["FU", 3, [0, 1]], ["SP", 3, 0, 201, [1], 1], ["AN", 3, 1, 2], ["FFSP", 3, 0, [2, 1], 1, 1], ["AN", 3, 1, 6], ["FU", 1, [0, 1]], ["SP", 1, 0, 67, [1], 1], ["AN", 1, 1, 2], ["FFSP", 1, 0, [2, 1], 1, 1], ["AN", 1, 1, 6], ["PR", 4, 0, "auto_unroll_max_step$1024"]]]], "r": [[2.69643e-06], 0, 0.62192, 1692824955], "v": "v0.6"}
{"i": [["[\"matmul\", 67, 67, 3, \"float32\"]", "cuda -keys=cuda,gpu -arch=sm_75 -max_num_threads=1024 -thread_warp_size=32", [-1, 16, 64, 49152, 2147483647, 1024, 8, 32], "", 0, []], [[], [["CHW", 2, "local"], ["SP", 2, 0, 67, [1, 67, 1, 1], 1], ["SP", 2, 5, 3, [1, 1, 1, 3], 1], ["SP", 2, 10, 67, [1, 1], 1], ["RE", 2, [0, 5, 1, 6, 2, 7, 10, 11, 3, 8, 12, 4, 9]], ["FSP", 3, 0, 1, 3], ["FSP", 3, 4, 2, 3], ["RE", 3, [0, 4, 1, 5, 2, 6, 3, 7]], ["CA", 2, 3, 5], ["CHR", 1, "shared", [2]], ["CA", 2, 3, 6], ["CHR", 0, "shared", [3]], ["CA", 1, 4, 6], ["FU", 5, [0, 1]], ["AN", 5, 0, 5], ["FU", 5, [1, 2]], ["AN", 5, 1, 4], ["FU", 5, [2, 3]], ["AN", 5, 2, 6], ["FU", 3, [0, 1]], ["SP", 3, 0, 3, [1], 1], ["AN", 3, 1, 2], ["FFSP", 3, 0, [2, 1], 1, 1], ["AN", 3, 1, 6], ["FU", 1, [0, 1]], ["SP", 1, 0, 1, [1], 1], ["AN", 1, 1, 2], ["FFSP", 1, 0, [2, 1], 1, 1], ["AN", 1, 1, 6], ["PR", 4, 0, "auto_unroll_max_step$512"]]]], "r": [[4.83562e-06], 0, 0.788062, 1692824955], "v": "v0.6"}
{"i": [["[\"matmul\", 67, 67, 3, \"float32\"]", "cuda -keys=cuda,gpu -arch=sm_75 -max_num_threads=1024 -thread_warp_size=32", [-1, 16, 64, 49152, 2147483647, 1024, 8, 32], "", 0, []], [[], [["CHW", 2, "local"], ["SP", 2, 0, 67, [1, 1, 1, 1], 1], ["SP", 2, 5, 3, [1, 3, 1, 1], 1], ["SP", 2, 10, 67, [67, 1], 1], ["RE", 2, [0, 5, 1, 6, 2, 7, 10, 11, 3, 8, 12, 4, 9]], ["FSP", 3, 0, 1, 3], ["FSP", 3, 4, 2, 3], ["RE", 3, [0, 4, 1, 5, 2, 6, 3, 7]], ["CA", 2, 3, 5], ["CHR", 1, "shared", [2]], ["CA", 2, 3, 6], ["CHR", 0, "shared", [3]], ["CA", 1, 4, 6], ["FU", 5, [0, 1]], ["AN", 5, 0, 5], ["FU", 5, [1, 2]], ["AN", 5, 1, 4], ["FU", 5, [2, 3]], ["AN", 5, 2, 6], ["FU", 3, [0, 1]], ["SP", 3, 0, 67, [1], 1], ["AN", 3, 1, 2], ["FFSP", 3, 0, [2, 1], 1, 1], ["AN", 3, 1, 6], ["FU", 1, [0, 1]], ["SP", 1, 0, 67, [1], 1], ["AN", 1, 1, 2], ["FFSP", 1, 0, [2, 1], 1, 1], ["AN", 1, 1, 6], ["PR", 4, 0, "auto_unroll_max_step$16"]]]], "r": [[2.60704e-06], 0, 0.57524, 1692824955], "v": "v0.6"}
{"i": [["[\"matmul\", 67, 67, 3, \"float32\"]", "cuda -keys=cuda,gpu -arch=sm_75 -max_num_threads=1024 -thread_warp_size=32", [-1, 16, 64, 49152, 2147483647, 1024, 8, 32], "", 0, []], [[], [["CHW", 2, "local"], ["SP", 2, 0, 67, [1, 67, 1, 1], 1], ["SP", 2, 5, 3, [1, 3, 1, 1], 1], ["SP", 2, 10, 67, [67, 1], 1], ["RE", 2, [0, 5, 1, 6, 2, 7, 10, 11, 3, 8, 12, 4, 9]], ["FSP", 3, 0, 1, 3], ["FSP", 3, 4, 2, 3], ["RE", 3, [0, 4, 1, 5, 2, 6, 3, 7]], ["CA", 2, 3, 5], ["CHR", 1, "shared", [2]], ["CA", 2, 3, 6], ["CHR", 0, "shared", [3]], ["CA", 1, 4, 6], ["FU", 5, [0, 1]], ["AN", 5, 0, 5], ["FU", 5, [1, 2]], ["AN", 5, 1, 4], ["FU", 5, [2, 3]], ["AN", 5, 2, 6], ["FU", 3, [0, 1]], ["SP", 3, 0, 201, [3], 1], ["AN", 3, 1, 2], ["FFSP", 3, 0, [2, 1], 1, 1], ["AN", 3, 1, 6], ["FU", 1, [0, 1]], ["SP", 1, 0, 67, [1], 1], ["AN", 1, 1, 2], ["FFSP", 1, 0, [2, 1], 1, 1], ["AN", 1, 1, 6], ["PR", 4, 0, "auto_unroll_max_step$1024"]]]], "r": [[2.70645e-06], 0, 0.615187, 1692824955], "v": "v0.6"}
{"i": [["[\"matmul\", 67, 67, 3, \"float32\"]", "cuda -keys=cuda,gpu -arch=sm_75 -max_num_threads=1024 -thread_warp_size=32", [-1, 16, 64, 49152, 2147483647, 1024, 8, 32], "", 0, []], [[], [["CHW", 2, "local"], ["SP", 2, 0, 67, [1, 67, 1, 1], 1], ["SP", 2, 5, 3, [1, 1, 1, 3], 1], ["SP", 2, 10, 67, [67, 1], 1], ["RE", 2, [0, 5, 1, 6, 2, 7, 10, 11, 3, 8, 12, 4, 9]], ["FSP", 3, 0, 1, 3], ["FSP", 3, 4, 2, 3], ["RE", 3, [0, 4, 1, 5, 2, 6, 3, 7]], ["CA", 2, 3, 5], ["CHR", 1, "shared", [2]], ["CA", 2, 3, 6], ["CHR", 0, "shared", [3]], ["CA", 1, 4, 6], ["FU", 5, [0, 1]], ["AN", 5, 0, 5], ["FU", 5, [1, 2]], ["AN", 5, 1, 4], ["FU", 5, [2, 3]], ["AN", 5, 2, 6], ["FU", 3, [0, 1]], ["SP", 3, 0, 1, [1], 1], ["AN", 3, 1, 2], ["FFSP", 3, 0, [2, 1], 1, 1], ["AN", 3, 1, 6], ["FU", 1, [0, 1]], ["SP", 1, 0, 1, [1], 1], ["AN", 1, 1, 2], ["FFSP", 1, 0, [2, 1], 1, 1], ["AN", 1, 1, 6], ["PR", 4, 0, "auto_unroll_max_step$16"]]]], "r": [[2.23498e-06], 0, 0.515139, 1692824956], "v": "v0.6"}
{"i": [["[\"matmul\", 67, 67, 3, \"float32\"]", "cuda -keys=cuda,gpu -arch=sm_75 -max_num_threads=1024 -thread_warp_size=32", [-1, 16, 64, 49152, 2147483647, 1024, 8, 32], "", 0, []], [[], [["CHW", 2, "local"], ["SP", 2, 0, 67, [1, 1, 67, 1], 1], ["SP", 2, 5, 3, [1, 1, 3, 1], 1], ["SP", 2, 10, 67, [1, 1], 1], ["RE", 2, [0, 5, 1, 6, 2, 7, 10, 11, 3, 8, 12, 4, 9]], ["FSP", 3, 0, 1, 3], ["FSP", 3, 4, 2, 3], ["RE", 3, [0, 4, 1, 5, 2, 6, 3, 7]], ["CA", 2, 3, 5], ["CHR", 1, "shared", [2]], ["CA", 2, 3, 6], ["CHR", 0, "shared", [3]], ["CA", 1, 4, 6], ["FU", 5, [0, 1]], ["AN", 5, 0, 5], ["FU", 5, [1, 2]], ["AN", 5, 1, 4], ["FU", 5, [2, 3]], ["AN", 5, 2, 6], ["FU", 3, [0, 1]], ["SP", 3, 0, 1, [1], 1], ["AN", 3, 1, 2], ["FFSP", 3, 0, [2, 1], 1, 1], ["AN", 3, 1, 6], ["FU", 1, [0, 1]], ["SP", 1, 0, 1, [1], 1], ["AN", 1, 1, 2], ["FFSP", 1, 0, [2, 1], 1, 1], ["AN", 1, 1, 6], ["PR", 4, 0, "auto_unroll_max_step$16"]]]], "r": [[4.6779e-05], 0, 0.542802, 1692824956], "v": "v0.6"}
{"i": [["[\"matmul\", 67, 67, 3, \"float32\"]", "cuda -keys=cuda,gpu -arch=sm_75 -max_num_threads=1024 -thread_warp_size=32", [-1, 16, 64, 49152, 2147483647, 1024, 8, 32], "", 0, []], [[], [["CHW", 2, "local"], ["SP", 2, 0, 67, [1, 67, 1, 1], 1], ["SP", 2, 5, 3, [1, 1, 1, 3], 1], ["SP", 2, 10, 67, [1, 1], 1], ["RE", 2, [0, 5, 1, 6, 2, 7, 10, 11, 3, 8, 12, 4, 9]], ["FSP", 3, 0, 1, 3], ["FSP", 3, 4, 2, 3], ["RE", 3, [0, 4, 1, 5, 2, 6, 3, 7]], ["CA", 2, 3, 5], ["CHR", 1, "shared", [2]], ["CA", 2, 3, 6], ["CHR", 0, "shared", [3]], ["CA", 1, 4, 6], ["FU", 5, [0, 1]], ["AN", 5, 0, 5], ["FU", 5, [1, 2]], ["AN", 5, 1, 4], ["FU", 5, [2, 3]], ["AN", 5, 2, 6], ["FU", 3, [0, 1]], ["SP", 3, 0, 67, [1], 1], ["AN", 3, 1, 2], ["FFSP", 3, 0, [2, 1], 1, 1], ["AN", 3, 1, 6], ["FU", 1, [0, 1]], ["SP", 1, 0, 67, [1], 1], ["AN", 1, 1, 2], ["FFSP", 1, 0, [2, 1], 1, 1], ["AN", 1, 1, 6], ["PR", 4, 0, "auto_unroll_max_step$64"]]]], "r": [[7.92917e-06], 0, 0.556421, 1692824956], "v": "v0.6"}
{"i": [["[\"matmul\", 67, 67, 3, \"float32\"]", "cuda -keys=cuda,gpu -arch=sm_75 -max_num_threads=1024 -thread_warp_size=32", [-1, 16, 64, 49152, 2147483647, 1024, 8, 32], "", 0, []], [[], [["CHW", 2, "local"], ["SP", 2, 0, 67, [1, 1, 1, 1], 1], ["SP", 2, 5, 3, [1, 1, 3, 1], 1], ["SP", 2, 10, 67, [67, 1], 1], ["RE", 2, [0, 5, 1, 6, 2, 7, 10, 11, 3, 8, 12, 4, 9]], ["FSP", 3, 0, 1, 3], ["FSP", 3, 4, 2, 3], ["RE", 3, [0, 4, 1, 5, 2, 6, 3, 7]], ["CA", 2, 3, 5], ["CHR", 1, "shared", [2]], ["CA", 2, 3, 6], ["CHR", 0, "shared", [3]], ["CA", 1, 4, 6], ["FU", 5, [0, 1]], ["AN", 5, 0, 5], ["FU", 5, [1, 2]], ["AN", 5, 1, 4], ["FU", 5, [2, 3]], ["AN", 5, 2, 6], ["FU", 3, [0, 1]], ["SP", 3, 0, 3, [1], 1], ["AN", 3, 1, 2], ["FFSP", 3, 0, [2, 1], 1, 1], ["AN", 3, 1, 6], ["FU", 1, [0, 1]], ["SP", 1, 0, 1, [1], 1], ["AN", 1, 1, 2], ["FFSP", 1, 0, [2, 1], 1, 1], ["AN", 1, 1, 6], ["PR", 4, 0, "auto_unroll_max_step$1024"]]]], "r": [[3.23886e-06], 0, 0.796905, 1692824956], "v": "v0.6"}
{"i": [["[\"matmul\", 67, 67, 3, \"float32\"]", "cuda -keys=cuda,gpu -arch=sm_75 -max_num_threads=1024 -thread_warp_size=32", [-1, 16, 64, 49152, 2147483647, 1024, 8, 32], "", 0, []], [[], [["CHW", 2, "local"], ["SP", 2, 0, 67, [1, 1, 67, 1], 1], ["SP", 2, 5, 3, [1, 1, 3, 1], 1], ["SP", 2, 10, 67, [1, 1], 1], ["RE", 2, [0, 5, 1, 6, 2, 7, 10, 11, 3, 8, 12, 4, 9]], ["FSP", 3, 0, 1, 3], ["FSP", 3, 4, 2, 3], ["RE", 3, [0, 4, 1, 5, 2, 6, 3, 7]], ["CA", 2, 3, 5], ["CHR", 1, "shared", [2]], ["CA", 2, 3, 6], ["CHR", 0, "shared", [3]], ["CA", 1, 4, 6], ["FU", 5, [0, 1]], ["AN", 5, 0, 5], ["FU", 5, [1, 2]], ["AN", 5, 1, 4], ["FU", 5, [2, 3]], ["AN", 5, 2, 6], ["FU", 3, [0, 1]], ["SP", 3, 0, 3, [1], 1], ["AN", 3, 1, 2], ["FFSP", 3, 0, [2, 1], 1, 1], ["AN", 3, 1, 6], ["FU", 1, [0, 1]], ["SP", 1, 0, 1, [1], 1], ["AN", 1, 1, 2], ["FFSP", 1, 0, [2, 1], 1, 1], ["AN", 1, 1, 6], ["PR", 4, 0, "auto_unroll_max_step$0"]]]], "r": [[4.66893e-05], 0, 0.499878, 1692824956], "v": "v0.6"}
{"i": [["[\"matmul\", 67, 67, 3, \"float32\"]", "cuda -keys=cuda,gpu -arch=sm_75 -max_num_threads=1024 -thread_warp_size=32", [-1, 16, 64, 49152, 2147483647, 1024, 8, 32], "", 0, []], [[], [["CHW", 2, "local"], ["SP", 2, 0, 67, [1, 67, 1, 1], 1], ["SP", 2, 5, 3, [3, 1, 1, 1], 1], ["SP", 2, 10, 67, [67, 1], 1], ["RE", 2, [0, 5, 1, 6, 2, 7, 10, 11, 3, 8, 12, 4, 9]], ["FSP", 3, 0, 1, 3], ["FSP", 3, 4, 2, 3], ["RE", 3, [0, 4, 1, 5, 2, 6, 3, 7]], ["CA", 2, 3, 5], ["CHR", 1, "shared", [2]], ["CA", 2, 3, 6], ["CHR", 0, "shared", [3]], ["CA", 1, 4, 6], ["FU", 5, [0, 1]], ["AN", 5, 0, 5], ["FU", 5, [1, 2]], ["AN", 5, 1, 4], ["FU", 5, [2, 3]], ["AN", 5, 2, 6], ["FU", 3, [0, 1]], ["SP", 3, 0, 3, [1], 1], ["AN", 3, 1, 2], ["FFSP", 3, 0, [2, 1], 1, 1], ["AN", 3, 1, 6], ["FU", 1, [0, 1]], ["SP", 1, 0, 1, [1], 1], ["AN", 1, 1, 2], ["FFSP", 1, 0, [2, 1], 1, 1], ["AN", 1, 1, 6], ["PR", 4, 0, "auto_unroll_max_step$64"]]]], "r": [[2.23566e-06], 0, 0.528263, 1692824957], "v": "v0.6"}
{"i": [["[\"matmul\", 67, 67, 3, \"float32\"]", "cuda -keys=cuda,gpu -arch=sm_75 -max_num_threads=1024 -thread_warp_size=32", [-1, 16, 64, 49152, 2147483647, 1024, 8, 32], "", 0, []], [[], [["CHW", 2, "local"], ["SP", 2, 0, 67, [1, 67, 1, 1], 1], ["SP", 2, 5, 3, [1, 1, 1, 1], 1], ["SP", 2, 10, 67, [1, 1], 1], ["RE", 2, [0, 5, 1, 6, 2, 7, 10, 11, 3, 8, 12, 4, 9]], ["FSP", 3, 0, 1, 3], ["FSP", 3, 4, 2, 3], ["RE", 3, [0, 4, 1, 5, 2, 6, 3, 7]], ["CA", 2, 3, 5], ["CHR", 1, "shared", [2]], ["CA", 2, 3, 6], ["CHR", 0, "shared", [3]], ["CA", 1, 4, 6], ["FU", 5, [0, 1]], ["AN", 5, 0, 5], ["FU", 5, [1, 2]], ["AN", 5, 1, 4], ["FU", 5, [2, 3]], ["AN", 5, 2, 6], ["FU", 3, [0, 1]], ["SP", 3, 0, 3, [1], 1], ["AN", 3, 1, 2], ["FFSP", 3, 0, [2, 1], 1, 1], ["AN", 3, 1, 6], ["FU", 1, [0, 1]], ["SP", 1, 0, 1, [1], 1], ["AN", 1, 1, 2], ["FFSP", 1, 0, [2, 1], 1, 1], ["AN", 1, 1, 6], ["PR", 4, 0, "auto_unroll_max_step$0"]]]], "r": [[8.00972e-06], 0, 0.556463, 1692824957], "v": "v0.6"}
{"i": [["[\"matmul\", 67, 67, 3, \"float32\"]", "cuda -keys=cuda,gpu -arch=sm_75 -max_num_threads=1024 -thread_warp_size=32", [-1, 16, 64, 49152, 2147483647, 1024, 8, 32], "", 0, []], [[], [["CHW", 2, "local"], ["SP", 2, 0, 67, [1, 1, 1, 1], 1], ["SP", 2, 5, 3, [3, 1, 1, 1], 1], ["SP", 2, 10, 67, [1, 1], 1], ["RE", 2, [0, 5, 1, 6, 2, 7, 10, 11, 3, 8, 12, 4, 9]], ["FSP", 3, 0, 1, 3], ["FSP", 3, 4, 2, 3], ["RE", 3, [0, 4, 1, 5, 2, 6, 3, 7]], ["CA", 2, 3, 5], ["CHR", 1, "shared", [2]], ["CA", 2, 3, 6], ["CHR", 0, "shared", [3]], ["CA", 1, 4, 6], ["FU", 5, [0, 1]], ["AN", 5, 0, 5], ["FU", 5, [1, 2]], ["AN", 5, 1, 4], ["FU", 5, [2, 3]], ["AN", 5, 2, 6], ["FU", 3, [0, 1]], ["SP", 3, 0, 3, [1], 1], ["AN", 3, 1, 2], ["FFSP", 3, 0, [2, 1], 1, 1], ["AN", 3, 1, 6], ["FU", 1, [0, 1]], ["SP", 1, 0, 1, [1], 1], ["AN", 1, 1, 2], ["FFSP", 1, 0, [2, 1], 1, 1], ["AN", 1, 1, 6], ["PR", 4, 0, "auto_unroll_max_step$16"]]]], "r": [[5.11275e-06], 0, 0.56376, 1692824957], "v": "v0.6"}
{"i": [["[\"matmul\", 67, 67, 3, \"float32\"]", "cuda -keys=cuda,gpu -arch=sm_75 -max_num_threads=1024 -thread_warp_size=32", [-1, 16, 64, 49152, 2147483647, 1024, 8, 32], "", 0, []], [[], [["CHW", 2, "local"], ["SP", 2, 0, 67, [1, 1, 67, 1], 1], ["SP", 2, 5, 3, [1, 1, 1, 3], 1], ["SP", 2, 10, 67, [1, 1], 1], ["RE", 2, [0, 5, 1, 6, 2, 7, 10, 11, 3, 8, 12, 4, 9]], ["FSP", 3, 0, 1, 3], ["FSP", 3, 4, 2, 3], ["RE", 3, [0, 4, 1, 5, 2, 6, 3, 7]], ["CA", 2, 3, 5], ["CHR", 1, "shared", [2]], ["CA", 2, 3, 6], ["CHR", 0, "shared", [3]], ["CA", 1, 4, 6], ["FU", 5, [0, 1]], ["AN", 5, 0, 5], ["FU", 5, [1, 2]], ["AN", 5, 1, 4], ["FU", 5, [2, 3]], ["AN", 5, 2, 6], ["FU", 3, [0, 1]], ["SP", 3, 0, 3, [1], 1], ["AN", 3, 1, 2], ["FFSP", 3, 0, [2, 1], 1, 1], ["AN", 3, 1, 6], ["FU", 1, [0, 1]], ["SP", 1, 0, 1, [1], 1], ["AN", 1, 1, 2], ["FFSP", 1, 0, [2, 1], 1, 1], ["AN", 1, 1, 6], ["PR", 4, 0, "auto_unroll_max_step$1024"]]]], "r": [[4.4128e-05], 0, 0.754584, 1692824957], "v": "v0.6"}
{"i": [["[\"matmul\", 67, 67, 3, \"float32\"]", "cuda -keys=cuda,gpu -arch=sm_75 -max_num_threads=1024 -thread_warp_size=32", [-1, 16, 64, 49152, 2147483647, 1024, 8, 32], "", 0, []], [[], [["CHW", 2, "local"], ["SP", 2, 0, 67, [1, 67, 1, 1], 1], ["SP", 2, 5, 3, [1, 1, 1, 1], 1], ["SP", 2, 10, 67, [67, 1], 1], ["RE", 2, [0, 5, 1, 6, 2, 7, 10, 11, 3, 8, 12, 4, 9]], ["FSP", 3, 0, 1, 3], ["FSP", 3, 4, 2, 3], ["RE", 3, [0, 4, 1, 5, 2, 6, 3, 7]], ["CA", 2, 3, 5], ["CHR", 1, "shared", [2]], ["CA", 2, 3, 6], ["CHR", 0, "shared", [3]], ["CA", 1, 4, 6], ["FU", 5, [0, 1]], ["AN", 5, 0, 5], ["FU", 5, [1, 2]], ["AN", 5, 1, 4], ["FU", 5, [2, 3]], ["AN", 5, 2, 6], ["FU", 3, [0, 1]], ["SP", 3, 0, 201, [3], 1], ["AN", 3, 1, 2], ["FFSP", 3, 0, [2, 1], 1, 1], ["AN", 3, 1, 6], ["FU", 1, [0, 1]], ["SP", 1, 0, 67, [1], 1], ["AN", 1, 1, 2], ["FFSP", 1, 0, [2, 1], 1, 1], ["AN", 1, 1, 6], ["PR", 4, 0, "auto_unroll_max_step$1024"]]]], "r": [[2.10521e-06], 0, 0.55623, 1692824958], "v": "v0.6"}
{"i": [["[\"matmul\", 67, 67, 3, \"float32\"]", "cuda -keys=cuda,gpu -arch=sm_75 -max_num_threads=1024 -thread_warp_size=32", [-1, 16, 64, 49152, 2147483647, 1024, 8, 32], "", 0, []], [[], [["CHW", 2, "local"], ["SP", 2, 0, 67, [1, 67, 1, 1], 1], ["SP", 2, 5, 3, [1, 1, 1, 1], 1], ["SP", 2, 10, 67, [1, 1], 1], ["RE", 2, [0, 5, 1, 6, 2, 7, 10, 11, 3, 8, 12, 4, 9]], ["FSP", 3, 0, 1, 3], ["FSP", 3, 4, 2, 3], ["RE", 3, [0, 4, 1, 5, 2, 6, 3, 7]], ["CA", 2, 3, 5], ["CHR", 1, "shared", [2]], ["CA", 2, 3, 6], ["CHR", 0, "shared", [3]], ["CA", 1, 4, 6], ["FU", 5, [0, 1]], ["AN", 5, 0, 5], ["FU", 5, [1, 2]], ["AN", 5, 1, 4], ["FU", 5, [2, 3]], ["AN", 5, 2, 6], ["FU", 3, [0, 1]], ["SP", 3, 0, 1, [1], 1], ["AN", 3, 1, 2], ["FFSP", 3, 0, [2, 1], 1, 1], ["AN", 3, 1, 6], ["FU", 1, [0, 1]], ["SP", 1, 0, 1, [1], 1], ["AN", 1, 1, 2], ["FFSP", 1, 0, [2, 1], 1, 1], ["AN", 1, 1, 6], ["PR", 4, 0, "auto_unroll_max_step$1024"]]]], "r": [[5.1529e-06], 0, 0.752425, 1692824961], "v": "v0.6"}
{"i": [["[\"matmul\", 67, 67, 3, \"float32\"]", "cuda -keys=cuda,gpu -arch=sm_75 -max_num_threads=1024 -thread_warp_size=32", [-1, 16, 64, 49152, 2147483647, 1024, 8, 32], "", 0, []], [[], [["CHW", 2, "local"], ["SP", 2, 0, 67, [1, 1, 1, 1], 1], ["SP", 2, 5, 3, [1, 3, 1, 1], 1], ["SP", 2, 10, 67, [1, 1], 1], ["RE", 2, [0, 5, 1, 6, 2, 7, 10, 11, 3, 8, 12, 4, 9]], ["FSP", 3, 0, 1, 3], ["FSP", 3, 4, 2, 3], ["RE", 3, [0, 4, 1, 5, 2, 6, 3, 7]], ["CA", 2, 3, 5], ["CHR", 1, "shared", [2]], ["CA", 2, 3, 6], ["CHR", 0, "shared", [3]], ["CA", 1, 4, 6], ["FU", 5, [0, 1]], ["AN", 5, 0, 5], ["FU", 5, [1, 2]], ["AN", 5, 1, 4], ["FU", 5, [2, 3]], ["AN", 5, 2, 6], ["FU", 3, [0, 1]], ["SP", 3, 0, 3, [1], 1], ["AN", 3, 1, 2], ["FFSP", 3, 0, [2, 1], 1, 1], ["AN", 3, 1, 6], ["FU", 1, [0, 1]], ["SP", 1, 0, 1, [1], 1], ["AN", 1, 1, 2], ["FFSP", 1, 0, [2, 1], 1, 1], ["AN", 1, 1, 6], ["PR", 4, 0, "auto_unroll_max_step$64"]]]], "r": [[5.75324e-06], 0, 0.53768, 1692824961], "v": "v0.6"}
{"i": [["[\"matmul\", 67, 67, 3, \"float32\"]", "cuda -keys=cuda,gpu -arch=sm_75 -max_num_threads=1024 -thread_warp_size=32", [-1, 16, 64, 49152, 2147483647, 1024, 8, 32], "", 0, []], [[], [["CHW", 2, "local"], ["SP", 2, 0, 67, [1, 67, 1, 1], 1], ["SP", 2, 5, 3, [1, 1, 1, 1], 1], ["SP", 2, 10, 67, [67, 1], 1], ["RE", 2, [0, 5, 1, 6, 2, 7, 10, 11, 3, 8, 12, 4, 9]], ["FSP", 3, 0, 1, 3], ["FSP", 3, 4, 2, 3], ["RE", 3, [0, 4, 1, 5, 2, 6, 3, 7]], ["CA", 2, 3, 5], ["CHR", 1, "shared", [2]], ["CA", 2, 3, 6], ["CHR", 0, "shared", [3]], ["CA", 1, 4, 6], ["FU", 5, [0, 1]], ["AN", 5, 0, 5], ["FU", 5, [1, 2]], ["AN", 5, 1, 4], ["FU", 5, [2, 3]], ["AN", 5, 2, 6], ["FU", 3, [0, 1]], ["SP", 3, 0, 67, [1], 1], ["AN", 3, 1, 2], ["FFSP", 3, 0, [2, 1], 1, 1], ["AN", 3, 1, 6], ["FU", 1, [0, 1]], ["SP", 1, 0, 67, [1], 1], ["AN", 1, 1, 2], ["FFSP", 1, 0, [2, 1], 1, 1], ["AN", 1, 1, 6], ["PR", 4, 0, "auto_unroll_max_step$64"]]]], "r": [[2.09735e-06], 0, 0.671785, 1692824962], "v": "v0.6"}
{"i": [["[\"matmul\", 67, 67, 3, \"float32\"]", "cuda -keys=cuda,gpu -arch=sm_75 -max_num_threads=1024 -thread_warp_size=32", [-1, 16, 64, 49152, 2147483647, 1024, 8, 32], "", 0, []], [[], [["CHW", 2, "local"], ["SP", 2, 0, 67, [1, 1, 67, 1], 1], ["SP", 2, 5, 3, [1, 3, 1, 1], 1], ["SP", 2, 10, 67, [1, 1], 1], ["RE", 2, [0, 5, 1, 6, 2, 7, 10, 11, 3, 8, 12, 4, 9]], ["FSP", 3, 0, 1, 3], ["FSP", 3, 4, 2, 3], ["RE", 3, [0, 4, 1, 5, 2, 6, 3, 7]], ["CA", 2, 3, 5], ["CHR", 1, "shared", [2]], ["CA", 2, 3, 6], ["CHR", 0, "shared", [3]], ["CA", 1, 4, 6], ["FU", 5, [0, 1]], ["AN", 5, 0, 5], ["FU", 5, [1, 2]], ["AN", 5, 1, 4], ["FU", 5, [2, 3]], ["AN", 5, 2, 6], ["FU", 3, [0, 1]], ["SP", 3, 0, 1, [1], 1], ["AN", 3, 1, 2], ["FFSP", 3, 0, [2, 1], 1, 1], ["AN", 3, 1, 6], ["FU", 1, [0, 1]], ["SP", 1, 0, 1, [1], 1], ["AN", 1, 1, 2], ["FFSP", 1, 0, [2, 1], 1, 1], ["AN", 1, 1, 6], ["PR", 4, 0, "auto_unroll_max_step$16"]]]], "r": [[4.13526e-05], 0, 0.643964, 1692824962], "v": "v0.6"}
{"i": [["[\"matmul\", 67, 67, 3, \"float32\"]", "cuda -keys=cuda,gpu -arch=sm_75 -max_num_threads=1024 -thread_warp_size=32", [-1, 16, 64, 49152, 2147483647, 1024, 8, 32], "", 0, []], [[], [["CHW", 2, "local"], ["SP", 2, 0, 67, [1, 67, 1, 1], 1], ["SP", 2, 5, 3, [1, 1, 3, 1], 1], ["SP", 2, 10, 67, [67, 1], 1], ["RE", 2, [0, 5, 1, 6, 2, 7, 10, 11, 3, 8, 12, 4, 9]], ["FSP", 3, 0, 1, 3], ["FSP", 3, 4, 2, 3], ["RE", 3, [0, 4, 1, 5, 2, 6, 3, 7]], ["CA", 2, 3, 5], ["CHR", 1, "shared", [2]], ["CA", 2, 3, 6], ["CHR", 0, "shared", [3]], ["CA", 1, 4, 6], ["FU", 5, [0, 1]], ["AN", 5, 0, 5], ["FU", 5, [1, 2]], ["AN", 5, 1, 4], ["FU", 5, [2, 3]], ["AN", 5, 2, 6], ["FU", 3, [0, 1]], ["SP", 3, 0, 67, [1], 1], ["AN", 3, 1, 2], ["FFSP", 3, 0, [2, 1], 1, 1], ["AN", 3, 1, 6], ["FU", 1, [0, 1]], ["SP", 1, 0, 67, [1], 1], ["AN", 1, 1, 2], ["FFSP", 1, 0, [2, 1], 1, 1], ["AN", 1, 1, 6], ["PR", 4, 0, "auto_unroll_max_step$512"]]]], "r": [[2.22385e-06], 0, 0.727306, 1692824962], "v": "v0.6"}
{"i": [["[\"matmul\", 67, 67, 3, \"float32\"]", "cuda -keys=cuda,gpu -arch=sm_75 -max_num_threads=1024 -thread_warp_size=32", [-1, 16, 64, 49152, 2147483647, 1024, 8, 32], "", 0, []], [[], [["CHW", 2, "local"], ["SP", 2, 0, 67, [1, 1, 67, 1], 1], ["SP", 2, 5, 3, [1, 3, 1, 1], 1], ["SP", 2, 10, 67, [67, 1], 1], ["RE", 2, [0, 5, 1, 6, 2, 7, 10, 11, 3, 8, 12, 4, 9]], ["FSP", 3, 0, 1, 3], ["FSP", 3, 4, 2, 3], ["RE", 3, [0, 4, 1, 5, 2, 6, 3, 7]], ["CA", 2, 3, 5], ["CHR", 1, "shared", [2]], ["CA", 2, 3, 6], ["CHR", 0, "shared", [3]], ["CA", 1, 4, 6], ["FU", 5, [0, 1]], ["AN", 5, 0, 5], ["FU", 5, [1, 2]], ["AN", 5, 1, 4], ["FU", 5, [2, 3]], ["AN", 5, 2, 6], ["FU", 3, [0, 1]], ["SP", 3, 0, 1, [1], 1], ["AN", 3, 1, 2], ["FFSP", 3, 0, [2, 1], 1, 1], ["AN", 3, 1, 6], ["FU", 1, [0, 1]], ["SP", 1, 0, 1, [1], 1], ["AN", 1, 1, 2], ["FFSP", 1, 0, [2, 1], 1, 1], ["AN", 1, 1, 6], ["PR", 4, 0, "auto_unroll_max_step$64"]]]], "r": [[9.59253e-05], 0, 0.732437, 1692824962], "v": "v0.6"}
{"i": [["[\"matmul\", 67, 67, 3, \"float32\"]", "cuda -keys=cuda,gpu -arch=sm_75 -max_num_threads=1024 -thread_warp_size=32", [-1, 16, 64, 49152, 2147483647, 1024, 8, 32], "", 0, []], [[], [["CHW", 2, "local"], ["SP", 2, 0, 67, [1, 67, 1, 1], 1], ["SP", 2, 5, 3, [1, 1, 3, 1], 1], ["SP", 2, 10, 67, [67, 1], 1], ["RE", 2, [0, 5, 1, 6, 2, 7, 10, 11, 3, 8, 12, 4, 9]], ["FSP", 3, 0, 1, 3], ["FSP", 3, 4, 2, 3], ["RE", 3, [0, 4, 1, 5, 2, 6, 3, 7]], ["CA", 2, 3, 5], ["CHR", 1, "shared", [2]], ["CA", 2, 3, 6], ["CHR", 0, "shared", [3]], ["CA", 1, 4, 6], ["FU", 5, [0, 1]], ["AN", 5, 0, 5], ["FU", 5, [1, 2]], ["AN", 5, 1, 4], ["FU", 5, [2, 3]], ["AN", 5, 2, 6], ["FU", 3, [0, 1]], ["SP", 3, 0, 201, [1], 1], ["AN", 3, 1, 2], ["FFSP", 3, 0, [2, 1], 1, 1], ["AN", 3, 1, 6], ["FU", 1, [0, 1]], ["SP", 1, 0, 67, [1], 1], ["AN", 1, 1, 2], ["FFSP", 1, 0, [2, 1], 1, 1], ["AN", 1, 1, 6], ["PR", 4, 0, "auto_unroll_max_step$64"]]]], "r": [[2.24022e-06], 0, 0.521731, 1692824963], "v": "v0.6"}
{"i": [["[\"matmul\", 67, 67, 3, \"float32\"]", "cuda -keys=cuda,gpu -arch=sm_75 -max_num_threads=1024 -thread_warp_size=32", [-1, 16, 64, 49152, 2147483647, 1024, 8, 32], "", 0, []], [[], [["CHW", 2, "local"], ["SP", 2, 0, 67, [1, 67, 1, 1], 1], ["SP", 2, 5, 3, [1, 1, 3, 1], 1], ["SP", 2, 10, 67, [1, 1], 1], ["RE", 2, [0, 5, 1, 6, 2, 7, 10, 11, 3, 8, 12, 4, 9]], ["FSP", 3, 0, 1, 3], ["FSP", 3, 4, 2, 3], ["RE", 3, [0, 4, 1, 5, 2, 6, 3, 7]], ["CA", 2, 3, 5], ["CHR", 1, "shared", [2]], ["CA", 2, 3, 6], ["CHR", 0, "shared", [3]], ["CA", 1, 4, 6], ["FU", 5, [0, 1]], ["AN", 5, 0, 5], ["FU", 5, [1, 2]], ["AN", 5, 1, 4], ["FU", 5, [2, 3]], ["AN", 5, 2, 6], ["FU", 3, [0, 1]], ["SP", 3, 0, 3, [3], 1], ["AN", 3, 1, 2], ["FFSP", 3, 0, [2, 1], 1, 1], ["AN", 3, 1, 6], ["FU", 1, [0, 1]], ["SP", 1, 0, 1, [1], 1], ["AN", 1, 1, 2], ["FFSP", 1, 0, [2, 1], 1, 1], ["AN", 1, 1, 6], ["PR", 4, 0, "auto_unroll_max_step$1024"]]]], "r": [[5.85007e-06], 0, 0.860458, 1692824963], "v": "v0.6"}
{"i": [["[\"matmul\", 67, 67, 3, \"float32\"]", "cuda -keys=cuda,gpu -arch=sm_75 -max_num_threads=1024 -thread_warp_size=32", [-1, 16, 64, 49152, 2147483647, 1024, 8, 32], "", 0, []], [[], [["CHW", 2, "local"], ["SP", 2, 0, 67, [1, 1, 67, 1], 1], ["SP", 2, 5, 3, [3, 1, 1, 1], 1], ["SP", 2, 10, 67, [1, 1], 1], ["RE", 2, [0, 5, 1, 6, 2, 7, 10, 11, 3, 8, 12, 4, 9]], ["FSP", 3, 0, 1, 3], ["FSP", 3, 4, 2, 3], ["RE", 3, [0, 4, 1, 5, 2, 6, 3, 7]], ["CA", 2, 3, 5], ["CHR", 1, "shared", [2]], ["CA", 2, 3, 6], ["CHR", 0, "shared", [3]], ["CA", 1, 4, 6], ["FU", 5, [0, 1]], ["AN", 5, 0, 5], ["FU", 5, [1, 2]], ["AN", 5, 1, 4], ["FU", 5, [2, 3]], ["AN", 5, 2, 6], ["FU", 3, [0, 1]], ["SP", 3, 0, 67, [1], 1], ["AN", 3, 1, 2], ["FFSP", 3, 0, [2, 1], 1, 1], ["AN", 3, 1, 6], ["FU", 1, [0, 1]], ["SP", 1, 0, 67, [1], 1], ["AN", 1, 1, 2], ["FFSP", 1, 0, [2, 1], 1, 1], ["AN", 1, 1, 6], ["PR", 4, 0, "auto_unroll_max_step$0"]]]], "r": [[4.63947e-05], 0, 0.701158, 1692824963], "v": "v0.6"}
{"i": [["[\"matmul\", 67, 67, 3, \"float32\"]", "cuda -keys=cuda,gpu -arch=sm_75 -max_num_threads=1024 -thread_warp_size=32", [-1, 16, 64, 49152, 2147483647, 1024, 8, 32], "", 0, []], [[], [["CHW", 2, "local"], ["SP", 2, 0, 67, [1, 67, 1, 1], 1], ["SP", 2, 5, 3, [3, 1, 1, 1], 1], ["SP", 2, 10, 67, [67, 1], 1], ["RE", 2, [0, 5, 1, 6, 2, 7, 10, 11, 3, 8, 12, 4, 9]], ["FSP", 3, 0, 1, 3], ["FSP", 3, 4, 2, 3], ["RE", 3, [0, 4, 1, 5, 2, 6, 3, 7]], ["CA", 2, 3, 5], ["CHR", 1, "shared", [2]], ["CA", 2, 3, 6], ["CHR", 0, "shared", [3]], ["CA", 1, 4, 6], ["FU", 5, [0, 1]], ["AN", 5, 0, 5], ["FU", 5, [1, 2]], ["AN", 5, 1, 4], ["FU", 5, [2, 3]], ["AN", 5, 2, 6], ["FU", 3, [0, 1]], ["SP", 3, 0, 67, [1], 1], ["AN", 3, 1, 2], ["FFSP", 3, 0, [2, 1], 1, 1], ["AN", 3, 1, 6], ["FU", 1, [0, 1]], ["SP", 1, 0, 67, [1], 1], ["AN", 1, 1, 2], ["FFSP", 1, 0, [2, 1], 1, 1], ["AN", 1, 1, 6], ["PR", 4, 0, "auto_unroll_max_step$1024"]]]], "r": [[2.22089e-06], 0, 0.700778, 1692824963], "v": "v0.6"}
{"i": [["[\"matmul\", 67, 67, 3, \"float32\"]", "cuda -keys=cuda,gpu -arch=sm_75 -max_num_threads=1024 -thread_warp_size=32", [-1, 16, 64, 49152, 2147483647, 1024, 8, 32], "", 0, []], [[], [["CHW", 2, "local"], ["SP", 2, 0, 67, [1, 1, 67, 1], 1], ["SP", 2, 5, 3, [3, 1, 1, 1], 1], ["SP", 2, 10, 67, [67, 1], 1], ["RE", 2, [0, 5, 1, 6, 2, 7, 10, 11, 3, 8, 12, 4, 9]], ["FSP", 3, 0, 1, 3], ["FSP", 3, 4, 2, 3], ["RE", 3, [0, 4, 1, 5, 2, 6, 3, 7]], ["CA", 2, 3, 5], ["CHR", 1, "shared", [2]], ["CA", 2, 3, 6], ["CHR", 0, "shared", [3]], ["CA", 1, 4, 6], ["FU", 5, [0, 1]], ["AN", 5, 0, 5], ["FU", 5, [1, 2]], ["AN", 5, 1, 4], ["FU", 5, [2, 3]], ["AN", 5, 2, 6], ["FU", 3, [0, 1]], ["SP", 3, 0, 67, [1], 1], ["AN", 3, 1, 2], ["FFSP", 3, 0, [2, 1], 1, 1], ["AN", 3, 1, 6], ["FU", 1, [0, 1]], ["SP", 1, 0, 67, [1], 1], ["AN", 1, 1, 2], ["FFSP", 1, 0, [2, 1], 1, 1], ["AN", 1, 1, 6], ["PR", 4, 0, "auto_unroll_max_step$16"]]]], "r": [[3.97934e-05], 0, 0.722157, 1692824964], "v": "v0.6"}
{"i": [["[\"matmul\", 67, 67, 3, \"float32\"]", "cuda -keys=cuda,gpu -arch=sm_75 -max_num_threads=1024 -thread_warp_size=32", [-1, 16, 64, 49152, 2147483647, 1024, 8, 32], "", 0, []], [[], [["CHW", 2, "local"], ["SP", 2, 0, 67, [1, 1, 67, 1], 1], ["SP", 2, 5, 3, [1, 1, 1, 3], 1], ["SP", 2, 10, 67, [1, 1], 1], ["RE", 2, [0, 5, 1, 6, 2, 7, 10, 11, 3, 8, 12, 4, 9]], ["FSP", 3, 0, 1, 3], ["FSP", 3, 4, 2, 3], ["RE", 3, [0, 4, 1, 5, 2, 6, 3, 7]], ["CA", 2, 3, 5], ["CHR", 1, "shared", [2]], ["CA", 2, 3, 6], ["CHR", 0, "shared", [3]], ["CA", 1, 4, 6], ["FU", 5, [0, 1]], ["AN", 5, 0, 5], ["FU", 5, [1, 2]], ["AN", 5, 1, 4], ["FU", 5, [2, 3]], ["AN", 5, 2, 6], ["FU", 3, [0, 1]], ["SP", 3, 0, 1, [1], 1], ["AN", 3, 1, 2], ["FFSP", 3, 0, [2, 1], 1, 1], ["AN", 3, 1, 6], ["FU", 1, [0, 1]], ["SP", 1, 0, 1, [1], 1], ["AN", 1, 1, 2], ["FFSP", 1, 0, [2, 1], 1, 1], ["AN", 1, 1, 6], ["PR", 4, 0, "auto_unroll_max_step$0"]]]], "r": [[4.66005e-05], 0, 0.550202, 1692824964], "v": "v0.6"}
{"i": [["[\"matmul\", 67, 67, 3, \"float32\"]", "cuda -keys=cuda,gpu -arch=sm_75 -max_num_threads=1024 -thread_warp_size=32", [-1, 16, 64, 49152, 2147483647, 1024, 8, 32], "", 0, []], [[], [["CHW", 2, "local"], ["SP", 2, 0, 67, [1, 67, 1, 1], 1], ["SP", 2, 5, 3, [1, 3, 1, 1], 1], ["SP", 2, 10, 67, [67, 1], 1], ["RE", 2, [0, 5, 1, 6, 2, 7, 10, 11, 3, 8, 12, 4, 9]], ["FSP", 3, 0, 1, 3], ["FSP", 3, 4, 2, 3], ["RE", 3, [0, 4, 1, 5, 2, 6, 3, 7]], ["CA", 2, 3, 5], ["CHR", 1, "shared", [2]], ["CA", 2, 3, 6], ["CHR", 0, "shared", [3]], ["CA", 1, 4, 6], ["FU", 5, [0, 1]], ["AN", 5, 0, 5], ["FU", 5, [1, 2]], ["AN", 5, 1, 4], ["FU", 5, [2, 3]], ["AN", 5, 2, 6], ["FU", 3, [0, 1]], ["SP", 3, 0, 201, [1], 1], ["AN", 3, 1, 2], ["FFSP", 3, 0, [2, 1], 1, 1], ["AN", 3, 1, 6], ["FU", 1, [0, 1]], ["SP", 1, 0, 67, [1], 1], ["AN", 1, 1, 2], ["FFSP", 1, 0, [2, 1], 1, 1], ["AN", 1, 1, 6], ["PR", 4, 0, "auto_unroll_max_step$0"]]]], "r": [[2.82211e-06], 0, 0.568679, 1692824964], "v": "v0.6"}
{"i": [["[\"matmul\", 67, 67, 3, \"float32\"]", "cuda -keys=cuda,gpu -arch=sm_75 -max_num_threads=1024 -thread_warp_size=32", [-1, 16, 64, 49152, 2147483647, 1024, 8, 32], "", 0, []], [[], [["CHW", 2, "local"], ["SP", 2, 0, 67, [1, 67, 1, 1], 1], ["SP", 2, 5, 3, [1, 1, 1, 1], 1], ["SP", 2, 10, 67, [67, 1], 1], ["RE", 2, [0, 5, 1, 6, 2, 7, 10, 11, 3, 8, 12, 4, 9]], ["FSP", 3, 0, 1, 3], ["FSP", 3, 4, 2, 3], ["RE", 3, [0, 4, 1, 5, 2, 6, 3, 7]], ["CA", 2, 3, 5], ["CHR", 1, "shared", [2]], ["CA", 2, 3, 6], ["CHR", 0, "shared", [3]], ["CA", 1, 4, 6], ["FU", 5, [0, 1]], ["AN", 5, 0, 5], ["FU", 5, [1, 2]], ["AN", 5, 1, 4], ["FU", 5, [2, 3]], ["AN", 5, 2, 6], ["FU", 3, [0, 1]], ["SP", 3, 0, 1, [1], 1], ["AN", 3, 1, 2], ["FFSP", 3, 0, [2, 1], 1, 1], ["AN", 3, 1, 6], ["FU", 1, [0, 1]], ["SP", 1, 0, 1, [1], 1], ["AN", 1, 1, 2], ["FFSP", 1, 0, [2, 1], 1, 1], ["AN", 1, 1, 6], ["PR", 4, 0, "auto_unroll_max_step$0"]]]], "r": [[2.09681e-06], 0, 0.503385, 1692824964], "v": "v0.6"}
{"i": [["[\"matmul\", 67, 67, 3, \"float32\"]", "cuda -keys=cuda,gpu -arch=sm_75 -max_num_threads=1024 -thread_warp_size=32", [-1, 16, 64, 49152, 2147483647, 1024, 8, 32], "", 0, []], [[], [["CHW", 2, "local"], ["SP", 2, 0, 67, [1, 67, 1, 1], 1], ["SP", 2, 5, 3, [1, 1, 1, 3], 1], ["SP", 2, 10, 67, [67, 1], 1], ["RE", 2, [0, 5, 1, 6, 2, 7, 10, 11, 3, 8, 12, 4, 9]], ["FSP", 3, 0, 1, 3], ["FSP", 3, 4, 2, 3], ["RE", 3, [0, 4, 1, 5, 2, 6, 3, 7]], ["CA", 2, 3, 5], ["CHR", 1, "shared", [2]], ["CA", 2, 3, 6], ["CHR", 0, "shared", [3]], ["CA", 1, 4, 6], ["FU", 5, [0, 1]], ["AN", 5, 0, 5], ["FU", 5, [1, 2]], ["AN", 5, 1, 4], ["FU", 5, [2, 3]], ["AN", 5, 2, 6], ["FU", 3, [0, 1]], ["SP", 3, 0, 201, [3], 1], ["AN", 3, 1, 2], ["FFSP", 3, 0, [2, 1], 1, 1], ["AN", 3, 1, 6], ["FU", 1, [0, 1]], ["SP", 1, 0, 67, [1], 1], ["AN", 1, 1, 2], ["FFSP", 1, 0, [2, 1], 1, 1], ["AN", 1, 1, 6], ["PR", 4, 0, "auto_unroll_max_step$1024"]]]], "r": [[2.23696e-06], 0, 0.647418, 1692824964], "v": "v0.6"}
{"i": [["[\"matmul\", 67, 67, 3, \"float32\"]", "cuda -keys=cuda,gpu -arch=sm_75 -max_num_threads=1024 -thread_warp_size=32", [-1, 16, 64, 49152, 2147483647, 1024, 8, 32], "", 0, []], [[], [["CHW", 2, "local"], ["SP", 2, 0, 67, [1, 67, 1, 1], 1], ["SP", 2, 5, 3, [1, 3, 1, 1], 1], ["SP", 2, 10, 67, [1, 1], 1], ["RE", 2, [0, 5, 1, 6, 2, 7, 10, 11, 3, 8, 12, 4, 9]], ["FSP", 3, 0, 1, 3], ["FSP", 3, 4, 2, 3], ["RE", 3, [0, 4, 1, 5, 2, 6, 3, 7]], ["CA", 2, 3, 5], ["CHR", 1, "shared", [2]], ["CA", 2, 3, 6], ["CHR", 0, "shared", [3]], ["CA", 1, 4, 6], ["FU", 5, [0, 1]], ["AN", 5, 0, 5], ["FU", 5, [1, 2]], ["AN", 5, 1, 4], ["FU", 5, [2, 3]], ["AN", 5, 2, 6], ["FU", 3, [0, 1]], ["SP", 3, 0, 67, [1], 1], ["AN", 3, 1, 2], ["FFSP", 3, 0, [2, 1], 1, 1], ["AN", 3, 1, 6], ["FU", 1, [0, 1]], ["SP", 1, 0, 67, [1], 1], ["AN", 1, 1, 2], ["FFSP", 1, 0, [2, 1], 1, 1], ["AN", 1, 1, 6], ["PR", 4, 0, "auto_unroll_max_step$16"]]]], "r": [[9.36187e-06], 0, 0.519583, 1692824965], "v": "v0.6"}
{"i": [["[\"matmul\", 67, 67, 3, \"float32\"]", "cuda -keys=cuda,gpu -arch=sm_75 -max_num_threads=1024 -thread_warp_size=32", [-1, 16, 64, 49152, 2147483647, 1024, 8, 32], "", 0, []], [[], [["CHW", 2, "local"], ["SP", 2, 0, 67, [1, 1, 67, 1], 1], ["SP", 2, 5, 3, [3, 1, 1, 1], 1], ["SP", 2, 10, 67, [67, 1], 1], ["RE", 2, [0, 5, 1, 6, 2, 7, 10, 11, 3, 8, 12, 4, 9]], ["FSP", 3, 0, 1, 3], ["FSP", 3, 4, 2, 3], ["RE", 3, [0, 4, 1, 5, 2, 6, 3, 7]], ["CA", 2, 3, 5], ["CHR", 1, "shared", [2]], ["CA", 2, 3, 6], ["CHR", 0, "shared", [3]], ["CA", 1, 4, 6], ["FU", 5, [0, 1]], ["AN", 5, 0, 5], ["FU", 5, [1, 2]], ["AN", 5, 1, 4], ["FU", 5, [2, 3]], ["AN", 5, 2, 6], ["FU", 3, [0, 1]], ["SP", 3, 0, 1, [1], 1], ["AN", 3, 1, 2], ["FFSP", 3, 0, [2, 1], 1, 1], ["AN", 3, 1, 6], ["FU", 1, [0, 1]], ["SP", 1, 0, 1, [1], 1], ["AN", 1, 1, 2], ["FFSP", 1, 0, [2, 1], 1, 1], ["AN", 1, 1, 6], ["PR", 4, 0, "auto_unroll_max_step$0"]]]], "r": [[4.43156e-05], 0, 0.748227, 1692824968], "v": "v0.6"}
{"i": [["[\"matmul\", 67, 67, 3, \"float32\"]", "cuda -keys=cuda,gpu -arch=sm_75 -max_num_threads=1024 -thread_warp_size=32", [-1, 16, 64, 49152, 2147483647, 1024, 8, 32], "", 0, []], [[], [["CHW", 2, "local"], ["SP", 2, 0, 67, [1, 1, 67, 1], 1], ["SP", 2, 5, 3, [1, 1, 3, 1], 1], ["SP", 2, 10, 67, [67, 1], 1], ["RE", 2, [0, 5, 1, 6, 2, 7, 10, 11, 3, 8, 12, 4, 9]], ["FSP", 3, 0, 1, 3], ["FSP", 3, 4, 2, 3], ["RE", 3, [0, 4, 1, 5, 2, 6, 3, 7]], ["CA", 2, 3, 5], ["CHR", 1, "shared", [2]], ["CA", 2, 3, 6], ["CHR", 0, "shared", [3]], ["CA", 1, 4, 6], ["FU", 5, [0, 1]], ["AN", 5, 0, 5], ["FU", 5, [1, 2]], ["AN", 5, 1, 4], ["FU", 5, [2, 3]], ["AN", 5, 2, 6], ["FU", 3, [0, 1]], ["SP", 3, 0, 201, [3], 1], ["AN", 3, 1, 2], ["FFSP", 3, 0, [2, 1], 1, 1], ["AN", 3, 1, 6], ["FU", 1, [0, 1]], ["SP", 1, 0, 67, [1], 1], ["AN", 1, 1, 2], ["FFSP", 1, 0, [2, 1], 1, 1], ["AN", 1, 1, 6], ["PR", 4, 0, "auto_unroll_max_step$1024"]]]], "r": [[3.96989e-05], 0, 0.936026, 1692824968], "v": "v0.6"}
{"i": [["[\"matmul\", 67, 67, 3, \"float32\"]", "cuda -keys=cuda,gpu -arch=sm_75 -max_num_threads=1024 -thread_warp_size=32", [-1, 16, 64, 49152, 2147483647, 1024, 8, 32], "", 0, []], [[], [["CHW", 2, "local"], ["SP", 2, 0, 67, [1, 1, 1, 1], 1], ["SP", 2, 5, 3, [1, 1, 1, 1], 1], ["SP", 2, 10, 67, [67, 1], 1], ["RE", 2, [0, 5, 1, 6, 2, 7, 10, 11, 3, 8, 12, 4, 9]], ["FSP", 3, 0, 1, 3], ["FSP", 3, 4, 2, 3], ["RE", 3, [0, 4, 1, 5, 2, 6, 3, 7]], ["CA", 2, 3, 5], ["CHR", 1, "shared", [2]], ["CA", 2, 3, 6], ["CHR", 0, "shared", [3]], ["CA", 1, 4, 6], ["FU", 5, [0, 1]], ["AN", 5, 0, 5], ["FU", 5, [1, 2]], ["AN", 5, 1, 4], ["FU", 5, [2, 3]], ["AN", 5, 2, 6], ["FU", 3, [0, 1]], ["SP", 3, 0, 1, [1], 1], ["AN", 3, 1, 2], ["FFSP", 3, 0, [2, 1], 1, 1], ["AN", 3, 1, 6], ["FU", 1, [0, 1]], ["SP", 1, 0, 1, [1], 1], ["AN", 1, 1, 2], ["FFSP", 1, 0, [2, 1], 1, 1], ["AN", 1, 1, 6], ["PR", 4, 0, "auto_unroll_max_step$512"]]]], "r": [[3.95028e-06], 0, 0.621001, 1692824968], "v": "v0.6"}
{"i": [["[\"matmul\", 67, 67, 3, \"float32\"]", "cuda -keys=cuda,gpu -arch=sm_75 -max_num_threads=1024 -thread_warp_size=32", [-1, 16, 64, 49152, 2147483647, 1024, 8, 32], "", 0, []], [[], [["CHW", 2, "local"], ["SP", 2, 0, 67, [1, 67, 1, 1], 1], ["SP", 2, 5, 3, [1, 3, 1, 1], 1], ["SP", 2, 10, 67, [1, 1], 1], ["RE", 2, [0, 5, 1, 6, 2, 7, 10, 11, 3, 8, 12, 4, 9]], ["FSP", 3, 0, 1, 3], ["FSP", 3, 4, 2, 3], ["RE", 3, [0, 4, 1, 5, 2, 6, 3, 7]], ["CA", 2, 3, 5], ["CHR", 1, "shared", [2]], ["CA", 2, 3, 6], ["CHR", 0, "shared", [3]], ["CA", 1, 4, 6], ["FU", 5, [0, 1]], ["AN", 5, 0, 5], ["FU", 5, [1, 2]], ["AN", 5, 1, 4], ["FU", 5, [2, 3]], ["AN", 5, 2, 6], ["FU", 3, [0, 1]], ["SP", 3, 0, 3, [1], 1], ["AN", 3, 1, 2], ["FFSP", 3, 0, [2, 1], 1, 1], ["AN", 3, 1, 6], ["FU", 1, [0, 1]], ["SP", 1, 0, 1, [1], 1], ["AN", 1, 1, 2], ["FFSP", 1, 0, [2, 1], 1, 1], ["AN", 1, 1, 6], ["PR", 4, 0, "auto_unroll_max_step$1024"]]]], "r": [[6.39797e-06], 0, 0.686881, 1692824969], "v": "v0.6"}
{"i": [["[\"matmul\", 67, 67, 3, \"float32\"]", "cuda -keys=cuda,gpu -arch=sm_75 -max_num_threads=1024 -thread_warp_size=32", [-1, 16, 64, 49152, 2147483647, 1024, 8, 32], "", 0, []], [[], [["CHW", 2, "local"], ["SP", 2, 0, 67, [1, 1, 1, 1], 1], ["SP", 2, 5, 3, [3, 1, 1, 1], 1], ["SP", 2, 10, 67, [1, 1], 1], ["RE", 2, [0, 5, 1, 6, 2, 7, 10, 11, 3, 8, 12, 4, 9]], ["FSP", 3, 0, 1, 3], ["FSP", 3, 4, 2, 3], ["RE", 3, [0, 4, 1, 5, 2, 6, 3, 7]], ["CA", 2, 3, 5], ["CHR", 1, "shared", [2]], ["CA", 2, 3, 6], ["CHR", 0, "shared", [3]], ["CA", 1, 4, 6], ["FU", 5, [0, 1]], ["AN", 5, 0, 5], ["FU", 5, [1, 2]], ["AN", 5, 1, 4], ["FU", 5, [2, 3]], ["AN", 5, 2, 6], ["FU", 3, [0, 1]], ["SP", 3, 0, 1, [1], 1], ["AN", 3, 1, 2], ["FFSP", 3, 0, [2, 1], 1, 1], ["AN", 3, 1, 6], ["FU", 1, [0, 1]], ["SP", 1, 0, 1, [1], 1], ["AN", 1, 1, 2], ["FFSP", 1, 0, [2, 1], 1, 1], ["AN", 1, 1, 6], ["PR", 4, 0, "auto_unroll_max_step$1024"]]]], "r": [[5.08423e-06], 0, 0.725299, 1692824969], "v": "v0.6"}
{"i": [["[\"matmul\", 67, 67, 3, \"float32\"]", "cuda -keys=cuda,gpu -arch=sm_75 -max_num_threads=1024 -thread_warp_size=32", [-1, 16, 64, 49152, 2147483647, 1024, 8, 32], "", 0, []], [[], [["CHW", 2, "local"], ["SP", 2, 0, 67, [1, 1, 1, 1], 1], ["SP", 2, 5, 3, [1, 1, 1, 3], 1], ["SP", 2, 10, 67, [1, 1], 1], ["RE", 2, [0, 5, 1, 6, 2, 7, 10, 11, 3, 8, 12, 4, 9]], ["FSP", 3, 0, 1, 3], ["FSP", 3, 4, 2, 3], ["RE", 3, [0, 4, 1, 5, 2, 6, 3, 7]], ["CA", 2, 3, 5], ["CHR", 1, "shared", [2]], ["CA", 2, 3, 6], ["CHR", 0, "shared", [3]], ["CA", 1, 4, 6], ["FU", 5, [0, 1]], ["AN", 5, 0, 5], ["FU", 5, [1, 2]], ["AN", 5, 1, 4], ["FU", 5, [2, 3]], ["AN", 5, 2, 6], ["FU", 3, [0, 1]], ["SP", 3, 0, 201, [1], 1], ["AN", 3, 1, 2], ["FFSP", 3, 0, [2, 1], 1, 1], ["AN", 3, 1, 6], ["FU", 1, [0, 1]], ["SP", 1, 0, 67, [1], 1], ["AN", 1, 1, 2], ["FFSP", 1, 0, [2, 1], 1, 1], ["AN", 1, 1, 6], ["PR", 4, 0, "auto_unroll_max_step$1024"]]]], "r": [[5.08345e-06], 0, 0.711466, 1692824969], "v": "v0.6"}
{"i": [["[\"matmul\", 67, 67, 3, \"float32\"]", "cuda -keys=cuda,gpu -arch=sm_75 -max_num_threads=1024 -thread_warp_size=32", [-1, 16, 64, 49152, 2147483647, 1024, 8, 32], "", 0, []], [[], [["CHW", 2, "local"], ["SP", 2, 0, 67, [1, 67, 1, 1], 1], ["SP", 2, 5, 3, [1, 1, 1, 3], 1], ["SP", 2, 10, 67, [67, 1], 1], ["RE", 2, [0, 5, 1, 6, 2, 7, 10, 11, 3, 8, 12, 4, 9]], ["FSP", 3, 0, 1, 3], ["FSP", 3, 4, 2, 3], ["RE", 3, [0, 4, 1, 5, 2, 6, 3, 7]], ["CA", 2, 3, 5], ["CHR", 1, "shared", [2]], ["CA", 2, 3, 6], ["CHR", 0, "shared", [3]], ["CA", 1, 4, 6], ["FU", 5, [0, 1]], ["AN", 5, 0, 5], ["FU", 5, [1, 2]], ["AN", 5, 1, 4], ["FU", 5, [2, 3]], ["AN", 5, 2, 6], ["FU", 3, [0, 1]], ["SP", 3, 0, 67, [1], 1], ["AN", 3, 1, 2], ["FFSP", 3, 0, [2, 1], 1, 1], ["AN", 3, 1, 6], ["FU", 1, [0, 1]], ["SP", 1, 0, 67, [1], 1], ["AN", 1, 1, 2], ["FFSP", 1, 0, [2, 1], 1, 1], ["AN", 1, 1, 6], ["PR", 4, 0, "auto_unroll_max_step$64"]]]], "r": [[2.23422e-06], 0, 0.505889, 1692824969], "v": "v0.6"}
{"i": [["[\"matmul\", 67, 67, 3, \"float32\"]", "cuda -keys=cuda,gpu -arch=sm_75 -max_num_threads=1024 -thread_warp_size=32", [-1, 16, 64, 49152, 2147483647, 1024, 8, 32], "", 0, []], [[], [["CHW", 2, "local"], ["SP", 2, 0, 67, [1, 67, 1, 1], 1], ["SP", 2, 5, 3, [3, 1, 1, 1], 1], ["SP", 2, 10, 67, [67, 1], 1], ["RE", 2, [0, 5, 1, 6, 2, 7, 10, 11, 3, 8, 12, 4, 9]], ["FSP", 3, 0, 1, 3], ["FSP", 3, 4, 2, 3], ["RE", 3, [0, 4, 1, 5, 2, 6, 3, 7]], ["CA", 2, 3, 5], ["CHR", 1, "shared", [2]], ["CA", 2, 3, 6], ["CHR", 0, "shared", [3]], ["CA", 1, 4, 6], ["FU", 5, [0, 1]], ["AN", 5, 0, 5], ["FU", 5, [1, 2]], ["AN", 5, 1, 4], ["FU", 5, [2, 3]], ["AN", 5, 2, 6], ["FU", 3, [0, 1]], ["SP", 3, 0, 201, [3], 1], ["AN", 3, 1, 2], ["FFSP", 3, 0, [2, 1], 1, 1], ["AN", 3, 1, 6], ["FU", 1, [0, 1]], ["SP", 1, 0, 67, [1], 1], ["AN", 1, 1, 2], ["FFSP", 1, 0, [2, 1], 1, 1], ["AN", 1, 1, 6], ["PR", 4, 0, "auto_unroll_max_step$512"]]]], "r": [[2.21987e-06], 0, 0.655001, 1692824970], "v": "v0.6"}
{"i": [["[\"matmul\", 67, 67, 3, \"float32\"]", "cuda -keys=cuda,gpu -arch=sm_75 -max_num_threads=1024 -thread_warp_size=32", [-1, 16, 64, 49152, 2147483647, 1024, 8, 32], "", 0, []], [[], [["CHW", 2, "local"], ["SP", 2, 0, 67, [1, 67, 1, 1], 1], ["SP", 2, 5, 3, [3, 1, 1, 1], 1], ["SP", 2, 10, 67, [1, 1], 1], ["RE", 2, [0, 5, 1, 6, 2, 7, 10, 11, 3, 8, 12, 4, 9]], ["FSP", 3, 0, 1, 3], ["FSP", 3, 4, 2, 3], ["RE", 3, [0, 4, 1, 5, 2, 6, 3, 7]], ["CA", 2, 3, 5], ["CHR", 1, "shared", [2]], ["CA", 2, 3, 6], ["CHR", 0, "shared", [3]], ["CA", 1, 4, 6], ["FU", 5, [0, 1]], ["AN", 5, 0, 5], ["FU", 5, [1, 2]], ["AN", 5, 1, 4], ["FU", 5, [2, 3]], ["AN", 5, 2, 6], ["FU", 3, [0, 1]], ["SP", 3, 0, 1, [1], 1], ["AN", 3, 1, 2], ["FFSP", 3, 0, [2, 1], 1, 1], ["AN", 3, 1, 6], ["FU", 1, [0, 1]], ["SP", 1, 0, 1, [1], 1], ["AN", 1, 1, 2], ["FFSP", 1, 0, [2, 1], 1, 1], ["AN", 1, 1, 6], ["PR", 4, 0, "auto_unroll_max_step$1024"]]]], "r": [[4.87639e-06], 0, 0.726105, 1692824970], "v": "v0.6"}
{"i": [["[\"matmul\", 67, 67, 3, \"float32\"]", "cuda -keys=cuda,gpu -arch=sm_75 -max_num_threads=1024 -thread_warp_size=32", [-1, 16, 64, 49152, 2147483647, 1024, 8, 32], "", 0, []], [[], [["CHW", 2, "local"], ["SP", 2, 0, 67, [1, 67, 1, 1], 1], ["SP", 2, 5, 3, [1, 3, 1, 1], 1], ["SP", 2, 10, 67, [67, 1], 1], ["RE", 2, [0, 5, 1, 6, 2, 7, 10, 11, 3, 8, 12, 4, 9]], ["FSP", 3, 0, 1, 3], ["FSP", 3, 4, 2, 3], ["RE", 3, [0, 4, 1, 5, 2, 6, 3, 7]], ["CA", 2, 3, 5], ["CHR", 1, "shared", [2]], ["CA", 2, 3, 6], ["CHR", 0, "shared", [3]], ["CA", 1, 4, 6], ["FU", 5, [0, 1]], ["AN", 5, 0, 5], ["FU", 5, [1, 2]], ["AN", 5, 1, 4], ["FU", 5, [2, 3]], ["AN", 5, 2, 6], ["FU", 3, [0, 1]], ["SP", 3, 0, 201, [3], 1], ["AN", 3, 1, 2], ["FFSP", 3, 0, [2, 1], 1, 1], ["AN", 3, 1, 6], ["FU", 1, [0, 1]], ["SP", 1, 0, 67, [1], 1], ["AN", 1, 1, 2], ["FFSP", 1, 0, [2, 1], 1, 1], ["AN", 1, 1, 6], ["PR", 4, 0, "auto_unroll_max_step$512"]]]], "r": [[2.70529e-06], 0, 0.616921, 1692824970], "v": "v0.6"}
{"i": [["[\"matmul\", 67, 67, 3, \"float32\"]", "cuda -keys=cuda,gpu -arch=sm_75 -max_num_threads=1024 -thread_warp_size=32", [-1, 16, 64, 49152, 2147483647, 1024, 8, 32], "", 0, []], [[], [["CHW", 2, "local"], ["SP", 2, 0, 67, [1, 1, 67, 1], 1], ["SP", 2, 5, 3, [1, 1, 1, 1], 1], ["SP", 2, 10, 67, [67, 1], 1], ["RE", 2, [0, 5, 1, 6, 2, 7, 10, 11, 3, 8, 12, 4, 9]], ["FSP", 3, 0, 1, 3], ["FSP", 3, 4, 2, 3], ["RE", 3, [0, 4, 1, 5, 2, 6, 3, 7]], ["CA", 2, 3, 5], ["CHR", 1, "shared", [2]], ["CA", 2, 3, 6], ["CHR", 0, "shared", [3]], ["CA", 1, 4, 6], ["FU", 5, [0, 1]], ["AN", 5, 0, 5], ["FU", 5, [1, 2]], ["AN", 5, 1, 4], ["FU", 5, [2, 3]], ["AN", 5, 2, 6], ["FU", 3, [0, 1]], ["SP", 3, 0, 1, [1], 1], ["AN", 3, 1, 2], ["FFSP", 3, 0, [2, 1], 1, 1], ["AN", 3, 1, 6], ["FU", 1, [0, 1]], ["SP", 1, 0, 1, [1], 1], ["AN", 1, 1, 2], ["FFSP", 1, 0, [2, 1], 1, 1], ["AN", 1, 1, 6], ["PR", 4, 0, "auto_unroll_max_step$1024"]]]], "r": [[3.7382e-05], 0, 0.656377, 1692824970], "v": "v0.6"}
{"i": [["[\"matmul\", 67, 67, 3, \"float32\"]", "cuda -keys=cuda,gpu -arch=sm_75 -max_num_threads=1024 -thread_warp_size=32", [-1, 16, 64, 49152, 2147483647, 1024, 8, 32], "", 0, []], [[], [["CHW", 2, "local"], ["SP", 2, 0, 67, [1, 1, 1, 1], 1], ["SP", 2, 5, 3, [1, 1, 1, 3], 1], ["SP", 2, 10, 67, [1, 1], 1], ["RE", 2, [0, 5, 1, 6, 2, 7, 10, 11, 3, 8, 12, 4, 9]], ["FSP", 3, 0, 1, 3], ["FSP", 3, 4, 2, 3], ["RE", 3, [0, 4, 1, 5, 2, 6, 3, 7]], ["CA", 2, 3, 5], ["CHR", 1, "shared", [2]], ["CA", 2, 3, 6], ["CHR", 0, "shared", [3]], ["CA", 1, 4, 6], ["FU", 5, [0, 1]], ["AN", 5, 0, 5], ["FU", 5, [1, 2]], ["AN", 5, 1, 4], ["FU", 5, [2, 3]], ["AN", 5, 2, 6], ["FU", 3, [0, 1]], ["SP", 3, 0, 3, [1], 1], ["AN", 3, 1, 2], ["FFSP", 3, 0, [2, 1], 1, 1], ["AN", 3, 1, 6], ["FU", 1, [0, 1]], ["SP", 1, 0, 1, [1], 1], ["AN", 1, 1, 2], ["FFSP", 1, 0, [2, 1], 1, 1], ["AN", 1, 1, 6], ["PR", 4, 0, "auto_unroll_max_step$64"]]]], "r": [[5.12008e-06], 0, 0.532261, 1692824971], "v": "v0.6"}
{"i": [["[\"matmul\", 67, 67, 3, \"float32\"]", "cuda -keys=cuda,gpu -arch=sm_75 -max_num_threads=1024 -thread_warp_size=32", [-1, 16, 64, 49152, 2147483647, 1024, 8, 32], "", 0, []], [[], [["CHW", 2, "local"], ["SP", 2, 0, 67, [1, 1, 1, 1], 1], ["SP", 2, 5, 3, [1, 3, 1, 1], 1], ["SP", 2, 10, 67, [1, 1], 1], ["RE", 2, [0, 5, 1, 6, 2, 7, 10, 11, 3, 8, 12, 4, 9]], ["FSP", 3, 0, 1, 3], ["FSP", 3, 4, 2, 3], ["RE", 3, [0, 4, 1, 5, 2, 6, 3, 7]], ["CA", 2, 3, 5], ["CHR", 1, "shared", [2]], ["CA", 2, 3, 6], ["CHR", 0, "shared", [3]], ["CA", 1, 4, 6], ["FU", 5, [0, 1]], ["AN", 5, 0, 5], ["FU", 5, [1, 2]], ["AN", 5, 1, 4], ["FU", 5, [2, 3]], ["AN", 5, 2, 6], ["FU", 3, [0, 1]], ["SP", 3, 0, 67, [1], 1], ["AN", 3, 1, 2], ["FFSP", 3, 0, [2, 1], 1, 1], ["AN", 3, 1, 6], ["FU", 1, [0, 1]], ["SP", 1, 0, 67, [1], 1], ["AN", 1, 1, 2], ["FFSP", 1, 0, [2, 1], 1, 1], ["AN", 1, 1, 6], ["PR", 4, 0, "auto_unroll_max_step$0"]]]], "r": [[5.71275e-06], 0, 0.513074, 1692824971], "v": "v0.6"}
{"i": [["[\"matmul\", 67, 67, 3, \"float32\"]", "cuda -keys=cuda,gpu -arch=sm_75 -max_num_threads=1024 -thread_warp_size=32", [-1, 16, 64, 49152, 2147483647, 1024, 8, 32], "", 0, []], [[], [["CHW", 2, "local"], ["SP", 2, 0, 67, [1, 1, 67, 1], 1], ["SP", 2, 5, 3, [1, 3, 1, 1], 1], ["SP", 2, 10, 67, [67, 1], 1], ["RE", 2, [0, 5, 1, 6, 2, 7, 10, 11, 3, 8, 12, 4, 9]], ["FSP", 3, 0, 1, 3], ["FSP", 3, 4, 2, 3], ["RE", 3, [0, 4, 1, 5, 2, 6, 3, 7]], ["CA", 2, 3, 5], ["CHR", 1, "shared", [2]], ["CA", 2, 3, 6], ["CHR", 0, "shared", [3]], ["CA", 1, 4, 6], ["FU", 5, [0, 1]], ["AN", 5, 0, 5], ["FU", 5, [1, 2]], ["AN", 5, 1, 4], ["FU", 5, [2, 3]], ["AN", 5, 2, 6], ["FU", 3, [0, 1]], ["SP", 3, 0, 67, [1], 1], ["AN", 3, 1, 2], ["FFSP", 3, 0, [2, 1], 1, 1], ["AN", 3, 1, 6], ["FU", 1, [0, 1]], ["SP", 1, 0, 67, [1], 1], ["AN", 1, 1, 2], ["FFSP", 1, 0, [2, 1], 1, 1], ["AN", 1, 1, 6], ["PR", 4, 0, "auto_unroll_max_step$0"]]]], "r": [[9.73659e-05], 0, 0.45543, 1692824971], "v": "v0.6"}
{"i": [["[\"matmul\", 67, 67, 3, \"float32\"]", "cuda -keys=cuda,gpu -arch=sm_75 -max_num_threads=1024 -thread_warp_size=32", [-1, 16, 64, 49152, 2147483647, 1024, 8, 32], "", 0, []], [[], [["CHW", 2, "local"], ["SP", 2, 0, 67, [1, 1, 1, 1], 1], ["SP", 2, 5, 3, [1, 1, 1, 1], 1], ["SP", 2, 10, 67, [67, 1], 1], ["RE", 2, [0, 5, 1, 6, 2, 7, 10, 11, 3, 8, 12, 4, 9]], ["FSP", 3, 0, 1, 3], ["FSP", 3, 4, 2, 3], ["RE", 3, [0, 4, 1, 5, 2, 6, 3, 7]], ["CA", 2, 3, 5], ["CHR", 1, "shared", [2]], ["CA", 2, 3, 6], ["CHR", 0, "shared", [3]], ["CA", 1, 4, 6], ["FU", 5, [0, 1]], ["AN", 5, 0, 5], ["FU", 5, [1, 2]], ["AN", 5, 1, 4], ["FU", 5, [2, 3]], ["AN", 5, 2, 6], ["FU", 3, [0, 1]], ["SP", 3, 0, 201, [1], 1], ["AN", 3, 1, 2], ["FFSP", 3, 0, [2, 1], 1, 1], ["AN", 3, 1, 6], ["FU", 1, [0, 1]], ["SP", 1, 0, 67, [1], 1], ["AN", 1, 1, 2], ["FFSP", 1, 0, [2, 1], 1, 1], ["AN", 1, 1, 6], ["PR", 4, 0, "auto_unroll_max_step$1024"]]]], "r": [[3.94926e-06], 0, 0.61535, 1692824971], "v": "v0.6"}
{"i": [["[\"matmul\", 67, 67, 3, \"float32\"]", "cuda -keys=cuda,gpu -arch=sm_75 -max_num_threads=1024 -thread_warp_size=32", [-1, 16, 64, 49152, 2147483647, 1024, 8, 32], "", 0, []], [[], [["CHW", 2, "local"], ["SP", 2, 0, 67, [1, 67, 1, 1], 1], ["SP", 2, 5, 3, [1, 1, 3, 1], 1], ["SP", 2, 10, 67, [67, 1], 1], ["RE", 2, [0, 5, 1, 6, 2, 7, 10, 11, 3, 8, 12, 4, 9]], ["FSP", 3, 0, 1, 3], ["FSP", 3, 4, 2, 3], ["RE", 3, [0, 4, 1, 5, 2, 6, 3, 7]], ["CA", 2, 3, 5], ["CHR", 1, "shared", [2]], ["CA", 2, 3, 6], ["CHR", 0, "shared", [3]], ["CA", 1, 4, 6], ["FU", 5, [0, 1]], ["AN", 5, 0, 5], ["FU", 5, [1, 2]], ["AN", 5, 1, 4], ["FU", 5, [2, 3]], ["AN", 5, 2, 6], ["FU", 3, [0, 1]], ["SP", 3, 0, 1, [1], 1], ["AN", 3, 1, 2], ["FFSP", 3, 0, [2, 1], 1, 1], ["AN", 3, 1, 6], ["FU", 1, [0, 1]], ["SP", 1, 0, 1, [1], 1], ["AN", 1, 1, 2], ["FFSP", 1, 0, [2, 1], 1, 1], ["AN", 1, 1, 6], ["PR", 4, 0, "auto_unroll_max_step$16"]]]], "r": [[2.23169e-06], 0, 0.469683, 1692824971], "v": "v0.6"}
{"i": [["[\"matmul\", 67, 67, 3, \"float32\"]", "cuda -keys=cuda,gpu -arch=sm_75 -max_num_threads=1024 -thread_warp_size=32", [-1, 16, 64, 49152, 2147483647, 1024, 8, 32], "", 0, []], [[], [["CHW", 2, "local"], ["SP", 2, 0, 67, [1, 67, 1, 1], 1], ["SP", 2, 5, 3, [1, 1, 3, 1], 1], ["SP", 2, 10, 67, [67, 1], 1], ["RE", 2, [0, 5, 1, 6, 2, 7, 10, 11, 3, 8, 12, 4, 9]], ["FSP", 3, 0, 1, 3], ["FSP", 3, 4, 2, 3], ["RE", 3, [0, 4, 1, 5, 2, 6, 3, 7]], ["CA", 2, 3, 5], ["CHR", 1, "shared", [2]], ["CA", 2, 3, 6], ["CHR", 0, "shared", [3]], ["CA", 1, 4, 6], ["FU", 5, [0, 1]], ["AN", 5, 0, 5], ["FU", 5, [1, 2]], ["AN", 5, 1, 4], ["FU", 5, [2, 3]], ["AN", 5, 2, 6], ["FU", 3, [0, 1]], ["SP", 3, 0, 201, [1], 1], ["AN", 3, 1, 2], ["FFSP", 3, 0, [2, 1], 1, 1], ["AN", 3, 1, 6], ["FU", 1, [0, 1]], ["SP", 1, 0, 67, [1], 1], ["AN", 1, 1, 2], ["FFSP", 1, 0, [2, 1], 1, 1], ["AN", 1, 1, 6], ["PR", 4, 0, "auto_unroll_max_step$1024"]]]], "r": [[2.69829e-06], 0, 0.730565, 1692824975], "v": "v0.6"}
{"i": [["[\"matmul\", 67, 67, 3, \"float32\"]", "cuda -keys=cuda,gpu -arch=sm_75 -max_num_threads=1024 -thread_warp_size=32", [-1, 16, 64, 49152, 2147483647, 1024, 8, 32], "", 0, []], [[], [["CHW", 2, "local"], ["SP", 2, 0, 67, [1, 67, 1, 1], 1], ["SP", 2, 5, 3, [1, 1, 3, 1], 1], ["SP", 2, 10, 67, [67, 1], 1], ["RE", 2, [0, 5, 1, 6, 2, 7, 10, 11, 3, 8, 12, 4, 9]], ["FSP", 3, 0, 1, 3], ["FSP", 3, 4, 2, 3], ["RE", 3, [0, 4, 1, 5, 2, 6, 3, 7]], ["CA", 2, 3, 5], ["CHR", 1, "shared", [2]], ["CA", 2, 3, 6], ["CHR", 0, "shared", [3]], ["CA", 1, 4, 6], ["FU", 5, [0, 1]], ["AN", 5, 0, 5], ["FU", 5, [1, 2]], ["AN", 5, 1, 4], ["FU", 5, [2, 3]], ["AN", 5, 2, 6], ["FU", 3, [0, 1]], ["SP", 3, 0, 3, [3], 1], ["AN", 3, 1, 2], ["FFSP", 3, 0, [2, 1], 1, 1], ["AN", 3, 1, 6], ["FU", 1, [0, 1]], ["SP", 1, 0, 1, [1], 1], ["AN", 1, 1, 2], ["FFSP", 1, 0, [2, 1], 1, 1], ["AN", 1, 1, 6], ["PR", 4, 0, "auto_unroll_max_step$1024"]]]], "r": [[2.23415e-06], 0, 0.692075, 1692824975], "v": "v0.6"}
{"i": [["[\"matmul\", 67, 67, 3, \"float32\"]", "cuda -keys=cuda,gpu -arch=sm_75 -max_num_threads=1024 -thread_warp_size=32", [-1, 16, 64, 49152, 2147483647, 1024, 8, 32], "", 0, []], [[], [["CHW", 2, "local"], ["SP", 2, 0, 67, [1, 1, 67, 1], 1], ["SP", 2, 5, 3, [1, 1, 1, 3], 1], ["SP", 2, 10, 67, [1, 1], 1], ["RE", 2, [0, 5, 1, 6, 2, 7, 10, 11, 3, 8, 12, 4, 9]], ["FSP", 3, 0, 1, 3], ["FSP", 3, 4, 2, 3], ["RE", 3, [0, 4, 1, 5, 2, 6, 3, 7]], ["CA", 2, 3, 5], ["CHR", 1, "shared", [2]], ["CA", 2, 3, 6], ["CHR", 0, "shared", [3]], ["CA", 1, 4, 6], ["FU", 5, [0, 1]], ["AN", 5, 0, 5], ["FU", 5, [1, 2]], ["AN", 5, 1, 4], ["FU", 5, [2, 3]], ["AN", 5, 2, 6], ["FU", 3, [0, 1]], ["SP", 3, 0, 3, [1], 1], ["AN", 3, 1, 2], ["FFSP", 3, 0, [2, 1], 1, 1], ["AN", 3, 1, 6], ["FU", 1, [0, 1]], ["SP", 1, 0, 1, [1], 1], ["AN", 1, 1, 2], ["FFSP", 1, 0, [2, 1], 1, 1], ["AN", 1, 1, 6], ["PR", 4, 0, "auto_unroll_max_step$64"]]]], "r": [[4.61918e-05], 0, 0.627867, 1692824975], "v": "v0.6"}
{"i": [["[\"matmul\", 67, 67, 3, \"float32\"]", "cuda -keys=cuda,gpu -arch=sm_75 -max_num_threads=1024 -thread_warp_size=32", [-1, 16, 64, 49152, 2147483647, 1024, 8, 32], "", 0, []], [[], [["CHW", 2, "local"], ["SP", 2, 0, 67, [1, 67, 1, 1], 1], ["SP", 2, 5, 3, [1, 1, 1, 1], 1], ["SP", 2, 10, 67, [1, 1], 1], ["RE", 2, [0, 5, 1, 6, 2, 7, 10, 11, 3, 8, 12, 4, 9]], ["FSP", 3, 0, 1, 3], ["FSP", 3, 4, 2, 3], ["RE", 3, [0, 4, 1, 5, 2, 6, 3, 7]], ["CA", 2, 3, 5], ["CHR", 1, "shared", [2]], ["CA", 2, 3, 6], ["CHR", 0, "shared", [3]], ["CA", 1, 4, 6], ["FU", 5, [0, 1]], ["AN", 5, 0, 5], ["FU", 5, [1, 2]], ["AN", 5, 1, 4], ["FU", 5, [2, 3]], ["AN", 5, 2, 6], ["FU", 3, [0, 1]], ["SP", 3, 0, 67, [1], 1], ["AN", 3, 1, 2], ["FFSP", 3, 0, [2, 1], 1, 1], ["AN", 3, 1, 6], ["FU", 1, [0, 1]], ["SP", 1, 0, 67, [1], 1], ["AN", 1, 1, 2], ["FFSP", 1, 0, [2, 1], 1, 1], ["AN", 1, 1, 6], ["PR", 4, 0, "auto_unroll_max_step$16"]]]], "r": [[8.03579e-06], 0, 0.534793, 1692824975], "v": "v0.6"}
{"i": [["[\"matmul\", 67, 67, 3, \"float32\"]", "cuda -keys=cuda,gpu -arch=sm_75 -max_num_threads=1024 -thread_warp_size=32", [-1, 16, 64, 49152, 2147483647, 1024, 8, 32], "", 0, []], [[], [["CHW", 2, "local"], ["SP", 2, 0, 67, [1, 67, 1, 1], 1], ["SP", 2, 5, 3, [1, 1, 3, 1], 1], ["SP", 2, 10, 67, [1, 1], 1], ["RE", 2, [0, 5, 1, 6, 2, 7, 10, 11, 3, 8, 12, 4, 9]], ["FSP", 3, 0, 1, 3], ["FSP", 3, 4, 2, 3], ["RE", 3, [0, 4, 1, 5, 2, 6, 3, 7]], ["CA", 2, 3, 5], ["CHR", 1, "shared", [2]], ["CA", 2, 3, 6], ["CHR", 0, "shared", [3]], ["CA", 1, 4, 6], ["FU", 5, [0, 1]], ["AN", 5, 0, 5], ["FU", 5, [1, 2]], ["AN", 5, 1, 4], ["FU", 5, [2, 3]], ["AN", 5, 2, 6], ["FU", 3, [0, 1]], ["SP", 3, 0, 3, [3], 1], ["AN", 3, 1, 2], ["FFSP", 3, 0, [2, 1], 1, 1], ["AN", 3, 1, 6], ["FU", 1, [0, 1]], ["SP", 1, 0, 1, [1], 1], ["AN", 1, 1, 2], ["FFSP", 1, 0, [2, 1], 1, 1], ["AN", 1, 1, 6], ["PR", 4, 0, "auto_unroll_max_step$512"]]]], "r": [[5.85736e-06], 0, 0.780421, 1692824976], "v": "v0.6"}
{"i": [["[\"matmul\", 67, 67, 3, \"float32\"]", "cuda -keys=cuda,gpu -arch=sm_75 -max_num_threads=1024 -thread_warp_size=32", [-1, 16, 64, 49152, 2147483647, 1024, 8, 32], "", 0, []], [[], [["CHW", 2, "local"], ["SP", 2, 0, 67, [1, 1, 67, 1], 1], ["SP", 2, 5, 3, [1, 3, 1, 1], 1], ["SP", 2, 10, 67, [1, 1], 1], ["RE", 2, [0, 5, 1, 6, 2, 7, 10, 11, 3, 8, 12, 4, 9]], ["FSP", 3, 0, 1, 3], ["FSP", 3, 4, 2, 3], ["RE", 3, [0, 4, 1, 5, 2, 6, 3, 7]], ["CA", 2, 3, 5], ["CHR", 1, "shared", [2]], ["CA", 2, 3, 6], ["CHR", 0, "shared", [3]], ["CA", 1, 4, 6], ["FU", 5, [0, 1]], ["AN", 5, 0, 5], ["FU", 5, [1, 2]], ["AN", 5, 1, 4], ["FU", 5, [2, 3]], ["AN", 5, 2, 6], ["FU", 3, [0, 1]], ["SP", 3, 0, 3, [3], 1], ["AN", 3, 1, 2], ["FFSP", 3, 0, [2, 1], 1, 1], ["AN", 3, 1, 6], ["FU", 1, [0, 1]], ["SP", 1, 0, 1, [1], 1], ["AN", 1, 1, 2], ["FFSP", 1, 0, [2, 1], 1, 1], ["AN", 1, 1, 6], ["PR", 4, 0, "auto_unroll_max_step$512"]]]], "r": [[2.28302e-05], 0, 0.623357, 1692824976], "v": "v0.6"}
{"i": [["[\"matmul\", 67, 67, 3, \"float32\"]", "cuda -keys=cuda,gpu -arch=sm_75 -max_num_threads=1024 -thread_warp_size=32", [-1, 16, 64, 49152, 2147483647, 1024, 8, 32], "", 0, []], [[], [["CHW", 2, "local"], ["SP", 2, 0, 67, [1, 1, 67, 1], 1], ["SP", 2, 5, 3, [1, 1, 1, 1], 1], ["SP", 2, 10, 67, [1, 1], 1], ["RE", 2, [0, 5, 1, 6, 2, 7, 10, 11, 3, 8, 12, 4, 9]], ["FSP", 3, 0, 1, 3], ["FSP", 3, 4, 2, 3], ["RE", 3, [0, 4, 1, 5, 2, 6, 3, 7]], ["CA", 2, 3, 5], ["CHR", 1, "shared", [2]], ["CA", 2, 3, 6], ["CHR", 0, "shared", [3]], ["CA", 1, 4, 6], ["FU", 5, [0, 1]], ["AN", 5, 0, 5], ["FU", 5, [1, 2]], ["AN", 5, 1, 4], ["FU", 5, [2, 3]], ["AN", 5, 2, 6], ["FU", 3, [0, 1]], ["SP", 3, 0, 1, [1], 1], ["AN", 3, 1, 2], ["FFSP", 3, 0, [2, 1], 1, 1], ["AN", 3, 1, 6], ["FU", 1, [0, 1]], ["SP", 1, 0, 1, [1], 1], ["AN", 1, 1, 2], ["FFSP", 1, 0, [2, 1], 1, 1], ["AN", 1, 1, 6], ["PR", 4, 0, "auto_unroll_max_step$64"]]]], "r": [[3.64808e-05], 0, 0.580516, 1692824976], "v": "v0.6"}
{"i": [["[\"matmul\", 67, 67, 3, \"float32\"]", "cuda -keys=cuda,gpu -arch=sm_75 -max_num_threads=1024 -thread_warp_size=32", [-1, 16, 64, 49152, 2147483647, 1024, 8, 32], "", 0, []], [[], [["CHW", 2, "local"], ["SP", 2, 0, 67, [1, 67, 1, 1], 1], ["SP", 2, 5, 3, [1, 1, 3, 1], 1], ["SP", 2, 10, 67, [67, 1], 1], ["RE", 2, [0, 5, 1, 6, 2, 7, 10, 11, 3, 8, 12, 4, 9]], ["FSP", 3, 0, 1, 3], ["FSP", 3, 4, 2, 3], ["RE", 3, [0, 4, 1, 5, 2, 6, 3, 7]], ["CA", 2, 3, 5], ["CHR", 1, "shared", [2]], ["CA", 2, 3, 6], ["CHR", 0, "shared", [3]], ["CA", 1, 4, 6], ["FU", 5, [0, 1]], ["AN", 5, 0, 5], ["FU", 5, [1, 2]], ["AN", 5, 1, 4], ["FU", 5, [2, 3]], ["AN", 5, 2, 6], ["FU", 3, [0, 1]], ["SP", 3, 0, 201, [3], 1], ["AN", 3, 1, 2], ["FFSP", 3, 0, [2, 1], 1, 1], ["AN", 3, 1, 6], ["FU", 1, [0, 1]], ["SP", 1, 0, 67, [1], 1], ["AN", 1, 1, 2], ["FFSP", 1, 0, [2, 1], 1, 1], ["AN", 1, 1, 6], ["PR", 4, 0, "auto_unroll_max_step$64"]]]], "r": [[2.21337e-06], 0, 0.480133, 1692824976], "v": "v0.6"}
{"i": [["[\"matmul\", 67, 67, 3, \"float32\"]", "cuda -keys=cuda,gpu -arch=sm_75 -max_num_threads=1024 -thread_warp_size=32", [-1, 16, 64, 49152, 2147483647, 1024, 8, 32], "", 0, []], [[], [["CHW", 2, "local"], ["SP", 2, 0, 67, [1, 1, 67, 1], 1], ["SP", 2, 5, 3, [1, 1, 1, 3], 1], ["SP", 2, 10, 67, [67, 1], 1], ["RE", 2, [0, 5, 1, 6, 2, 7, 10, 11, 3, 8, 12, 4, 9]], ["FSP", 3, 0, 1, 3], ["FSP", 3, 4, 2, 3], ["RE", 3, [0, 4, 1, 5, 2, 6, 3, 7]], ["CA", 2, 3, 5], ["CHR", 1, "shared", [2]], ["CA", 2, 3, 6], ["CHR", 0, "shared", [3]], ["CA", 1, 4, 6], ["FU", 5, [0, 1]], ["AN", 5, 0, 5], ["FU", 5, [1, 2]], ["AN", 5, 1, 4], ["FU", 5, [2, 3]], ["AN", 5, 2, 6], ["FU", 3, [0, 1]], ["SP", 3, 0, 201, [1], 1], ["AN", 3, 1, 2], ["FFSP", 3, 0, [2, 1], 1, 1], ["AN", 3, 1, 6], ["FU", 1, [0, 1]], ["SP", 1, 0, 67, [1], 1], ["AN", 1, 1, 2], ["FFSP", 1, 0, [2, 1], 1, 1], ["AN", 1, 1, 6], ["PR", 4, 0, "auto_unroll_max_step$1024"]]]], "r": [[4.00307e-05], 0, 0.947541, 1692824977], "v": "v0.6"}
{"i": [["[\"matmul\", 67, 67, 3, \"float32\"]", "cuda -keys=cuda,gpu -arch=sm_75 -max_num_threads=1024 -thread_warp_size=32", [-1, 16, 64, 49152, 2147483647, 1024, 8, 32], "", 0, []], [[], [["CHW", 2, "local"], ["SP", 2, 0, 67, [1, 67, 1, 1], 1], ["SP", 2, 5, 3, [1, 1, 1, 1], 1], ["SP", 2, 10, 67, [1, 1], 1], ["RE", 2, [0, 5, 1, 6, 2, 7, 10, 11, 3, 8, 12, 4, 9]], ["FSP", 3, 0, 1, 3], ["FSP", 3, 4, 2, 3], ["RE", 3, [0, 4, 1, 5, 2, 6, 3, 7]], ["CA", 2, 3, 5], ["CHR", 1, "shared", [2]], ["CA", 2, 3, 6], ["CHR", 0, "shared", [3]], ["CA", 1, 4, 6], ["FU", 5, [0, 1]], ["AN", 5, 0, 5], ["FU", 5, [1, 2]], ["AN", 5, 1, 4], ["FU", 5, [2, 3]], ["AN", 5, 2, 6], ["FU", 3, [0, 1]], ["SP", 3, 0, 1, [1], 1], ["AN", 3, 1, 2], ["FFSP", 3, 0, [2, 1], 1, 1], ["AN", 3, 1, 6], ["FU", 1, [0, 1]], ["SP", 1, 0, 1, [1], 1], ["AN", 1, 1, 2], ["FFSP", 1, 0, [2, 1], 1, 1], ["AN", 1, 1, 6], ["PR", 4, 0, "auto_unroll_max_step$64"]]]], "r": [[7.99122e-06], 0, 0.547838, 1692824977], "v": "v0.6"}
{"i": [["[\"matmul\", 67, 67, 3, \"float32\"]", "cuda -keys=cuda,gpu -arch=sm_75 -max_num_threads=1024 -thread_warp_size=32", [-1, 16, 64, 49152, 2147483647, 1024, 8, 32], "", 0, []], [[], [["CHW", 2, "local"], ["SP", 2, 0, 67, [1, 1, 1, 1], 1], ["SP", 2, 5, 3, [1, 1, 1, 3], 1], ["SP", 2, 10, 67, [1, 1], 1], ["RE", 2, [0, 5, 1, 6, 2, 7, 10, 11, 3, 8, 12, 4, 9]], ["FSP", 3, 0, 1, 3], ["FSP", 3, 4, 2, 3], ["RE", 3, [0, 4, 1, 5, 2, 6, 3, 7]], ["CA", 2, 3, 5], ["CHR", 1, "shared", [2]], ["CA", 2, 3, 6], ["CHR", 0, "shared", [3]], ["CA", 1, 4, 6], ["FU", 5, [0, 1]], ["AN", 5, 0, 5], ["FU", 5, [1, 2]], ["AN", 5, 1, 4], ["FU", 5, [2, 3]], ["AN", 5, 2, 6], ["FU", 3, [0, 1]], ["SP", 3, 0, 1, [1], 1], ["AN", 3, 1, 2], ["FFSP", 3, 0, [2, 1], 1, 1], ["AN", 3, 1, 6], ["FU", 1, [0, 1]], ["SP", 1, 0, 1, [1], 1], ["AN", 1, 1, 2], ["FFSP", 1, 0, [2, 1], 1, 1], ["AN", 1, 1, 6], ["PR", 4, 0, "auto_unroll_max_step$16"]]]], "r": [[5.1377e-06], 0, 0.499925, 1692824977], "v": "v0.6"}
{"i": [["[\"matmul\", 67, 67, 3, \"float32\"]", "cuda -keys=cuda,gpu -arch=sm_75 -max_num_threads=1024 -thread_warp_size=32", [-1, 16, 64, 49152, 2147483647, 1024, 8, 32], "", 0, []], [[], [["CHW", 2, "local"], ["SP", 2, 0, 67, [1, 67, 1, 1], 1], ["SP", 2, 5, 3, [3, 1, 1, 1], 1], ["SP", 2, 10, 67, [67, 1], 1], ["RE", 2, [0, 5, 1, 6, 2, 7, 10, 11, 3, 8, 12, 4, 9]], ["FSP", 3, 0, 1, 3], ["FSP", 3, 4, 2, 3], ["RE", 3, [0, 4, 1, 5, 2, 6, 3, 7]], ["CA", 2, 3, 5], ["CHR", 1, "shared", [2]], ["CA", 2, 3, 6], ["CHR", 0, "shared", [3]], ["CA", 1, 4, 6], ["FU", 5, [0, 1]], ["AN", 5, 0, 5], ["FU", 5, [1, 2]], ["AN", 5, 1, 4], ["FU", 5, [2, 3]], ["AN", 5, 2, 6], ["FU", 3, [0, 1]], ["SP", 3, 0, 1, [1], 1], ["AN", 3, 1, 2], ["FFSP", 3, 0, [2, 1], 1, 1], ["AN", 3, 1, 6], ["FU", 1, [0, 1]], ["SP", 1, 0, 1, [1], 1], ["AN", 1, 1, 2], ["FFSP", 1, 0, [2, 1], 1, 1], ["AN", 1, 1, 6], ["PR", 4, 0, "auto_unroll_max_step$0"]]]], "r": [[2.219e-06], 0, 0.496714, 1692824977], "v": "v0.6"}
{"i": [["[\"matmul\", 67, 67, 3, \"float32\"]", "cuda -keys=cuda,gpu -arch=sm_75 -max_num_threads=1024 -thread_warp_size=32", [-1, 16, 64, 49152, 2147483647, 1024, 8, 32], "", 0, []], [[], [["CHW", 2, "local"], ["SP", 2, 0, 67, [1, 67, 1, 1], 1], ["SP", 2, 5, 3, [3, 1, 1, 1], 1], ["SP", 2, 10, 67, [1, 1], 1], ["RE", 2, [0, 5, 1, 6, 2, 7, 10, 11, 3, 8, 12, 4, 9]], ["FSP", 3, 0, 1, 3], ["FSP", 3, 4, 2, 3], ["RE", 3, [0, 4, 1, 5, 2, 6, 3, 7]], ["CA", 2, 3, 5], ["CHR", 1, "shared", [2]], ["CA", 2, 3, 6], ["CHR", 0, "shared", [3]], ["CA", 1, 4, 6], ["FU", 5, [0, 1]], ["AN", 5, 0, 5], ["FU", 5, [1, 2]], ["AN", 5, 1, 4], ["FU", 5, [2, 3]], ["AN", 5, 2, 6], ["FU", 3, [0, 1]], ["SP", 3, 0, 201, [3], 1], ["AN", 3, 1, 2], ["FFSP", 3, 0, [2, 1], 1, 1], ["AN", 3, 1, 6], ["FU", 1, [0, 1]], ["SP", 1, 0, 67, [1], 1], ["AN", 1, 1, 2], ["FFSP", 1, 0, [2, 1], 1, 1], ["AN", 1, 1, 6], ["PR", 4, 0, "auto_unroll_max_step$16"]]]], "r": [[8.92641e-06], 0, 0.531516, 1692824978], "v": "v0.6"}
{"i": [["[\"matmul\", 67, 67, 3, \"float32\"]", "cuda -keys=cuda,gpu -arch=sm_75 -max_num_threads=1024 -thread_warp_size=32", [-1, 16, 64, 49152, 2147483647, 1024, 8, 32], "", 0, []], [[], [["CHW", 2, "local"], ["SP", 2, 0, 67, [1, 67, 1, 1], 1], ["SP", 2, 5, 3, [1, 1, 1, 3], 1], ["SP", 2, 10, 67, [1, 1], 1], ["RE", 2, [0, 5, 1, 6, 2, 7, 10, 11, 3, 8, 12, 4, 9]], ["FSP", 3, 0, 1, 3], ["FSP", 3, 4, 2, 3], ["RE", 3, [0, 4, 1, 5, 2, 6, 3, 7]], ["CA", 2, 3, 5], ["CHR", 1, "shared", [2]], ["CA", 2, 3, 6], ["CHR", 0, "shared", [3]], ["CA", 1, 4, 6], ["FU", 5, [0, 1]], ["AN", 5, 0, 5], ["FU", 5, [1, 2]], ["AN", 5, 1, 4], ["FU", 5, [2, 3]], ["AN", 5, 2, 6], ["FU", 3, [0, 1]], ["SP", 3, 0, 3, [1], 1], ["AN", 3, 1, 2], ["FFSP", 3, 0, [2, 1], 1, 1], ["AN", 3, 1, 6], ["FU", 1, [0, 1]], ["SP", 1, 0, 1, [1], 1], ["AN", 1, 1, 2], ["FFSP", 1, 0, [2, 1], 1, 1], ["AN", 1, 1, 6], ["PR", 4, 0, "auto_unroll_max_step$1024"]]]], "r": [[4.86177e-06], 0, 0.687183, 1692824978], "v": "v0.6"}
{"i": [["[\"matmul\", 67, 67, 3, \"float32\"]", "cuda -keys=cuda,gpu -arch=sm_75 -max_num_threads=1024 -thread_warp_size=32", [-1, 16, 64, 49152, 2147483647, 1024, 8, 32], "", 0, []], [[], [["CHW", 2, "local"], ["SP", 2, 0, 67, [1, 67, 1, 1], 1], ["SP", 2, 5, 3, [1, 1, 3, 1], 1], ["SP", 2, 10, 67, [1, 1], 1], ["RE", 2, [0, 5, 1, 6, 2, 7, 10, 11, 3, 8, 12, 4, 9]], ["FSP", 3, 0, 1, 3], ["FSP", 3, 4, 2, 3], ["RE", 3, [0, 4, 1, 5, 2, 6, 3, 7]], ["CA", 2, 3, 5], ["CHR", 1, "shared", [2]], ["CA", 2, 3, 6], ["CHR", 0, "shared", [3]], ["CA", 1, 4, 6], ["FU", 5, [0, 1]], ["AN", 5, 0, 5], ["FU", 5, [1, 2]], ["AN", 5, 1, 4], ["FU", 5, [2, 3]], ["AN", 5, 2, 6], ["FU", 3, [0, 1]], ["SP", 3, 0, 3, [1], 1], ["AN", 3, 1, 2], ["FFSP", 3, 0, [2, 1], 1, 1], ["AN", 3, 1, 6], ["FU", 1, [0, 1]], ["SP", 1, 0, 1, [1], 1], ["AN", 1, 1, 2], ["FFSP", 1, 0, [2, 1], 1, 1], ["AN", 1, 1, 6], ["PR", 4, 0, "auto_unroll_max_step$512"]]]], "r": [[4.86384e-06], 0, 0.69885, 1692824978], "v": "v0.6"}
{"i": [["[\"matmul\", 67, 67, 3, \"float32\"]", "cuda -keys=cuda,gpu -arch=sm_75 -max_num_threads=1024 -thread_warp_size=32", [-1, 16, 64, 49152, 2147483647, 1024, 8, 32], "", 0, []], [[], [["CHW", 2, "local"], ["SP", 2, 0, 67, [1, 67, 1, 1], 1], ["SP", 2, 5, 3, [1, 1, 3, 1], 1], ["SP", 2, 10, 67, [1, 1], 1], ["RE", 2, [0, 5, 1, 6, 2, 7, 10, 11, 3, 8, 12, 4, 9]], ["FSP", 3, 0, 1, 3], ["FSP", 3, 4, 2, 3], ["RE", 3, [0, 4, 1, 5, 2, 6, 3, 7]], ["CA", 2, 3, 5], ["CHR", 1, "shared", [2]], ["CA", 2, 3, 6], ["CHR", 0, "shared", [3]], ["CA", 1, 4, 6], ["FU", 5, [0, 1]], ["AN", 5, 0, 5], ["FU", 5, [1, 2]], ["AN", 5, 1, 4], ["FU", 5, [2, 3]], ["AN", 5, 2, 6], ["FU", 3, [0, 1]], ["SP", 3, 0, 3, [1], 1], ["AN", 3, 1, 2], ["FFSP", 3, 0, [2, 1], 1, 1], ["AN", 3, 1, 6], ["FU", 1, [0, 1]], ["SP", 1, 0, 1, [1], 1], ["AN", 1, 1, 2], ["FFSP", 1, 0, [2, 1], 1, 1], ["AN", 1, 1, 6], ["PR", 4, 0, "auto_unroll_max_step$0"]]]], "r": [[7.9876e-06], 0, 0.559863, 1692824978], "v": "v0.6"}
{"i": [["[\"matmul\", 67, 67, 3, \"float32\"]", "cuda -keys=cuda,gpu -arch=sm_75 -max_num_threads=1024 -thread_warp_size=32", [-1, 16, 64, 49152, 2147483647, 1024, 8, 32], "", 0, []], [[], [["CHW", 2, "local"], ["SP", 2, 0, 67, [1, 1, 67, 1], 1], ["SP", 2, 5, 3, [1, 1, 1, 1], 1], ["SP", 2, 10, 67, [1, 1], 1], ["RE", 2, [0, 5, 1, 6, 2, 7, 10, 11, 3, 8, 12, 4, 9]], ["FSP", 3, 0, 1, 3], ["FSP", 3, 4, 2, 3], ["RE", 3, [0, 4, 1, 5, 2, 6, 3, 7]], ["CA", 2, 3, 5], ["CHR", 1, "shared", [2]], ["CA", 2, 3, 6], ["CHR", 0, "shared", [3]], ["CA", 1, 4, 6], ["FU", 5, [0, 1]], ["AN", 5, 0, 5], ["FU", 5, [1, 2]], ["AN", 5, 1, 4], ["FU", 5, [2, 3]], ["AN", 5, 2, 6], ["FU", 3, [0, 1]], ["SP", 3, 0, 3, [1], 1], ["AN", 3, 1, 2], ["FFSP", 3, 0, [2, 1], 1, 1], ["AN", 3, 1, 6], ["FU", 1, [0, 1]], ["SP", 1, 0, 1, [1], 1], ["AN", 1, 1, 2], ["FFSP", 1, 0, [2, 1], 1, 1], ["AN", 1, 1, 6], ["PR", 4, 0, "auto_unroll_max_step$512"]]]], "r": [[4.83106e-05], 0, 0.720055, 1692824996], "v": "v0.6"}
